data/50-start-3/34cuda_testCase_3_matmul_M512_N64_K768.json
{"i": [["[\"_matmul\", 512, 768, 64, \"float32\"]", "cuda -keys=cuda,gpu -arch=sm_86 -max_num_threads=1024 -model=unknown -thread_warp_size=32", [82, 999, 999, 49152, 2147483647, 1024, 255, 32], "", 0, []], [[], [["CHW", 2, "local"], ["SP", 2, 0, 512, [1, 2, 128, 1], 1], ["SP", 2, 5, 64, [1, 16, 2, 1], 1], ["SP", 2, 10, 768, [12, 1], 1], ["RE", 2, [0, 5, 1, 6, 2, 7, 10, 11, 3, 8, 12, 4, 9]], ["FSP", 3, 0, 1, 3], ["FSP", 3, 4, 2, 3], ["RE", 3, [0, 4, 1, 5, 2, 6, 3, 7]], ["CA", 2, 3, 5], ["CHR", 1, "shared", [2]], ["CA", 2, 3, 6], ["CHR", 0, "shared", [3]], ["CA", 1, 4, 6], ["FU", 5, [0, 1]], ["AN", 5, 0, 5], ["FU", 5, [1, 2]], ["AN", 5, 1, 4], ["FU", 5, [2, 3]], ["AN", 5, 2, 6], ["FU", 3, [0, 1]], ["SP", 3, 0, 24, [2], 1], ["AN", 3, 1, 2], ["FFSP", 3, 0, [2, 1], 1, 1], ["AN", 3, 1, 6], ["FU", 1, [0, 1]], ["SP", 1, 0, 1536, [2], 1], ["AN", 1, 1, 2], ["FFSP", 1, 0, [2, 1], 1, 1], ["AN", 1, 1, 6], ["PR", 4, 0, "auto_unroll_max_step$1024"]]]], "r": [[0.00128667], 0, 1.81238, 1707732080], "mark": 2, "ag": 0, "v": "v0.6"}
{"i": [["[\"_matmul\", 512, 768, 64, \"float32\"]", "cuda -keys=cuda,gpu -arch=sm_86 -max_num_threads=1024 -model=unknown -thread_warp_size=32", [82, 999, 999, 49152, 2147483647, 1024, 255, 32], "", 0, []], [[], [["CHW", 2, "local"], ["SP", 2, 0, 512, [1, 2, 128, 1], 1], ["SP", 2, 5, 64, [1, 16, 2, 1], 1], ["SP", 2, 10, 768, [8, 1], 1], ["RE", 2, [0, 5, 1, 6, 2, 7, 10, 11, 3, 8, 12, 4, 9]], ["FSP", 3, 0, 1, 3], ["FSP", 3, 4, 2, 3], ["RE", 3, [0, 4, 1, 5, 2, 6, 3, 7]], ["CA", 2, 3, 5], ["CHR", 1, "shared", [2]], ["CA", 2, 3, 6], ["CHR", 0, "shared", [3]], ["CA", 1, 4, 6], ["FU", 5, [0, 1]], ["AN", 5, 0, 5], ["FU", 5, [1, 2]], ["AN", 5, 1, 4], ["FU", 5, [2, 3]], ["AN", 5, 2, 6], ["FU", 3, [0, 1]], ["SP", 3, 0, 16, [2], 1], ["AN", 3, 1, 2], ["FFSP", 3, 0, [2, 1], 1, 1], ["AN", 3, 1, 6], ["FU", 1, [0, 1]], ["SP", 1, 0, 1024, [2], 1], ["AN", 1, 1, 2], ["FFSP", 1, 0, [2, 1], 1, 1], ["AN", 1, 1, 6], ["PR", 4, 0, "auto_unroll_max_step$1024"]]]], "r": [[0.000808064], 0, 1.43735, 1707732080], "mark": 2, "ag": 0, "v": "v0.6"}
{"i": [["[\"_matmul\", 512, 768, 64, \"float32\"]", "cuda -keys=cuda,gpu -arch=sm_86 -max_num_threads=1024 -model=unknown -thread_warp_size=32", [82, 999, 999, 49152, 2147483647, 1024, 255, 32], "", 0, []], [[], [["CHW", 2, "local"], ["SP", 2, 0, 512, [1, 2, 128, 1], 1], ["SP", 2, 5, 64, [1, 16, 2, 1], 1], ["SP", 2, 10, 768, [16, 1], 1], ["RE", 2, [0, 5, 1, 6, 2, 7, 10, 11, 3, 8, 12, 4, 9]], ["FSP", 3, 0, 1, 3], ["FSP", 3, 4, 2, 3], ["RE", 3, [0, 4, 1, 5, 2, 6, 3, 7]], ["CA", 2, 3, 5], ["CHR", 1, "shared", [2]], ["CA", 2, 3, 6], ["CHR", 0, "shared", [3]], ["CA", 1, 4, 6], ["FU", 5, [0, 1]], ["AN", 5, 0, 5], ["FU", 5, [1, 2]], ["AN", 5, 1, 4], ["FU", 5, [2, 3]], ["AN", 5, 2, 6], ["FU", 3, [0, 1]], ["SP", 3, 0, 32, [2], 1], ["AN", 3, 1, 2], ["FFSP", 3, 0, [2, 1], 1, 1], ["AN", 3, 1, 6], ["FU", 1, [0, 1]], ["SP", 1, 0, 2048, [2], 1], ["AN", 1, 1, 2], ["FFSP", 1, 0, [2, 1], 1, 1], ["AN", 1, 1, 6], ["PR", 4, 0, "auto_unroll_max_step$1024"]]]], "r": [[0.00186909], 0, 1.76359, 1707732080], "mark": 2, "ag": 0, "v": "v0.6"}
{"i": [["[\"_matmul\", 512, 768, 64, \"float32\"]", "cuda -keys=cuda,gpu -arch=sm_86 -max_num_threads=1024 -model=unknown -thread_warp_size=32", [82, 999, 999, 49152, 2147483647, 1024, 255, 32], "", 0, []], [[], [["CHW", 2, "local"], ["SP", 2, 0, 512, [1, 2, 128, 1], 1], ["SP", 2, 5, 64, [1, 32, 2, 1], 1], ["SP", 2, 10, 768, [12, 1], 1], ["RE", 2, [0, 5, 1, 6, 2, 7, 10, 11, 3, 8, 12, 4, 9]], ["FSP", 3, 0, 1, 3], ["FSP", 3, 4, 2, 3], ["RE", 3, [0, 4, 1, 5, 2, 6, 3, 7]], ["CA", 2, 3, 5], ["CHR", 1, "shared", [2]], ["CA", 2, 3, 6], ["CHR", 0, "shared", [3]], ["CA", 1, 4, 6], ["FU", 5, [0, 1]], ["AN", 5, 0, 5], ["FU", 5, [1, 2]], ["AN", 5, 1, 4], ["FU", 5, [2, 3]], ["AN", 5, 2, 6], ["FU", 3, [0, 1]], ["SP", 3, 0, 24, [2], 1], ["AN", 3, 1, 2], ["FFSP", 3, 0, [2, 1], 1, 1], ["AN", 3, 1, 6], ["FU", 1, [0, 1]], ["SP", 1, 0, 1536, [2], 1], ["AN", 1, 1, 2], ["FFSP", 1, 0, [2, 1], 1, 1], ["AN", 1, 1, 6], ["PR", 4, 0, "auto_unroll_max_step$1024"]]]], "r": [[0.00103778], 0, 1.87222, 1707732080], "mark": 2, "ag": 0, "v": "v0.6"}
{"i": [["[\"_matmul\", 512, 768, 64, \"float32\"]", "cuda -keys=cuda,gpu -arch=sm_86 -max_num_threads=1024 -model=unknown -thread_warp_size=32", [82, 999, 999, 49152, 2147483647, 1024, 255, 32], "", 0, []], [[], [["CHW", 2, "local"], ["SP", 2, 0, 512, [1, 2, 128, 1], 1], ["SP", 2, 5, 64, [1, 16, 1, 1], 1], ["SP", 2, 10, 768, [12, 1], 1], ["RE", 2, [0, 5, 1, 6, 2, 7, 10, 11, 3, 8, 12, 4, 9]], ["FSP", 3, 0, 1, 3], ["FSP", 3, 4, 2, 3], ["RE", 3, [0, 4, 1, 5, 2, 6, 3, 7]], ["CA", 2, 3, 5], ["CHR", 1, "shared", [2]], ["CA", 2, 3, 6], ["CHR", 0, "shared", [3]], ["CA", 1, 4, 6], ["FU", 5, [0, 1]], ["AN", 5, 0, 5], ["FU", 5, [1, 2]], ["AN", 5, 1, 4], ["FU", 5, [2, 3]], ["AN", 5, 2, 6], ["FU", 3, [0, 1]], ["SP", 3, 0, 12, [2], 1], ["AN", 3, 1, 2], ["FFSP", 3, 0, [2, 1], 1, 1], ["AN", 3, 1, 6], ["FU", 1, [0, 1]], ["SP", 1, 0, 1536, [2], 1], ["AN", 1, 1, 2], ["FFSP", 1, 0, [2, 1], 1, 1], ["AN", 1, 1, 6], ["PR", 4, 0, "auto_unroll_max_step$1024"]]]], "r": [[0.00063485], 0, 1.41002, 1707732081], "mark": 2, "ag": 0, "v": "v0.6"}
{"i": [["[\"_matmul\", 512, 768, 64, \"float32\"]", "cuda -keys=cuda,gpu -arch=sm_86 -max_num_threads=1024 -model=unknown -thread_warp_size=32", [82, 999, 999, 49152, 2147483647, 1024, 255, 32], "", 0, []], [[], [["CHW", 2, "local"], ["SP", 2, 0, 512, [1, 2, 128, 1], 1], ["SP", 2, 5, 64, [1, 16, 4, 1], 1], ["SP", 2, 10, 768, [12, 1], 1], ["RE", 2, [0, 5, 1, 6, 2, 7, 10, 11, 3, 8, 12, 4, 9]], ["FSP", 3, 0, 1, 3], ["FSP", 3, 4, 2, 3], ["RE", 3, [0, 4, 1, 5, 2, 6, 3, 7]], ["CA", 2, 3, 5], ["CHR", 1, "shared", [2]], ["CA", 2, 3, 6], ["CHR", 0, "shared", [3]], ["CA", 1, 4, 6], ["FU", 5, [0, 1]], ["AN", 5, 0, 5], ["FU", 5, [1, 2]], ["AN", 5, 1, 4], ["FU", 5, [2, 3]], ["AN", 5, 2, 6], ["FU", 3, [0, 1]], ["SP", 3, 0, 48, [2], 1], ["AN", 3, 1, 2], ["FFSP", 3, 0, [2, 1], 1, 1], ["AN", 3, 1, 6], ["FU", 1, [0, 1]], ["SP", 1, 0, 1536, [2], 1], ["AN", 1, 1, 2], ["FFSP", 1, 0, [2, 1], 1, 1], ["AN", 1, 1, 6], ["PR", 4, 0, "auto_unroll_max_step$1024"]]]], "r": [[0.00356629], 0, 1.75565, 1707732081], "mark": 2, "ag": 0, "v": "v0.6"}
{"i": [["[\"_matmul\", 512, 768, 64, \"float32\"]", "cuda -keys=cuda,gpu -arch=sm_86 -max_num_threads=1024 -model=unknown -thread_warp_size=32", [82, 999, 999, 49152, 2147483647, 1024, 255, 32], "", 0, []], [[], [["CHW", 2, "local"], ["SP", 2, 0, 512, [1, 4, 128, 1], 1], ["SP", 2, 5, 64, [1, 16, 2, 1], 1], ["SP", 2, 10, 768, [12, 1], 1], ["RE", 2, [0, 5, 1, 6, 2, 7, 10, 11, 3, 8, 12, 4, 9]], ["FSP", 3, 0, 1, 3], ["FSP", 3, 4, 2, 3], ["RE", 3, [0, 4, 1, 5, 2, 6, 3, 7]], ["CA", 2, 3, 5], ["CHR", 1, "shared", [2]], ["CA", 2, 3, 6], ["CHR", 0, "shared", [3]], ["CA", 1, 4, 6], ["FU", 5, [0, 1]], ["AN", 5, 0, 5], ["FU", 5, [1, 2]], ["AN", 5, 1, 4], ["FU", 5, [2, 3]], ["AN", 5, 2, 6], ["FU", 3, [0, 1]], ["SP", 3, 0, 24, [2], 1], ["AN", 3, 1, 2], ["FFSP", 3, 0, [2, 1], 1, 1], ["AN", 3, 1, 6], ["FU", 1, [0, 1]], ["SP", 1, 0, 1536, [2], 1], ["AN", 1, 1, 2], ["FFSP", 1, 0, [2, 1], 1, 1], ["AN", 1, 1, 6], ["PR", 4, 0, "auto_unroll_max_step$1024"]]]], "r": [[0.00130247], 0, 1.56764, 1707732081], "mark": 2, "ag": 0, "v": "v0.6"}
{"i": [["[\"_matmul\", 512, 768, 64, \"float32\"]", "cuda -keys=cuda,gpu -arch=sm_86 -max_num_threads=1024 -model=unknown -thread_warp_size=32", [82, 999, 999, 49152, 2147483647, 1024, 255, 32], "", 0, []], [[], [["CHW", 2, "local"], ["SP", 2, 0, 512, [1, 2, 64, 1], 1], ["SP", 2, 5, 64, [1, 16, 2, 1], 1], ["SP", 2, 10, 768, [12, 1], 1], ["RE", 2, [0, 5, 1, 6, 2, 7, 10, 11, 3, 8, 12, 4, 9]], ["FSP", 3, 0, 1, 3], ["FSP", 3, 4, 2, 3], ["RE", 3, [0, 4, 1, 5, 2, 6, 3, 7]], ["CA", 2, 3, 5], ["CHR", 1, "shared", [2]], ["CA", 2, 3, 6], ["CHR", 0, "shared", [3]], ["CA", 1, 4, 6], ["FU", 5, [0, 1]], ["AN", 5, 0, 5], ["FU", 5, [1, 2]], ["AN", 5, 1, 4], ["FU", 5, [2, 3]], ["AN", 5, 2, 6], ["FU", 3, [0, 1]], ["SP", 3, 0, 24, [2], 1], ["AN", 3, 1, 2], ["FFSP", 3, 0, [2, 1], 1, 1], ["AN", 3, 1, 6], ["FU", 1, [0, 1]], ["SP", 1, 0, 768, [2], 1], ["AN", 1, 1, 2], ["FFSP", 1, 0, [2, 1], 1, 1], ["AN", 1, 1, 6], ["PR", 4, 0, "auto_unroll_max_step$1024"]]]], "r": [[0.00015925], 0, 1.16254, 1707732081], "mark": 2, "ag": 0, "v": "v0.6"}
{"i": [["[\"_matmul\", 512, 768, 64, \"float32\"]", "cuda -keys=cuda,gpu -arch=sm_86 -max_num_threads=1024 -model=unknown -thread_warp_size=32", [82, 999, 999, 49152, 2147483647, 1024, 255, 32], "", 0, []], [[], [["CHW", 2, "local"], ["SP", 2, 0, 512, [1, 2, 256, 1], 1], ["SP", 2, 5, 64, [1, 16, 2, 1], 1], ["SP", 2, 10, 768, [12, 1], 1], ["RE", 2, [0, 5, 1, 6, 2, 7, 10, 11, 3, 8, 12, 4, 9]], ["FSP", 3, 0, 1, 3], ["FSP", 3, 4, 2, 3], ["RE", 3, [0, 4, 1, 5, 2, 6, 3, 7]], ["CA", 2, 3, 5], ["CHR", 1, "shared", [2]], ["CA", 2, 3, 6], ["CHR", 0, "shared", [3]], ["CA", 1, 4, 6], ["FU", 5, [0, 1]], ["AN", 5, 0, 5], ["FU", 5, [1, 2]], ["AN", 5, 1, 4], ["FU", 5, [2, 3]], ["AN", 5, 2, 6], ["FU", 3, [0, 1]], ["SP", 3, 0, 24, [2], 1], ["AN", 3, 1, 2], ["FFSP", 3, 0, [2, 1], 1, 1], ["AN", 3, 1, 6], ["FU", 1, [0, 1]], ["SP", 1, 0, 3072, [2], 1], ["AN", 1, 1, 2], ["FFSP", 1, 0, [2, 1], 1, 1], ["AN", 1, 1, 6], ["PR", 4, 0, "auto_unroll_max_step$1024"]]]], "r": [[0.00499422], 0, 2.43048, 1707732081], "mark": 2, "ag": 0, "v": "v0.6"}
{"i": [["[\"_matmul\", 512, 768, 64, \"float32\"]", "cuda -keys=cuda,gpu -arch=sm_86 -max_num_threads=1024 -model=unknown -thread_warp_size=32", [82, 999, 999, 49152, 2147483647, 1024, 255, 32], "", 0, []], [[], [["CHW", 2, "local"], ["SP", 2, 0, 512, [1, 2, 128, 1], 1], ["SP", 2, 5, 64, [1, 32, 2, 1], 1], ["SP", 2, 10, 768, [8, 1], 1], ["RE", 2, [0, 5, 1, 6, 2, 7, 10, 11, 3, 8, 12, 4, 9]], ["FSP", 3, 0, 1, 3], ["FSP", 3, 4, 2, 3], ["RE", 3, [0, 4, 1, 5, 2, 6, 3, 7]], ["CA", 2, 3, 5], ["CHR", 1, "shared", [2]], ["CA", 2, 3, 6], ["CHR", 0, "shared", [3]], ["CA", 1, 4, 6], ["FU", 5, [0, 1]], ["AN", 5, 0, 5], ["FU", 5, [1, 2]], ["AN", 5, 1, 4], ["FU", 5, [2, 3]], ["AN", 5, 2, 6], ["FU", 3, [0, 1]], ["SP", 3, 0, 16, [2], 1], ["AN", 3, 1, 2], ["FFSP", 3, 0, [2, 1], 1, 1], ["AN", 3, 1, 6], ["FU", 1, [0, 1]], ["SP", 1, 0, 1024, [2], 1], ["AN", 1, 1, 2], ["FFSP", 1, 0, [2, 1], 1, 1], ["AN", 1, 1, 6], ["PR", 4, 0, "auto_unroll_max_step$1024"]]]], "r": [[0.000951461], 0, 1.38006, 1707732081], "mark": 2, "ag": 0, "v": "v0.6"}
{"i": [["[\"_matmul\", 512, 768, 64, \"float32\"]", "cuda -keys=cuda,gpu -arch=sm_86 -max_num_threads=1024 -model=unknown -thread_warp_size=32", [82, 999, 999, 49152, 2147483647, 1024, 255, 32], "", 0, []], [[], [["CHW", 2, "local"], ["SP", 2, 0, 512, [1, 2, 128, 1], 1], ["SP", 2, 5, 64, [1, 32, 2, 1], 1], ["SP", 2, 10, 768, [16, 1], 1], ["RE", 2, [0, 5, 1, 6, 2, 7, 10, 11, 3, 8, 12, 4, 9]], ["FSP", 3, 0, 1, 3], ["FSP", 3, 4, 2, 3], ["RE", 3, [0, 4, 1, 5, 2, 6, 3, 7]], ["CA", 2, 3, 5], ["CHR", 1, "shared", [2]], ["CA", 2, 3, 6], ["CHR", 0, "shared", [3]], ["CA", 1, 4, 6], ["FU", 5, [0, 1]], ["AN", 5, 0, 5], ["FU", 5, [1, 2]], ["AN", 5, 1, 4], ["FU", 5, [2, 3]], ["AN", 5, 2, 6], ["FU", 3, [0, 1]], ["SP", 3, 0, 32, [2], 1], ["AN", 3, 1, 2], ["FFSP", 3, 0, [2, 1], 1, 1], ["AN", 3, 1, 6], ["FU", 1, [0, 1]], ["SP", 1, 0, 2048, [2], 1], ["AN", 1, 1, 2], ["FFSP", 1, 0, [2, 1], 1, 1], ["AN", 1, 1, 6], ["PR", 4, 0, "auto_unroll_max_step$1024"]]]], "r": [[0.00224063], 0, 2.10618, 1707732082], "mark": 2, "ag": 0, "v": "v0.6"}
{"i": [["[\"_matmul\", 512, 768, 64, \"float32\"]", "cuda -keys=cuda,gpu -arch=sm_86 -max_num_threads=1024 -model=unknown -thread_warp_size=32", [82, 999, 999, 49152, 2147483647, 1024, 255, 32], "", 0, []], [[], [["CHW", 2, "local"], ["SP", 2, 0, 512, [1, 2, 128, 1], 1], ["SP", 2, 5, 64, [1, 16, 1, 1], 1], ["SP", 2, 10, 768, [8, 1], 1], ["RE", 2, [0, 5, 1, 6, 2, 7, 10, 11, 3, 8, 12, 4, 9]], ["FSP", 3, 0, 1, 3], ["FSP", 3, 4, 2, 3], ["RE", 3, [0, 4, 1, 5, 2, 6, 3, 7]], ["CA", 2, 3, 5], ["CHR", 1, "shared", [2]], ["CA", 2, 3, 6], ["CHR", 0, "shared", [3]], ["CA", 1, 4, 6], ["FU", 5, [0, 1]], ["AN", 5, 0, 5], ["FU", 5, [1, 2]], ["AN", 5, 1, 4], ["FU", 5, [2, 3]], ["AN", 5, 2, 6], ["FU", 3, [0, 1]], ["SP", 3, 0, 8, [2], 1], ["AN", 3, 1, 2], ["FFSP", 3, 0, [2, 1], 1, 1], ["AN", 3, 1, 6], ["FU", 1, [0, 1]], ["SP", 1, 0, 1024, [2], 1], ["AN", 1, 1, 2], ["FFSP", 1, 0, [2, 1], 1, 1], ["AN", 1, 1, 6], ["PR", 4, 0, "auto_unroll_max_step$1024"]]]], "r": [[0.000478943], 0, 2.49063, 1707732082], "mark": 2, "ag": 0, "v": "v0.6"}
{"i": [["[\"_matmul\", 512, 768, 64, \"float32\"]", "cuda -keys=cuda,gpu -arch=sm_86 -max_num_threads=1024 -model=unknown -thread_warp_size=32", [82, 999, 999, 49152, 2147483647, 1024, 255, 32], "", 0, []], [[], [["CHW", 2, "local"], ["SP", 2, 0, 512, [1, 2, 128, 1], 1], ["SP", 2, 5, 64, [1, 16, 1, 1], 1], ["SP", 2, 10, 768, [16, 1], 1], ["RE", 2, [0, 5, 1, 6, 2, 7, 10, 11, 3, 8, 12, 4, 9]], ["FSP", 3, 0, 1, 3], ["FSP", 3, 4, 2, 3], ["RE", 3, [0, 4, 1, 5, 2, 6, 3, 7]], ["CA", 2, 3, 5], ["CHR", 1, "shared", [2]], ["CA", 2, 3, 6], ["CHR", 0, "shared", [3]], ["CA", 1, 4, 6], ["FU", 5, [0, 1]], ["AN", 5, 0, 5], ["FU", 5, [1, 2]], ["AN", 5, 1, 4], ["FU", 5, [2, 3]], ["AN", 5, 2, 6], ["FU", 3, [0, 1]], ["SP", 3, 0, 16, [2], 1], ["AN", 3, 1, 2], ["FFSP", 3, 0, [2, 1], 1, 1], ["AN", 3, 1, 6], ["FU", 1, [0, 1]], ["SP", 1, 0, 2048, [2], 1], ["AN", 1, 1, 2], ["FFSP", 1, 0, [2, 1], 1, 1], ["AN", 1, 1, 6], ["PR", 4, 0, "auto_unroll_max_step$1024"]]]], "r": [[0.000684655], 0, 1.86346, 1707732082], "mark": 2, "ag": 0, "v": "v0.6"}
{"i": [["[\"_matmul\", 512, 768, 64, \"float32\"]", "cuda -keys=cuda,gpu -arch=sm_86 -max_num_threads=1024 -model=unknown -thread_warp_size=32", [82, 999, 999, 49152, 2147483647, 1024, 255, 32], "", 0, []], [[], [["CHW", 2, "local"], ["SP", 2, 0, 512, [1, 2, 128, 1], 1], ["SP", 2, 5, 64, [1, 16, 4, 1], 1], ["SP", 2, 10, 768, [8, 1], 1], ["RE", 2, [0, 5, 1, 6, 2, 7, 10, 11, 3, 8, 12, 4, 9]], ["FSP", 3, 0, 1, 3], ["FSP", 3, 4, 2, 3], ["RE", 3, [0, 4, 1, 5, 2, 6, 3, 7]], ["CA", 2, 3, 5], ["CHR", 1, "shared", [2]], ["CA", 2, 3, 6], ["CHR", 0, "shared", [3]], ["CA", 1, 4, 6], ["FU", 5, [0, 1]], ["AN", 5, 0, 5], ["FU", 5, [1, 2]], ["AN", 5, 1, 4], ["FU", 5, [2, 3]], ["AN", 5, 2, 6], ["FU", 3, [0, 1]], ["SP", 3, 0, 32, [2], 1], ["AN", 3, 1, 2], ["FFSP", 3, 0, [2, 1], 1, 1], ["AN", 3, 1, 6], ["FU", 1, [0, 1]], ["SP", 1, 0, 1024, [2], 1], ["AN", 1, 1, 2], ["FFSP", 1, 0, [2, 1], 1, 1], ["AN", 1, 1, 6], ["PR", 4, 0, "auto_unroll_max_step$1024"]]]], "r": [[0.00353623], 0, 1.78421, 1707732082], "mark": 2, "ag": 0, "v": "v0.6"}
{"i": [["[\"_matmul\", 512, 768, 64, \"float32\"]", "cuda -keys=cuda,gpu -arch=sm_86 -max_num_threads=1024 -model=unknown -thread_warp_size=32", [82, 999, 999, 49152, 2147483647, 1024, 255, 32], "", 0, []], [[], [["CHW", 2, "local"], ["SP", 2, 0, 512, [1, 2, 128, 1], 1], ["SP", 2, 5, 64, [1, 16, 4, 1], 1], ["SP", 2, 10, 768, [16, 1], 1], ["RE", 2, [0, 5, 1, 6, 2, 7, 10, 11, 3, 8, 12, 4, 9]], ["FSP", 3, 0, 1, 3], ["FSP", 3, 4, 2, 3], ["RE", 3, [0, 4, 1, 5, 2, 6, 3, 7]], ["CA", 2, 3, 5], ["CHR", 1, "shared", [2]], ["CA", 2, 3, 6], ["CHR", 0, "shared", [3]], ["CA", 1, 4, 6], ["FU", 5, [0, 1]], ["AN", 5, 0, 5], ["FU", 5, [1, 2]], ["AN", 5, 1, 4], ["FU", 5, [2, 3]], ["AN", 5, 2, 6], ["FU", 3, [0, 1]], ["SP", 3, 0, 64, [2], 1], ["AN", 3, 1, 2], ["FFSP", 3, 0, [2, 1], 1, 1], ["AN", 3, 1, 6], ["FU", 1, [0, 1]], ["SP", 1, 0, 2048, [2], 1], ["AN", 1, 1, 2], ["FFSP", 1, 0, [2, 1], 1, 1], ["AN", 1, 1, 6], ["PR", 4, 0, "auto_unroll_max_step$1024"]]]], "r": [[0.00351883], 0, 1.76985, 1707732082], "mark": 2, "ag": 0, "v": "v0.6"}
{"i": [["[\"_matmul\", 512, 768, 64, \"float32\"]", "cuda -keys=cuda,gpu -arch=sm_86 -max_num_threads=1024 -model=unknown -thread_warp_size=32", [82, 999, 999, 49152, 2147483647, 1024, 255, 32], "", 0, []], [[], [["CHW", 2, "local"], ["SP", 2, 0, 512, [1, 2, 128, 1], 1], ["SP", 2, 5, 64, [1, 32, 1, 1], 1], ["SP", 2, 10, 768, [12, 1], 1], ["RE", 2, [0, 5, 1, 6, 2, 7, 10, 11, 3, 8, 12, 4, 9]], ["FSP", 3, 0, 1, 3], ["FSP", 3, 4, 2, 3], ["RE", 3, [0, 4, 1, 5, 2, 6, 3, 7]], ["CA", 2, 3, 5], ["CHR", 1, "shared", [2]], ["CA", 2, 3, 6], ["CHR", 0, "shared", [3]], ["CA", 1, 4, 6], ["FU", 5, [0, 1]], ["AN", 5, 0, 5], ["FU", 5, [1, 2]], ["AN", 5, 1, 4], ["FU", 5, [2, 3]], ["AN", 5, 2, 6], ["FU", 3, [0, 1]], ["SP", 3, 0, 12, [2], 1], ["AN", 3, 1, 2], ["FFSP", 3, 0, [2, 1], 1, 1], ["AN", 3, 1, 6], ["FU", 1, [0, 1]], ["SP", 1, 0, 1536, [2], 1], ["AN", 1, 1, 2], ["FFSP", 1, 0, [2, 1], 1, 1], ["AN", 1, 1, 6], ["PR", 4, 0, "auto_unroll_max_step$1024"]]]], "r": [[0.000572856], 0, 1.42428, 1707732083], "mark": 2, "ag": 0, "v": "v0.6"}
{"i": [["[\"_matmul\", 512, 768, 64, \"float32\"]", "cuda -keys=cuda,gpu -arch=sm_86 -max_num_threads=1024 -model=unknown -thread_warp_size=32", [82, 999, 999, 49152, 2147483647, 1024, 255, 32], "", 0, []], [[], [["CHW", 2, "local"], ["SP", 2, 0, 512, [1, 4, 128, 1], 1], ["SP", 2, 5, 64, [1, 16, 2, 1], 1], ["SP", 2, 10, 768, [8, 1], 1], ["RE", 2, [0, 5, 1, 6, 2, 7, 10, 11, 3, 8, 12, 4, 9]], ["FSP", 3, 0, 1, 3], ["FSP", 3, 4, 2, 3], ["RE", 3, [0, 4, 1, 5, 2, 6, 3, 7]], ["CA", 2, 3, 5], ["CHR", 1, "shared", [2]], ["CA", 2, 3, 6], ["CHR", 0, "shared", [3]], ["CA", 1, 4, 6], ["FU", 5, [0, 1]], ["AN", 5, 0, 5], ["FU", 5, [1, 2]], ["AN", 5, 1, 4], ["FU", 5, [2, 3]], ["AN", 5, 2, 6], ["FU", 3, [0, 1]], ["SP", 3, 0, 16, [2], 1], ["AN", 3, 1, 2], ["FFSP", 3, 0, [2, 1], 1, 1], ["AN", 3, 1, 6], ["FU", 1, [0, 1]], ["SP", 1, 0, 1024, [2], 1], ["AN", 1, 1, 2], ["FFSP", 1, 0, [2, 1], 1, 1], ["AN", 1, 1, 6], ["PR", 4, 0, "auto_unroll_max_step$1024"]]]], "r": [[0.00197943], 0, 1.55105, 1707732083], "mark": 2, "ag": 0, "v": "v0.6"}
{"i": [["[\"_matmul\", 512, 768, 64, \"float32\"]", "cuda -keys=cuda,gpu -arch=sm_86 -max_num_threads=1024 -model=unknown -thread_warp_size=32", [82, 999, 999, 49152, 2147483647, 1024, 255, 32], "", 0, []], [[], [["CHW", 2, "local"], ["SP", 2, 0, 512, [1, 4, 128, 1], 1], ["SP", 2, 5, 64, [1, 16, 2, 1], 1], ["SP", 2, 10, 768, [16, 1], 1], ["RE", 2, [0, 5, 1, 6, 2, 7, 10, 11, 3, 8, 12, 4, 9]], ["FSP", 3, 0, 1, 3], ["FSP", 3, 4, 2, 3], ["RE", 3, [0, 4, 1, 5, 2, 6, 3, 7]], ["CA", 2, 3, 5], ["CHR", 1, "shared", [2]], ["CA", 2, 3, 6], ["CHR", 0, "shared", [3]], ["CA", 1, 4, 6], ["FU", 5, [0, 1]], ["AN", 5, 0, 5], ["FU", 5, [1, 2]], ["AN", 5, 1, 4], ["FU", 5, [2, 3]], ["AN", 5, 2, 6], ["FU", 3, [0, 1]], ["SP", 3, 0, 32, [2], 1], ["AN", 3, 1, 2], ["FFSP", 3, 0, [2, 1], 1, 1], ["AN", 3, 1, 6], ["FU", 1, [0, 1]], ["SP", 1, 0, 2048, [2], 1], ["AN", 1, 1, 2], ["FFSP", 1, 0, [2, 1], 1, 1], ["AN", 1, 1, 6], ["PR", 4, 0, "auto_unroll_max_step$1024"]]]], "r": [[0.00210857], 0, 1.96751, 1707732083], "mark": 2, "ag": 0, "v": "v0.6"}
{"i": [["[\"_matmul\", 512, 768, 64, \"float32\"]", "cuda -keys=cuda,gpu -arch=sm_86 -max_num_threads=1024 -model=unknown -thread_warp_size=32", [82, 999, 999, 49152, 2147483647, 1024, 255, 32], "", 0, []], [[], [["CHW", 2, "local"], ["SP", 2, 0, 512, [1, 1, 128, 1], 1], ["SP", 2, 5, 64, [1, 32, 2, 1], 1], ["SP", 2, 10, 768, [12, 1], 1], ["RE", 2, [0, 5, 1, 6, 2, 7, 10, 11, 3, 8, 12, 4, 9]], ["FSP", 3, 0, 1, 3], ["FSP", 3, 4, 2, 3], ["RE", 3, [0, 4, 1, 5, 2, 6, 3, 7]], ["CA", 2, 3, 5], ["CHR", 1, "shared", [2]], ["CA", 2, 3, 6], ["CHR", 0, "shared", [3]], ["CA", 1, 4, 6], ["FU", 5, [0, 1]], ["AN", 5, 0, 5], ["FU", 5, [1, 2]], ["AN", 5, 1, 4], ["FU", 5, [2, 3]], ["AN", 5, 2, 6], ["FU", 3, [0, 1]], ["SP", 3, 0, 24, [2], 1], ["AN", 3, 1, 2], ["FFSP", 3, 0, [2, 1], 1, 1], ["AN", 3, 1, 6], ["FU", 1, [0, 1]], ["SP", 1, 0, 1536, [2], 1], ["AN", 1, 1, 2], ["FFSP", 1, 0, [2, 1], 1, 1], ["AN", 1, 1, 6], ["PR", 4, 0, "auto_unroll_max_step$1024"]]]], "r": [[0.00154482], 0, 1.72018, 1707732083], "mark": 2, "ag": 0, "v": "v0.6"}
{"i": [["[\"_matmul\", 512, 768, 64, \"float32\"]", "cuda -keys=cuda,gpu -arch=sm_86 -max_num_threads=1024 -model=unknown -thread_warp_size=32", [82, 999, 999, 49152, 2147483647, 1024, 255, 32], "", 0, []], [[], [["CHW", 2, "local"], ["SP", 2, 0, 512, [1, 4, 128, 1], 1], ["SP", 2, 5, 64, [1, 8, 2, 1], 1], ["SP", 2, 10, 768, [12, 1], 1], ["RE", 2, [0, 5, 1, 6, 2, 7, 10, 11, 3, 8, 12, 4, 9]], ["FSP", 3, 0, 1, 3], ["FSP", 3, 4, 2, 3], ["RE", 3, [0, 4, 1, 5, 2, 6, 3, 7]], ["CA", 2, 3, 5], ["CHR", 1, "shared", [2]], ["CA", 2, 3, 6], ["CHR", 0, "shared", [3]], ["CA", 1, 4, 6], ["FU", 5, [0, 1]], ["AN", 5, 0, 5], ["FU", 5, [1, 2]], ["AN", 5, 1, 4], ["FU", 5, [2, 3]], ["AN", 5, 2, 6], ["FU", 3, [0, 1]], ["SP", 3, 0, 24, [2], 1], ["AN", 3, 1, 2], ["FFSP", 3, 0, [2, 1], 1, 1], ["AN", 3, 1, 6], ["FU", 1, [0, 1]], ["SP", 1, 0, 1536, [2], 1], ["AN", 1, 1, 2], ["FFSP", 1, 0, [2, 1], 1, 1], ["AN", 1, 1, 6], ["PR", 4, 0, "auto_unroll_max_step$1024"]]]], "r": [[0.0012328], 0, 1.99819, 1707732083], "mark": 2, "ag": 0, "v": "v0.6"}
{"i": [["[\"_matmul\", 512, 768, 64, \"float32\"]", "cuda -keys=cuda,gpu -arch=sm_86 -max_num_threads=1024 -model=unknown -thread_warp_size=32", [82, 999, 999, 49152, 2147483647, 1024, 255, 32], "", 0, []], [[], [["CHW", 2, "local"], ["SP", 2, 0, 512, [1, 4, 128, 1], 1], ["SP", 2, 5, 64, [1, 32, 2, 1], 1], ["SP", 2, 10, 768, [12, 1], 1], ["RE", 2, [0, 5, 1, 6, 2, 7, 10, 11, 3, 8, 12, 4, 9]], ["FSP", 3, 0, 1, 3], ["FSP", 3, 4, 2, 3], ["RE", 3, [0, 4, 1, 5, 2, 6, 3, 7]], ["CA", 2, 3, 5], ["CHR", 1, "shared", [2]], ["CA", 2, 3, 6], ["CHR", 0, "shared", [3]], ["CA", 1, 4, 6], ["FU", 5, [0, 1]], ["AN", 5, 0, 5], ["FU", 5, [1, 2]], ["AN", 5, 1, 4], ["FU", 5, [2, 3]], ["AN", 5, 2, 6], ["FU", 3, [0, 1]], ["SP", 3, 0, 24, [2], 1], ["AN", 3, 1, 2], ["FFSP", 3, 0, [2, 1], 1, 1], ["AN", 3, 1, 6], ["FU", 1, [0, 1]], ["SP", 1, 0, 1536, [2], 1], ["AN", 1, 1, 2], ["FFSP", 1, 0, [2, 1], 1, 1], ["AN", 1, 1, 6], ["PR", 4, 0, "auto_unroll_max_step$1024"]]]], "r": [[0.0014201], 0, 1.48459, 1707732083], "mark": 2, "ag": 0, "v": "v0.6"}
{"i": [["[\"_matmul\", 512, 768, 64, \"float32\"]", "cuda -keys=cuda,gpu -arch=sm_86 -max_num_threads=1024 -model=unknown -thread_warp_size=32", [82, 999, 999, 49152, 2147483647, 1024, 255, 32], "", 0, []], [[], [["CHW", 2, "local"], ["SP", 2, 0, 512, [1, 4, 128, 1], 1], ["SP", 2, 5, 64, [1, 16, 1, 1], 1], ["SP", 2, 10, 768, [12, 1], 1], ["RE", 2, [0, 5, 1, 6, 2, 7, 10, 11, 3, 8, 12, 4, 9]], ["FSP", 3, 0, 1, 3], ["FSP", 3, 4, 2, 3], ["RE", 3, [0, 4, 1, 5, 2, 6, 3, 7]], ["CA", 2, 3, 5], ["CHR", 1, "shared", [2]], ["CA", 2, 3, 6], ["CHR", 0, "shared", [3]], ["CA", 1, 4, 6], ["FU", 5, [0, 1]], ["AN", 5, 0, 5], ["FU", 5, [1, 2]], ["AN", 5, 1, 4], ["FU", 5, [2, 3]], ["AN", 5, 2, 6], ["FU", 3, [0, 1]], ["SP", 3, 0, 12, [2], 1], ["AN", 3, 1, 2], ["FFSP", 3, 0, [2, 1], 1, 1], ["AN", 3, 1, 6], ["FU", 1, [0, 1]], ["SP", 1, 0, 1536, [2], 1], ["AN", 1, 1, 2], ["FFSP", 1, 0, [2, 1], 1, 1], ["AN", 1, 1, 6], ["PR", 4, 0, "auto_unroll_max_step$1024"]]]], "r": [[0.000315833], 0, 1.05841, 1707732084], "mark": 2, "ag": 0, "v": "v0.6"}
{"i": [["[\"_matmul\", 512, 768, 64, \"float32\"]", "cuda -keys=cuda,gpu -arch=sm_86 -max_num_threads=1024 -model=unknown -thread_warp_size=32", [82, 999, 999, 49152, 2147483647, 1024, 255, 32], "", 0, []], [[], [["CHW", 2, "local"], ["SP", 2, 0, 512, [1, 4, 128, 1], 1], ["SP", 2, 5, 64, [1, 16, 4, 1], 1], ["SP", 2, 10, 768, [12, 1], 1], ["RE", 2, [0, 5, 1, 6, 2, 7, 10, 11, 3, 8, 12, 4, 9]], ["FSP", 3, 0, 1, 3], ["FSP", 3, 4, 2, 3], ["RE", 3, [0, 4, 1, 5, 2, 6, 3, 7]], ["CA", 2, 3, 5], ["CHR", 1, "shared", [2]], ["CA", 2, 3, 6], ["CHR", 0, "shared", [3]], ["CA", 1, 4, 6], ["FU", 5, [0, 1]], ["AN", 5, 0, 5], ["FU", 5, [1, 2]], ["AN", 5, 1, 4], ["FU", 5, [2, 3]], ["AN", 5, 2, 6], ["FU", 3, [0, 1]], ["SP", 3, 0, 48, [2], 1], ["AN", 3, 1, 2], ["FFSP", 3, 0, [2, 1], 1, 1], ["AN", 3, 1, 6], ["FU", 1, [0, 1]], ["SP", 1, 0, 1536, [2], 1], ["AN", 1, 1, 2], ["FFSP", 1, 0, [2, 1], 1, 1], ["AN", 1, 1, 6], ["PR", 4, 0, "auto_unroll_max_step$1024"]]]], "r": [[0.00369115], 0, 1.80553, 1707732084], "mark": 2, "ag": 0, "v": "v0.6"}
{"i": [["[\"_matmul\", 512, 768, 64, \"float32\"]", "cuda -keys=cuda,gpu -arch=sm_86 -max_num_threads=1024 -model=unknown -thread_warp_size=32", [82, 999, 999, 49152, 2147483647, 1024, 255, 32], "", 0, []], [[], [["CHW", 2, "local"], ["SP", 2, 0, 512, [1, 2, 64, 1], 1], ["SP", 2, 5, 64, [1, 16, 2, 1], 1], ["SP", 2, 10, 768, [8, 1], 1], ["RE", 2, [0, 5, 1, 6, 2, 7, 10, 11, 3, 8, 12, 4, 9]], ["FSP", 3, 0, 1, 3], ["FSP", 3, 4, 2, 3], ["RE", 3, [0, 4, 1, 5, 2, 6, 3, 7]], ["CA", 2, 3, 5], ["CHR", 1, "shared", [2]], ["CA", 2, 3, 6], ["CHR", 0, "shared", [3]], ["CA", 1, 4, 6], ["FU", 5, [0, 1]], ["AN", 5, 0, 5], ["FU", 5, [1, 2]], ["AN", 5, 1, 4], ["FU", 5, [2, 3]], ["AN", 5, 2, 6], ["FU", 3, [0, 1]], ["SP", 3, 0, 16, [2], 1], ["AN", 3, 1, 2], ["FFSP", 3, 0, [2, 1], 1, 1], ["AN", 3, 1, 6], ["FU", 1, [0, 1]], ["SP", 1, 0, 512, [2], 1], ["AN", 1, 1, 2], ["FFSP", 1, 0, [2, 1], 1, 1], ["AN", 1, 1, 6], ["PR", 4, 0, "auto_unroll_max_step$1024"]]]], "r": [[0.000148417], 0, 2.04937, 1707732084], "mark": 2, "ag": 0, "v": "v0.6"}
{"i": [["[\"_matmul\", 512, 768, 64, \"float32\"]", "cuda -keys=cuda,gpu -arch=sm_86 -max_num_threads=1024 -model=unknown -thread_warp_size=32", [82, 999, 999, 49152, 2147483647, 1024, 255, 32], "", 0, []], [[], [["CHW", 2, "local"], ["SP", 2, 0, 512, [1, 2, 64, 1], 1], ["SP", 2, 5, 64, [1, 16, 2, 1], 1], ["SP", 2, 10, 768, [16, 1], 1], ["RE", 2, [0, 5, 1, 6, 2, 7, 10, 11, 3, 8, 12, 4, 9]], ["FSP", 3, 0, 1, 3], ["FSP", 3, 4, 2, 3], ["RE", 3, [0, 4, 1, 5, 2, 6, 3, 7]], ["CA", 2, 3, 5], ["CHR", 1, "shared", [2]], ["CA", 2, 3, 6], ["CHR", 0, "shared", [3]], ["CA", 1, 4, 6], ["FU", 5, [0, 1]], ["AN", 5, 0, 5], ["FU", 5, [1, 2]], ["AN", 5, 1, 4], ["FU", 5, [2, 3]], ["AN", 5, 2, 6], ["FU", 3, [0, 1]], ["SP", 3, 0, 32, [2], 1], ["AN", 3, 1, 2], ["FFSP", 3, 0, [2, 1], 1, 1], ["AN", 3, 1, 6], ["FU", 1, [0, 1]], ["SP", 1, 0, 1024, [2], 1], ["AN", 1, 1, 2], ["FFSP", 1, 0, [2, 1], 1, 1], ["AN", 1, 1, 6], ["PR", 4, 0, "auto_unroll_max_step$1024"]]]], "r": [[0.00015605], 0, 1.17789, 1707732084], "mark": 2, "ag": 0, "v": "v0.6"}
{"i": [["[\"_matmul\", 512, 768, 64, \"float32\"]", "cuda -keys=cuda,gpu -arch=sm_86 -max_num_threads=1024 -model=unknown -thread_warp_size=32", [82, 999, 999, 49152, 2147483647, 1024, 255, 32], "", 0, []], [[], [["CHW", 2, "local"], ["SP", 2, 0, 512, [1, 2, 256, 1], 1], ["SP", 2, 5, 64, [1, 16, 2, 1], 1], ["SP", 2, 10, 768, [8, 1], 1], ["RE", 2, [0, 5, 1, 6, 2, 7, 10, 11, 3, 8, 12, 4, 9]], ["FSP", 3, 0, 1, 3], ["FSP", 3, 4, 2, 3], ["RE", 3, [0, 4, 1, 5, 2, 6, 3, 7]], ["CA", 2, 3, 5], ["CHR", 1, "shared", [2]], ["CA", 2, 3, 6], ["CHR", 0, "shared", [3]], ["CA", 1, 4, 6], ["FU", 5, [0, 1]], ["AN", 5, 0, 5], ["FU", 5, [1, 2]], ["AN", 5, 1, 4], ["FU", 5, [2, 3]], ["AN", 5, 2, 6], ["FU", 3, [0, 1]], ["SP", 3, 0, 16, [2], 1], ["AN", 3, 1, 2], ["FFSP", 3, 0, [2, 1], 1, 1], ["AN", 3, 1, 6], ["FU", 1, [0, 1]], ["SP", 1, 0, 2048, [2], 1], ["AN", 1, 1, 2], ["FFSP", 1, 0, [2, 1], 1, 1], ["AN", 1, 1, 6], ["PR", 4, 0, "auto_unroll_max_step$1024"]]]], "r": [[0.00503808], 0, 2.79323, 1707732085], "mark": 2, "ag": 0, "v": "v0.6"}
{"i": [["[\"_matmul\", 512, 768, 64, \"float32\"]", "cuda -keys=cuda,gpu -arch=sm_86 -max_num_threads=1024 -model=unknown -thread_warp_size=32", [82, 999, 999, 49152, 2147483647, 1024, 255, 32], "", 0, []], [[], [["CHW", 2, "local"], ["SP", 2, 0, 512, [1, 2, 256, 1], 1], ["SP", 2, 5, 64, [1, 16, 2, 1], 1], ["SP", 2, 10, 768, [16, 1], 1], ["RE", 2, [0, 5, 1, 6, 2, 7, 10, 11, 3, 8, 12, 4, 9]], ["FSP", 3, 0, 1, 3], ["FSP", 3, 4, 2, 3], ["RE", 3, [0, 4, 1, 5, 2, 6, 3, 7]], ["CA", 2, 3, 5], ["CHR", 1, "shared", [2]], ["CA", 2, 3, 6], ["CHR", 0, "shared", [3]], ["CA", 1, 4, 6], ["FU", 5, [0, 1]], ["AN", 5, 0, 5], ["FU", 5, [1, 2]], ["AN", 5, 1, 4], ["FU", 5, [2, 3]], ["AN", 5, 2, 6], ["FU", 3, [0, 1]], ["SP", 3, 0, 32, [2], 1], ["AN", 3, 1, 2], ["FFSP", 3, 0, [2, 1], 1, 1], ["AN", 3, 1, 6], ["FU", 1, [0, 1]], ["SP", 1, 0, 4096, [2], 1], ["AN", 1, 1, 2], ["FFSP", 1, 0, [2, 1], 1, 1], ["AN", 1, 1, 6], ["PR", 4, 0, "auto_unroll_max_step$1024"]]]], "r": [[0.00515953], 0, 2.07301, 1707732085], "mark": 2, "ag": 0, "v": "v0.6"}
{"i": [["[\"_matmul\", 512, 768, 64, \"float32\"]", "cuda -keys=cuda,gpu -arch=sm_86 -max_num_threads=1024 -model=unknown -thread_warp_size=32", [82, 999, 999, 49152, 2147483647, 1024, 255, 32], "", 0, []], [[], [["CHW", 2, "local"], ["SP", 2, 0, 512, [1, 2, 64, 1], 1], ["SP", 2, 5, 64, [1, 32, 2, 1], 1], ["SP", 2, 10, 768, [12, 1], 1], ["RE", 2, [0, 5, 1, 6, 2, 7, 10, 11, 3, 8, 12, 4, 9]], ["FSP", 3, 0, 1, 3], ["FSP", 3, 4, 2, 3], ["RE", 3, [0, 4, 1, 5, 2, 6, 3, 7]], ["CA", 2, 3, 5], ["CHR", 1, "shared", [2]], ["CA", 2, 3, 6], ["CHR", 0, "shared", [3]], ["CA", 1, 4, 6], ["FU", 5, [0, 1]], ["AN", 5, 0, 5], ["FU", 5, [1, 2]], ["AN", 5, 1, 4], ["FU", 5, [2, 3]], ["AN", 5, 2, 6], ["FU", 3, [0, 1]], ["SP", 3, 0, 24, [2], 1], ["AN", 3, 1, 2], ["FFSP", 3, 0, [2, 1], 1, 1], ["AN", 3, 1, 6], ["FU", 1, [0, 1]], ["SP", 1, 0, 768, [2], 1], ["AN", 1, 1, 2], ["FFSP", 1, 0, [2, 1], 1, 1], ["AN", 1, 1, 6], ["PR", 4, 0, "auto_unroll_max_step$1024"]]]], "r": [[0.000146967], 0, 1.00581, 1707732085], "mark": 2, "ag": 0, "v": "v0.6"}
{"i": [["[\"_matmul\", 512, 768, 64, \"float32\"]", "cuda -keys=cuda,gpu -arch=sm_86 -max_num_threads=1024 -model=unknown -thread_warp_size=32", [82, 999, 999, 49152, 2147483647, 1024, 255, 32], "", 0, []], [[], [["CHW", 2, "local"], ["SP", 2, 0, 512, [1, 2, 256, 1], 1], ["SP", 2, 5, 64, [1, 32, 2, 1], 1], ["SP", 2, 10, 768, [12, 1], 1], ["RE", 2, [0, 5, 1, 6, 2, 7, 10, 11, 3, 8, 12, 4, 9]], ["FSP", 3, 0, 1, 3], ["FSP", 3, 4, 2, 3], ["RE", 3, [0, 4, 1, 5, 2, 6, 3, 7]], ["CA", 2, 3, 5], ["CHR", 1, "shared", [2]], ["CA", 2, 3, 6], ["CHR", 0, "shared", [3]], ["CA", 1, 4, 6], ["FU", 5, [0, 1]], ["AN", 5, 0, 5], ["FU", 5, [1, 2]], ["AN", 5, 1, 4], ["FU", 5, [2, 3]], ["AN", 5, 2, 6], ["FU", 3, [0, 1]], ["SP", 3, 0, 24, [2], 1], ["AN", 3, 1, 2], ["FFSP", 3, 0, [2, 1], 1, 1], ["AN", 3, 1, 6], ["FU", 1, [0, 1]], ["SP", 1, 0, 3072, [2], 1], ["AN", 1, 1, 2], ["FFSP", 1, 0, [2, 1], 1, 1], ["AN", 1, 1, 6], ["PR", 4, 0, "auto_unroll_max_step$1024"]]]], "r": [[0.00529403], 0, 1.86175, 1707732085], "mark": 2, "ag": 0, "v": "v0.6"}
{"i": [["[\"_matmul\", 512, 768, 64, \"float32\"]", "cuda -keys=cuda,gpu -arch=sm_86 -max_num_threads=1024 -model=unknown -thread_warp_size=32", [82, 999, 999, 49152, 2147483647, 1024, 255, 32], "", 0, []], [[], [["CHW", 2, "local"], ["SP", 2, 0, 512, [1, 2, 64, 1], 1], ["SP", 2, 5, 64, [1, 16, 1, 1], 1], ["SP", 2, 10, 768, [12, 1], 1], ["RE", 2, [0, 5, 1, 6, 2, 7, 10, 11, 3, 8, 12, 4, 9]], ["FSP", 3, 0, 1, 3], ["FSP", 3, 4, 2, 3], ["RE", 3, [0, 4, 1, 5, 2, 6, 3, 7]], ["CA", 2, 3, 5], ["CHR", 1, "shared", [2]], ["CA", 2, 3, 6], ["CHR", 0, "shared", [3]], ["CA", 1, 4, 6], ["FU", 5, [0, 1]], ["AN", 5, 0, 5], ["FU", 5, [1, 2]], ["AN", 5, 1, 4], ["FU", 5, [2, 3]], ["AN", 5, 2, 6], ["FU", 3, [0, 1]], ["SP", 3, 0, 12, [2], 1], ["AN", 3, 1, 2], ["FFSP", 3, 0, [2, 1], 1, 1], ["AN", 3, 1, 6], ["FU", 1, [0, 1]], ["SP", 1, 0, 768, [2], 1], ["AN", 1, 1, 2], ["FFSP", 1, 0, [2, 1], 1, 1], ["AN", 1, 1, 6], ["PR", 4, 0, "auto_unroll_max_step$1024"]]]], "r": [[0.000100933], 0, 2.15421, 1707732085], "mark": 2, "ag": 0, "v": "v0.6"}
{"i": [["[\"_matmul\", 512, 768, 64, \"float32\"]", "cuda -keys=cuda,gpu -arch=sm_86 -max_num_threads=1024 -model=unknown -thread_warp_size=32", [82, 999, 999, 49152, 2147483647, 1024, 255, 32], "", 0, []], [[], [["CHW", 2, "local"], ["SP", 2, 0, 512, [1, 2, 64, 1], 1], ["SP", 2, 5, 64, [1, 16, 4, 1], 1], ["SP", 2, 10, 768, [12, 1], 1], ["RE", 2, [0, 5, 1, 6, 2, 7, 10, 11, 3, 8, 12, 4, 9]], ["FSP", 3, 0, 1, 3], ["FSP", 3, 4, 2, 3], ["RE", 3, [0, 4, 1, 5, 2, 6, 3, 7]], ["CA", 2, 3, 5], ["CHR", 1, "shared", [2]], ["CA", 2, 3, 6], ["CHR", 0, "shared", [3]], ["CA", 1, 4, 6], ["FU", 5, [0, 1]], ["AN", 5, 0, 5], ["FU", 5, [1, 2]], ["AN", 5, 1, 4], ["FU", 5, [2, 3]], ["AN", 5, 2, 6], ["FU", 3, [0, 1]], ["SP", 3, 0, 48, [2], 1], ["AN", 3, 1, 2], ["FFSP", 3, 0, [2, 1], 1, 1], ["AN", 3, 1, 6], ["FU", 1, [0, 1]], ["SP", 1, 0, 768, [2], 1], ["AN", 1, 1, 2], ["FFSP", 1, 0, [2, 1], 1, 1], ["AN", 1, 1, 6], ["PR", 4, 0, "auto_unroll_max_step$1024"]]]], "r": [[0.00106905], 0, 1.60174, 1707732086], "mark": 2, "ag": 0, "v": "v0.6"}
{"i": [["[\"_matmul\", 512, 768, 64, \"float32\"]", "cuda -keys=cuda,gpu -arch=sm_86 -max_num_threads=1024 -model=unknown -thread_warp_size=32", [82, 999, 999, 49152, 2147483647, 1024, 255, 32], "", 0, []], [[], [["CHW", 2, "local"], ["SP", 2, 0, 512, [1, 2, 256, 1], 1], ["SP", 2, 5, 64, [1, 16, 1, 1], 1], ["SP", 2, 10, 768, [12, 1], 1], ["RE", 2, [0, 5, 1, 6, 2, 7, 10, 11, 3, 8, 12, 4, 9]], ["FSP", 3, 0, 1, 3], ["FSP", 3, 4, 2, 3], ["RE", 3, [0, 4, 1, 5, 2, 6, 3, 7]], ["CA", 2, 3, 5], ["CHR", 1, "shared", [2]], ["CA", 2, 3, 6], ["CHR", 0, "shared", [3]], ["CA", 1, 4, 6], ["FU", 5, [0, 1]], ["AN", 5, 0, 5], ["FU", 5, [1, 2]], ["AN", 5, 1, 4], ["FU", 5, [2, 3]], ["AN", 5, 2, 6], ["FU", 3, [0, 1]], ["SP", 3, 0, 12, [2], 1], ["AN", 3, 1, 2], ["FFSP", 3, 0, [2, 1], 1, 1], ["AN", 3, 1, 6], ["FU", 1, [0, 1]], ["SP", 1, 0, 3072, [2], 1], ["AN", 1, 1, 2], ["FFSP", 1, 0, [2, 1], 1, 1], ["AN", 1, 1, 6], ["PR", 4, 0, "auto_unroll_max_step$1024"]]]], "r": [[0.00185635], 0, 2.14247, 1707732086], "mark": 2, "ag": 0, "v": "v0.6"}
{"i": [["[\"_matmul\", 512, 768, 64, \"float32\"]", "cuda -keys=cuda,gpu -arch=sm_86 -max_num_threads=1024 -model=unknown -thread_warp_size=32", [82, 999, 999, 49152, 2147483647, 1024, 255, 32], "", 0, []], [[], [["CHW", 2, "local"], ["SP", 2, 0, 512, [1, 2, 256, 1], 1], ["SP", 2, 5, 64, [1, 16, 4, 1], 1], ["SP", 2, 10, 768, [12, 1], 1], ["RE", 2, [0, 5, 1, 6, 2, 7, 10, 11, 3, 8, 12, 4, 9]], ["FSP", 3, 0, 1, 3], ["FSP", 3, 4, 2, 3], ["RE", 3, [0, 4, 1, 5, 2, 6, 3, 7]], ["CA", 2, 3, 5], ["CHR", 1, "shared", [2]], ["CA", 2, 3, 6], ["CHR", 0, "shared", [3]], ["CA", 1, 4, 6], ["FU", 5, [0, 1]], ["AN", 5, 0, 5], ["FU", 5, [1, 2]], ["AN", 5, 1, 4], ["FU", 5, [2, 3]], ["AN", 5, 2, 6], ["FU", 3, [0, 1]], ["SP", 3, 0, 48, [2], 1], ["AN", 3, 1, 2], ["FFSP", 3, 0, [2, 1], 1, 1], ["AN", 3, 1, 6], ["FU", 1, [0, 1]], ["SP", 1, 0, 3072, [2], 1], ["AN", 1, 1, 2], ["FFSP", 1, 0, [2, 1], 1, 1], ["AN", 1, 1, 6], ["PR", 4, 0, "auto_unroll_max_step$1024"]]]], "r": [[0.00934334], 0, 2.95344, 1707732086], "mark": 2, "ag": 0, "v": "v0.6"}
{"i": [["[\"_matmul\", 512, 768, 64, \"float32\"]", "cuda -keys=cuda,gpu -arch=sm_86 -max_num_threads=1024 -model=unknown -thread_warp_size=32", [82, 999, 999, 49152, 2147483647, 1024, 255, 32], "", 0, []], [[], [["CHW", 2, "local"], ["SP", 2, 0, 512, [1, 4, 64, 1], 1], ["SP", 2, 5, 64, [1, 16, 2, 1], 1], ["SP", 2, 10, 768, [12, 1], 1], ["RE", 2, [0, 5, 1, 6, 2, 7, 10, 11, 3, 8, 12, 4, 9]], ["FSP", 3, 0, 1, 3], ["FSP", 3, 4, 2, 3], ["RE", 3, [0, 4, 1, 5, 2, 6, 3, 7]], ["CA", 2, 3, 5], ["CHR", 1, "shared", [2]], ["CA", 2, 3, 6], ["CHR", 0, "shared", [3]], ["CA", 1, 4, 6], ["FU", 5, [0, 1]], ["AN", 5, 0, 5], ["FU", 5, [1, 2]], ["AN", 5, 1, 4], ["FU", 5, [2, 3]], ["AN", 5, 2, 6], ["FU", 3, [0, 1]], ["SP", 3, 0, 24, [2], 1], ["AN", 3, 1, 2], ["FFSP", 3, 0, [2, 1], 1, 1], ["AN", 3, 1, 6], ["FU", 1, [0, 1]], ["SP", 1, 0, 768, [2], 1], ["AN", 1, 1, 2], ["FFSP", 1, 0, [2, 1], 1, 1], ["AN", 1, 1, 6], ["PR", 4, 0, "auto_unroll_max_step$1024"]]]], "r": [[0.000159229], 0, 0.854087, 1707732086], "mark": 2, "ag": 0, "v": "v0.6"}
{"i": [["[\"_matmul\", 512, 768, 64, \"float32\"]", "cuda -keys=cuda,gpu -arch=sm_86 -max_num_threads=1024 -model=unknown -thread_warp_size=32", [82, 999, 999, 49152, 2147483647, 1024, 255, 32], "", 0, []], [[], [["CHW", 2, "local"], ["SP", 2, 0, 512, [1, 2, 64, 1], 1], ["SP", 2, 5, 64, [1, 16, 1, 1], 1], ["SP", 2, 10, 768, [12, 1], 1], ["RE", 2, [0, 5, 1, 6, 2, 7, 10, 11, 3, 8, 12, 4, 9]], ["FSP", 3, 0, 1, 3], ["FSP", 3, 4, 2, 3], ["RE", 3, [0, 4, 1, 5, 2, 6, 3, 7]], ["CA", 2, 3, 5], ["CHR", 1, "shared", [2]], ["CA", 2, 3, 6], ["CHR", 0, "shared", [3]], ["CA", 1, 4, 6], ["FU", 5, [0, 1]], ["AN", 5, 0, 5], ["FU", 5, [1, 2]], ["AN", 5, 1, 4], ["FU", 5, [2, 3]], ["AN", 5, 2, 6], ["FU", 3, [0, 1]], ["SP", 3, 0, 12, [2], 1], ["AN", 3, 1, 2], ["FFSP", 3, 0, [2, 1], 1, 1], ["AN", 3, 1, 6], ["FU", 1, [0, 1]], ["SP", 1, 0, 768, [2], 1], ["AN", 1, 1, 2], ["FFSP", 1, 0, [2, 1], 1, 1], ["AN", 1, 1, 6], ["PR", 4, 0, "auto_unroll_max_step$1024"]]]], "r": [[0.000100933], 0, 2.15421, 1707732085], "mark": 2, "ag": 1, "v": "v0.6"}
{"i": [["[\"_matmul\", 512, 768, 64, \"float32\"]", "cuda -keys=cuda,gpu -arch=sm_86 -max_num_threads=1024 -model=unknown -thread_warp_size=32", [82, 999, 999, 49152, 2147483647, 1024, 255, 32], "", 0, []], [[], [["CHW", 2, "local"], ["SP", 2, 0, 512, [1, 2, 64, 1], 1], ["SP", 2, 5, 64, [1, 16, 1, 1], 1], ["SP", 2, 10, 768, [8, 1], 1], ["RE", 2, [0, 5, 1, 6, 2, 7, 10, 11, 3, 8, 12, 4, 9]], ["FSP", 3, 0, 1, 3], ["FSP", 3, 4, 2, 3], ["RE", 3, [0, 4, 1, 5, 2, 6, 3, 7]], ["CA", 2, 3, 5], ["CHR", 1, "shared", [2]], ["CA", 2, 3, 6], ["CHR", 0, "shared", [3]], ["CA", 1, 4, 6], ["FU", 5, [0, 1]], ["AN", 5, 0, 5], ["FU", 5, [1, 2]], ["AN", 5, 1, 4], ["FU", 5, [2, 3]], ["AN", 5, 2, 6], ["FU", 3, [0, 1]], ["SP", 3, 0, 8, [2], 1], ["AN", 3, 1, 2], ["FFSP", 3, 0, [2, 1], 1, 1], ["AN", 3, 1, 6], ["FU", 1, [0, 1]], ["SP", 1, 0, 512, [2], 1], ["AN", 1, 1, 2], ["FFSP", 1, 0, [2, 1], 1, 1], ["AN", 1, 1, 6], ["PR", 4, 0, "auto_unroll_max_step$1024"]]]], "r": [[8.31404e-05], 0, 0.963829, 1707732091], "mark": 2, "ag": 1, "v": "v0.6"}
{"i": [["[\"_matmul\", 512, 768, 64, \"float32\"]", "cuda -keys=cuda,gpu -arch=sm_86 -max_num_threads=1024 -model=unknown -thread_warp_size=32", [82, 999, 999, 49152, 2147483647, 1024, 255, 32], "", 0, []], [[], [["CHW", 2, "local"], ["SP", 2, 0, 512, [1, 2, 64, 1], 1], ["SP", 2, 5, 64, [1, 16, 1, 1], 1], ["SP", 2, 10, 768, [16, 1], 1], ["RE", 2, [0, 5, 1, 6, 2, 7, 10, 11, 3, 8, 12, 4, 9]], ["FSP", 3, 0, 1, 3], ["FSP", 3, 4, 2, 3], ["RE", 3, [0, 4, 1, 5, 2, 6, 3, 7]], ["CA", 2, 3, 5], ["CHR", 1, "shared", [2]], ["CA", 2, 3, 6], ["CHR", 0, "shared", [3]], ["CA", 1, 4, 6], ["FU", 5, [0, 1]], ["AN", 5, 0, 5], ["FU", 5, [1, 2]], ["AN", 5, 1, 4], ["FU", 5, [2, 3]], ["AN", 5, 2, 6], ["FU", 3, [0, 1]], ["SP", 3, 0, 16, [2], 1], ["AN", 3, 1, 2], ["FFSP", 3, 0, [2, 1], 1, 1], ["AN", 3, 1, 6], ["FU", 1, [0, 1]], ["SP", 1, 0, 1024, [2], 1], ["AN", 1, 1, 2], ["FFSP", 1, 0, [2, 1], 1, 1], ["AN", 1, 1, 6], ["PR", 4, 0, "auto_unroll_max_step$1024"]]]], "r": [[0.000122335], 0, 2.25836, 1707732091], "mark": 2, "ag": 1, "v": "v0.6"}
{"i": [["[\"_matmul\", 512, 768, 64, \"float32\"]", "cuda -keys=cuda,gpu -arch=sm_86 -max_num_threads=1024 -model=unknown -thread_warp_size=32", [82, 999, 999, 49152, 2147483647, 1024, 255, 32], "", 0, []], [[], [["CHW", 2, "local"], ["SP", 2, 0, 512, [1, 2, 64, 1], 1], ["SP", 2, 5, 64, [1, 32, 1, 1], 1], ["SP", 2, 10, 768, [12, 1], 1], ["RE", 2, [0, 5, 1, 6, 2, 7, 10, 11, 3, 8, 12, 4, 9]], ["FSP", 3, 0, 1, 3], ["FSP", 3, 4, 2, 3], ["RE", 3, [0, 4, 1, 5, 2, 6, 3, 7]], ["CA", 2, 3, 5], ["CHR", 1, "shared", [2]], ["CA", 2, 3, 6], ["CHR", 0, "shared", [3]], ["CA", 1, 4, 6], ["FU", 5, [0, 1]], ["AN", 5, 0, 5], ["FU", 5, [1, 2]], ["AN", 5, 1, 4], ["FU", 5, [2, 3]], ["AN", 5, 2, 6], ["FU", 3, [0, 1]], ["SP", 3, 0, 12, [2], 1], ["AN", 3, 1, 2], ["FFSP", 3, 0, [2, 1], 1, 1], ["AN", 3, 1, 6], ["FU", 1, [0, 1]], ["SP", 1, 0, 768, [2], 1], ["AN", 1, 1, 2], ["FFSP", 1, 0, [2, 1], 1, 1], ["AN", 1, 1, 6], ["PR", 4, 0, "auto_unroll_max_step$1024"]]]], "r": [[8.57434e-05], 0, 1.6623, 1707732091], "mark": 2, "ag": 1, "v": "v0.6"}
{"i": [["[\"_matmul\", 512, 768, 64, \"float32\"]", "cuda -keys=cuda,gpu -arch=sm_86 -max_num_threads=1024 -model=unknown -thread_warp_size=32", [82, 999, 999, 49152, 2147483647, 1024, 255, 32], "", 0, []], [[], [["CHW", 2, "local"], ["SP", 2, 0, 512, [1, 2, 64, 1], 1], ["SP", 2, 5, 64, [1, 16, 2, 1], 1], ["SP", 2, 10, 768, [12, 1], 1], ["RE", 2, [0, 5, 1, 6, 2, 7, 10, 11, 3, 8, 12, 4, 9]], ["FSP", 3, 0, 1, 3], ["FSP", 3, 4, 2, 3], ["RE", 3, [0, 4, 1, 5, 2, 6, 3, 7]], ["CA", 2, 3, 5], ["CHR", 1, "shared", [2]], ["CA", 2, 3, 6], ["CHR", 0, "shared", [3]], ["CA", 1, 4, 6], ["FU", 5, [0, 1]], ["AN", 5, 0, 5], ["FU", 5, [1, 2]], ["AN", 5, 1, 4], ["FU", 5, [2, 3]], ["AN", 5, 2, 6], ["FU", 3, [0, 1]], ["SP", 3, 0, 24, [2], 1], ["AN", 3, 1, 2], ["FFSP", 3, 0, [2, 1], 1, 1], ["AN", 3, 1, 6], ["FU", 1, [0, 1]], ["SP", 1, 0, 768, [2], 1], ["AN", 1, 1, 2], ["FFSP", 1, 0, [2, 1], 1, 1], ["AN", 1, 1, 6], ["PR", 4, 0, "auto_unroll_max_step$1024"]]]], "r": [[0.000159528], 0, 1.01799, 1707732091], "mark": 2, "ag": 1, "v": "v0.6"}
{"i": [["[\"_matmul\", 512, 768, 64, \"float32\"]", "cuda -keys=cuda,gpu -arch=sm_86 -max_num_threads=1024 -model=unknown -thread_warp_size=32", [82, 999, 999, 49152, 2147483647, 1024, 255, 32], "", 0, []], [[], [["CHW", 2, "local"], ["SP", 2, 0, 512, [1, 4, 64, 1], 1], ["SP", 2, 5, 64, [1, 16, 1, 1], 1], ["SP", 2, 10, 768, [12, 1], 1], ["RE", 2, [0, 5, 1, 6, 2, 7, 10, 11, 3, 8, 12, 4, 9]], ["FSP", 3, 0, 1, 3], ["FSP", 3, 4, 2, 3], ["RE", 3, [0, 4, 1, 5, 2, 6, 3, 7]], ["CA", 2, 3, 5], ["CHR", 1, "shared", [2]], ["CA", 2, 3, 6], ["CHR", 0, "shared", [3]], ["CA", 1, 4, 6], ["FU", 5, [0, 1]], ["AN", 5, 0, 5], ["FU", 5, [1, 2]], ["AN", 5, 1, 4], ["FU", 5, [2, 3]], ["AN", 5, 2, 6], ["FU", 3, [0, 1]], ["SP", 3, 0, 12, [2], 1], ["AN", 3, 1, 2], ["FFSP", 3, 0, [2, 1], 1, 1], ["AN", 3, 1, 6], ["FU", 1, [0, 1]], ["SP", 1, 0, 768, [2], 1], ["AN", 1, 1, 2], ["FFSP", 1, 0, [2, 1], 1, 1], ["AN", 1, 1, 6], ["PR", 4, 0, "auto_unroll_max_step$1024"]]]], "r": [[0.000100916], 0, 1.54596, 1707732092], "mark": 2, "ag": 1, "v": "v0.6"}
{"i": [["[\"_matmul\", 512, 768, 64, \"float32\"]", "cuda -keys=cuda,gpu -arch=sm_86 -max_num_threads=1024 -model=unknown -thread_warp_size=32", [82, 999, 999, 49152, 2147483647, 1024, 255, 32], "", 0, []], [[], [["CHW", 2, "local"], ["SP", 2, 0, 512, [1, 2, 32, 1], 1], ["SP", 2, 5, 64, [1, 16, 1, 1], 1], ["SP", 2, 10, 768, [12, 1], 1], ["RE", 2, [0, 5, 1, 6, 2, 7, 10, 11, 3, 8, 12, 4, 9]], ["FSP", 3, 0, 1, 3], ["FSP", 3, 4, 2, 3], ["RE", 3, [0, 4, 1, 5, 2, 6, 3, 7]], ["CA", 2, 3, 5], ["CHR", 1, "shared", [2]], ["CA", 2, 3, 6], ["CHR", 0, "shared", [3]], ["CA", 1, 4, 6], ["FU", 5, [0, 1]], ["AN", 5, 0, 5], ["FU", 5, [1, 2]], ["AN", 5, 1, 4], ["FU", 5, [2, 3]], ["AN", 5, 2, 6], ["FU", 3, [0, 1]], ["SP", 3, 0, 12, [2], 1], ["AN", 3, 1, 2], ["FFSP", 3, 0, [2, 1], 1, 1], ["AN", 3, 1, 6], ["FU", 1, [0, 1]], ["SP", 1, 0, 384, [2], 1], ["AN", 1, 1, 2], ["FFSP", 1, 0, [2, 1], 1, 1], ["AN", 1, 1, 6], ["PR", 4, 0, "auto_unroll_max_step$1024"]]]], "r": [[4.74835e-05], 0, 1.00199, 1707732092], "mark": 2, "ag": 1, "v": "v0.6"}
{"i": [["[\"_matmul\", 512, 768, 64, \"float32\"]", "cuda -keys=cuda,gpu -arch=sm_86 -max_num_threads=1024 -model=unknown -thread_warp_size=32", [82, 999, 999, 49152, 2147483647, 1024, 255, 32], "", 0, []], [[], [["CHW", 2, "local"], ["SP", 2, 0, 512, [1, 2, 128, 1], 1], ["SP", 2, 5, 64, [1, 16, 1, 1], 1], ["SP", 2, 10, 768, [12, 1], 1], ["RE", 2, [0, 5, 1, 6, 2, 7, 10, 11, 3, 8, 12, 4, 9]], ["FSP", 3, 0, 1, 3], ["FSP", 3, 4, 2, 3], ["RE", 3, [0, 4, 1, 5, 2, 6, 3, 7]], ["CA", 2, 3, 5], ["CHR", 1, "shared", [2]], ["CA", 2, 3, 6], ["CHR", 0, "shared", [3]], ["CA", 1, 4, 6], ["FU", 5, [0, 1]], ["AN", 5, 0, 5], ["FU", 5, [1, 2]], ["AN", 5, 1, 4], ["FU", 5, [2, 3]], ["AN", 5, 2, 6], ["FU", 3, [0, 1]], ["SP", 3, 0, 12, [2], 1], ["AN", 3, 1, 2], ["FFSP", 3, 0, [2, 1], 1, 1], ["AN", 3, 1, 6], ["FU", 1, [0, 1]], ["SP", 1, 0, 1536, [2], 1], ["AN", 1, 1, 2], ["FFSP", 1, 0, [2, 1], 1, 1], ["AN", 1, 1, 6], ["PR", 4, 0, "auto_unroll_max_step$1024"]]]], "r": [[0.000631092], 0, 0.981807, 1707732092], "mark": 2, "ag": 1, "v": "v0.6"}
{"i": [["[\"_matmul\", 512, 768, 64, \"float32\"]", "cuda -keys=cuda,gpu -arch=sm_86 -max_num_threads=1024 -model=unknown -thread_warp_size=32", [82, 999, 999, 49152, 2147483647, 1024, 255, 32], "", 0, []], [[], [["CHW", 2, "local"], ["SP", 2, 0, 512, [1, 2, 64, 1], 1], ["SP", 2, 5, 64, [1, 32, 1, 1], 1], ["SP", 2, 10, 768, [8, 1], 1], ["RE", 2, [0, 5, 1, 6, 2, 7, 10, 11, 3, 8, 12, 4, 9]], ["FSP", 3, 0, 1, 3], ["FSP", 3, 4, 2, 3], ["RE", 3, [0, 4, 1, 5, 2, 6, 3, 7]], ["CA", 2, 3, 5], ["CHR", 1, "shared", [2]], ["CA", 2, 3, 6], ["CHR", 0, "shared", [3]], ["CA", 1, 4, 6], ["FU", 5, [0, 1]], ["AN", 5, 0, 5], ["FU", 5, [1, 2]], ["AN", 5, 1, 4], ["FU", 5, [2, 3]], ["AN", 5, 2, 6], ["FU", 3, [0, 1]], ["SP", 3, 0, 8, [2], 1], ["AN", 3, 1, 2], ["FFSP", 3, 0, [2, 1], 1, 1], ["AN", 3, 1, 6], ["FU", 1, [0, 1]], ["SP", 1, 0, 512, [2], 1], ["AN", 1, 1, 2], ["FFSP", 1, 0, [2, 1], 1, 1], ["AN", 1, 1, 6], ["PR", 4, 0, "auto_unroll_max_step$1024"]]]], "r": [[0.000114537], 0, 1.26665, 1707732092], "mark": 2, "ag": 1, "v": "v0.6"}
{"i": [["[\"_matmul\", 512, 768, 64, \"float32\"]", "cuda -keys=cuda,gpu -arch=sm_86 -max_num_threads=1024 -model=unknown -thread_warp_size=32", [82, 999, 999, 49152, 2147483647, 1024, 255, 32], "", 0, []], [[], [["CHW", 2, "local"], ["SP", 2, 0, 512, [1, 2, 64, 1], 1], ["SP", 2, 5, 64, [1, 32, 1, 1], 1], ["SP", 2, 10, 768, [16, 1], 1], ["RE", 2, [0, 5, 1, 6, 2, 7, 10, 11, 3, 8, 12, 4, 9]], ["FSP", 3, 0, 1, 3], ["FSP", 3, 4, 2, 3], ["RE", 3, [0, 4, 1, 5, 2, 6, 3, 7]], ["CA", 2, 3, 5], ["CHR", 1, "shared", [2]], ["CA", 2, 3, 6], ["CHR", 0, "shared", [3]], ["CA", 1, 4, 6], ["FU", 5, [0, 1]], ["AN", 5, 0, 5], ["FU", 5, [1, 2]], ["AN", 5, 1, 4], ["FU", 5, [2, 3]], ["AN", 5, 2, 6], ["FU", 3, [0, 1]], ["SP", 3, 0, 16, [2], 1], ["AN", 3, 1, 2], ["FFSP", 3, 0, [2, 1], 1, 1], ["AN", 3, 1, 6], ["FU", 1, [0, 1]], ["SP", 1, 0, 1024, [2], 1], ["AN", 1, 1, 2], ["FFSP", 1, 0, [2, 1], 1, 1], ["AN", 1, 1, 6], ["PR", 4, 0, "auto_unroll_max_step$1024"]]]], "r": [[7.38996e-05], 0, 1.96083, 1707732093], "mark": 2, "ag": 1, "v": "v0.6"}
{"i": [["[\"_matmul\", 512, 768, 64, \"float32\"]", "cuda -keys=cuda,gpu -arch=sm_86 -max_num_threads=1024 -model=unknown -thread_warp_size=32", [82, 999, 999, 49152, 2147483647, 1024, 255, 32], "", 0, []], [[], [["CHW", 2, "local"], ["SP", 2, 0, 512, [1, 2, 64, 1], 1], ["SP", 2, 5, 64, [1, 16, 2, 1], 1], ["SP", 2, 10, 768, [8, 1], 1], ["RE", 2, [0, 5, 1, 6, 2, 7, 10, 11, 3, 8, 12, 4, 9]], ["FSP", 3, 0, 1, 3], ["FSP", 3, 4, 2, 3], ["RE", 3, [0, 4, 1, 5, 2, 6, 3, 7]], ["CA", 2, 3, 5], ["CHR", 1, "shared", [2]], ["CA", 2, 3, 6], ["CHR", 0, "shared", [3]], ["CA", 1, 4, 6], ["FU", 5, [0, 1]], ["AN", 5, 0, 5], ["FU", 5, [1, 2]], ["AN", 5, 1, 4], ["FU", 5, [2, 3]], ["AN", 5, 2, 6], ["FU", 3, [0, 1]], ["SP", 3, 0, 16, [2], 1], ["AN", 3, 1, 2], ["FFSP", 3, 0, [2, 1], 1, 1], ["AN", 3, 1, 6], ["FU", 1, [0, 1]], ["SP", 1, 0, 512, [2], 1], ["AN", 1, 1, 2], ["FFSP", 1, 0, [2, 1], 1, 1], ["AN", 1, 1, 6], ["PR", 4, 0, "auto_unroll_max_step$1024"]]]], "r": [[0.000148469], 0, 1.66894, 1707732093], "mark": 2, "ag": 1, "v": "v0.6"}
{"i": [["[\"_matmul\", 512, 768, 64, \"float32\"]", "cuda -keys=cuda,gpu -arch=sm_86 -max_num_threads=1024 -model=unknown -thread_warp_size=32", [82, 999, 999, 49152, 2147483647, 1024, 255, 32], "", 0, []], [[], [["CHW", 2, "local"], ["SP", 2, 0, 512, [1, 2, 64, 1], 1], ["SP", 2, 5, 64, [1, 16, 2, 1], 1], ["SP", 2, 10, 768, [16, 1], 1], ["RE", 2, [0, 5, 1, 6, 2, 7, 10, 11, 3, 8, 12, 4, 9]], ["FSP", 3, 0, 1, 3], ["FSP", 3, 4, 2, 3], ["RE", 3, [0, 4, 1, 5, 2, 6, 3, 7]], ["CA", 2, 3, 5], ["CHR", 1, "shared", [2]], ["CA", 2, 3, 6], ["CHR", 0, "shared", [3]], ["CA", 1, 4, 6], ["FU", 5, [0, 1]], ["AN", 5, 0, 5], ["FU", 5, [1, 2]], ["AN", 5, 1, 4], ["FU", 5, [2, 3]], ["AN", 5, 2, 6], ["FU", 3, [0, 1]], ["SP", 3, 0, 32, [2], 1], ["AN", 3, 1, 2], ["FFSP", 3, 0, [2, 1], 1, 1], ["AN", 3, 1, 6], ["FU", 1, [0, 1]], ["SP", 1, 0, 1024, [2], 1], ["AN", 1, 1, 2], ["FFSP", 1, 0, [2, 1], 1, 1], ["AN", 1, 1, 6], ["PR", 4, 0, "auto_unroll_max_step$1024"]]]], "r": [[0.000156156], 0, 1.04107, 1707732093], "mark": 2, "ag": 1, "v": "v0.6"}
{"i": [["[\"_matmul\", 512, 768, 64, \"float32\"]", "cuda -keys=cuda,gpu -arch=sm_86 -max_num_threads=1024 -model=unknown -thread_warp_size=32", [82, 999, 999, 49152, 2147483647, 1024, 255, 32], "", 0, []], [[], [["CHW", 2, "local"], ["SP", 2, 0, 512, [1, 2, 64, 1], 1], ["SP", 2, 5, 64, [1, 32, 2, 1], 1], ["SP", 2, 10, 768, [12, 1], 1], ["RE", 2, [0, 5, 1, 6, 2, 7, 10, 11, 3, 8, 12, 4, 9]], ["FSP", 3, 0, 1, 3], ["FSP", 3, 4, 2, 3], ["RE", 3, [0, 4, 1, 5, 2, 6, 3, 7]], ["CA", 2, 3, 5], ["CHR", 1, "shared", [2]], ["CA", 2, 3, 6], ["CHR", 0, "shared", [3]], ["CA", 1, 4, 6], ["FU", 5, [0, 1]], ["AN", 5, 0, 5], ["FU", 5, [1, 2]], ["AN", 5, 1, 4], ["FU", 5, [2, 3]], ["AN", 5, 2, 6], ["FU", 3, [0, 1]], ["SP", 3, 0, 24, [2], 1], ["AN", 3, 1, 2], ["FFSP", 3, 0, [2, 1], 1, 1], ["AN", 3, 1, 6], ["FU", 1, [0, 1]], ["SP", 1, 0, 768, [2], 1], ["AN", 1, 1, 2], ["FFSP", 1, 0, [2, 1], 1, 1], ["AN", 1, 1, 6], ["PR", 4, 0, "auto_unroll_max_step$1024"]]]], "r": [[0.000147076], 0, 0.980302, 1707732093], "mark": 2, "ag": 1, "v": "v0.6"}
{"i": [["[\"_matmul\", 512, 768, 64, \"float32\"]", "cuda -keys=cuda,gpu -arch=sm_86 -max_num_threads=1024 -model=unknown -thread_warp_size=32", [82, 999, 999, 49152, 2147483647, 1024, 255, 32], "", 0, []], [[], [["CHW", 2, "local"], ["SP", 2, 0, 512, [1, 4, 64, 1], 1], ["SP", 2, 5, 64, [1, 16, 1, 1], 1], ["SP", 2, 10, 768, [8, 1], 1], ["RE", 2, [0, 5, 1, 6, 2, 7, 10, 11, 3, 8, 12, 4, 9]], ["FSP", 3, 0, 1, 3], ["FSP", 3, 4, 2, 3], ["RE", 3, [0, 4, 1, 5, 2, 6, 3, 7]], ["CA", 2, 3, 5], ["CHR", 1, "shared", [2]], ["CA", 2, 3, 6], ["CHR", 0, "shared", [3]], ["CA", 1, 4, 6], ["FU", 5, [0, 1]], ["AN", 5, 0, 5], ["FU", 5, [1, 2]], ["AN", 5, 1, 4], ["FU", 5, [2, 3]], ["AN", 5, 2, 6], ["FU", 3, [0, 1]], ["SP", 3, 0, 8, [2], 1], ["AN", 3, 1, 2], ["FFSP", 3, 0, [2, 1], 1, 1], ["AN", 3, 1, 6], ["FU", 1, [0, 1]], ["SP", 1, 0, 512, [2], 1], ["AN", 1, 1, 2], ["FFSP", 1, 0, [2, 1], 1, 1], ["AN", 1, 1, 6], ["PR", 4, 0, "auto_unroll_max_step$1024"]]]], "r": [[0.00013833], 0, 1.25293, 1707732094], "mark": 2, "ag": 1, "v": "v0.6"}
{"i": [["[\"_matmul\", 512, 768, 64, \"float32\"]", "cuda -keys=cuda,gpu -arch=sm_86 -max_num_threads=1024 -model=unknown -thread_warp_size=32", [82, 999, 999, 49152, 2147483647, 1024, 255, 32], "", 0, []], [[], [["CHW", 2, "local"], ["SP", 2, 0, 512, [1, 4, 64, 1], 1], ["SP", 2, 5, 64, [1, 16, 1, 1], 1], ["SP", 2, 10, 768, [16, 1], 1], ["RE", 2, [0, 5, 1, 6, 2, 7, 10, 11, 3, 8, 12, 4, 9]], ["FSP", 3, 0, 1, 3], ["FSP", 3, 4, 2, 3], ["RE", 3, [0, 4, 1, 5, 2, 6, 3, 7]], ["CA", 2, 3, 5], ["CHR", 1, "shared", [2]], ["CA", 2, 3, 6], ["CHR", 0, "shared", [3]], ["CA", 1, 4, 6], ["FU", 5, [0, 1]], ["AN", 5, 0, 5], ["FU", 5, [1, 2]], ["AN", 5, 1, 4], ["FU", 5, [2, 3]], ["AN", 5, 2, 6], ["FU", 3, [0, 1]], ["SP", 3, 0, 16, [2], 1], ["AN", 3, 1, 2], ["FFSP", 3, 0, [2, 1], 1, 1], ["AN", 3, 1, 6], ["FU", 1, [0, 1]], ["SP", 1, 0, 1024, [2], 1], ["AN", 1, 1, 2], ["FFSP", 1, 0, [2, 1], 1, 1], ["AN", 1, 1, 6], ["PR", 4, 0, "auto_unroll_max_step$1024"]]]], "r": [[8.6004e-05], 0, 2.28682, 1707732094], "mark": 2, "ag": 1, "v": "v0.6"}
{"i": [["[\"_matmul\", 512, 768, 64, \"float32\"]", "cuda -keys=cuda,gpu -arch=sm_86 -max_num_threads=1024 -model=unknown -thread_warp_size=32", [82, 999, 999, 49152, 2147483647, 1024, 255, 32], "", 0, []], [[], [["CHW", 2, "local"], ["SP", 2, 0, 512, [1, 1, 64, 1], 1], ["SP", 2, 5, 64, [1, 32, 1, 1], 1], ["SP", 2, 10, 768, [12, 1], 1], ["RE", 2, [0, 5, 1, 6, 2, 7, 10, 11, 3, 8, 12, 4, 9]], ["FSP", 3, 0, 1, 3], ["FSP", 3, 4, 2, 3], ["RE", 3, [0, 4, 1, 5, 2, 6, 3, 7]], ["CA", 2, 3, 5], ["CHR", 1, "shared", [2]], ["CA", 2, 3, 6], ["CHR", 0, "shared", [3]], ["CA", 1, 4, 6], ["FU", 5, [0, 1]], ["AN", 5, 0, 5], ["FU", 5, [1, 2]], ["AN", 5, 1, 4], ["FU", 5, [2, 3]], ["AN", 5, 2, 6], ["FU", 3, [0, 1]], ["SP", 3, 0, 12, [2], 1], ["AN", 3, 1, 2], ["FFSP", 3, 0, [2, 1], 1, 1], ["AN", 3, 1, 6], ["FU", 1, [0, 1]], ["SP", 1, 0, 768, [2], 1], ["AN", 1, 1, 2], ["FFSP", 1, 0, [2, 1], 1, 1], ["AN", 1, 1, 6], ["PR", 4, 0, "auto_unroll_max_step$1024"]]]], "r": [[0.00013726], 0, 1.14546, 1707732094], "mark": 2, "ag": 1, "v": "v0.6"}
{"i": [["[\"_matmul\", 512, 768, 64, \"float32\"]", "cuda -keys=cuda,gpu -arch=sm_86 -max_num_threads=1024 -model=unknown -thread_warp_size=32", [82, 999, 999, 49152, 2147483647, 1024, 255, 32], "", 0, []], [[], [["CHW", 2, "local"], ["SP", 2, 0, 512, [1, 4, 64, 1], 1], ["SP", 2, 5, 64, [1, 8, 1, 1], 1], ["SP", 2, 10, 768, [12, 1], 1], ["RE", 2, [0, 5, 1, 6, 2, 7, 10, 11, 3, 8, 12, 4, 9]], ["FSP", 3, 0, 1, 3], ["FSP", 3, 4, 2, 3], ["RE", 3, [0, 4, 1, 5, 2, 6, 3, 7]], ["CA", 2, 3, 5], ["CHR", 1, "shared", [2]], ["CA", 2, 3, 6], ["CHR", 0, "shared", [3]], ["CA", 1, 4, 6], ["FU", 5, [0, 1]], ["AN", 5, 0, 5], ["FU", 5, [1, 2]], ["AN", 5, 1, 4], ["FU", 5, [2, 3]], ["AN", 5, 2, 6], ["FU", 3, [0, 1]], ["SP", 3, 0, 12, [2], 1], ["AN", 3, 1, 2], ["FFSP", 3, 0, [2, 1], 1, 1], ["AN", 3, 1, 6], ["FU", 1, [0, 1]], ["SP", 1, 0, 768, [2], 1], ["AN", 1, 1, 2], ["FFSP", 1, 0, [2, 1], 1, 1], ["AN", 1, 1, 6], ["PR", 4, 0, "auto_unroll_max_step$1024"]]]], "r": [[0.000119501], 0, 1.69777, 1707732094], "mark": 2, "ag": 1, "v": "v0.6"}
{"i": [["[\"_matmul\", 512, 768, 64, \"float32\"]", "cuda -keys=cuda,gpu -arch=sm_86 -max_num_threads=1024 -model=unknown -thread_warp_size=32", [82, 999, 999, 49152, 2147483647, 1024, 255, 32], "", 0, []], [[], [["CHW", 2, "local"], ["SP", 2, 0, 512, [1, 4, 64, 1], 1], ["SP", 2, 5, 64, [1, 32, 1, 1], 1], ["SP", 2, 10, 768, [12, 1], 1], ["RE", 2, [0, 5, 1, 6, 2, 7, 10, 11, 3, 8, 12, 4, 9]], ["FSP", 3, 0, 1, 3], ["FSP", 3, 4, 2, 3], ["RE", 3, [0, 4, 1, 5, 2, 6, 3, 7]], ["CA", 2, 3, 5], ["CHR", 1, "shared", [2]], ["CA", 2, 3, 6], ["CHR", 0, "shared", [3]], ["CA", 1, 4, 6], ["FU", 5, [0, 1]], ["AN", 5, 0, 5], ["FU", 5, [1, 2]], ["AN", 5, 1, 4], ["FU", 5, [2, 3]], ["AN", 5, 2, 6], ["FU", 3, [0, 1]], ["SP", 3, 0, 12, [2], 1], ["AN", 3, 1, 2], ["FFSP", 3, 0, [2, 1], 1, 1], ["AN", 3, 1, 6], ["FU", 1, [0, 1]], ["SP", 1, 0, 768, [2], 1], ["AN", 1, 1, 2], ["FFSP", 1, 0, [2, 1], 1, 1], ["AN", 1, 1, 6], ["PR", 4, 0, "auto_unroll_max_step$1024"]]]], "r": [[0.000108099], 0, 1.73486, 1707732095], "mark": 2, "ag": 1, "v": "v0.6"}
{"i": [["[\"_matmul\", 512, 768, 64, \"float32\"]", "cuda -keys=cuda,gpu -arch=sm_86 -max_num_threads=1024 -model=unknown -thread_warp_size=32", [82, 999, 999, 49152, 2147483647, 1024, 255, 32], "", 0, []], [[], [["CHW", 2, "local"], ["SP", 2, 0, 512, [1, 4, 64, 1], 1], ["SP", 2, 5, 64, [1, 16, 2, 1], 1], ["SP", 2, 10, 768, [12, 1], 1], ["RE", 2, [0, 5, 1, 6, 2, 7, 10, 11, 3, 8, 12, 4, 9]], ["FSP", 3, 0, 1, 3], ["FSP", 3, 4, 2, 3], ["RE", 3, [0, 4, 1, 5, 2, 6, 3, 7]], ["CA", 2, 3, 5], ["CHR", 1, "shared", [2]], ["CA", 2, 3, 6], ["CHR", 0, "shared", [3]], ["CA", 1, 4, 6], ["FU", 5, [0, 1]], ["AN", 5, 0, 5], ["FU", 5, [1, 2]], ["AN", 5, 1, 4], ["FU", 5, [2, 3]], ["AN", 5, 2, 6], ["FU", 3, [0, 1]], ["SP", 3, 0, 24, [2], 1], ["AN", 3, 1, 2], ["FFSP", 3, 0, [2, 1], 1, 1], ["AN", 3, 1, 6], ["FU", 1, [0, 1]], ["SP", 1, 0, 768, [2], 1], ["AN", 1, 1, 2], ["FFSP", 1, 0, [2, 1], 1, 1], ["AN", 1, 1, 6], ["PR", 4, 0, "auto_unroll_max_step$1024"]]]], "r": [[0.000159324], 0, 0.971155, 1707732095], "mark": 2, "ag": 1, "v": "v0.6"}
{"i": [["[\"_matmul\", 512, 768, 64, \"float32\"]", "cuda -keys=cuda,gpu -arch=sm_86 -max_num_threads=1024 -model=unknown -thread_warp_size=32", [82, 999, 999, 49152, 2147483647, 1024, 255, 32], "", 0, []], [[], [["CHW", 2, "local"], ["SP", 2, 0, 512, [1, 2, 32, 1], 1], ["SP", 2, 5, 64, [1, 16, 1, 1], 1], ["SP", 2, 10, 768, [8, 1], 1], ["RE", 2, [0, 5, 1, 6, 2, 7, 10, 11, 3, 8, 12, 4, 9]], ["FSP", 3, 0, 1, 3], ["FSP", 3, 4, 2, 3], ["RE", 3, [0, 4, 1, 5, 2, 6, 3, 7]], ["CA", 2, 3, 5], ["CHR", 1, "shared", [2]], ["CA", 2, 3, 6], ["CHR", 0, "shared", [3]], ["CA", 1, 4, 6], ["FU", 5, [0, 1]], ["AN", 5, 0, 5], ["FU", 5, [1, 2]], ["AN", 5, 1, 4], ["FU", 5, [2, 3]], ["AN", 5, 2, 6], ["FU", 3, [0, 1]], ["SP", 3, 0, 8, [2], 1], ["AN", 3, 1, 2], ["FFSP", 3, 0, [2, 1], 1, 1], ["AN", 3, 1, 6], ["FU", 1, [0, 1]], ["SP", 1, 0, 256, [2], 1], ["AN", 1, 1, 2], ["FFSP", 1, 0, [2, 1], 1, 1], ["AN", 1, 1, 6], ["PR", 4, 0, "auto_unroll_max_step$1024"]]]], "r": [[4.93818e-05], 0, 0.712195, 1707732095], "mark": 2, "ag": 1, "v": "v0.6"}
{"i": [["[\"_matmul\", 512, 768, 64, \"float32\"]", "cuda -keys=cuda,gpu -arch=sm_86 -max_num_threads=1024 -model=unknown -thread_warp_size=32", [82, 999, 999, 49152, 2147483647, 1024, 255, 32], "", 0, []], [[], [["CHW", 2, "local"], ["SP", 2, 0, 512, [1, 2, 32, 1], 1], ["SP", 2, 5, 64, [1, 16, 1, 1], 1], ["SP", 2, 10, 768, [16, 1], 1], ["RE", 2, [0, 5, 1, 6, 2, 7, 10, 11, 3, 8, 12, 4, 9]], ["FSP", 3, 0, 1, 3], ["FSP", 3, 4, 2, 3], ["RE", 3, [0, 4, 1, 5, 2, 6, 3, 7]], ["CA", 2, 3, 5], ["CHR", 1, "shared", [2]], ["CA", 2, 3, 6], ["CHR", 0, "shared", [3]], ["CA", 1, 4, 6], ["FU", 5, [0, 1]], ["AN", 5, 0, 5], ["FU", 5, [1, 2]], ["AN", 5, 1, 4], ["FU", 5, [2, 3]], ["AN", 5, 2, 6], ["FU", 3, [0, 1]], ["SP", 3, 0, 16, [2], 1], ["AN", 3, 1, 2], ["FFSP", 3, 0, [2, 1], 1, 1], ["AN", 3, 1, 6], ["FU", 1, [0, 1]], ["SP", 1, 0, 512, [2], 1], ["AN", 1, 1, 2], ["FFSP", 1, 0, [2, 1], 1, 1], ["AN", 1, 1, 6], ["PR", 4, 0, "auto_unroll_max_step$1024"]]]], "r": [[4.01198e-05], 0, 1.13285, 1707732096], "mark": 2, "ag": 1, "v": "v0.6"}
{"i": [["[\"_matmul\", 512, 768, 64, \"float32\"]", "cuda -keys=cuda,gpu -arch=sm_86 -max_num_threads=1024 -model=unknown -thread_warp_size=32", [82, 999, 999, 49152, 2147483647, 1024, 255, 32], "", 0, []], [[], [["CHW", 2, "local"], ["SP", 2, 0, 512, [1, 2, 128, 1], 1], ["SP", 2, 5, 64, [1, 16, 1, 1], 1], ["SP", 2, 10, 768, [8, 1], 1], ["RE", 2, [0, 5, 1, 6, 2, 7, 10, 11, 3, 8, 12, 4, 9]], ["FSP", 3, 0, 1, 3], ["FSP", 3, 4, 2, 3], ["RE", 3, [0, 4, 1, 5, 2, 6, 3, 7]], ["CA", 2, 3, 5], ["CHR", 1, "shared", [2]], ["CA", 2, 3, 6], ["CHR", 0, "shared", [3]], ["CA", 1, 4, 6], ["FU", 5, [0, 1]], ["AN", 5, 0, 5], ["FU", 5, [1, 2]], ["AN", 5, 1, 4], ["FU", 5, [2, 3]], ["AN", 5, 2, 6], ["FU", 3, [0, 1]], ["SP", 3, 0, 8, [2], 1], ["AN", 3, 1, 2], ["FFSP", 3, 0, [2, 1], 1, 1], ["AN", 3, 1, 6], ["FU", 1, [0, 1]], ["SP", 1, 0, 1024, [2], 1], ["AN", 1, 1, 2], ["FFSP", 1, 0, [2, 1], 1, 1], ["AN", 1, 1, 6], ["PR", 4, 0, "auto_unroll_max_step$1024"]]]], "r": [[0.000481227], 0, 2.1778, 1707732096], "mark": 2, "ag": 1, "v": "v0.6"}
{"i": [["[\"_matmul\", 512, 768, 64, \"float32\"]", "cuda -keys=cuda,gpu -arch=sm_86 -max_num_threads=1024 -model=unknown -thread_warp_size=32", [82, 999, 999, 49152, 2147483647, 1024, 255, 32], "", 0, []], [[], [["CHW", 2, "local"], ["SP", 2, 0, 512, [1, 2, 128, 1], 1], ["SP", 2, 5, 64, [1, 16, 1, 1], 1], ["SP", 2, 10, 768, [16, 1], 1], ["RE", 2, [0, 5, 1, 6, 2, 7, 10, 11, 3, 8, 12, 4, 9]], ["FSP", 3, 0, 1, 3], ["FSP", 3, 4, 2, 3], ["RE", 3, [0, 4, 1, 5, 2, 6, 3, 7]], ["CA", 2, 3, 5], ["CHR", 1, "shared", [2]], ["CA", 2, 3, 6], ["CHR", 0, "shared", [3]], ["CA", 1, 4, 6], ["FU", 5, [0, 1]], ["AN", 5, 0, 5], ["FU", 5, [1, 2]], ["AN", 5, 1, 4], ["FU", 5, [2, 3]], ["AN", 5, 2, 6], ["FU", 3, [0, 1]], ["SP", 3, 0, 16, [2], 1], ["AN", 3, 1, 2], ["FFSP", 3, 0, [2, 1], 1, 1], ["AN", 3, 1, 6], ["FU", 1, [0, 1]], ["SP", 1, 0, 2048, [2], 1], ["AN", 1, 1, 2], ["FFSP", 1, 0, [2, 1], 1, 1], ["AN", 1, 1, 6], ["PR", 4, 0, "auto_unroll_max_step$1024"]]]], "r": [[0.000689059], 0, 1.5017, 1707732096], "mark": 2, "ag": 1, "v": "v0.6"}
{"i": [["[\"_matmul\", 512, 768, 64, \"float32\"]", "cuda -keys=cuda,gpu -arch=sm_86 -max_num_threads=1024 -model=unknown -thread_warp_size=32", [82, 999, 999, 49152, 2147483647, 1024, 255, 32], "", 0, []], [[], [["CHW", 2, "local"], ["SP", 2, 0, 512, [1, 2, 32, 1], 1], ["SP", 2, 5, 64, [1, 32, 1, 1], 1], ["SP", 2, 10, 768, [12, 1], 1], ["RE", 2, [0, 5, 1, 6, 2, 7, 10, 11, 3, 8, 12, 4, 9]], ["FSP", 3, 0, 1, 3], ["FSP", 3, 4, 2, 3], ["RE", 3, [0, 4, 1, 5, 2, 6, 3, 7]], ["CA", 2, 3, 5], ["CHR", 1, "shared", [2]], ["CA", 2, 3, 6], ["CHR", 0, "shared", [3]], ["CA", 1, 4, 6], ["FU", 5, [0, 1]], ["AN", 5, 0, 5], ["FU", 5, [1, 2]], ["AN", 5, 1, 4], ["FU", 5, [2, 3]], ["AN", 5, 2, 6], ["FU", 3, [0, 1]], ["SP", 3, 0, 12, [2], 1], ["AN", 3, 1, 2], ["FFSP", 3, 0, [2, 1], 1, 1], ["AN", 3, 1, 6], ["FU", 1, [0, 1]], ["SP", 1, 0, 384, [2], 1], ["AN", 1, 1, 2], ["FFSP", 1, 0, [2, 1], 1, 1], ["AN", 1, 1, 6], ["PR", 4, 0, "auto_unroll_max_step$1024"]]]], "r": [[4.82325e-05], 0, 0.88568, 1707732096], "mark": 2, "ag": 1, "v": "v0.6"}
{"i": [["[\"_matmul\", 512, 768, 64, \"float32\"]", "cuda -keys=cuda,gpu -arch=sm_86 -max_num_threads=1024 -model=unknown -thread_warp_size=32", [82, 999, 999, 49152, 2147483647, 1024, 255, 32], "", 0, []], [[], [["CHW", 2, "local"], ["SP", 2, 0, 512, [1, 2, 128, 1], 1], ["SP", 2, 5, 64, [1, 32, 1, 1], 1], ["SP", 2, 10, 768, [12, 1], 1], ["RE", 2, [0, 5, 1, 6, 2, 7, 10, 11, 3, 8, 12, 4, 9]], ["FSP", 3, 0, 1, 3], ["FSP", 3, 4, 2, 3], ["RE", 3, [0, 4, 1, 5, 2, 6, 3, 7]], ["CA", 2, 3, 5], ["CHR", 1, "shared", [2]], ["CA", 2, 3, 6], ["CHR", 0, "shared", [3]], ["CA", 1, 4, 6], ["FU", 5, [0, 1]], ["AN", 5, 0, 5], ["FU", 5, [1, 2]], ["AN", 5, 1, 4], ["FU", 5, [2, 3]], ["AN", 5, 2, 6], ["FU", 3, [0, 1]], ["SP", 3, 0, 12, [2], 1], ["AN", 3, 1, 2], ["FFSP", 3, 0, [2, 1], 1, 1], ["AN", 3, 1, 6], ["FU", 1, [0, 1]], ["SP", 1, 0, 1536, [2], 1], ["AN", 1, 1, 2], ["FFSP", 1, 0, [2, 1], 1, 1], ["AN", 1, 1, 6], ["PR", 4, 0, "auto_unroll_max_step$1024"]]]], "r": [[0.000590659], 0, 1.01525, 1707732096], "mark": 2, "ag": 1, "v": "v0.6"}
{"i": [["[\"_matmul\", 512, 768, 64, \"float32\"]", "cuda -keys=cuda,gpu -arch=sm_86 -max_num_threads=1024 -model=unknown -thread_warp_size=32", [82, 999, 999, 49152, 2147483647, 1024, 255, 32], "", 0, []], [[], [["CHW", 2, "local"], ["SP", 2, 0, 512, [1, 2, 32, 1], 1], ["SP", 2, 5, 64, [1, 16, 2, 1], 1], ["SP", 2, 10, 768, [12, 1], 1], ["RE", 2, [0, 5, 1, 6, 2, 7, 10, 11, 3, 8, 12, 4, 9]], ["FSP", 3, 0, 1, 3], ["FSP", 3, 4, 2, 3], ["RE", 3, [0, 4, 1, 5, 2, 6, 3, 7]], ["CA", 2, 3, 5], ["CHR", 1, "shared", [2]], ["CA", 2, 3, 6], ["CHR", 0, "shared", [3]], ["CA", 1, 4, 6], ["FU", 5, [0, 1]], ["AN", 5, 0, 5], ["FU", 5, [1, 2]], ["AN", 5, 1, 4], ["FU", 5, [2, 3]], ["AN", 5, 2, 6], ["FU", 3, [0, 1]], ["SP", 3, 0, 24, [2], 1], ["AN", 3, 1, 2], ["FFSP", 3, 0, [2, 1], 1, 1], ["AN", 3, 1, 6], ["FU", 1, [0, 1]], ["SP", 1, 0, 384, [2], 1], ["AN", 1, 1, 2], ["FFSP", 1, 0, [2, 1], 1, 1], ["AN", 1, 1, 6], ["PR", 4, 0, "auto_unroll_max_step$1024"]]]], "r": [[6.62841e-05], 0, 1.30702, 1707732097], "mark": 2, "ag": 1, "v": "v0.6"}
{"i": [["[\"_matmul\", 512, 768, 64, \"float32\"]", "cuda -keys=cuda,gpu -arch=sm_86 -max_num_threads=1024 -model=unknown -thread_warp_size=32", [82, 999, 999, 49152, 2147483647, 1024, 255, 32], "", 0, []], [[], [["CHW", 2, "local"], ["SP", 2, 0, 512, [1, 4, 32, 1], 1], ["SP", 2, 5, 64, [1, 16, 1, 1], 1], ["SP", 2, 10, 768, [12, 1], 1], ["RE", 2, [0, 5, 1, 6, 2, 7, 10, 11, 3, 8, 12, 4, 9]], ["FSP", 3, 0, 1, 3], ["FSP", 3, 4, 2, 3], ["RE", 3, [0, 4, 1, 5, 2, 6, 3, 7]], ["CA", 2, 3, 5], ["CHR", 1, "shared", [2]], ["CA", 2, 3, 6], ["CHR", 0, "shared", [3]], ["CA", 1, 4, 6], ["FU", 5, [0, 1]], ["AN", 5, 0, 5], ["FU", 5, [1, 2]], ["AN", 5, 1, 4], ["FU", 5, [2, 3]], ["AN", 5, 2, 6], ["FU", 3, [0, 1]], ["SP", 3, 0, 12, [2], 1], ["AN", 3, 1, 2], ["FFSP", 3, 0, [2, 1], 1, 1], ["AN", 3, 1, 6], ["FU", 1, [0, 1]], ["SP", 1, 0, 384, [2], 1], ["AN", 1, 1, 2], ["FFSP", 1, 0, [2, 1], 1, 1], ["AN", 1, 1, 6], ["PR", 4, 0, "auto_unroll_max_step$1024"]]]], "r": [[6.01841e-05], 0, 0.952512, 1707732097], "mark": 2, "ag": 1, "v": "v0.6"}
{"i": [["[\"_matmul\", 512, 768, 64, \"float32\"]", "cuda -keys=cuda,gpu -arch=sm_86 -max_num_threads=1024 -model=unknown -thread_warp_size=32", [82, 999, 999, 49152, 2147483647, 1024, 255, 32], "", 0, []], [[], [["CHW", 2, "local"], ["SP", 2, 0, 512, [1, 4, 128, 1], 1], ["SP", 2, 5, 64, [1, 16, 1, 1], 1], ["SP", 2, 10, 768, [12, 1], 1], ["RE", 2, [0, 5, 1, 6, 2, 7, 10, 11, 3, 8, 12, 4, 9]], ["FSP", 3, 0, 1, 3], ["FSP", 3, 4, 2, 3], ["RE", 3, [0, 4, 1, 5, 2, 6, 3, 7]], ["CA", 2, 3, 5], ["CHR", 1, "shared", [2]], ["CA", 2, 3, 6], ["CHR", 0, "shared", [3]], ["CA", 1, 4, 6], ["FU", 5, [0, 1]], ["AN", 5, 0, 5], ["FU", 5, [1, 2]], ["AN", 5, 1, 4], ["FU", 5, [2, 3]], ["AN", 5, 2, 6], ["FU", 3, [0, 1]], ["SP", 3, 0, 12, [2], 1], ["AN", 3, 1, 2], ["FFSP", 3, 0, [2, 1], 1, 1], ["AN", 3, 1, 6], ["FU", 1, [0, 1]], ["SP", 1, 0, 1536, [2], 1], ["AN", 1, 1, 2], ["FFSP", 1, 0, [2, 1], 1, 1], ["AN", 1, 1, 6], ["PR", 4, 0, "auto_unroll_max_step$1024"]]]], "r": [[0.000315841], 0, 0.749138, 1707732097], "mark": 2, "ag": 1, "v": "v0.6"}
