data/new-200-5/133cuda_testCase_5_matmul_M512_N768_K3072.json
{"i": [["[\"_matmul\", 512, 3072, 768, \"float32\"]", "cuda -keys=cuda,gpu -arch=sm_86 -max_num_threads=1024 -model=unknown -thread_warp_size=32", [82, 999, 999, 49152, 2147483647, 1024, 255, 32], "", 0, []], [[], [["CHW", 2, "local"], ["SP", 2, 0, 512, [1, 32, 8, 1], 1], ["SP", 2, 5, 768, [1, 2, 384, 1], 1], ["SP", 2, 10, 3072, [3, 1], 1], ["RE", 2, [0, 5, 1, 6, 2, 7, 10, 11, 3, 8, 12, 4, 9]], ["FSP", 3, 0, 1, 3], ["FSP", 3, 4, 2, 3], ["RE", 3, [0, 4, 1, 5, 2, 6, 3, 7]], ["CA", 2, 3, 5], ["CHR", 1, "shared", [2]], ["CA", 2, 3, 6], ["CHR", 0, "shared", [3]], ["CA", 1, 4, 6], ["FU", 5, [0, 1]], ["AN", 5, 0, 5], ["FU", 5, [1, 2]], ["AN", 5, 1, 4], ["FU", 5, [2, 3]], ["AN", 5, 2, 6], ["FU", 3, [0, 1]], ["SP", 3, 0, 1152, [2], 1], ["AN", 3, 1, 2], ["FFSP", 3, 0, [2, 1], 1, 1], ["AN", 3, 1, 6], ["FU", 1, [0, 1]], ["SP", 1, 0, 24, [2], 1], ["AN", 1, 1, 2], ["FFSP", 1, 0, [2, 1], 1, 1], ["AN", 1, 1, 6], ["PR", 4, 0, "auto_unroll_max_step$1024"]]]], "r": [[0.189203], 0, 15.2627, 1708774720], "mark": 2, "ag": 0, "v": "v0.6"}
{"i": [["[\"_matmul\", 512, 3072, 768, \"float32\"]", "cuda -keys=cuda,gpu -arch=sm_86 -max_num_threads=1024 -model=unknown -thread_warp_size=32", [82, 999, 999, 49152, 2147483647, 1024, 255, 32], "", 0, []], [[], [["CHW", 2, "local"], ["SP", 2, 0, 512, [1, 32, 8, 1], 1], ["SP", 2, 5, 768, [1, 2, 384, 1], 1], ["SP", 2, 10, 3072, [2, 1], 1], ["RE", 2, [0, 5, 1, 6, 2, 7, 10, 11, 3, 8, 12, 4, 9]], ["FSP", 3, 0, 1, 3], ["FSP", 3, 4, 2, 3], ["RE", 3, [0, 4, 1, 5, 2, 6, 3, 7]], ["CA", 2, 3, 5], ["CHR", 1, "shared", [2]], ["CA", 2, 3, 6], ["CHR", 0, "shared", [3]], ["CA", 1, 4, 6], ["FU", 5, [0, 1]], ["AN", 5, 0, 5], ["FU", 5, [1, 2]], ["AN", 5, 1, 4], ["FU", 5, [2, 3]], ["AN", 5, 2, 6], ["FU", 3, [0, 1]], ["SP", 3, 0, 768, [2], 1], ["AN", 3, 1, 2], ["FFSP", 3, 0, [2, 1], 1, 1], ["AN", 3, 1, 6], ["FU", 1, [0, 1]], ["SP", 1, 0, 16, [2], 1], ["AN", 1, 1, 2], ["FFSP", 1, 0, [2, 1], 1, 1], ["AN", 1, 1, 6], ["PR", 4, 0, "auto_unroll_max_step$1024"]]]], "r": [[0.188965], 0, 14.9818, 1708774721], "mark": 2, "ag": 0, "v": "v0.6"}
{"i": [["[\"_matmul\", 512, 3072, 768, \"float32\"]", "cuda -keys=cuda,gpu -arch=sm_86 -max_num_threads=1024 -model=unknown -thread_warp_size=32", [82, 999, 999, 49152, 2147483647, 1024, 255, 32], "", 0, []], [[], [["CHW", 2, "local"], ["SP", 2, 0, 512, [1, 32, 8, 1], 1], ["SP", 2, 5, 768, [1, 2, 384, 1], 1], ["SP", 2, 10, 3072, [4, 1], 1], ["RE", 2, [0, 5, 1, 6, 2, 7, 10, 11, 3, 8, 12, 4, 9]], ["FSP", 3, 0, 1, 3], ["FSP", 3, 4, 2, 3], ["RE", 3, [0, 4, 1, 5, 2, 6, 3, 7]], ["CA", 2, 3, 5], ["CHR", 1, "shared", [2]], ["CA", 2, 3, 6], ["CHR", 0, "shared", [3]], ["CA", 1, 4, 6], ["FU", 5, [0, 1]], ["AN", 5, 0, 5], ["FU", 5, [1, 2]], ["AN", 5, 1, 4], ["FU", 5, [2, 3]], ["AN", 5, 2, 6], ["FU", 3, [0, 1]], ["SP", 3, 0, 1536, [2], 1], ["AN", 3, 1, 2], ["FFSP", 3, 0, [2, 1], 1, 1], ["AN", 3, 1, 6], ["FU", 1, [0, 1]], ["SP", 1, 0, 32, [2], 1], ["AN", 1, 1, 2], ["FFSP", 1, 0, [2, 1], 1, 1], ["AN", 1, 1, 6], ["PR", 4, 0, "auto_unroll_max_step$1024"]]]], "r": [[0.188544], 0, 15.154, 1708774722], "mark": 2, "ag": 0, "v": "v0.6"}
{"i": [["[\"_matmul\", 512, 3072, 768, \"float32\"]", "cuda -keys=cuda,gpu -arch=sm_86 -max_num_threads=1024 -model=unknown -thread_warp_size=32", [82, 999, 999, 49152, 2147483647, 1024, 255, 32], "", 0, []], [[], [["CHW", 2, "local"], ["SP", 2, 0, 512, [1, 32, 8, 1], 1], ["SP", 2, 5, 768, [1, 1, 384, 1], 1], ["SP", 2, 10, 3072, [3, 1], 1], ["RE", 2, [0, 5, 1, 6, 2, 7, 10, 11, 3, 8, 12, 4, 9]], ["FSP", 3, 0, 1, 3], ["FSP", 3, 4, 2, 3], ["RE", 3, [0, 4, 1, 5, 2, 6, 3, 7]], ["CA", 2, 3, 5], ["CHR", 1, "shared", [2]], ["CA", 2, 3, 6], ["CHR", 0, "shared", [3]], ["CA", 1, 4, 6], ["FU", 5, [0, 1]], ["AN", 5, 0, 5], ["FU", 5, [1, 2]], ["AN", 5, 1, 4], ["FU", 5, [2, 3]], ["AN", 5, 2, 6], ["FU", 3, [0, 1]], ["SP", 3, 0, 1152, [2], 1], ["AN", 3, 1, 2], ["FFSP", 3, 0, [2, 1], 1, 1], ["AN", 3, 1, 6], ["FU", 1, [0, 1]], ["SP", 1, 0, 24, [2], 1], ["AN", 1, 1, 2], ["FFSP", 1, 0, [2, 1], 1, 1], ["AN", 1, 1, 6], ["PR", 4, 0, "auto_unroll_max_step$1024"]]]], "r": [[0.185725], 0, 11.6721, 1708774723], "mark": 2, "ag": 0, "v": "v0.6"}
{"i": [["[\"_matmul\", 512, 3072, 768, \"float32\"]", "cuda -keys=cuda,gpu -arch=sm_86 -max_num_threads=1024 -model=unknown -thread_warp_size=32", [82, 999, 999, 49152, 2147483647, 1024, 255, 32], "", 0, []], [[], [["CHW", 2, "local"], ["SP", 2, 0, 512, [1, 16, 8, 1], 1], ["SP", 2, 5, 768, [1, 2, 384, 1], 1], ["SP", 2, 10, 3072, [3, 1], 1], ["RE", 2, [0, 5, 1, 6, 2, 7, 10, 11, 3, 8, 12, 4, 9]], ["FSP", 3, 0, 1, 3], ["FSP", 3, 4, 2, 3], ["RE", 3, [0, 4, 1, 5, 2, 6, 3, 7]], ["CA", 2, 3, 5], ["CHR", 1, "shared", [2]], ["CA", 2, 3, 6], ["CHR", 0, "shared", [3]], ["CA", 1, 4, 6], ["FU", 5, [0, 1]], ["AN", 5, 0, 5], ["FU", 5, [1, 2]], ["AN", 5, 1, 4], ["FU", 5, [2, 3]], ["AN", 5, 2, 6], ["FU", 3, [0, 1]], ["SP", 3, 0, 1152, [2], 1], ["AN", 3, 1, 2], ["FFSP", 3, 0, [2, 1], 1, 1], ["AN", 3, 1, 6], ["FU", 1, [0, 1]], ["SP", 1, 0, 24, [2], 1], ["AN", 1, 1, 2], ["FFSP", 1, 0, [2, 1], 1, 1], ["AN", 1, 1, 6], ["PR", 4, 0, "auto_unroll_max_step$1024"]]]], "r": [[0.185924], 0, 11.536, 1708774723], "mark": 2, "ag": 0, "v": "v0.6"}
{"i": [["[\"_matmul\", 512, 3072, 768, \"float32\"]", "cuda -keys=cuda,gpu -arch=sm_86 -max_num_threads=1024 -model=unknown -thread_warp_size=32", [82, 999, 999, 49152, 2147483647, 1024, 255, 32], "", 0, []], [[], [["CHW", 2, "local"], ["SP", 2, 0, 512, [1, 64, 8, 1], 1], ["SP", 2, 5, 768, [1, 2, 384, 1], 1], ["SP", 2, 10, 3072, [3, 1], 1], ["RE", 2, [0, 5, 1, 6, 2, 7, 10, 11, 3, 8, 12, 4, 9]], ["FSP", 3, 0, 1, 3], ["FSP", 3, 4, 2, 3], ["RE", 3, [0, 4, 1, 5, 2, 6, 3, 7]], ["CA", 2, 3, 5], ["CHR", 1, "shared", [2]], ["CA", 2, 3, 6], ["CHR", 0, "shared", [3]], ["CA", 1, 4, 6], ["FU", 5, [0, 1]], ["AN", 5, 0, 5], ["FU", 5, [1, 2]], ["AN", 5, 1, 4], ["FU", 5, [2, 3]], ["AN", 5, 2, 6], ["FU", 3, [0, 1]], ["SP", 3, 0, 1152, [2], 1], ["AN", 3, 1, 2], ["FFSP", 3, 0, [2, 1], 1, 1], ["AN", 3, 1, 6], ["FU", 1, [0, 1]], ["SP", 1, 0, 24, [2], 1], ["AN", 1, 1, 2], ["FFSP", 1, 0, [2, 1], 1, 1], ["AN", 1, 1, 6], ["PR", 4, 0, "auto_unroll_max_step$1024"]]]], "r": [[0.186001], 0, 11.0119, 1708774724], "mark": 2, "ag": 0, "v": "v0.6"}
{"i": [["[\"_matmul\", 512, 3072, 768, \"float32\"]", "cuda -keys=cuda,gpu -arch=sm_86 -max_num_threads=1024 -model=unknown -thread_warp_size=32", [82, 999, 999, 49152, 2147483647, 1024, 255, 32], "", 0, []], [[], [["CHW", 2, "local"], ["SP", 2, 0, 512, [1, 32, 4, 1], 1], ["SP", 2, 5, 768, [1, 2, 384, 1], 1], ["SP", 2, 10, 3072, [3, 1], 1], ["RE", 2, [0, 5, 1, 6, 2, 7, 10, 11, 3, 8, 12, 4, 9]], ["FSP", 3, 0, 1, 3], ["FSP", 3, 4, 2, 3], ["RE", 3, [0, 4, 1, 5, 2, 6, 3, 7]], ["CA", 2, 3, 5], ["CHR", 1, "shared", [2]], ["CA", 2, 3, 6], ["CHR", 0, "shared", [3]], ["CA", 1, 4, 6], ["FU", 5, [0, 1]], ["AN", 5, 0, 5], ["FU", 5, [1, 2]], ["AN", 5, 1, 4], ["FU", 5, [2, 3]], ["AN", 5, 2, 6], ["FU", 3, [0, 1]], ["SP", 3, 0, 1152, [2], 1], ["AN", 3, 1, 2], ["FFSP", 3, 0, [2, 1], 1, 1], ["AN", 3, 1, 6], ["FU", 1, [0, 1]], ["SP", 1, 0, 12, [2], 1], ["AN", 1, 1, 2], ["FFSP", 1, 0, [2, 1], 1, 1], ["AN", 1, 1, 6], ["PR", 4, 0, "auto_unroll_max_step$1024"]]]], "r": [[0.0954335], 0, 10.5843, 1708774725], "mark": 2, "ag": 0, "v": "v0.6"}
{"i": [["[\"_matmul\", 512, 3072, 768, \"float32\"]", "cuda -keys=cuda,gpu -arch=sm_86 -max_num_threads=1024 -model=unknown -thread_warp_size=32", [82, 999, 999, 49152, 2147483647, 1024, 255, 32], "", 0, []], [[], [["CHW", 2, "local"], ["SP", 2, 0, 512, [1, 32, 16, 1], 1], ["SP", 2, 5, 768, [1, 2, 384, 1], 1], ["SP", 2, 10, 3072, [3, 1], 1], ["RE", 2, [0, 5, 1, 6, 2, 7, 10, 11, 3, 8, 12, 4, 9]], ["FSP", 3, 0, 1, 3], ["FSP", 3, 4, 2, 3], ["RE", 3, [0, 4, 1, 5, 2, 6, 3, 7]], ["CA", 2, 3, 5], ["CHR", 1, "shared", [2]], ["CA", 2, 3, 6], ["CHR", 0, "shared", [3]], ["CA", 1, 4, 6], ["FU", 5, [0, 1]], ["AN", 5, 0, 5], ["FU", 5, [1, 2]], ["AN", 5, 1, 4], ["FU", 5, [2, 3]], ["AN", 5, 2, 6], ["FU", 3, [0, 1]], ["SP", 3, 0, 1152, [2], 1], ["AN", 3, 1, 2], ["FFSP", 3, 0, [2, 1], 1, 1], ["AN", 3, 1, 6], ["FU", 1, [0, 1]], ["SP", 1, 0, 48, [2], 1], ["AN", 1, 1, 2], ["FFSP", 1, 0, [2, 1], 1, 1], ["AN", 1, 1, 6], ["PR", 4, 0, "auto_unroll_max_step$1024"]]]], "r": [[0.372822], 0, 15.8839, 1708774726], "mark": 2, "ag": 0, "v": "v0.6"}
{"i": [["[\"_matmul\", 512, 3072, 768, \"float32\"]", "cuda -keys=cuda,gpu -arch=sm_86 -max_num_threads=1024 -model=unknown -thread_warp_size=32", [82, 999, 999, 49152, 2147483647, 1024, 255, 32], "", 0, []], [[], [["CHW", 2, "local"], ["SP", 2, 0, 512, [1, 32, 8, 1], 1], ["SP", 2, 5, 768, [1, 1, 384, 1], 1], ["SP", 2, 10, 3072, [2, 1], 1], ["RE", 2, [0, 5, 1, 6, 2, 7, 10, 11, 3, 8, 12, 4, 9]], ["FSP", 3, 0, 1, 3], ["FSP", 3, 4, 2, 3], ["RE", 3, [0, 4, 1, 5, 2, 6, 3, 7]], ["CA", 2, 3, 5], ["CHR", 1, "shared", [2]], ["CA", 2, 3, 6], ["CHR", 0, "shared", [3]], ["CA", 1, 4, 6], ["FU", 5, [0, 1]], ["AN", 5, 0, 5], ["FU", 5, [1, 2]], ["AN", 5, 1, 4], ["FU", 5, [2, 3]], ["AN", 5, 2, 6], ["FU", 3, [0, 1]], ["SP", 3, 0, 768, [2], 1], ["AN", 3, 1, 2], ["FFSP", 3, 0, [2, 1], 1, 1], ["AN", 3, 1, 6], ["FU", 1, [0, 1]], ["SP", 1, 0, 16, [2], 1], ["AN", 1, 1, 2], ["FFSP", 1, 0, [2, 1], 1, 1], ["AN", 1, 1, 6], ["PR", 4, 0, "auto_unroll_max_step$1024"]]]], "r": [[0.185226], 0, 10.363, 1708774727], "mark": 2, "ag": 0, "v": "v0.6"}
{"i": [["[\"_matmul\", 512, 3072, 768, \"float32\"]", "cuda -keys=cuda,gpu -arch=sm_86 -max_num_threads=1024 -model=unknown -thread_warp_size=32", [82, 999, 999, 49152, 2147483647, 1024, 255, 32], "", 0, []], [[], [["CHW", 2, "local"], ["SP", 2, 0, 512, [1, 32, 8, 1], 1], ["SP", 2, 5, 768, [1, 1, 384, 1], 1], ["SP", 2, 10, 3072, [4, 1], 1], ["RE", 2, [0, 5, 1, 6, 2, 7, 10, 11, 3, 8, 12, 4, 9]], ["FSP", 3, 0, 1, 3], ["FSP", 3, 4, 2, 3], ["RE", 3, [0, 4, 1, 5, 2, 6, 3, 7]], ["CA", 2, 3, 5], ["CHR", 1, "shared", [2]], ["CA", 2, 3, 6], ["CHR", 0, "shared", [3]], ["CA", 1, 4, 6], ["FU", 5, [0, 1]], ["AN", 5, 0, 5], ["FU", 5, [1, 2]], ["AN", 5, 1, 4], ["FU", 5, [2, 3]], ["AN", 5, 2, 6], ["FU", 3, [0, 1]], ["SP", 3, 0, 1536, [2], 1], ["AN", 3, 1, 2], ["FFSP", 3, 0, [2, 1], 1, 1], ["AN", 3, 1, 6], ["FU", 1, [0, 1]], ["SP", 1, 0, 32, [2], 1], ["AN", 1, 1, 2], ["FFSP", 1, 0, [2, 1], 1, 1], ["AN", 1, 1, 6], ["PR", 4, 0, "auto_unroll_max_step$1024"]]]], "r": [[0.18551], 0, 11.585, 1708774728], "mark": 2, "ag": 0, "v": "v0.6"}
{"i": [["[\"_matmul\", 512, 3072, 768, \"float32\"]", "cuda -keys=cuda,gpu -arch=sm_86 -max_num_threads=1024 -model=unknown -thread_warp_size=32", [82, 999, 999, 49152, 2147483647, 1024, 255, 32], "", 0, []], [[], [["CHW", 2, "local"], ["SP", 2, 0, 512, [1, 32, 8, 1], 1], ["SP", 2, 5, 768, [1, 1, 256, 1], 1], ["SP", 2, 10, 3072, [3, 1], 1], ["RE", 2, [0, 5, 1, 6, 2, 7, 10, 11, 3, 8, 12, 4, 9]], ["FSP", 3, 0, 1, 3], ["FSP", 3, 4, 2, 3], ["RE", 3, [0, 4, 1, 5, 2, 6, 3, 7]], ["CA", 2, 3, 5], ["CHR", 1, "shared", [2]], ["CA", 2, 3, 6], ["CHR", 0, "shared", [3]], ["CA", 1, 4, 6], ["FU", 5, [0, 1]], ["AN", 5, 0, 5], ["FU", 5, [1, 2]], ["AN", 5, 1, 4], ["FU", 5, [2, 3]], ["AN", 5, 2, 6], ["FU", 3, [0, 1]], ["SP", 3, 0, 768, [2], 1], ["AN", 3, 1, 2], ["FFSP", 3, 0, [2, 1], 1, 1], ["AN", 3, 1, 6], ["FU", 1, [0, 1]], ["SP", 1, 0, 24, [2], 1], ["AN", 1, 1, 2], ["FFSP", 1, 0, [2, 1], 1, 1], ["AN", 1, 1, 6], ["PR", 4, 0, "auto_unroll_max_step$1024"]]]], "r": [[0.0880929], 0, 4.68991, 1708774728], "mark": 2, "ag": 0, "v": "v0.6"}
{"i": [["[\"_matmul\", 512, 3072, 768, \"float32\"]", "cuda -keys=cuda,gpu -arch=sm_86 -max_num_threads=1024 -model=unknown -thread_warp_size=32", [82, 999, 999, 49152, 2147483647, 1024, 255, 32], "", 0, []], [[], [["CHW", 2, "local"], ["SP", 2, 0, 512, [1, 16, 8, 1], 1], ["SP", 2, 5, 768, [1, 2, 384, 1], 1], ["SP", 2, 10, 3072, [2, 1], 1], ["RE", 2, [0, 5, 1, 6, 2, 7, 10, 11, 3, 8, 12, 4, 9]], ["FSP", 3, 0, 1, 3], ["FSP", 3, 4, 2, 3], ["RE", 3, [0, 4, 1, 5, 2, 6, 3, 7]], ["CA", 2, 3, 5], ["CHR", 1, "shared", [2]], ["CA", 2, 3, 6], ["CHR", 0, "shared", [3]], ["CA", 1, 4, 6], ["FU", 5, [0, 1]], ["AN", 5, 0, 5], ["FU", 5, [1, 2]], ["AN", 5, 1, 4], ["FU", 5, [2, 3]], ["AN", 5, 2, 6], ["FU", 3, [0, 1]], ["SP", 3, 0, 768, [2], 1], ["AN", 3, 1, 2], ["FFSP", 3, 0, [2, 1], 1, 1], ["AN", 3, 1, 6], ["FU", 1, [0, 1]], ["SP", 1, 0, 16, [2], 1], ["AN", 1, 1, 2], ["FFSP", 1, 0, [2, 1], 1, 1], ["AN", 1, 1, 6], ["PR", 4, 0, "auto_unroll_max_step$1024"]]]], "r": [[0.185499], 0, 14.941, 1708774729], "mark": 2, "ag": 0, "v": "v0.6"}
{"i": [["[\"_matmul\", 512, 3072, 768, \"float32\"]", "cuda -keys=cuda,gpu -arch=sm_86 -max_num_threads=1024 -model=unknown -thread_warp_size=32", [82, 999, 999, 49152, 2147483647, 1024, 255, 32], "", 0, []], [[], [["CHW", 2, "local"], ["SP", 2, 0, 512, [1, 16, 8, 1], 1], ["SP", 2, 5, 768, [1, 2, 384, 1], 1], ["SP", 2, 10, 3072, [4, 1], 1], ["RE", 2, [0, 5, 1, 6, 2, 7, 10, 11, 3, 8, 12, 4, 9]], ["FSP", 3, 0, 1, 3], ["FSP", 3, 4, 2, 3], ["RE", 3, [0, 4, 1, 5, 2, 6, 3, 7]], ["CA", 2, 3, 5], ["CHR", 1, "shared", [2]], ["CA", 2, 3, 6], ["CHR", 0, "shared", [3]], ["CA", 1, 4, 6], ["FU", 5, [0, 1]], ["AN", 5, 0, 5], ["FU", 5, [1, 2]], ["AN", 5, 1, 4], ["FU", 5, [2, 3]], ["AN", 5, 2, 6], ["FU", 3, [0, 1]], ["SP", 3, 0, 1536, [2], 1], ["AN", 3, 1, 2], ["FFSP", 3, 0, [2, 1], 1, 1], ["AN", 3, 1, 6], ["FU", 1, [0, 1]], ["SP", 1, 0, 32, [2], 1], ["AN", 1, 1, 2], ["FFSP", 1, 0, [2, 1], 1, 1], ["AN", 1, 1, 6], ["PR", 4, 0, "auto_unroll_max_step$1024"]]]], "r": [[0.185903], 0, 14.0389, 1708774730], "mark": 2, "ag": 0, "v": "v0.6"}
{"i": [["[\"_matmul\", 512, 3072, 768, \"float32\"]", "cuda -keys=cuda,gpu -arch=sm_86 -max_num_threads=1024 -model=unknown -thread_warp_size=32", [82, 999, 999, 49152, 2147483647, 1024, 255, 32], "", 0, []], [[], [["CHW", 2, "local"], ["SP", 2, 0, 512, [1, 64, 8, 1], 1], ["SP", 2, 5, 768, [1, 2, 384, 1], 1], ["SP", 2, 10, 3072, [2, 1], 1], ["RE", 2, [0, 5, 1, 6, 2, 7, 10, 11, 3, 8, 12, 4, 9]], ["FSP", 3, 0, 1, 3], ["FSP", 3, 4, 2, 3], ["RE", 3, [0, 4, 1, 5, 2, 6, 3, 7]], ["CA", 2, 3, 5], ["CHR", 1, "shared", [2]], ["CA", 2, 3, 6], ["CHR", 0, "shared", [3]], ["CA", 1, 4, 6], ["FU", 5, [0, 1]], ["AN", 5, 0, 5], ["FU", 5, [1, 2]], ["AN", 5, 1, 4], ["FU", 5, [2, 3]], ["AN", 5, 2, 6], ["FU", 3, [0, 1]], ["SP", 3, 0, 768, [2], 1], ["AN", 3, 1, 2], ["FFSP", 3, 0, [2, 1], 1, 1], ["AN", 3, 1, 6], ["FU", 1, [0, 1]], ["SP", 1, 0, 16, [2], 1], ["AN", 1, 1, 2], ["FFSP", 1, 0, [2, 1], 1, 1], ["AN", 1, 1, 6], ["PR", 4, 0, "auto_unroll_max_step$1024"]]]], "r": [[0.187278], 0, 12.3985, 1708774731], "mark": 2, "ag": 0, "v": "v0.6"}
{"i": [["[\"_matmul\", 512, 3072, 768, \"float32\"]", "cuda -keys=cuda,gpu -arch=sm_86 -max_num_threads=1024 -model=unknown -thread_warp_size=32", [82, 999, 999, 49152, 2147483647, 1024, 255, 32], "", 0, []], [[], [["CHW", 2, "local"], ["SP", 2, 0, 512, [1, 64, 8, 1], 1], ["SP", 2, 5, 768, [1, 2, 384, 1], 1], ["SP", 2, 10, 3072, [4, 1], 1], ["RE", 2, [0, 5, 1, 6, 2, 7, 10, 11, 3, 8, 12, 4, 9]], ["FSP", 3, 0, 1, 3], ["FSP", 3, 4, 2, 3], ["RE", 3, [0, 4, 1, 5, 2, 6, 3, 7]], ["CA", 2, 3, 5], ["CHR", 1, "shared", [2]], ["CA", 2, 3, 6], ["CHR", 0, "shared", [3]], ["CA", 1, 4, 6], ["FU", 5, [0, 1]], ["AN", 5, 0, 5], ["FU", 5, [1, 2]], ["AN", 5, 1, 4], ["FU", 5, [2, 3]], ["AN", 5, 2, 6], ["FU", 3, [0, 1]], ["SP", 3, 0, 1536, [2], 1], ["AN", 3, 1, 2], ["FFSP", 3, 0, [2, 1], 1, 1], ["AN", 3, 1, 6], ["FU", 1, [0, 1]], ["SP", 1, 0, 32, [2], 1], ["AN", 1, 1, 2], ["FFSP", 1, 0, [2, 1], 1, 1], ["AN", 1, 1, 6], ["PR", 4, 0, "auto_unroll_max_step$1024"]]]], "r": [[0.186508], 0, 14.0656, 1708774731], "mark": 2, "ag": 0, "v": "v0.6"}
{"i": [["[\"_matmul\", 512, 3072, 768, \"float32\"]", "cuda -keys=cuda,gpu -arch=sm_86 -max_num_threads=1024 -model=unknown -thread_warp_size=32", [82, 999, 999, 49152, 2147483647, 1024, 255, 32], "", 0, []], [[], [["CHW", 2, "local"], ["SP", 2, 0, 512, [1, 64, 8, 1], 1], ["SP", 2, 5, 768, [1, 1, 384, 1], 1], ["SP", 2, 10, 3072, [3, 1], 1], ["RE", 2, [0, 5, 1, 6, 2, 7, 10, 11, 3, 8, 12, 4, 9]], ["FSP", 3, 0, 1, 3], ["FSP", 3, 4, 2, 3], ["RE", 3, [0, 4, 1, 5, 2, 6, 3, 7]], ["CA", 2, 3, 5], ["CHR", 1, "shared", [2]], ["CA", 2, 3, 6], ["CHR", 0, "shared", [3]], ["CA", 1, 4, 6], ["FU", 5, [0, 1]], ["AN", 5, 0, 5], ["FU", 5, [1, 2]], ["AN", 5, 1, 4], ["FU", 5, [2, 3]], ["AN", 5, 2, 6], ["FU", 3, [0, 1]], ["SP", 3, 0, 1152, [2], 1], ["AN", 3, 1, 2], ["FFSP", 3, 0, [2, 1], 1, 1], ["AN", 3, 1, 6], ["FU", 1, [0, 1]], ["SP", 1, 0, 24, [2], 1], ["AN", 1, 1, 2], ["FFSP", 1, 0, [2, 1], 1, 1], ["AN", 1, 1, 6], ["PR", 4, 0, "auto_unroll_max_step$1024"]]]], "r": [[0.188016], 0, 11.4144, 1708774732], "mark": 2, "ag": 0, "v": "v0.6"}
{"i": [["[\"_matmul\", 512, 3072, 768, \"float32\"]", "cuda -keys=cuda,gpu -arch=sm_86 -max_num_threads=1024 -model=unknown -thread_warp_size=32", [82, 999, 999, 49152, 2147483647, 1024, 255, 32], "", 0, []], [[], [["CHW", 2, "local"], ["SP", 2, 0, 512, [1, 32, 4, 1], 1], ["SP", 2, 5, 768, [1, 2, 384, 1], 1], ["SP", 2, 10, 3072, [2, 1], 1], ["RE", 2, [0, 5, 1, 6, 2, 7, 10, 11, 3, 8, 12, 4, 9]], ["FSP", 3, 0, 1, 3], ["FSP", 3, 4, 2, 3], ["RE", 3, [0, 4, 1, 5, 2, 6, 3, 7]], ["CA", 2, 3, 5], ["CHR", 1, "shared", [2]], ["CA", 2, 3, 6], ["CHR", 0, "shared", [3]], ["CA", 1, 4, 6], ["FU", 5, [0, 1]], ["AN", 5, 0, 5], ["FU", 5, [1, 2]], ["AN", 5, 1, 4], ["FU", 5, [2, 3]], ["AN", 5, 2, 6], ["FU", 3, [0, 1]], ["SP", 3, 0, 768, [2], 1], ["AN", 3, 1, 2], ["FFSP", 3, 0, [2, 1], 1, 1], ["AN", 3, 1, 6], ["FU", 1, [0, 1]], ["SP", 1, 0, 8, [2], 1], ["AN", 1, 1, 2], ["FFSP", 1, 0, [2, 1], 1, 1], ["AN", 1, 1, 6], ["PR", 4, 0, "auto_unroll_max_step$1024"]]]], "r": [[0.0958906], 0, 13.7525, 1708774733], "mark": 2, "ag": 0, "v": "v0.6"}
{"i": [["[\"_matmul\", 512, 3072, 768, \"float32\"]", "cuda -keys=cuda,gpu -arch=sm_86 -max_num_threads=1024 -model=unknown -thread_warp_size=32", [82, 999, 999, 49152, 2147483647, 1024, 255, 32], "", 0, []], [[], [["CHW", 2, "local"], ["SP", 2, 0, 512, [1, 32, 4, 1], 1], ["SP", 2, 5, 768, [1, 2, 384, 1], 1], ["SP", 2, 10, 3072, [4, 1], 1], ["RE", 2, [0, 5, 1, 6, 2, 7, 10, 11, 3, 8, 12, 4, 9]], ["FSP", 3, 0, 1, 3], ["FSP", 3, 4, 2, 3], ["RE", 3, [0, 4, 1, 5, 2, 6, 3, 7]], ["CA", 2, 3, 5], ["CHR", 1, "shared", [2]], ["CA", 2, 3, 6], ["CHR", 0, "shared", [3]], ["CA", 1, 4, 6], ["FU", 5, [0, 1]], ["AN", 5, 0, 5], ["FU", 5, [1, 2]], ["AN", 5, 1, 4], ["FU", 5, [2, 3]], ["AN", 5, 2, 6], ["FU", 3, [0, 1]], ["SP", 3, 0, 1536, [2], 1], ["AN", 3, 1, 2], ["FFSP", 3, 0, [2, 1], 1, 1], ["AN", 3, 1, 6], ["FU", 1, [0, 1]], ["SP", 1, 0, 16, [2], 1], ["AN", 1, 1, 2], ["FFSP", 1, 0, [2, 1], 1, 1], ["AN", 1, 1, 6], ["PR", 4, 0, "auto_unroll_max_step$1024"]]]], "r": [[0.0955901], 0, 11.0602, 1708774733], "mark": 2, "ag": 0, "v": "v0.6"}
{"i": [["[\"_matmul\", 512, 3072, 768, \"float32\"]", "cuda -keys=cuda,gpu -arch=sm_86 -max_num_threads=1024 -model=unknown -thread_warp_size=32", [82, 999, 999, 49152, 2147483647, 1024, 255, 32], "", 0, []], [[], [["CHW", 2, "local"], ["SP", 2, 0, 512, [1, 32, 16, 1], 1], ["SP", 2, 5, 768, [1, 2, 384, 1], 1], ["SP", 2, 10, 3072, [2, 1], 1], ["RE", 2, [0, 5, 1, 6, 2, 7, 10, 11, 3, 8, 12, 4, 9]], ["FSP", 3, 0, 1, 3], ["FSP", 3, 4, 2, 3], ["RE", 3, [0, 4, 1, 5, 2, 6, 3, 7]], ["CA", 2, 3, 5], ["CHR", 1, "shared", [2]], ["CA", 2, 3, 6], ["CHR", 0, "shared", [3]], ["CA", 1, 4, 6], ["FU", 5, [0, 1]], ["AN", 5, 0, 5], ["FU", 5, [1, 2]], ["AN", 5, 1, 4], ["FU", 5, [2, 3]], ["AN", 5, 2, 6], ["FU", 3, [0, 1]], ["SP", 3, 0, 768, [2], 1], ["AN", 3, 1, 2], ["FFSP", 3, 0, [2, 1], 1, 1], ["AN", 3, 1, 6], ["FU", 1, [0, 1]], ["SP", 1, 0, 32, [2], 1], ["AN", 1, 1, 2], ["FFSP", 1, 0, [2, 1], 1, 1], ["AN", 1, 1, 6], ["PR", 4, 0, "auto_unroll_max_step$1024"]]]], "r": [[0.37405], 0, 14.7984, 1708774735], "mark": 2, "ag": 0, "v": "v0.6"}
{"i": [["[\"_matmul\", 512, 3072, 768, \"float32\"]", "cuda -keys=cuda,gpu -arch=sm_86 -max_num_threads=1024 -model=unknown -thread_warp_size=32", [82, 999, 999, 49152, 2147483647, 1024, 255, 32], "", 0, []], [[], [["CHW", 2, "local"], ["SP", 2, 0, 512, [1, 32, 16, 1], 1], ["SP", 2, 5, 768, [1, 2, 384, 1], 1], ["SP", 2, 10, 3072, [4, 1], 1], ["RE", 2, [0, 5, 1, 6, 2, 7, 10, 11, 3, 8, 12, 4, 9]], ["FSP", 3, 0, 1, 3], ["FSP", 3, 4, 2, 3], ["RE", 3, [0, 4, 1, 5, 2, 6, 3, 7]], ["CA", 2, 3, 5], ["CHR", 1, "shared", [2]], ["CA", 2, 3, 6], ["CHR", 0, "shared", [3]], ["CA", 1, 4, 6], ["FU", 5, [0, 1]], ["AN", 5, 0, 5], ["FU", 5, [1, 2]], ["AN", 5, 1, 4], ["FU", 5, [2, 3]], ["AN", 5, 2, 6], ["FU", 3, [0, 1]], ["SP", 3, 0, 1536, [2], 1], ["AN", 3, 1, 2], ["FFSP", 3, 0, [2, 1], 1, 1], ["AN", 3, 1, 6], ["FU", 1, [0, 1]], ["SP", 1, 0, 64, [2], 1], ["AN", 1, 1, 2], ["FFSP", 1, 0, [2, 1], 1, 1], ["AN", 1, 1, 6], ["PR", 4, 0, "auto_unroll_max_step$1024"]]]], "r": [[0.373671], 0, 15.2134, 1708774736], "mark": 2, "ag": 0, "v": "v0.6"}
{"i": [["[\"_matmul\", 512, 3072, 768, \"float32\"]", "cuda -keys=cuda,gpu -arch=sm_86 -max_num_threads=1024 -model=unknown -thread_warp_size=32", [82, 999, 999, 49152, 2147483647, 1024, 255, 32], "", 0, []], [[], [["CHW", 2, "local"], ["SP", 2, 0, 512, [1, 32, 4, 1], 1], ["SP", 2, 5, 768, [1, 1, 384, 1], 1], ["SP", 2, 10, 3072, [3, 1], 1], ["RE", 2, [0, 5, 1, 6, 2, 7, 10, 11, 3, 8, 12, 4, 9]], ["FSP", 3, 0, 1, 3], ["FSP", 3, 4, 2, 3], ["RE", 3, [0, 4, 1, 5, 2, 6, 3, 7]], ["CA", 2, 3, 5], ["CHR", 1, "shared", [2]], ["CA", 2, 3, 6], ["CHR", 0, "shared", [3]], ["CA", 1, 4, 6], ["FU", 5, [0, 1]], ["AN", 5, 0, 5], ["FU", 5, [1, 2]], ["AN", 5, 1, 4], ["FU", 5, [2, 3]], ["AN", 5, 2, 6], ["FU", 3, [0, 1]], ["SP", 3, 0, 1152, [2], 1], ["AN", 3, 1, 2], ["FFSP", 3, 0, [2, 1], 1, 1], ["AN", 3, 1, 6], ["FU", 1, [0, 1]], ["SP", 1, 0, 12, [2], 1], ["AN", 1, 1, 2], ["FFSP", 1, 0, [2, 1], 1, 1], ["AN", 1, 1, 6], ["PR", 4, 0, "auto_unroll_max_step$1024"]]]], "r": [[0.0935383], 0, 10.7069, 1708774737], "mark": 2, "ag": 0, "v": "v0.6"}
{"i": [["[\"_matmul\", 512, 3072, 768, \"float32\"]", "cuda -keys=cuda,gpu -arch=sm_86 -max_num_threads=1024 -model=unknown -thread_warp_size=32", [82, 999, 999, 49152, 2147483647, 1024, 255, 32], "", 0, []], [[], [["CHW", 2, "local"], ["SP", 2, 0, 512, [1, 32, 16, 1], 1], ["SP", 2, 5, 768, [1, 1, 384, 1], 1], ["SP", 2, 10, 3072, [3, 1], 1], ["RE", 2, [0, 5, 1, 6, 2, 7, 10, 11, 3, 8, 12, 4, 9]], ["FSP", 3, 0, 1, 3], ["FSP", 3, 4, 2, 3], ["RE", 3, [0, 4, 1, 5, 2, 6, 3, 7]], ["CA", 2, 3, 5], ["CHR", 1, "shared", [2]], ["CA", 2, 3, 6], ["CHR", 0, "shared", [3]], ["CA", 1, 4, 6], ["FU", 5, [0, 1]], ["AN", 5, 0, 5], ["FU", 5, [1, 2]], ["AN", 5, 1, 4], ["FU", 5, [2, 3]], ["AN", 5, 2, 6], ["FU", 3, [0, 1]], ["SP", 3, 0, 1152, [2], 1], ["AN", 3, 1, 2], ["FFSP", 3, 0, [2, 1], 1, 1], ["AN", 3, 1, 6], ["FU", 1, [0, 1]], ["SP", 1, 0, 48, [2], 1], ["AN", 1, 1, 2], ["FFSP", 1, 0, [2, 1], 1, 1], ["AN", 1, 1, 6], ["PR", 4, 0, "auto_unroll_max_step$1024"]]]], "r": [[0.370243], 0, 9.06647, 1708774738], "mark": 2, "ag": 0, "v": "v0.6"}
{"i": [["[\"_matmul\", 512, 3072, 768, \"float32\"]", "cuda -keys=cuda,gpu -arch=sm_86 -max_num_threads=1024 -model=unknown -thread_warp_size=32", [82, 999, 999, 49152, 2147483647, 1024, 255, 32], "", 0, []], [[], [["CHW", 2, "local"], ["SP", 2, 0, 512, [1, 16, 4, 1], 1], ["SP", 2, 5, 768, [1, 2, 384, 1], 1], ["SP", 2, 10, 3072, [3, 1], 1], ["RE", 2, [0, 5, 1, 6, 2, 7, 10, 11, 3, 8, 12, 4, 9]], ["FSP", 3, 0, 1, 3], ["FSP", 3, 4, 2, 3], ["RE", 3, [0, 4, 1, 5, 2, 6, 3, 7]], ["CA", 2, 3, 5], ["CHR", 1, "shared", [2]], ["CA", 2, 3, 6], ["CHR", 0, "shared", [3]], ["CA", 1, 4, 6], ["FU", 5, [0, 1]], ["AN", 5, 0, 5], ["FU", 5, [1, 2]], ["AN", 5, 1, 4], ["FU", 5, [2, 3]], ["AN", 5, 2, 6], ["FU", 3, [0, 1]], ["SP", 3, 0, 1152, [2], 1], ["AN", 3, 1, 2], ["FFSP", 3, 0, [2, 1], 1, 1], ["AN", 3, 1, 6], ["FU", 1, [0, 1]], ["SP", 1, 0, 12, [2], 1], ["AN", 1, 1, 2], ["FFSP", 1, 0, [2, 1], 1, 1], ["AN", 1, 1, 6], ["PR", 4, 0, "auto_unroll_max_step$1024"]]]], "r": [[0.0944977], 0, 14.405, 1708774739], "mark": 2, "ag": 0, "v": "v0.6"}
{"i": [["[\"_matmul\", 512, 3072, 768, \"float32\"]", "cuda -keys=cuda,gpu -arch=sm_86 -max_num_threads=1024 -model=unknown -thread_warp_size=32", [82, 999, 999, 49152, 2147483647, 1024, 255, 32], "", 0, []], [[], [["CHW", 2, "local"], ["SP", 2, 0, 512, [1, 64, 4, 1], 1], ["SP", 2, 5, 768, [1, 2, 384, 1], 1], ["SP", 2, 10, 3072, [3, 1], 1], ["RE", 2, [0, 5, 1, 6, 2, 7, 10, 11, 3, 8, 12, 4, 9]], ["FSP", 3, 0, 1, 3], ["FSP", 3, 4, 2, 3], ["RE", 3, [0, 4, 1, 5, 2, 6, 3, 7]], ["CA", 2, 3, 5], ["CHR", 1, "shared", [2]], ["CA", 2, 3, 6], ["CHR", 0, "shared", [3]], ["CA", 1, 4, 6], ["FU", 5, [0, 1]], ["AN", 5, 0, 5], ["FU", 5, [1, 2]], ["AN", 5, 1, 4], ["FU", 5, [2, 3]], ["AN", 5, 2, 6], ["FU", 3, [0, 1]], ["SP", 3, 0, 1152, [2], 1], ["AN", 3, 1, 2], ["FFSP", 3, 0, [2, 1], 1, 1], ["AN", 3, 1, 6], ["FU", 1, [0, 1]], ["SP", 1, 0, 12, [2], 1], ["AN", 1, 1, 2], ["FFSP", 1, 0, [2, 1], 1, 1], ["AN", 1, 1, 6], ["PR", 4, 0, "auto_unroll_max_step$1024"]]]], "r": [[0.0959155], 0, 14.6179, 1708774739], "mark": 2, "ag": 0, "v": "v0.6"}
{"i": [["[\"_matmul\", 512, 3072, 768, \"float32\"]", "cuda -keys=cuda,gpu -arch=sm_86 -max_num_threads=1024 -model=unknown -thread_warp_size=32", [82, 999, 999, 49152, 2147483647, 1024, 255, 32], "", 0, []], [[], [["CHW", 2, "local"], ["SP", 2, 0, 512, [1, 16, 16, 1], 1], ["SP", 2, 5, 768, [1, 2, 384, 1], 1], ["SP", 2, 10, 3072, [3, 1], 1], ["RE", 2, [0, 5, 1, 6, 2, 7, 10, 11, 3, 8, 12, 4, 9]], ["FSP", 3, 0, 1, 3], ["FSP", 3, 4, 2, 3], ["RE", 3, [0, 4, 1, 5, 2, 6, 3, 7]], ["CA", 2, 3, 5], ["CHR", 1, "shared", [2]], ["CA", 2, 3, 6], ["CHR", 0, "shared", [3]], ["CA", 1, 4, 6], ["FU", 5, [0, 1]], ["AN", 5, 0, 5], ["FU", 5, [1, 2]], ["AN", 5, 1, 4], ["FU", 5, [2, 3]], ["AN", 5, 2, 6], ["FU", 3, [0, 1]], ["SP", 3, 0, 1152, [2], 1], ["AN", 3, 1, 2], ["FFSP", 3, 0, [2, 1], 1, 1], ["AN", 3, 1, 6], ["FU", 1, [0, 1]], ["SP", 1, 0, 48, [2], 1], ["AN", 1, 1, 2], ["FFSP", 1, 0, [2, 1], 1, 1], ["AN", 1, 1, 6], ["PR", 4, 0, "auto_unroll_max_step$1024"]]]], "r": [[0.370229], 0, 15.0068, 1708774741], "mark": 2, "ag": 0, "v": "v0.6"}
{"i": [["[\"_matmul\", 512, 3072, 768, \"float32\"]", "cuda -keys=cuda,gpu -arch=sm_86 -max_num_threads=1024 -model=unknown -thread_warp_size=32", [82, 999, 999, 49152, 2147483647, 1024, 255, 32], "", 0, []], [[], [["CHW", 2, "local"], ["SP", 2, 0, 512, [1, 32, 8, 1], 1], ["SP", 2, 5, 768, [1, 1, 256, 1], 1], ["SP", 2, 10, 3072, [3, 1], 1], ["RE", 2, [0, 5, 1, 6, 2, 7, 10, 11, 3, 8, 12, 4, 9]], ["FSP", 3, 0, 1, 3], ["FSP", 3, 4, 2, 3], ["RE", 3, [0, 4, 1, 5, 2, 6, 3, 7]], ["CA", 2, 3, 5], ["CHR", 1, "shared", [2]], ["CA", 2, 3, 6], ["CHR", 0, "shared", [3]], ["CA", 1, 4, 6], ["FU", 5, [0, 1]], ["AN", 5, 0, 5], ["FU", 5, [1, 2]], ["AN", 5, 1, 4], ["FU", 5, [2, 3]], ["AN", 5, 2, 6], ["FU", 3, [0, 1]], ["SP", 3, 0, 768, [2], 1], ["AN", 3, 1, 2], ["FFSP", 3, 0, [2, 1], 1, 1], ["AN", 3, 1, 6], ["FU", 1, [0, 1]], ["SP", 1, 0, 24, [2], 1], ["AN", 1, 1, 2], ["FFSP", 1, 0, [2, 1], 1, 1], ["AN", 1, 1, 6], ["PR", 4, 0, "auto_unroll_max_step$1024"]]]], "r": [[0.0880929], 0, 4.68991, 1708774728], "mark": 2, "ag": 1, "v": "v0.6"}
{"i": [["[\"_matmul\", 512, 3072, 768, \"float32\"]", "cuda -keys=cuda,gpu -arch=sm_86 -max_num_threads=1024 -model=unknown -thread_warp_size=32", [82, 999, 999, 49152, 2147483647, 1024, 255, 32], "", 0, []], [[], [["CHW", 2, "local"], ["SP", 2, 0, 512, [1, 32, 8, 1], 1], ["SP", 2, 5, 768, [1, 1, 256, 1], 1], ["SP", 2, 10, 3072, [2, 1], 1], ["RE", 2, [0, 5, 1, 6, 2, 7, 10, 11, 3, 8, 12, 4, 9]], ["FSP", 3, 0, 1, 3], ["FSP", 3, 4, 2, 3], ["RE", 3, [0, 4, 1, 5, 2, 6, 3, 7]], ["CA", 2, 3, 5], ["CHR", 1, "shared", [2]], ["CA", 2, 3, 6], ["CHR", 0, "shared", [3]], ["CA", 1, 4, 6], ["FU", 5, [0, 1]], ["AN", 5, 0, 5], ["FU", 5, [1, 2]], ["AN", 5, 1, 4], ["FU", 5, [2, 3]], ["AN", 5, 2, 6], ["FU", 3, [0, 1]], ["SP", 3, 0, 512, [2], 1], ["AN", 3, 1, 2], ["FFSP", 3, 0, [2, 1], 1, 1], ["AN", 3, 1, 6], ["FU", 1, [0, 1]], ["SP", 1, 0, 16, [2], 1], ["AN", 1, 1, 2], ["FFSP", 1, 0, [2, 1], 1, 1], ["AN", 1, 1, 6], ["PR", 4, 0, "auto_unroll_max_step$1024"]]]], "r": [[0.0878135], 0, 3.71227, 1708774748], "mark": 2, "ag": 1, "v": "v0.6"}
{"i": [["[\"_matmul\", 512, 3072, 768, \"float32\"]", "cuda -keys=cuda,gpu -arch=sm_86 -max_num_threads=1024 -model=unknown -thread_warp_size=32", [82, 999, 999, 49152, 2147483647, 1024, 255, 32], "", 0, []], [[], [["CHW", 2, "local"], ["SP", 2, 0, 512, [1, 32, 8, 1], 1], ["SP", 2, 5, 768, [1, 1, 256, 1], 1], ["SP", 2, 10, 3072, [4, 1], 1], ["RE", 2, [0, 5, 1, 6, 2, 7, 10, 11, 3, 8, 12, 4, 9]], ["FSP", 3, 0, 1, 3], ["FSP", 3, 4, 2, 3], ["RE", 3, [0, 4, 1, 5, 2, 6, 3, 7]], ["CA", 2, 3, 5], ["CHR", 1, "shared", [2]], ["CA", 2, 3, 6], ["CHR", 0, "shared", [3]], ["CA", 1, 4, 6], ["FU", 5, [0, 1]], ["AN", 5, 0, 5], ["FU", 5, [1, 2]], ["AN", 5, 1, 4], ["FU", 5, [2, 3]], ["AN", 5, 2, 6], ["FU", 3, [0, 1]], ["SP", 3, 0, 1024, [2], 1], ["AN", 3, 1, 2], ["FFSP", 3, 0, [2, 1], 1, 1], ["AN", 3, 1, 6], ["FU", 1, [0, 1]], ["SP", 1, 0, 32, [2], 1], ["AN", 1, 1, 2], ["FFSP", 1, 0, [2, 1], 1, 1], ["AN", 1, 1, 6], ["PR", 4, 0, "auto_unroll_max_step$1024"]]]], "r": [[0.0879698], 0, 3.24191, 1708774749], "mark": 2, "ag": 1, "v": "v0.6"}
{"i": [["[\"_matmul\", 512, 3072, 768, \"float32\"]", "cuda -keys=cuda,gpu -arch=sm_86 -max_num_threads=1024 -model=unknown -thread_warp_size=32", [82, 999, 999, 49152, 2147483647, 1024, 255, 32], "", 0, []], [[], [["CHW", 2, "local"], ["SP", 2, 0, 512, [1, 32, 8, 1], 1], ["SP", 2, 5, 768, [1, 1, 192, 1], 1], ["SP", 2, 10, 3072, [3, 1], 1], ["RE", 2, [0, 5, 1, 6, 2, 7, 10, 11, 3, 8, 12, 4, 9]], ["FSP", 3, 0, 1, 3], ["FSP", 3, 4, 2, 3], ["RE", 3, [0, 4, 1, 5, 2, 6, 3, 7]], ["CA", 2, 3, 5], ["CHR", 1, "shared", [2]], ["CA", 2, 3, 6], ["CHR", 0, "shared", [3]], ["CA", 1, 4, 6], ["FU", 5, [0, 1]], ["AN", 5, 0, 5], ["FU", 5, [1, 2]], ["AN", 5, 1, 4], ["FU", 5, [2, 3]], ["AN", 5, 2, 6], ["FU", 3, [0, 1]], ["SP", 3, 0, 576, [2], 1], ["AN", 3, 1, 2], ["FFSP", 3, 0, [2, 1], 1, 1], ["AN", 3, 1, 6], ["FU", 1, [0, 1]], ["SP", 1, 0, 24, [2], 1], ["AN", 1, 1, 2], ["FFSP", 1, 0, [2, 1], 1, 1], ["AN", 1, 1, 6], ["PR", 4, 0, "auto_unroll_max_step$1024"]]]], "r": [[0.0417037], 0, 1.84079, 1708774749], "mark": 2, "ag": 1, "v": "v0.6"}
{"i": [["[\"_matmul\", 512, 3072, 768, \"float32\"]", "cuda -keys=cuda,gpu -arch=sm_86 -max_num_threads=1024 -model=unknown -thread_warp_size=32", [82, 999, 999, 49152, 2147483647, 1024, 255, 32], "", 0, []], [[], [["CHW", 2, "local"], ["SP", 2, 0, 512, [1, 64, 8, 1], 1], ["SP", 2, 5, 768, [1, 1, 256, 1], 1], ["SP", 2, 10, 3072, [3, 1], 1], ["RE", 2, [0, 5, 1, 6, 2, 7, 10, 11, 3, 8, 12, 4, 9]], ["FSP", 3, 0, 1, 3], ["FSP", 3, 4, 2, 3], ["RE", 3, [0, 4, 1, 5, 2, 6, 3, 7]], ["CA", 2, 3, 5], ["CHR", 1, "shared", [2]], ["CA", 2, 3, 6], ["CHR", 0, "shared", [3]], ["CA", 1, 4, 6], ["FU", 5, [0, 1]], ["AN", 5, 0, 5], ["FU", 5, [1, 2]], ["AN", 5, 1, 4], ["FU", 5, [2, 3]], ["AN", 5, 2, 6], ["FU", 3, [0, 1]], ["SP", 3, 0, 768, [2], 1], ["AN", 3, 1, 2], ["FFSP", 3, 0, [2, 1], 1, 1], ["AN", 3, 1, 6], ["FU", 1, [0, 1]], ["SP", 1, 0, 24, [2], 1], ["AN", 1, 1, 2], ["FFSP", 1, 0, [2, 1], 1, 1], ["AN", 1, 1, 6], ["PR", 4, 0, "auto_unroll_max_step$1024"]]]], "r": [[0.0898972], 0, 4.14531, 1708774749], "mark": 2, "ag": 1, "v": "v0.6"}
{"i": [["[\"_matmul\", 512, 3072, 768, \"float32\"]", "cuda -keys=cuda,gpu -arch=sm_86 -max_num_threads=1024 -model=unknown -thread_warp_size=32", [82, 999, 999, 49152, 2147483647, 1024, 255, 32], "", 0, []], [[], [["CHW", 2, "local"], ["SP", 2, 0, 512, [1, 32, 4, 1], 1], ["SP", 2, 5, 768, [1, 1, 256, 1], 1], ["SP", 2, 10, 3072, [3, 1], 1], ["RE", 2, [0, 5, 1, 6, 2, 7, 10, 11, 3, 8, 12, 4, 9]], ["FSP", 3, 0, 1, 3], ["FSP", 3, 4, 2, 3], ["RE", 3, [0, 4, 1, 5, 2, 6, 3, 7]], ["CA", 2, 3, 5], ["CHR", 1, "shared", [2]], ["CA", 2, 3, 6], ["CHR", 0, "shared", [3]], ["CA", 1, 4, 6], ["FU", 5, [0, 1]], ["AN", 5, 0, 5], ["FU", 5, [1, 2]], ["AN", 5, 1, 4], ["FU", 5, [2, 3]], ["AN", 5, 2, 6], ["FU", 3, [0, 1]], ["SP", 3, 0, 768, [2], 1], ["AN", 3, 1, 2], ["FFSP", 3, 0, [2, 1], 1, 1], ["AN", 3, 1, 6], ["FU", 1, [0, 1]], ["SP", 1, 0, 12, [2], 1], ["AN", 1, 1, 2], ["FFSP", 1, 0, [2, 1], 1, 1], ["AN", 1, 1, 6], ["PR", 4, 0, "auto_unroll_max_step$1024"]]]], "r": [[0.0401014], 0, 5.55013, 1708774750], "mark": 2, "ag": 1, "v": "v0.6"}
{"i": [["[\"_matmul\", 512, 3072, 768, \"float32\"]", "cuda -keys=cuda,gpu -arch=sm_86 -max_num_threads=1024 -model=unknown -thread_warp_size=32", [82, 999, 999, 49152, 2147483647, 1024, 255, 32], "", 0, []], [[], [["CHW", 2, "local"], ["SP", 2, 0, 512, [1, 32, 16, 1], 1], ["SP", 2, 5, 768, [1, 1, 256, 1], 1], ["SP", 2, 10, 3072, [3, 1], 1], ["RE", 2, [0, 5, 1, 6, 2, 7, 10, 11, 3, 8, 12, 4, 9]], ["FSP", 3, 0, 1, 3], ["FSP", 3, 4, 2, 3], ["RE", 3, [0, 4, 1, 5, 2, 6, 3, 7]], ["CA", 2, 3, 5], ["CHR", 1, "shared", [2]], ["CA", 2, 3, 6], ["CHR", 0, "shared", [3]], ["CA", 1, 4, 6], ["FU", 5, [0, 1]], ["AN", 5, 0, 5], ["FU", 5, [1, 2]], ["AN", 5, 1, 4], ["FU", 5, [2, 3]], ["AN", 5, 2, 6], ["FU", 3, [0, 1]], ["SP", 3, 0, 768, [2], 1], ["AN", 3, 1, 2], ["FFSP", 3, 0, [2, 1], 1, 1], ["AN", 3, 1, 6], ["FU", 1, [0, 1]], ["SP", 1, 0, 48, [2], 1], ["AN", 1, 1, 2], ["FFSP", 1, 0, [2, 1], 1, 1], ["AN", 1, 1, 6], ["PR", 4, 0, "auto_unroll_max_step$1024"]]]], "r": [[0.199026], 0, 4.85127, 1708774751], "mark": 2, "ag": 1, "v": "v0.6"}
{"i": [["[\"_matmul\", 512, 3072, 768, \"float32\"]", "cuda -keys=cuda,gpu -arch=sm_86 -max_num_threads=1024 -model=unknown -thread_warp_size=32", [82, 999, 999, 49152, 2147483647, 1024, 255, 32], "", 0, []], [[], [["CHW", 2, "local"], ["SP", 2, 0, 512, [1, 32, 8, 1], 1], ["SP", 2, 5, 768, [1, 1, 192, 1], 1], ["SP", 2, 10, 3072, [2, 1], 1], ["RE", 2, [0, 5, 1, 6, 2, 7, 10, 11, 3, 8, 12, 4, 9]], ["FSP", 3, 0, 1, 3], ["FSP", 3, 4, 2, 3], ["RE", 3, [0, 4, 1, 5, 2, 6, 3, 7]], ["CA", 2, 3, 5], ["CHR", 1, "shared", [2]], ["CA", 2, 3, 6], ["CHR", 0, "shared", [3]], ["CA", 1, 4, 6], ["FU", 5, [0, 1]], ["AN", 5, 0, 5], ["FU", 5, [1, 2]], ["AN", 5, 1, 4], ["FU", 5, [2, 3]], ["AN", 5, 2, 6], ["FU", 3, [0, 1]], ["SP", 3, 0, 384, [2], 1], ["AN", 3, 1, 2], ["FFSP", 3, 0, [2, 1], 1, 1], ["AN", 3, 1, 6], ["FU", 1, [0, 1]], ["SP", 1, 0, 16, [2], 1], ["AN", 1, 1, 2], ["FFSP", 1, 0, [2, 1], 1, 1], ["AN", 1, 1, 6], ["PR", 4, 0, "auto_unroll_max_step$1024"]]]], "r": [[0.0340745], 0, 1.73304, 1708774751], "mark": 2, "ag": 1, "v": "v0.6"}
{"i": [["[\"_matmul\", 512, 3072, 768, \"float32\"]", "cuda -keys=cuda,gpu -arch=sm_86 -max_num_threads=1024 -model=unknown -thread_warp_size=32", [82, 999, 999, 49152, 2147483647, 1024, 255, 32], "", 0, []], [[], [["CHW", 2, "local"], ["SP", 2, 0, 512, [1, 32, 8, 1], 1], ["SP", 2, 5, 768, [1, 1, 192, 1], 1], ["SP", 2, 10, 3072, [4, 1], 1], ["RE", 2, [0, 5, 1, 6, 2, 7, 10, 11, 3, 8, 12, 4, 9]], ["FSP", 3, 0, 1, 3], ["FSP", 3, 4, 2, 3], ["RE", 3, [0, 4, 1, 5, 2, 6, 3, 7]], ["CA", 2, 3, 5], ["CHR", 1, "shared", [2]], ["CA", 2, 3, 6], ["CHR", 0, "shared", [3]], ["CA", 1, 4, 6], ["FU", 5, [0, 1]], ["AN", 5, 0, 5], ["FU", 5, [1, 2]], ["AN", 5, 1, 4], ["FU", 5, [2, 3]], ["AN", 5, 2, 6], ["FU", 3, [0, 1]], ["SP", 3, 0, 768, [2], 1], ["AN", 3, 1, 2], ["FFSP", 3, 0, [2, 1], 1, 1], ["AN", 3, 1, 6], ["FU", 1, [0, 1]], ["SP", 1, 0, 32, [2], 1], ["AN", 1, 1, 2], ["FFSP", 1, 0, [2, 1], 1, 1], ["AN", 1, 1, 6], ["PR", 4, 0, "auto_unroll_max_step$1024"]]]], "r": [[0.0337945], 0, 1.74902, 1708774751], "mark": 2, "ag": 1, "v": "v0.6"}
{"i": [["[\"_matmul\", 512, 3072, 768, \"float32\"]", "cuda -keys=cuda,gpu -arch=sm_86 -max_num_threads=1024 -model=unknown -thread_warp_size=32", [82, 999, 999, 49152, 2147483647, 1024, 255, 32], "", 0, []], [[], [["CHW", 2, "local"], ["SP", 2, 0, 512, [1, 64, 8, 1], 1], ["SP", 2, 5, 768, [1, 1, 256, 1], 1], ["SP", 2, 10, 3072, [2, 1], 1], ["RE", 2, [0, 5, 1, 6, 2, 7, 10, 11, 3, 8, 12, 4, 9]], ["FSP", 3, 0, 1, 3], ["FSP", 3, 4, 2, 3], ["RE", 3, [0, 4, 1, 5, 2, 6, 3, 7]], ["CA", 2, 3, 5], ["CHR", 1, "shared", [2]], ["CA", 2, 3, 6], ["CHR", 0, "shared", [3]], ["CA", 1, 4, 6], ["FU", 5, [0, 1]], ["AN", 5, 0, 5], ["FU", 5, [1, 2]], ["AN", 5, 1, 4], ["FU", 5, [2, 3]], ["AN", 5, 2, 6], ["FU", 3, [0, 1]], ["SP", 3, 0, 512, [2], 1], ["AN", 3, 1, 2], ["FFSP", 3, 0, [2, 1], 1, 1], ["AN", 3, 1, 6], ["FU", 1, [0, 1]], ["SP", 1, 0, 16, [2], 1], ["AN", 1, 1, 2], ["FFSP", 1, 0, [2, 1], 1, 1], ["AN", 1, 1, 6], ["PR", 4, 0, "auto_unroll_max_step$1024"]]]], "r": [[0.0898112], 0, 3.21319, 1708774751], "mark": 2, "ag": 1, "v": "v0.6"}
{"i": [["[\"_matmul\", 512, 3072, 768, \"float32\"]", "cuda -keys=cuda,gpu -arch=sm_86 -max_num_threads=1024 -model=unknown -thread_warp_size=32", [82, 999, 999, 49152, 2147483647, 1024, 255, 32], "", 0, []], [[], [["CHW", 2, "local"], ["SP", 2, 0, 512, [1, 64, 8, 1], 1], ["SP", 2, 5, 768, [1, 1, 256, 1], 1], ["SP", 2, 10, 3072, [4, 1], 1], ["RE", 2, [0, 5, 1, 6, 2, 7, 10, 11, 3, 8, 12, 4, 9]], ["FSP", 3, 0, 1, 3], ["FSP", 3, 4, 2, 3], ["RE", 3, [0, 4, 1, 5, 2, 6, 3, 7]], ["CA", 2, 3, 5], ["CHR", 1, "shared", [2]], ["CA", 2, 3, 6], ["CHR", 0, "shared", [3]], ["CA", 1, 4, 6], ["FU", 5, [0, 1]], ["AN", 5, 0, 5], ["FU", 5, [1, 2]], ["AN", 5, 1, 4], ["FU", 5, [2, 3]], ["AN", 5, 2, 6], ["FU", 3, [0, 1]], ["SP", 3, 0, 1024, [2], 1], ["AN", 3, 1, 2], ["FFSP", 3, 0, [2, 1], 1, 1], ["AN", 3, 1, 6], ["FU", 1, [0, 1]], ["SP", 1, 0, 32, [2], 1], ["AN", 1, 1, 2], ["FFSP", 1, 0, [2, 1], 1, 1], ["AN", 1, 1, 6], ["PR", 4, 0, "auto_unroll_max_step$1024"]]]], "r": [[0.0894359], 0, 3.66592, 1708774752], "mark": 2, "ag": 1, "v": "v0.6"}
{"i": [["[\"_matmul\", 512, 3072, 768, \"float32\"]", "cuda -keys=cuda,gpu -arch=sm_86 -max_num_threads=1024 -model=unknown -thread_warp_size=32", [82, 999, 999, 49152, 2147483647, 1024, 255, 32], "", 0, []], [[], [["CHW", 2, "local"], ["SP", 2, 0, 512, [1, 64, 8, 1], 1], ["SP", 2, 5, 768, [1, 1, 192, 1], 1], ["SP", 2, 10, 3072, [3, 1], 1], ["RE", 2, [0, 5, 1, 6, 2, 7, 10, 11, 3, 8, 12, 4, 9]], ["FSP", 3, 0, 1, 3], ["FSP", 3, 4, 2, 3], ["RE", 3, [0, 4, 1, 5, 2, 6, 3, 7]], ["CA", 2, 3, 5], ["CHR", 1, "shared", [2]], ["CA", 2, 3, 6], ["CHR", 0, "shared", [3]], ["CA", 1, 4, 6], ["FU", 5, [0, 1]], ["AN", 5, 0, 5], ["FU", 5, [1, 2]], ["AN", 5, 1, 4], ["FU", 5, [2, 3]], ["AN", 5, 2, 6], ["FU", 3, [0, 1]], ["SP", 3, 0, 576, [2], 1], ["AN", 3, 1, 2], ["FFSP", 3, 0, [2, 1], 1, 1], ["AN", 3, 1, 6], ["FU", 1, [0, 1]], ["SP", 1, 0, 24, [2], 1], ["AN", 1, 1, 2], ["FFSP", 1, 0, [2, 1], 1, 1], ["AN", 1, 1, 6], ["PR", 4, 0, "auto_unroll_max_step$1024"]]]], "r": [[0.0562785], 0, 2.71751, 1708774752], "mark": 2, "ag": 1, "v": "v0.6"}
{"i": [["[\"_matmul\", 512, 3072, 768, \"float32\"]", "cuda -keys=cuda,gpu -arch=sm_86 -max_num_threads=1024 -model=unknown -thread_warp_size=32", [82, 999, 999, 49152, 2147483647, 1024, 255, 32], "", 0, []], [[], [["CHW", 2, "local"], ["SP", 2, 0, 512, [1, 32, 4, 1], 1], ["SP", 2, 5, 768, [1, 1, 256, 1], 1], ["SP", 2, 10, 3072, [2, 1], 1], ["RE", 2, [0, 5, 1, 6, 2, 7, 10, 11, 3, 8, 12, 4, 9]], ["FSP", 3, 0, 1, 3], ["FSP", 3, 4, 2, 3], ["RE", 3, [0, 4, 1, 5, 2, 6, 3, 7]], ["CA", 2, 3, 5], ["CHR", 1, "shared", [2]], ["CA", 2, 3, 6], ["CHR", 0, "shared", [3]], ["CA", 1, 4, 6], ["FU", 5, [0, 1]], ["AN", 5, 0, 5], ["FU", 5, [1, 2]], ["AN", 5, 1, 4], ["FU", 5, [2, 3]], ["AN", 5, 2, 6], ["FU", 3, [0, 1]], ["SP", 3, 0, 512, [2], 1], ["AN", 3, 1, 2], ["FFSP", 3, 0, [2, 1], 1, 1], ["AN", 3, 1, 6], ["FU", 1, [0, 1]], ["SP", 1, 0, 8, [2], 1], ["AN", 1, 1, 2], ["FFSP", 1, 0, [2, 1], 1, 1], ["AN", 1, 1, 6], ["PR", 4, 0, "auto_unroll_max_step$1024"]]]], "r": [[0.0357892], 0, 3.89412, 1708774752], "mark": 2, "ag": 1, "v": "v0.6"}
{"i": [["[\"_matmul\", 512, 3072, 768, \"float32\"]", "cuda -keys=cuda,gpu -arch=sm_86 -max_num_threads=1024 -model=unknown -thread_warp_size=32", [82, 999, 999, 49152, 2147483647, 1024, 255, 32], "", 0, []], [[], [["CHW", 2, "local"], ["SP", 2, 0, 512, [1, 32, 4, 1], 1], ["SP", 2, 5, 768, [1, 1, 256, 1], 1], ["SP", 2, 10, 3072, [4, 1], 1], ["RE", 2, [0, 5, 1, 6, 2, 7, 10, 11, 3, 8, 12, 4, 9]], ["FSP", 3, 0, 1, 3], ["FSP", 3, 4, 2, 3], ["RE", 3, [0, 4, 1, 5, 2, 6, 3, 7]], ["CA", 2, 3, 5], ["CHR", 1, "shared", [2]], ["CA", 2, 3, 6], ["CHR", 0, "shared", [3]], ["CA", 1, 4, 6], ["FU", 5, [0, 1]], ["AN", 5, 0, 5], ["FU", 5, [1, 2]], ["AN", 5, 1, 4], ["FU", 5, [2, 3]], ["AN", 5, 2, 6], ["FU", 3, [0, 1]], ["SP", 3, 0, 1024, [2], 1], ["AN", 3, 1, 2], ["FFSP", 3, 0, [2, 1], 1, 1], ["AN", 3, 1, 6], ["FU", 1, [0, 1]], ["SP", 1, 0, 16, [2], 1], ["AN", 1, 1, 2], ["FFSP", 1, 0, [2, 1], 1, 1], ["AN", 1, 1, 6], ["PR", 4, 0, "auto_unroll_max_step$1024"]]]], "r": [[0.0426148], 0, 5.6653, 1708774752], "mark": 2, "ag": 1, "v": "v0.6"}
{"i": [["[\"_matmul\", 512, 3072, 768, \"float32\"]", "cuda -keys=cuda,gpu -arch=sm_86 -max_num_threads=1024 -model=unknown -thread_warp_size=32", [82, 999, 999, 49152, 2147483647, 1024, 255, 32], "", 0, []], [[], [["CHW", 2, "local"], ["SP", 2, 0, 512, [1, 32, 16, 1], 1], ["SP", 2, 5, 768, [1, 1, 256, 1], 1], ["SP", 2, 10, 3072, [2, 1], 1], ["RE", 2, [0, 5, 1, 6, 2, 7, 10, 11, 3, 8, 12, 4, 9]], ["FSP", 3, 0, 1, 3], ["FSP", 3, 4, 2, 3], ["RE", 3, [0, 4, 1, 5, 2, 6, 3, 7]], ["CA", 2, 3, 5], ["CHR", 1, "shared", [2]], ["CA", 2, 3, 6], ["CHR", 0, "shared", [3]], ["CA", 1, 4, 6], ["FU", 5, [0, 1]], ["AN", 5, 0, 5], ["FU", 5, [1, 2]], ["AN", 5, 1, 4], ["FU", 5, [2, 3]], ["AN", 5, 2, 6], ["FU", 3, [0, 1]], ["SP", 3, 0, 512, [2], 1], ["AN", 3, 1, 2], ["FFSP", 3, 0, [2, 1], 1, 1], ["AN", 3, 1, 6], ["FU", 1, [0, 1]], ["SP", 1, 0, 32, [2], 1], ["AN", 1, 1, 2], ["FFSP", 1, 0, [2, 1], 1, 1], ["AN", 1, 1, 6], ["PR", 4, 0, "auto_unroll_max_step$1024"]]]], "r": [[0.175532], 0, 4.41502, 1708774753], "mark": 2, "ag": 1, "v": "v0.6"}
{"i": [["[\"_matmul\", 512, 3072, 768, \"float32\"]", "cuda -keys=cuda,gpu -arch=sm_86 -max_num_threads=1024 -model=unknown -thread_warp_size=32", [82, 999, 999, 49152, 2147483647, 1024, 255, 32], "", 0, []], [[], [["CHW", 2, "local"], ["SP", 2, 0, 512, [1, 32, 16, 1], 1], ["SP", 2, 5, 768, [1, 1, 256, 1], 1], ["SP", 2, 10, 3072, [4, 1], 1], ["RE", 2, [0, 5, 1, 6, 2, 7, 10, 11, 3, 8, 12, 4, 9]], ["FSP", 3, 0, 1, 3], ["FSP", 3, 4, 2, 3], ["RE", 3, [0, 4, 1, 5, 2, 6, 3, 7]], ["CA", 2, 3, 5], ["CHR", 1, "shared", [2]], ["CA", 2, 3, 6], ["CHR", 0, "shared", [3]], ["CA", 1, 4, 6], ["FU", 5, [0, 1]], ["AN", 5, 0, 5], ["FU", 5, [1, 2]], ["AN", 5, 1, 4], ["FU", 5, [2, 3]], ["AN", 5, 2, 6], ["FU", 3, [0, 1]], ["SP", 3, 0, 1024, [2], 1], ["AN", 3, 1, 2], ["FFSP", 3, 0, [2, 1], 1, 1], ["AN", 3, 1, 6], ["FU", 1, [0, 1]], ["SP", 1, 0, 64, [2], 1], ["AN", 1, 1, 2], ["FFSP", 1, 0, [2, 1], 1, 1], ["AN", 1, 1, 6], ["PR", 4, 0, "auto_unroll_max_step$1024"]]]], "r": [[0.175455], 0, 3.58704, 1708774754], "mark": 2, "ag": 1, "v": "v0.6"}
{"i": [["[\"_matmul\", 512, 3072, 768, \"float32\"]", "cuda -keys=cuda,gpu -arch=sm_86 -max_num_threads=1024 -model=unknown -thread_warp_size=32", [82, 999, 999, 49152, 2147483647, 1024, 255, 32], "", 0, []], [[], [["CHW", 2, "local"], ["SP", 2, 0, 512, [1, 32, 4, 1], 1], ["SP", 2, 5, 768, [1, 1, 192, 1], 1], ["SP", 2, 10, 3072, [3, 1], 1], ["RE", 2, [0, 5, 1, 6, 2, 7, 10, 11, 3, 8, 12, 4, 9]], ["FSP", 3, 0, 1, 3], ["FSP", 3, 4, 2, 3], ["RE", 3, [0, 4, 1, 5, 2, 6, 3, 7]], ["CA", 2, 3, 5], ["CHR", 1, "shared", [2]], ["CA", 2, 3, 6], ["CHR", 0, "shared", [3]], ["CA", 1, 4, 6], ["FU", 5, [0, 1]], ["AN", 5, 0, 5], ["FU", 5, [1, 2]], ["AN", 5, 1, 4], ["FU", 5, [2, 3]], ["AN", 5, 2, 6], ["FU", 3, [0, 1]], ["SP", 3, 0, 576, [2], 1], ["AN", 3, 1, 2], ["FFSP", 3, 0, [2, 1], 1, 1], ["AN", 3, 1, 6], ["FU", 1, [0, 1]], ["SP", 1, 0, 12, [2], 1], ["AN", 1, 1, 2], ["FFSP", 1, 0, [2, 1], 1, 1], ["AN", 1, 1, 6], ["PR", 4, 0, "auto_unroll_max_step$1024"]]]], "r": [[0.0248594], 0, 2.82882, 1708774754], "mark": 2, "ag": 1, "v": "v0.6"}
{"i": [["[\"_matmul\", 512, 3072, 768, \"float32\"]", "cuda -keys=cuda,gpu -arch=sm_86 -max_num_threads=1024 -model=unknown -thread_warp_size=32", [82, 999, 999, 49152, 2147483647, 1024, 255, 32], "", 0, []], [[], [["CHW", 2, "local"], ["SP", 2, 0, 512, [1, 32, 16, 1], 1], ["SP", 2, 5, 768, [1, 1, 192, 1], 1], ["SP", 2, 10, 3072, [3, 1], 1], ["RE", 2, [0, 5, 1, 6, 2, 7, 10, 11, 3, 8, 12, 4, 9]], ["FSP", 3, 0, 1, 3], ["FSP", 3, 4, 2, 3], ["RE", 3, [0, 4, 1, 5, 2, 6, 3, 7]], ["CA", 2, 3, 5], ["CHR", 1, "shared", [2]], ["CA", 2, 3, 6], ["CHR", 0, "shared", [3]], ["CA", 1, 4, 6], ["FU", 5, [0, 1]], ["AN", 5, 0, 5], ["FU", 5, [1, 2]], ["AN", 5, 1, 4], ["FU", 5, [2, 3]], ["AN", 5, 2, 6], ["FU", 3, [0, 1]], ["SP", 3, 0, 576, [2], 1], ["AN", 3, 1, 2], ["FFSP", 3, 0, [2, 1], 1, 1], ["AN", 3, 1, 6], ["FU", 1, [0, 1]], ["SP", 1, 0, 48, [2], 1], ["AN", 1, 1, 2], ["FFSP", 1, 0, [2, 1], 1, 1], ["AN", 1, 1, 6], ["PR", 4, 0, "auto_unroll_max_step$1024"]]]], "r": [[0.250959], 0, 3.18292, 1708774755], "mark": 2, "ag": 1, "v": "v0.6"}
{"i": [["[\"_matmul\", 512, 3072, 768, \"float32\"]", "cuda -keys=cuda,gpu -arch=sm_86 -max_num_threads=1024 -model=unknown -thread_warp_size=32", [82, 999, 999, 49152, 2147483647, 1024, 255, 32], "", 0, []], [[], [["CHW", 2, "local"], ["SP", 2, 0, 512, [1, 64, 4, 1], 1], ["SP", 2, 5, 768, [1, 1, 256, 1], 1], ["SP", 2, 10, 3072, [3, 1], 1], ["RE", 2, [0, 5, 1, 6, 2, 7, 10, 11, 3, 8, 12, 4, 9]], ["FSP", 3, 0, 1, 3], ["FSP", 3, 4, 2, 3], ["RE", 3, [0, 4, 1, 5, 2, 6, 3, 7]], ["CA", 2, 3, 5], ["CHR", 1, "shared", [2]], ["CA", 2, 3, 6], ["CHR", 0, "shared", [3]], ["CA", 1, 4, 6], ["FU", 5, [0, 1]], ["AN", 5, 0, 5], ["FU", 5, [1, 2]], ["AN", 5, 1, 4], ["FU", 5, [2, 3]], ["AN", 5, 2, 6], ["FU", 3, [0, 1]], ["SP", 3, 0, 768, [2], 1], ["AN", 3, 1, 2], ["FFSP", 3, 0, [2, 1], 1, 1], ["AN", 3, 1, 6], ["FU", 1, [0, 1]], ["SP", 1, 0, 12, [2], 1], ["AN", 1, 1, 2], ["FFSP", 1, 0, [2, 1], 1, 1], ["AN", 1, 1, 6], ["PR", 4, 0, "auto_unroll_max_step$1024"]]]], "r": [[0.0484363], 0, 5.86139, 1708774756], "mark": 2, "ag": 1, "v": "v0.6"}
{"i": [["[\"_matmul\", 512, 3072, 768, \"float32\"]", "cuda -keys=cuda,gpu -arch=sm_86 -max_num_threads=1024 -model=unknown -thread_warp_size=32", [82, 999, 999, 49152, 2147483647, 1024, 255, 32], "", 0, []], [[], [["CHW", 2, "local"], ["SP", 2, 0, 512, [1, 32, 4, 1], 1], ["SP", 2, 5, 768, [1, 1, 192, 1], 1], ["SP", 2, 10, 3072, [3, 1], 1], ["RE", 2, [0, 5, 1, 6, 2, 7, 10, 11, 3, 8, 12, 4, 9]], ["FSP", 3, 0, 1, 3], ["FSP", 3, 4, 2, 3], ["RE", 3, [0, 4, 1, 5, 2, 6, 3, 7]], ["CA", 2, 3, 5], ["CHR", 1, "shared", [2]], ["CA", 2, 3, 6], ["CHR", 0, "shared", [3]], ["CA", 1, 4, 6], ["FU", 5, [0, 1]], ["AN", 5, 0, 5], ["FU", 5, [1, 2]], ["AN", 5, 1, 4], ["FU", 5, [2, 3]], ["AN", 5, 2, 6], ["FU", 3, [0, 1]], ["SP", 3, 0, 576, [2], 1], ["AN", 3, 1, 2], ["FFSP", 3, 0, [2, 1], 1, 1], ["AN", 3, 1, 6], ["FU", 1, [0, 1]], ["SP", 1, 0, 12, [2], 1], ["AN", 1, 1, 2], ["FFSP", 1, 0, [2, 1], 1, 1], ["AN", 1, 1, 6], ["PR", 4, 0, "auto_unroll_max_step$1024"]]]], "r": [[0.0248594], 0, 2.82882, 1708774754], "mark": 2, "ag": 2, "v": "v0.6"}
{"i": [["[\"_matmul\", 512, 3072, 768, \"float32\"]", "cuda -keys=cuda,gpu -arch=sm_86 -max_num_threads=1024 -model=unknown -thread_warp_size=32", [82, 999, 999, 49152, 2147483647, 1024, 255, 32], "", 0, []], [[], [["CHW", 2, "local"], ["SP", 2, 0, 512, [1, 32, 4, 1], 1], ["SP", 2, 5, 768, [1, 1, 192, 1], 1], ["SP", 2, 10, 3072, [2, 1], 1], ["RE", 2, [0, 5, 1, 6, 2, 7, 10, 11, 3, 8, 12, 4, 9]], ["FSP", 3, 0, 1, 3], ["FSP", 3, 4, 2, 3], ["RE", 3, [0, 4, 1, 5, 2, 6, 3, 7]], ["CA", 2, 3, 5], ["CHR", 1, "shared", [2]], ["CA", 2, 3, 6], ["CHR", 0, "shared", [3]], ["CA", 1, 4, 6], ["FU", 5, [0, 1]], ["AN", 5, 0, 5], ["FU", 5, [1, 2]], ["AN", 5, 1, 4], ["FU", 5, [2, 3]], ["AN", 5, 2, 6], ["FU", 3, [0, 1]], ["SP", 3, 0, 384, [2], 1], ["AN", 3, 1, 2], ["FFSP", 3, 0, [2, 1], 1, 1], ["AN", 3, 1, 6], ["FU", 1, [0, 1]], ["SP", 1, 0, 8, [2], 1], ["AN", 1, 1, 2], ["FFSP", 1, 0, [2, 1], 1, 1], ["AN", 1, 1, 6], ["PR", 4, 0, "auto_unroll_max_step$1024"]]]], "r": [[0.0214853], 0, 3.20354, 1708774762], "mark": 2, "ag": 2, "v": "v0.6"}
{"i": [["[\"_matmul\", 512, 3072, 768, \"float32\"]", "cuda -keys=cuda,gpu -arch=sm_86 -max_num_threads=1024 -model=unknown -thread_warp_size=32", [82, 999, 999, 49152, 2147483647, 1024, 255, 32], "", 0, []], [[], [["CHW", 2, "local"], ["SP", 2, 0, 512, [1, 32, 4, 1], 1], ["SP", 2, 5, 768, [1, 1, 192, 1], 1], ["SP", 2, 10, 3072, [4, 1], 1], ["RE", 2, [0, 5, 1, 6, 2, 7, 10, 11, 3, 8, 12, 4, 9]], ["FSP", 3, 0, 1, 3], ["FSP", 3, 4, 2, 3], ["RE", 3, [0, 4, 1, 5, 2, 6, 3, 7]], ["CA", 2, 3, 5], ["CHR", 1, "shared", [2]], ["CA", 2, 3, 6], ["CHR", 0, "shared", [3]], ["CA", 1, 4, 6], ["FU", 5, [0, 1]], ["AN", 5, 0, 5], ["FU", 5, [1, 2]], ["AN", 5, 1, 4], ["FU", 5, [2, 3]], ["AN", 5, 2, 6], ["FU", 3, [0, 1]], ["SP", 3, 0, 768, [2], 1], ["AN", 3, 1, 2], ["FFSP", 3, 0, [2, 1], 1, 1], ["AN", 3, 1, 6], ["FU", 1, [0, 1]], ["SP", 1, 0, 16, [2], 1], ["AN", 1, 1, 2], ["FFSP", 1, 0, [2, 1], 1, 1], ["AN", 1, 1, 6], ["PR", 4, 0, "auto_unroll_max_step$1024"]]]], "r": [[0.0246159], 0, 3.25485, 1708774762], "mark": 2, "ag": 2, "v": "v0.6"}
{"i": [["[\"_matmul\", 512, 3072, 768, \"float32\"]", "cuda -keys=cuda,gpu -arch=sm_86 -max_num_threads=1024 -model=unknown -thread_warp_size=32", [82, 999, 999, 49152, 2147483647, 1024, 255, 32], "", 0, []], [[], [["CHW", 2, "local"], ["SP", 2, 0, 512, [1, 32, 4, 1], 1], ["SP", 2, 5, 768, [1, 1, 128, 1], 1], ["SP", 2, 10, 3072, [3, 1], 1], ["RE", 2, [0, 5, 1, 6, 2, 7, 10, 11, 3, 8, 12, 4, 9]], ["FSP", 3, 0, 1, 3], ["FSP", 3, 4, 2, 3], ["RE", 3, [0, 4, 1, 5, 2, 6, 3, 7]], ["CA", 2, 3, 5], ["CHR", 1, "shared", [2]], ["CA", 2, 3, 6], ["CHR", 0, "shared", [3]], ["CA", 1, 4, 6], ["FU", 5, [0, 1]], ["AN", 5, 0, 5], ["FU", 5, [1, 2]], ["AN", 5, 1, 4], ["FU", 5, [2, 3]], ["AN", 5, 2, 6], ["FU", 3, [0, 1]], ["SP", 3, 0, 384, [2], 1], ["AN", 3, 1, 2], ["FFSP", 3, 0, [2, 1], 1, 1], ["AN", 3, 1, 6], ["FU", 1, [0, 1]], ["SP", 1, 0, 12, [2], 1], ["AN", 1, 1, 2], ["FFSP", 1, 0, [2, 1], 1, 1], ["AN", 1, 1, 6], ["PR", 4, 0, "auto_unroll_max_step$1024"]]]], "r": [[0.0150601], 0, 1.80721, 1708774762], "mark": 2, "ag": 2, "v": "v0.6"}
{"i": [["[\"_matmul\", 512, 3072, 768, \"float32\"]", "cuda -keys=cuda,gpu -arch=sm_86 -max_num_threads=1024 -model=unknown -thread_warp_size=32", [82, 999, 999, 49152, 2147483647, 1024, 255, 32], "", 0, []], [[], [["CHW", 2, "local"], ["SP", 2, 0, 512, [1, 64, 4, 1], 1], ["SP", 2, 5, 768, [1, 1, 192, 1], 1], ["SP", 2, 10, 3072, [3, 1], 1], ["RE", 2, [0, 5, 1, 6, 2, 7, 10, 11, 3, 8, 12, 4, 9]], ["FSP", 3, 0, 1, 3], ["FSP", 3, 4, 2, 3], ["RE", 3, [0, 4, 1, 5, 2, 6, 3, 7]], ["CA", 2, 3, 5], ["CHR", 1, "shared", [2]], ["CA", 2, 3, 6], ["CHR", 0, "shared", [3]], ["CA", 1, 4, 6], ["FU", 5, [0, 1]], ["AN", 5, 0, 5], ["FU", 5, [1, 2]], ["AN", 5, 1, 4], ["FU", 5, [2, 3]], ["AN", 5, 2, 6], ["FU", 3, [0, 1]], ["SP", 3, 0, 576, [2], 1], ["AN", 3, 1, 2], ["FFSP", 3, 0, [2, 1], 1, 1], ["AN", 3, 1, 6], ["FU", 1, [0, 1]], ["SP", 1, 0, 12, [2], 1], ["AN", 1, 1, 2], ["FFSP", 1, 0, [2, 1], 1, 1], ["AN", 1, 1, 6], ["PR", 4, 0, "auto_unroll_max_step$1024"]]]], "r": [[0.0294558], 0, 3.95465, 1708774762], "mark": 2, "ag": 2, "v": "v0.6"}
{"i": [["[\"_matmul\", 512, 3072, 768, \"float32\"]", "cuda -keys=cuda,gpu -arch=sm_86 -max_num_threads=1024 -model=unknown -thread_warp_size=32", [82, 999, 999, 49152, 2147483647, 1024, 255, 32], "", 0, []], [[], [["CHW", 2, "local"], ["SP", 2, 0, 512, [1, 32, 2, 1], 1], ["SP", 2, 5, 768, [1, 1, 192, 1], 1], ["SP", 2, 10, 3072, [3, 1], 1], ["RE", 2, [0, 5, 1, 6, 2, 7, 10, 11, 3, 8, 12, 4, 9]], ["FSP", 3, 0, 1, 3], ["FSP", 3, 4, 2, 3], ["RE", 3, [0, 4, 1, 5, 2, 6, 3, 7]], ["CA", 2, 3, 5], ["CHR", 1, "shared", [2]], ["CA", 2, 3, 6], ["CHR", 0, "shared", [3]], ["CA", 1, 4, 6], ["FU", 5, [0, 1]], ["AN", 5, 0, 5], ["FU", 5, [1, 2]], ["AN", 5, 1, 4], ["FU", 5, [2, 3]], ["AN", 5, 2, 6], ["FU", 3, [0, 1]], ["SP", 3, 0, 576, [2], 1], ["AN", 3, 1, 2], ["FFSP", 3, 0, [2, 1], 1, 1], ["AN", 3, 1, 6], ["FU", 1, [0, 1]], ["SP", 1, 0, 6, [2], 1], ["AN", 1, 1, 2], ["FFSP", 1, 0, [2, 1], 1, 1], ["AN", 1, 1, 6], ["PR", 4, 0, "auto_unroll_max_step$1024"]]]], "r": [[0.00927504], 0, 1.76522, 1708774762], "mark": 2, "ag": 2, "v": "v0.6"}
{"i": [["[\"_matmul\", 512, 3072, 768, \"float32\"]", "cuda -keys=cuda,gpu -arch=sm_86 -max_num_threads=1024 -model=unknown -thread_warp_size=32", [82, 999, 999, 49152, 2147483647, 1024, 255, 32], "", 0, []], [[], [["CHW", 2, "local"], ["SP", 2, 0, 512, [1, 32, 8, 1], 1], ["SP", 2, 5, 768, [1, 1, 192, 1], 1], ["SP", 2, 10, 3072, [3, 1], 1], ["RE", 2, [0, 5, 1, 6, 2, 7, 10, 11, 3, 8, 12, 4, 9]], ["FSP", 3, 0, 1, 3], ["FSP", 3, 4, 2, 3], ["RE", 3, [0, 4, 1, 5, 2, 6, 3, 7]], ["CA", 2, 3, 5], ["CHR", 1, "shared", [2]], ["CA", 2, 3, 6], ["CHR", 0, "shared", [3]], ["CA", 1, 4, 6], ["FU", 5, [0, 1]], ["AN", 5, 0, 5], ["FU", 5, [1, 2]], ["AN", 5, 1, 4], ["FU", 5, [2, 3]], ["AN", 5, 2, 6], ["FU", 3, [0, 1]], ["SP", 3, 0, 576, [2], 1], ["AN", 3, 1, 2], ["FFSP", 3, 0, [2, 1], 1, 1], ["AN", 3, 1, 6], ["FU", 1, [0, 1]], ["SP", 1, 0, 24, [2], 1], ["AN", 1, 1, 2], ["FFSP", 1, 0, [2, 1], 1, 1], ["AN", 1, 1, 6], ["PR", 4, 0, "auto_unroll_max_step$1024"]]]], "r": [[0.0417183], 0, 2.16726, 1708774763], "mark": 2, "ag": 2, "v": "v0.6"}
{"i": [["[\"_matmul\", 512, 3072, 768, \"float32\"]", "cuda -keys=cuda,gpu -arch=sm_86 -max_num_threads=1024 -model=unknown -thread_warp_size=32", [82, 999, 999, 49152, 2147483647, 1024, 255, 32], "", 0, []], [[], [["CHW", 2, "local"], ["SP", 2, 0, 512, [1, 32, 4, 1], 1], ["SP", 2, 5, 768, [1, 1, 128, 1], 1], ["SP", 2, 10, 3072, [2, 1], 1], ["RE", 2, [0, 5, 1, 6, 2, 7, 10, 11, 3, 8, 12, 4, 9]], ["FSP", 3, 0, 1, 3], ["FSP", 3, 4, 2, 3], ["RE", 3, [0, 4, 1, 5, 2, 6, 3, 7]], ["CA", 2, 3, 5], ["CHR", 1, "shared", [2]], ["CA", 2, 3, 6], ["CHR", 0, "shared", [3]], ["CA", 1, 4, 6], ["FU", 5, [0, 1]], ["AN", 5, 0, 5], ["FU", 5, [1, 2]], ["AN", 5, 1, 4], ["FU", 5, [2, 3]], ["AN", 5, 2, 6], ["FU", 3, [0, 1]], ["SP", 3, 0, 256, [2], 1], ["AN", 3, 1, 2], ["FFSP", 3, 0, [2, 1], 1, 1], ["AN", 3, 1, 6], ["FU", 1, [0, 1]], ["SP", 1, 0, 8, [2], 1], ["AN", 1, 1, 2], ["FFSP", 1, 0, [2, 1], 1, 1], ["AN", 1, 1, 6], ["PR", 4, 0, "auto_unroll_max_step$1024"]]]], "r": [[0.0197758], 0, 2.74218, 1708774763], "mark": 2, "ag": 2, "v": "v0.6"}
{"i": [["[\"_matmul\", 512, 3072, 768, \"float32\"]", "cuda -keys=cuda,gpu -arch=sm_86 -max_num_threads=1024 -model=unknown -thread_warp_size=32", [82, 999, 999, 49152, 2147483647, 1024, 255, 32], "", 0, []], [[], [["CHW", 2, "local"], ["SP", 2, 0, 512, [1, 32, 4, 1], 1], ["SP", 2, 5, 768, [1, 1, 128, 1], 1], ["SP", 2, 10, 3072, [4, 1], 1], ["RE", 2, [0, 5, 1, 6, 2, 7, 10, 11, 3, 8, 12, 4, 9]], ["FSP", 3, 0, 1, 3], ["FSP", 3, 4, 2, 3], ["RE", 3, [0, 4, 1, 5, 2, 6, 3, 7]], ["CA", 2, 3, 5], ["CHR", 1, "shared", [2]], ["CA", 2, 3, 6], ["CHR", 0, "shared", [3]], ["CA", 1, 4, 6], ["FU", 5, [0, 1]], ["AN", 5, 0, 5], ["FU", 5, [1, 2]], ["AN", 5, 1, 4], ["FU", 5, [2, 3]], ["AN", 5, 2, 6], ["FU", 3, [0, 1]], ["SP", 3, 0, 512, [2], 1], ["AN", 3, 1, 2], ["FFSP", 3, 0, [2, 1], 1, 1], ["AN", 3, 1, 6], ["FU", 1, [0, 1]], ["SP", 1, 0, 16, [2], 1], ["AN", 1, 1, 2], ["FFSP", 1, 0, [2, 1], 1, 1], ["AN", 1, 1, 6], ["PR", 4, 0, "auto_unroll_max_step$1024"]]]], "r": [[0.0139228], 0, 2.5261, 1708774763], "mark": 2, "ag": 2, "v": "v0.6"}
{"i": [["[\"_matmul\", 512, 3072, 768, \"float32\"]", "cuda -keys=cuda,gpu -arch=sm_86 -max_num_threads=1024 -model=unknown -thread_warp_size=32", [82, 999, 999, 49152, 2147483647, 1024, 255, 32], "", 0, []], [[], [["CHW", 2, "local"], ["SP", 2, 0, 512, [1, 64, 4, 1], 1], ["SP", 2, 5, 768, [1, 1, 192, 1], 1], ["SP", 2, 10, 3072, [2, 1], 1], ["RE", 2, [0, 5, 1, 6, 2, 7, 10, 11, 3, 8, 12, 4, 9]], ["FSP", 3, 0, 1, 3], ["FSP", 3, 4, 2, 3], ["RE", 3, [0, 4, 1, 5, 2, 6, 3, 7]], ["CA", 2, 3, 5], ["CHR", 1, "shared", [2]], ["CA", 2, 3, 6], ["CHR", 0, "shared", [3]], ["CA", 1, 4, 6], ["FU", 5, [0, 1]], ["AN", 5, 0, 5], ["FU", 5, [1, 2]], ["AN", 5, 1, 4], ["FU", 5, [2, 3]], ["AN", 5, 2, 6], ["FU", 3, [0, 1]], ["SP", 3, 0, 384, [2], 1], ["AN", 3, 1, 2], ["FFSP", 3, 0, [2, 1], 1, 1], ["AN", 3, 1, 6], ["FU", 1, [0, 1]], ["SP", 1, 0, 8, [2], 1], ["AN", 1, 1, 2], ["FFSP", 1, 0, [2, 1], 1, 1], ["AN", 1, 1, 6], ["PR", 4, 0, "auto_unroll_max_step$1024"]]]], "r": [[0.0272177], 0, 2.68408, 1708774763], "mark": 2, "ag": 2, "v": "v0.6"}
{"i": [["[\"_matmul\", 512, 3072, 768, \"float32\"]", "cuda -keys=cuda,gpu -arch=sm_86 -max_num_threads=1024 -model=unknown -thread_warp_size=32", [82, 999, 999, 49152, 2147483647, 1024, 255, 32], "", 0, []], [[], [["CHW", 2, "local"], ["SP", 2, 0, 512, [1, 64, 4, 1], 1], ["SP", 2, 5, 768, [1, 1, 192, 1], 1], ["SP", 2, 10, 3072, [4, 1], 1], ["RE", 2, [0, 5, 1, 6, 2, 7, 10, 11, 3, 8, 12, 4, 9]], ["FSP", 3, 0, 1, 3], ["FSP", 3, 4, 2, 3], ["RE", 3, [0, 4, 1, 5, 2, 6, 3, 7]], ["CA", 2, 3, 5], ["CHR", 1, "shared", [2]], ["CA", 2, 3, 6], ["CHR", 0, "shared", [3]], ["CA", 1, 4, 6], ["FU", 5, [0, 1]], ["AN", 5, 0, 5], ["FU", 5, [1, 2]], ["AN", 5, 1, 4], ["FU", 5, [2, 3]], ["AN", 5, 2, 6], ["FU", 3, [0, 1]], ["SP", 3, 0, 768, [2], 1], ["AN", 3, 1, 2], ["FFSP", 3, 0, [2, 1], 1, 1], ["AN", 3, 1, 6], ["FU", 1, [0, 1]], ["SP", 1, 0, 16, [2], 1], ["AN", 1, 1, 2], ["FFSP", 1, 0, [2, 1], 1, 1], ["AN", 1, 1, 6], ["PR", 4, 0, "auto_unroll_max_step$1024"]]]], "r": [[0.0295523], 0, 3.71624, 1708774764], "mark": 2, "ag": 2, "v": "v0.6"}
{"i": [["[\"_matmul\", 512, 3072, 768, \"float32\"]", "cuda -keys=cuda,gpu -arch=sm_86 -max_num_threads=1024 -model=unknown -thread_warp_size=32", [82, 999, 999, 49152, 2147483647, 1024, 255, 32], "", 0, []], [[], [["CHW", 2, "local"], ["SP", 2, 0, 512, [1, 64, 4, 1], 1], ["SP", 2, 5, 768, [1, 1, 128, 1], 1], ["SP", 2, 10, 3072, [3, 1], 1], ["RE", 2, [0, 5, 1, 6, 2, 7, 10, 11, 3, 8, 12, 4, 9]], ["FSP", 3, 0, 1, 3], ["FSP", 3, 4, 2, 3], ["RE", 3, [0, 4, 1, 5, 2, 6, 3, 7]], ["CA", 2, 3, 5], ["CHR", 1, "shared", [2]], ["CA", 2, 3, 6], ["CHR", 0, "shared", [3]], ["CA", 1, 4, 6], ["FU", 5, [0, 1]], ["AN", 5, 0, 5], ["FU", 5, [1, 2]], ["AN", 5, 1, 4], ["FU", 5, [2, 3]], ["AN", 5, 2, 6], ["FU", 3, [0, 1]], ["SP", 3, 0, 384, [2], 1], ["AN", 3, 1, 2], ["FFSP", 3, 0, [2, 1], 1, 1], ["AN", 3, 1, 6], ["FU", 1, [0, 1]], ["SP", 1, 0, 12, [2], 1], ["AN", 1, 1, 2], ["FFSP", 1, 0, [2, 1], 1, 1], ["AN", 1, 1, 6], ["PR", 4, 0, "auto_unroll_max_step$1024"]]]], "r": [[0.0192094], 0, 2.62503, 1708774764], "mark": 2, "ag": 2, "v": "v0.6"}
{"i": [["[\"_matmul\", 512, 3072, 768, \"float32\"]", "cuda -keys=cuda,gpu -arch=sm_86 -max_num_threads=1024 -model=unknown -thread_warp_size=32", [82, 999, 999, 49152, 2147483647, 1024, 255, 32], "", 0, []], [[], [["CHW", 2, "local"], ["SP", 2, 0, 512, [1, 32, 2, 1], 1], ["SP", 2, 5, 768, [1, 1, 192, 1], 1], ["SP", 2, 10, 3072, [2, 1], 1], ["RE", 2, [0, 5, 1, 6, 2, 7, 10, 11, 3, 8, 12, 4, 9]], ["FSP", 3, 0, 1, 3], ["FSP", 3, 4, 2, 3], ["RE", 3, [0, 4, 1, 5, 2, 6, 3, 7]], ["CA", 2, 3, 5], ["CHR", 1, "shared", [2]], ["CA", 2, 3, 6], ["CHR", 0, "shared", [3]], ["CA", 1, 4, 6], ["FU", 5, [0, 1]], ["AN", 5, 0, 5], ["FU", 5, [1, 2]], ["AN", 5, 1, 4], ["FU", 5, [2, 3]], ["AN", 5, 2, 6], ["FU", 3, [0, 1]], ["SP", 3, 0, 384, [2], 1], ["AN", 3, 1, 2], ["FFSP", 3, 0, [2, 1], 1, 1], ["AN", 3, 1, 6], ["FU", 1, [0, 1]], ["SP", 1, 0, 4, [2], 1], ["AN", 1, 1, 2], ["FFSP", 1, 0, [2, 1], 1, 1], ["AN", 1, 1, 6], ["PR", 4, 0, "auto_unroll_max_step$1024"]]]], "r": [[0.00766141], 0, 2.09028, 1708774764], "mark": 2, "ag": 2, "v": "v0.6"}
{"i": [["[\"_matmul\", 512, 3072, 768, \"float32\"]", "cuda -keys=cuda,gpu -arch=sm_86 -max_num_threads=1024 -model=unknown -thread_warp_size=32", [82, 999, 999, 49152, 2147483647, 1024, 255, 32], "", 0, []], [[], [["CHW", 2, "local"], ["SP", 2, 0, 512, [1, 32, 2, 1], 1], ["SP", 2, 5, 768, [1, 1, 192, 1], 1], ["SP", 2, 10, 3072, [4, 1], 1], ["RE", 2, [0, 5, 1, 6, 2, 7, 10, 11, 3, 8, 12, 4, 9]], ["FSP", 3, 0, 1, 3], ["FSP", 3, 4, 2, 3], ["RE", 3, [0, 4, 1, 5, 2, 6, 3, 7]], ["CA", 2, 3, 5], ["CHR", 1, "shared", [2]], ["CA", 2, 3, 6], ["CHR", 0, "shared", [3]], ["CA", 1, 4, 6], ["FU", 5, [0, 1]], ["AN", 5, 0, 5], ["FU", 5, [1, 2]], ["AN", 5, 1, 4], ["FU", 5, [2, 3]], ["AN", 5, 2, 6], ["FU", 3, [0, 1]], ["SP", 3, 0, 768, [2], 1], ["AN", 3, 1, 2], ["FFSP", 3, 0, [2, 1], 1, 1], ["AN", 3, 1, 6], ["FU", 1, [0, 1]], ["SP", 1, 0, 8, [2], 1], ["AN", 1, 1, 2], ["FFSP", 1, 0, [2, 1], 1, 1], ["AN", 1, 1, 6], ["PR", 4, 0, "auto_unroll_max_step$1024"]]]], "r": [[0.00656177], 0, 1.9926, 1708774765], "mark": 2, "ag": 2, "v": "v0.6"}
{"i": [["[\"_matmul\", 512, 3072, 768, \"float32\"]", "cuda -keys=cuda,gpu -arch=sm_86 -max_num_threads=1024 -model=unknown -thread_warp_size=32", [82, 999, 999, 49152, 2147483647, 1024, 255, 32], "", 0, []], [[], [["CHW", 2, "local"], ["SP", 2, 0, 512, [1, 32, 8, 1], 1], ["SP", 2, 5, 768, [1, 1, 192, 1], 1], ["SP", 2, 10, 3072, [2, 1], 1], ["RE", 2, [0, 5, 1, 6, 2, 7, 10, 11, 3, 8, 12, 4, 9]], ["FSP", 3, 0, 1, 3], ["FSP", 3, 4, 2, 3], ["RE", 3, [0, 4, 1, 5, 2, 6, 3, 7]], ["CA", 2, 3, 5], ["CHR", 1, "shared", [2]], ["CA", 2, 3, 6], ["CHR", 0, "shared", [3]], ["CA", 1, 4, 6], ["FU", 5, [0, 1]], ["AN", 5, 0, 5], ["FU", 5, [1, 2]], ["AN", 5, 1, 4], ["FU", 5, [2, 3]], ["AN", 5, 2, 6], ["FU", 3, [0, 1]], ["SP", 3, 0, 384, [2], 1], ["AN", 3, 1, 2], ["FFSP", 3, 0, [2, 1], 1, 1], ["AN", 3, 1, 6], ["FU", 1, [0, 1]], ["SP", 1, 0, 16, [2], 1], ["AN", 1, 1, 2], ["FFSP", 1, 0, [2, 1], 1, 1], ["AN", 1, 1, 6], ["PR", 4, 0, "auto_unroll_max_step$1024"]]]], "r": [[0.0339586], 0, 2.39655, 1708774765], "mark": 2, "ag": 2, "v": "v0.6"}
{"i": [["[\"_matmul\", 512, 3072, 768, \"float32\"]", "cuda -keys=cuda,gpu -arch=sm_86 -max_num_threads=1024 -model=unknown -thread_warp_size=32", [82, 999, 999, 49152, 2147483647, 1024, 255, 32], "", 0, []], [[], [["CHW", 2, "local"], ["SP", 2, 0, 512, [1, 32, 8, 1], 1], ["SP", 2, 5, 768, [1, 1, 192, 1], 1], ["SP", 2, 10, 3072, [4, 1], 1], ["RE", 2, [0, 5, 1, 6, 2, 7, 10, 11, 3, 8, 12, 4, 9]], ["FSP", 3, 0, 1, 3], ["FSP", 3, 4, 2, 3], ["RE", 3, [0, 4, 1, 5, 2, 6, 3, 7]], ["CA", 2, 3, 5], ["CHR", 1, "shared", [2]], ["CA", 2, 3, 6], ["CHR", 0, "shared", [3]], ["CA", 1, 4, 6], ["FU", 5, [0, 1]], ["AN", 5, 0, 5], ["FU", 5, [1, 2]], ["AN", 5, 1, 4], ["FU", 5, [2, 3]], ["AN", 5, 2, 6], ["FU", 3, [0, 1]], ["SP", 3, 0, 768, [2], 1], ["AN", 3, 1, 2], ["FFSP", 3, 0, [2, 1], 1, 1], ["AN", 3, 1, 6], ["FU", 1, [0, 1]], ["SP", 1, 0, 32, [2], 1], ["AN", 1, 1, 2], ["FFSP", 1, 0, [2, 1], 1, 1], ["AN", 1, 1, 6], ["PR", 4, 0, "auto_unroll_max_step$1024"]]]], "r": [[0.033639], 0, 1.78555, 1708774765], "mark": 2, "ag": 2, "v": "v0.6"}
{"i": [["[\"_matmul\", 512, 3072, 768, \"float32\"]", "cuda -keys=cuda,gpu -arch=sm_86 -max_num_threads=1024 -model=unknown -thread_warp_size=32", [82, 999, 999, 49152, 2147483647, 1024, 255, 32], "", 0, []], [[], [["CHW", 2, "local"], ["SP", 2, 0, 512, [1, 32, 2, 1], 1], ["SP", 2, 5, 768, [1, 1, 128, 1], 1], ["SP", 2, 10, 3072, [3, 1], 1], ["RE", 2, [0, 5, 1, 6, 2, 7, 10, 11, 3, 8, 12, 4, 9]], ["FSP", 3, 0, 1, 3], ["FSP", 3, 4, 2, 3], ["RE", 3, [0, 4, 1, 5, 2, 6, 3, 7]], ["CA", 2, 3, 5], ["CHR", 1, "shared", [2]], ["CA", 2, 3, 6], ["CHR", 0, "shared", [3]], ["CA", 1, 4, 6], ["FU", 5, [0, 1]], ["AN", 5, 0, 5], ["FU", 5, [1, 2]], ["AN", 5, 1, 4], ["FU", 5, [2, 3]], ["AN", 5, 2, 6], ["FU", 3, [0, 1]], ["SP", 3, 0, 384, [2], 1], ["AN", 3, 1, 2], ["FFSP", 3, 0, [2, 1], 1, 1], ["AN", 3, 1, 6], ["FU", 1, [0, 1]], ["SP", 1, 0, 6, [2], 1], ["AN", 1, 1, 2], ["FFSP", 1, 0, [2, 1], 1, 1], ["AN", 1, 1, 6], ["PR", 4, 0, "auto_unroll_max_step$1024"]]]], "r": [[0.00307663], 0, 1.22109, 1708774765], "mark": 2, "ag": 2, "v": "v0.6"}
{"i": [["[\"_matmul\", 512, 3072, 768, \"float32\"]", "cuda -keys=cuda,gpu -arch=sm_86 -max_num_threads=1024 -model=unknown -thread_warp_size=32", [82, 999, 999, 49152, 2147483647, 1024, 255, 32], "", 0, []], [[], [["CHW", 2, "local"], ["SP", 2, 0, 512, [1, 32, 8, 1], 1], ["SP", 2, 5, 768, [1, 1, 128, 1], 1], ["SP", 2, 10, 3072, [3, 1], 1], ["RE", 2, [0, 5, 1, 6, 2, 7, 10, 11, 3, 8, 12, 4, 9]], ["FSP", 3, 0, 1, 3], ["FSP", 3, 4, 2, 3], ["RE", 3, [0, 4, 1, 5, 2, 6, 3, 7]], ["CA", 2, 3, 5], ["CHR", 1, "shared", [2]], ["CA", 2, 3, 6], ["CHR", 0, "shared", [3]], ["CA", 1, 4, 6], ["FU", 5, [0, 1]], ["AN", 5, 0, 5], ["FU", 5, [1, 2]], ["AN", 5, 1, 4], ["FU", 5, [2, 3]], ["AN", 5, 2, 6], ["FU", 3, [0, 1]], ["SP", 3, 0, 384, [2], 1], ["AN", 3, 1, 2], ["FFSP", 3, 0, [2, 1], 1, 1], ["AN", 3, 1, 6], ["FU", 1, [0, 1]], ["SP", 1, 0, 24, [2], 1], ["AN", 1, 1, 2], ["FFSP", 1, 0, [2, 1], 1, 1], ["AN", 1, 1, 6], ["PR", 4, 0, "auto_unroll_max_step$1024"]]]], "r": [[0.0329392], 0, 3.91062, 1708774765], "mark": 2, "ag": 2, "v": "v0.6"}
