data/new-200-5/35cuda_testCase_5_matmul_M512_N768_K3072.json
{"i": [["[\"_matmul\", 512, 3072, 768, \"float32\"]", "cuda -keys=cuda,gpu -arch=sm_86 -max_num_threads=1024 -model=unknown -thread_warp_size=32", [82, 999, 999, 49152, 2147483647, 1024, 255, 32], "", 0, []], [[], [["CHW", 2, "local"], ["SP", 2, 0, 512, [1, 4, 32, 1], 1], ["SP", 2, 5, 768, [1, 24, 32, 1], 1], ["SP", 2, 10, 3072, [1, 1], 1], ["RE", 2, [0, 5, 1, 6, 2, 7, 10, 11, 3, 8, 12, 4, 9]], ["FSP", 3, 0, 1, 3], ["FSP", 3, 4, 2, 3], ["RE", 3, [0, 4, 1, 5, 2, 6, 3, 7]], ["CA", 2, 3, 5], ["CHR", 1, "shared", [2]], ["CA", 2, 3, 6], ["CHR", 0, "shared", [3]], ["CA", 1, 4, 6], ["FU", 5, [0, 1]], ["AN", 5, 0, 5], ["FU", 5, [1, 2]], ["AN", 5, 1, 4], ["FU", 5, [2, 3]], ["AN", 5, 2, 6], ["FU", 3, [0, 1]], ["SP", 3, 0, 32, [2], 1], ["AN", 3, 1, 2], ["FFSP", 3, 0, [2, 1], 1, 1], ["AN", 3, 1, 6], ["FU", 1, [0, 1]], ["SP", 1, 0, 32, [2], 1], ["AN", 1, 1, 2], ["FFSP", 1, 0, [2, 1], 1, 1], ["AN", 1, 1, 6], ["PR", 4, 0, "auto_unroll_max_step$1024"]]]], "r": [[0.11194], 0, 2.5531, 1708765263], "mark": 2, "ag": 0, "v": "v0.6"}
{"i": [["[\"_matmul\", 512, 3072, 768, \"float32\"]", "cuda -keys=cuda,gpu -arch=sm_86 -max_num_threads=1024 -model=unknown -thread_warp_size=32", [82, 999, 999, 49152, 2147483647, 1024, 255, 32], "", 0, []], [[], [["CHW", 2, "local"], ["SP", 2, 0, 512, [1, 4, 32, 1], 1], ["SP", 2, 5, 768, [1, 24, 32, 1], 1], ["SP", 2, 10, 3072, [2, 1], 1], ["RE", 2, [0, 5, 1, 6, 2, 7, 10, 11, 3, 8, 12, 4, 9]], ["FSP", 3, 0, 1, 3], ["FSP", 3, 4, 2, 3], ["RE", 3, [0, 4, 1, 5, 2, 6, 3, 7]], ["CA", 2, 3, 5], ["CHR", 1, "shared", [2]], ["CA", 2, 3, 6], ["CHR", 0, "shared", [3]], ["CA", 1, 4, 6], ["FU", 5, [0, 1]], ["AN", 5, 0, 5], ["FU", 5, [1, 2]], ["AN", 5, 1, 4], ["FU", 5, [2, 3]], ["AN", 5, 2, 6], ["FU", 3, [0, 1]], ["SP", 3, 0, 64, [2], 1], ["AN", 3, 1, 2], ["FFSP", 3, 0, [2, 1], 1, 1], ["AN", 3, 1, 6], ["FU", 1, [0, 1]], ["SP", 1, 0, 64, [2], 1], ["AN", 1, 1, 2], ["FFSP", 1, 0, [2, 1], 1, 1], ["AN", 1, 1, 6], ["PR", 4, 0, "auto_unroll_max_step$1024"]]]], "r": [[0.0917858], 0, 2.73093, 1708765263], "mark": 2, "ag": 0, "v": "v0.6"}
{"i": [["[\"_matmul\", 512, 3072, 768, \"float32\"]", "cuda -keys=cuda,gpu -arch=sm_86 -max_num_threads=1024 -model=unknown -thread_warp_size=32", [82, 999, 999, 49152, 2147483647, 1024, 255, 32], "", 0, []], [[], [["CHW", 2, "local"], ["SP", 2, 0, 512, [1, 4, 32, 1], 1], ["SP", 2, 5, 768, [1, 12, 32, 1], 1], ["SP", 2, 10, 3072, [1, 1], 1], ["RE", 2, [0, 5, 1, 6, 2, 7, 10, 11, 3, 8, 12, 4, 9]], ["FSP", 3, 0, 1, 3], ["FSP", 3, 4, 2, 3], ["RE", 3, [0, 4, 1, 5, 2, 6, 3, 7]], ["CA", 2, 3, 5], ["CHR", 1, "shared", [2]], ["CA", 2, 3, 6], ["CHR", 0, "shared", [3]], ["CA", 1, 4, 6], ["FU", 5, [0, 1]], ["AN", 5, 0, 5], ["FU", 5, [1, 2]], ["AN", 5, 1, 4], ["FU", 5, [2, 3]], ["AN", 5, 2, 6], ["FU", 3, [0, 1]], ["SP", 3, 0, 32, [2], 1], ["AN", 3, 1, 2], ["FFSP", 3, 0, [2, 1], 1, 1], ["AN", 3, 1, 6], ["FU", 1, [0, 1]], ["SP", 1, 0, 32, [2], 1], ["AN", 1, 1, 2], ["FFSP", 1, 0, [2, 1], 1, 1], ["AN", 1, 1, 6], ["PR", 4, 0, "auto_unroll_max_step$1024"]]]], "r": [[0.0516821], 0, 2.25185, 1708765263], "mark": 2, "ag": 0, "v": "v0.6"}
{"i": [["[\"_matmul\", 512, 3072, 768, \"float32\"]", "cuda -keys=cuda,gpu -arch=sm_86 -max_num_threads=1024 -model=unknown -thread_warp_size=32", [82, 999, 999, 49152, 2147483647, 1024, 255, 32], "", 0, []], [[], [["CHW", 2, "local"], ["SP", 2, 0, 512, [1, 2, 32, 1], 1], ["SP", 2, 5, 768, [1, 24, 32, 1], 1], ["SP", 2, 10, 3072, [1, 1], 1], ["RE", 2, [0, 5, 1, 6, 2, 7, 10, 11, 3, 8, 12, 4, 9]], ["FSP", 3, 0, 1, 3], ["FSP", 3, 4, 2, 3], ["RE", 3, [0, 4, 1, 5, 2, 6, 3, 7]], ["CA", 2, 3, 5], ["CHR", 1, "shared", [2]], ["CA", 2, 3, 6], ["CHR", 0, "shared", [3]], ["CA", 1, 4, 6], ["FU", 5, [0, 1]], ["AN", 5, 0, 5], ["FU", 5, [1, 2]], ["AN", 5, 1, 4], ["FU", 5, [2, 3]], ["AN", 5, 2, 6], ["FU", 3, [0, 1]], ["SP", 3, 0, 32, [2], 1], ["AN", 3, 1, 2], ["FFSP", 3, 0, [2, 1], 1, 1], ["AN", 3, 1, 6], ["FU", 1, [0, 1]], ["SP", 1, 0, 32, [2], 1], ["AN", 1, 1, 2], ["FFSP", 1, 0, [2, 1], 1, 1], ["AN", 1, 1, 6], ["PR", 4, 0, "auto_unroll_max_step$1024"]]]], "r": [[0.0520291], 0, 2.34906, 1708765263], "mark": 2, "ag": 0, "v": "v0.6"}
{"i": [["[\"_matmul\", 512, 3072, 768, \"float32\"]", "cuda -keys=cuda,gpu -arch=sm_86 -max_num_threads=1024 -model=unknown -thread_warp_size=32", [82, 999, 999, 49152, 2147483647, 1024, 255, 32], "", 0, []], [[], [["CHW", 2, "local"], ["SP", 2, 0, 512, [1, 8, 32, 1], 1], ["SP", 2, 5, 768, [1, 24, 32, 1], 1], ["SP", 2, 10, 3072, [1, 1], 1], ["RE", 2, [0, 5, 1, 6, 2, 7, 10, 11, 3, 8, 12, 4, 9]], ["FSP", 3, 0, 1, 3], ["FSP", 3, 4, 2, 3], ["RE", 3, [0, 4, 1, 5, 2, 6, 3, 7]], ["CA", 2, 3, 5], ["CHR", 1, "shared", [2]], ["CA", 2, 3, 6], ["CHR", 0, "shared", [3]], ["CA", 1, 4, 6], ["FU", 5, [0, 1]], ["AN", 5, 0, 5], ["FU", 5, [1, 2]], ["AN", 5, 1, 4], ["FU", 5, [2, 3]], ["AN", 5, 2, 6], ["FU", 3, [0, 1]], ["SP", 3, 0, 32, [2], 1], ["AN", 3, 1, 2], ["FFSP", 3, 0, [2, 1], 1, 1], ["AN", 3, 1, 6], ["FU", 1, [0, 1]], ["SP", 1, 0, 32, [2], 1], ["AN", 1, 1, 2], ["FFSP", 1, 0, [2, 1], 1, 1], ["AN", 1, 1, 6], ["PR", 4, 0, "auto_unroll_max_step$1024"]]]], "r": [[0.113013], 0, 2.47457, 1708765264], "mark": 2, "ag": 0, "v": "v0.6"}
{"i": [["[\"_matmul\", 512, 3072, 768, \"float32\"]", "cuda -keys=cuda,gpu -arch=sm_86 -max_num_threads=1024 -model=unknown -thread_warp_size=32", [82, 999, 999, 49152, 2147483647, 1024, 255, 32], "", 0, []], [[], [["CHW", 2, "local"], ["SP", 2, 0, 512, [1, 4, 16, 1], 1], ["SP", 2, 5, 768, [1, 24, 32, 1], 1], ["SP", 2, 10, 3072, [1, 1], 1], ["RE", 2, [0, 5, 1, 6, 2, 7, 10, 11, 3, 8, 12, 4, 9]], ["FSP", 3, 0, 1, 3], ["FSP", 3, 4, 2, 3], ["RE", 3, [0, 4, 1, 5, 2, 6, 3, 7]], ["CA", 2, 3, 5], ["CHR", 1, "shared", [2]], ["CA", 2, 3, 6], ["CHR", 0, "shared", [3]], ["CA", 1, 4, 6], ["FU", 5, [0, 1]], ["AN", 5, 0, 5], ["FU", 5, [1, 2]], ["AN", 5, 1, 4], ["FU", 5, [2, 3]], ["AN", 5, 2, 6], ["FU", 3, [0, 1]], ["SP", 3, 0, 32, [2], 1], ["AN", 3, 1, 2], ["FFSP", 3, 0, [2, 1], 1, 1], ["AN", 3, 1, 6], ["FU", 1, [0, 1]], ["SP", 1, 0, 16, [2], 1], ["AN", 1, 1, 2], ["FFSP", 1, 0, [2, 1], 1, 1], ["AN", 1, 1, 6], ["PR", 4, 0, "auto_unroll_max_step$1024"]]]], "r": [[0.034131], 0, 0.897501, 1708765264], "mark": 2, "ag": 0, "v": "v0.6"}
{"i": [["[\"_matmul\", 512, 3072, 768, \"float32\"]", "cuda -keys=cuda,gpu -arch=sm_86 -max_num_threads=1024 -model=unknown -thread_warp_size=32", [82, 999, 999, 49152, 2147483647, 1024, 255, 32], "", 0, []], [[], [["CHW", 2, "local"], ["SP", 2, 0, 512, [1, 4, 64, 1], 1], ["SP", 2, 5, 768, [1, 24, 32, 1], 1], ["SP", 2, 10, 3072, [1, 1], 1], ["RE", 2, [0, 5, 1, 6, 2, 7, 10, 11, 3, 8, 12, 4, 9]], ["FSP", 3, 0, 1, 3], ["FSP", 3, 4, 2, 3], ["RE", 3, [0, 4, 1, 5, 2, 6, 3, 7]], ["CA", 2, 3, 5], ["CHR", 1, "shared", [2]], ["CA", 2, 3, 6], ["CHR", 0, "shared", [3]], ["CA", 1, 4, 6], ["FU", 5, [0, 1]], ["AN", 5, 0, 5], ["FU", 5, [1, 2]], ["AN", 5, 1, 4], ["FU", 5, [2, 3]], ["AN", 5, 2, 6], ["FU", 3, [0, 1]], ["SP", 3, 0, 32, [2], 1], ["AN", 3, 1, 2], ["FFSP", 3, 0, [2, 1], 1, 1], ["AN", 3, 1, 6], ["FU", 1, [0, 1]], ["SP", 1, 0, 64, [2], 1], ["AN", 1, 1, 2], ["FFSP", 1, 0, [2, 1], 1, 1], ["AN", 1, 1, 6], ["PR", 4, 0, "auto_unroll_max_step$1024"]]]], "r": [[0.0745716], 0, 0.593126, 1708765265], "mark": 2, "ag": 0, "v": "v0.6"}
{"i": [["[\"_matmul\", 512, 3072, 768, \"float32\"]", "cuda -keys=cuda,gpu -arch=sm_86 -max_num_threads=1024 -model=unknown -thread_warp_size=32", [82, 999, 999, 49152, 2147483647, 1024, 255, 32], "", 0, []], [[], [["CHW", 2, "local"], ["SP", 2, 0, 512, [1, 4, 32, 1], 1], ["SP", 2, 5, 768, [1, 12, 32, 1], 1], ["SP", 2, 10, 3072, [2, 1], 1], ["RE", 2, [0, 5, 1, 6, 2, 7, 10, 11, 3, 8, 12, 4, 9]], ["FSP", 3, 0, 1, 3], ["FSP", 3, 4, 2, 3], ["RE", 3, [0, 4, 1, 5, 2, 6, 3, 7]], ["CA", 2, 3, 5], ["CHR", 1, "shared", [2]], ["CA", 2, 3, 6], ["CHR", 0, "shared", [3]], ["CA", 1, 4, 6], ["FU", 5, [0, 1]], ["AN", 5, 0, 5], ["FU", 5, [1, 2]], ["AN", 5, 1, 4], ["FU", 5, [2, 3]], ["AN", 5, 2, 6], ["FU", 3, [0, 1]], ["SP", 3, 0, 64, [2], 1], ["AN", 3, 1, 2], ["FFSP", 3, 0, [2, 1], 1, 1], ["AN", 3, 1, 6], ["FU", 1, [0, 1]], ["SP", 1, 0, 64, [2], 1], ["AN", 1, 1, 2], ["FFSP", 1, 0, [2, 1], 1, 1], ["AN", 1, 1, 6], ["PR", 4, 0, "auto_unroll_max_step$1024"]]]], "r": [[0.0490186], 0, 3.13652, 1708765265], "mark": 2, "ag": 0, "v": "v0.6"}
{"i": [["[\"_matmul\", 512, 3072, 768, \"float32\"]", "cuda -keys=cuda,gpu -arch=sm_86 -max_num_threads=1024 -model=unknown -thread_warp_size=32", [82, 999, 999, 49152, 2147483647, 1024, 255, 32], "", 0, []], [[], [["CHW", 2, "local"], ["SP", 2, 0, 512, [1, 2, 32, 1], 1], ["SP", 2, 5, 768, [1, 24, 32, 1], 1], ["SP", 2, 10, 3072, [2, 1], 1], ["RE", 2, [0, 5, 1, 6, 2, 7, 10, 11, 3, 8, 12, 4, 9]], ["FSP", 3, 0, 1, 3], ["FSP", 3, 4, 2, 3], ["RE", 3, [0, 4, 1, 5, 2, 6, 3, 7]], ["CA", 2, 3, 5], ["CHR", 1, "shared", [2]], ["CA", 2, 3, 6], ["CHR", 0, "shared", [3]], ["CA", 1, 4, 6], ["FU", 5, [0, 1]], ["AN", 5, 0, 5], ["FU", 5, [1, 2]], ["AN", 5, 1, 4], ["FU", 5, [2, 3]], ["AN", 5, 2, 6], ["FU", 3, [0, 1]], ["SP", 3, 0, 64, [2], 1], ["AN", 3, 1, 2], ["FFSP", 3, 0, [2, 1], 1, 1], ["AN", 3, 1, 6], ["FU", 1, [0, 1]], ["SP", 1, 0, 64, [2], 1], ["AN", 1, 1, 2], ["FFSP", 1, 0, [2, 1], 1, 1], ["AN", 1, 1, 6], ["PR", 4, 0, "auto_unroll_max_step$1024"]]]], "r": [[0.0476484], 0, 3.1914, 1708765265], "mark": 2, "ag": 0, "v": "v0.6"}
{"i": [["[\"_matmul\", 512, 3072, 768, \"float32\"]", "cuda -keys=cuda,gpu -arch=sm_86 -max_num_threads=1024 -model=unknown -thread_warp_size=32", [82, 999, 999, 49152, 2147483647, 1024, 255, 32], "", 0, []], [[], [["CHW", 2, "local"], ["SP", 2, 0, 512, [1, 8, 32, 1], 1], ["SP", 2, 5, 768, [1, 24, 32, 1], 1], ["SP", 2, 10, 3072, [2, 1], 1], ["RE", 2, [0, 5, 1, 6, 2, 7, 10, 11, 3, 8, 12, 4, 9]], ["FSP", 3, 0, 1, 3], ["FSP", 3, 4, 2, 3], ["RE", 3, [0, 4, 1, 5, 2, 6, 3, 7]], ["CA", 2, 3, 5], ["CHR", 1, "shared", [2]], ["CA", 2, 3, 6], ["CHR", 0, "shared", [3]], ["CA", 1, 4, 6], ["FU", 5, [0, 1]], ["AN", 5, 0, 5], ["FU", 5, [1, 2]], ["AN", 5, 1, 4], ["FU", 5, [2, 3]], ["AN", 5, 2, 6], ["FU", 3, [0, 1]], ["SP", 3, 0, 64, [2], 1], ["AN", 3, 1, 2], ["FFSP", 3, 0, [2, 1], 1, 1], ["AN", 3, 1, 6], ["FU", 1, [0, 1]], ["SP", 1, 0, 64, [2], 1], ["AN", 1, 1, 2], ["FFSP", 1, 0, [2, 1], 1, 1], ["AN", 1, 1, 6], ["PR", 4, 0, "auto_unroll_max_step$1024"]]]], "r": [[0.0998943], 0, 2.98734, 1708765265], "mark": 2, "ag": 0, "v": "v0.6"}
{"i": [["[\"_matmul\", 512, 3072, 768, \"float32\"]", "cuda -keys=cuda,gpu -arch=sm_86 -max_num_threads=1024 -model=unknown -thread_warp_size=32", [82, 999, 999, 49152, 2147483647, 1024, 255, 32], "", 0, []], [[], [["CHW", 2, "local"], ["SP", 2, 0, 512, [1, 8, 32, 1], 1], ["SP", 2, 5, 768, [1, 12, 32, 1], 1], ["SP", 2, 10, 3072, [1, 1], 1], ["RE", 2, [0, 5, 1, 6, 2, 7, 10, 11, 3, 8, 12, 4, 9]], ["FSP", 3, 0, 1, 3], ["FSP", 3, 4, 2, 3], ["RE", 3, [0, 4, 1, 5, 2, 6, 3, 7]], ["CA", 2, 3, 5], ["CHR", 1, "shared", [2]], ["CA", 2, 3, 6], ["CHR", 0, "shared", [3]], ["CA", 1, 4, 6], ["FU", 5, [0, 1]], ["AN", 5, 0, 5], ["FU", 5, [1, 2]], ["AN", 5, 1, 4], ["FU", 5, [2, 3]], ["AN", 5, 2, 6], ["FU", 3, [0, 1]], ["SP", 3, 0, 32, [2], 1], ["AN", 3, 1, 2], ["FFSP", 3, 0, [2, 1], 1, 1], ["AN", 3, 1, 6], ["FU", 1, [0, 1]], ["SP", 1, 0, 32, [2], 1], ["AN", 1, 1, 2], ["FFSP", 1, 0, [2, 1], 1, 1], ["AN", 1, 1, 6], ["PR", 4, 0, "auto_unroll_max_step$1024"]]]], "r": [[0.102438], 0, 2.57484, 1708765266], "mark": 2, "ag": 0, "v": "v0.6"}
{"i": [["[\"_matmul\", 512, 3072, 768, \"float32\"]", "cuda -keys=cuda,gpu -arch=sm_86 -max_num_threads=1024 -model=unknown -thread_warp_size=32", [82, 999, 999, 49152, 2147483647, 1024, 255, 32], "", 0, []], [[], [["CHW", 2, "local"], ["SP", 2, 0, 512, [1, 4, 16, 1], 1], ["SP", 2, 5, 768, [1, 24, 32, 1], 1], ["SP", 2, 10, 3072, [2, 1], 1], ["RE", 2, [0, 5, 1, 6, 2, 7, 10, 11, 3, 8, 12, 4, 9]], ["FSP", 3, 0, 1, 3], ["FSP", 3, 4, 2, 3], ["RE", 3, [0, 4, 1, 5, 2, 6, 3, 7]], ["CA", 2, 3, 5], ["CHR", 1, "shared", [2]], ["CA", 2, 3, 6], ["CHR", 0, "shared", [3]], ["CA", 1, 4, 6], ["FU", 5, [0, 1]], ["AN", 5, 0, 5], ["FU", 5, [1, 2]], ["AN", 5, 1, 4], ["FU", 5, [2, 3]], ["AN", 5, 2, 6], ["FU", 3, [0, 1]], ["SP", 3, 0, 64, [2], 1], ["AN", 3, 1, 2], ["FFSP", 3, 0, [2, 1], 1, 1], ["AN", 3, 1, 6], ["FU", 1, [0, 1]], ["SP", 1, 0, 32, [2], 1], ["AN", 1, 1, 2], ["FFSP", 1, 0, [2, 1], 1, 1], ["AN", 1, 1, 6], ["PR", 4, 0, "auto_unroll_max_step$1024"]]]], "r": [[0.0318748], 0, 1.94871, 1708765266], "mark": 2, "ag": 0, "v": "v0.6"}
{"i": [["[\"_matmul\", 512, 3072, 768, \"float32\"]", "cuda -keys=cuda,gpu -arch=sm_86 -max_num_threads=1024 -model=unknown -thread_warp_size=32", [82, 999, 999, 49152, 2147483647, 1024, 255, 32], "", 0, []], [[], [["CHW", 2, "local"], ["SP", 2, 0, 512, [1, 4, 64, 1], 1], ["SP", 2, 5, 768, [1, 24, 32, 1], 1], ["SP", 2, 10, 3072, [2, 1], 1], ["RE", 2, [0, 5, 1, 6, 2, 7, 10, 11, 3, 8, 12, 4, 9]], ["FSP", 3, 0, 1, 3], ["FSP", 3, 4, 2, 3], ["RE", 3, [0, 4, 1, 5, 2, 6, 3, 7]], ["CA", 2, 3, 5], ["CHR", 1, "shared", [2]], ["CA", 2, 3, 6], ["CHR", 0, "shared", [3]], ["CA", 1, 4, 6], ["FU", 5, [0, 1]], ["AN", 5, 0, 5], ["FU", 5, [1, 2]], ["AN", 5, 1, 4], ["FU", 5, [2, 3]], ["AN", 5, 2, 6], ["FU", 3, [0, 1]], ["SP", 3, 0, 64, [2], 1], ["AN", 3, 1, 2], ["FFSP", 3, 0, [2, 1], 1, 1], ["AN", 3, 1, 6], ["FU", 1, [0, 1]], ["SP", 1, 0, 128, [2], 1], ["AN", 1, 1, 2], ["FFSP", 1, 0, [2, 1], 1, 1], ["AN", 1, 1, 6], ["PR", 4, 0, "auto_unroll_max_step$1024"]]]], "r": [[0.0787375], 0, 0.834656, 1708765267], "mark": 2, "ag": 0, "v": "v0.6"}
{"i": [["[\"_matmul\", 512, 3072, 768, \"float32\"]", "cuda -keys=cuda,gpu -arch=sm_86 -max_num_threads=1024 -model=unknown -thread_warp_size=32", [82, 999, 999, 49152, 2147483647, 1024, 255, 32], "", 0, []], [[], [["CHW", 2, "local"], ["SP", 2, 0, 512, [1, 4, 16, 1], 1], ["SP", 2, 5, 768, [1, 12, 32, 1], 1], ["SP", 2, 10, 3072, [1, 1], 1], ["RE", 2, [0, 5, 1, 6, 2, 7, 10, 11, 3, 8, 12, 4, 9]], ["FSP", 3, 0, 1, 3], ["FSP", 3, 4, 2, 3], ["RE", 3, [0, 4, 1, 5, 2, 6, 3, 7]], ["CA", 2, 3, 5], ["CHR", 1, "shared", [2]], ["CA", 2, 3, 6], ["CHR", 0, "shared", [3]], ["CA", 1, 4, 6], ["FU", 5, [0, 1]], ["AN", 5, 0, 5], ["FU", 5, [1, 2]], ["AN", 5, 1, 4], ["FU", 5, [2, 3]], ["AN", 5, 2, 6], ["FU", 3, [0, 1]], ["SP", 3, 0, 32, [2], 1], ["AN", 3, 1, 2], ["FFSP", 3, 0, [2, 1], 1, 1], ["AN", 3, 1, 6], ["FU", 1, [0, 1]], ["SP", 1, 0, 16, [2], 1], ["AN", 1, 1, 2], ["FFSP", 1, 0, [2, 1], 1, 1], ["AN", 1, 1, 6], ["PR", 4, 0, "auto_unroll_max_step$1024"]]]], "r": [[0.0155408], 0, 1.00053, 1708765267], "mark": 2, "ag": 0, "v": "v0.6"}
{"i": [["[\"_matmul\", 512, 3072, 768, \"float32\"]", "cuda -keys=cuda,gpu -arch=sm_86 -max_num_threads=1024 -model=unknown -thread_warp_size=32", [82, 999, 999, 49152, 2147483647, 1024, 255, 32], "", 0, []], [[], [["CHW", 2, "local"], ["SP", 2, 0, 512, [1, 4, 64, 1], 1], ["SP", 2, 5, 768, [1, 12, 32, 1], 1], ["SP", 2, 10, 3072, [1, 1], 1], ["RE", 2, [0, 5, 1, 6, 2, 7, 10, 11, 3, 8, 12, 4, 9]], ["FSP", 3, 0, 1, 3], ["FSP", 3, 4, 2, 3], ["RE", 3, [0, 4, 1, 5, 2, 6, 3, 7]], ["CA", 2, 3, 5], ["CHR", 1, "shared", [2]], ["CA", 2, 3, 6], ["CHR", 0, "shared", [3]], ["CA", 1, 4, 6], ["FU", 5, [0, 1]], ["AN", 5, 0, 5], ["FU", 5, [1, 2]], ["AN", 5, 1, 4], ["FU", 5, [2, 3]], ["AN", 5, 2, 6], ["FU", 3, [0, 1]], ["SP", 3, 0, 32, [2], 1], ["AN", 3, 1, 2], ["FFSP", 3, 0, [2, 1], 1, 1], ["AN", 3, 1, 6], ["FU", 1, [0, 1]], ["SP", 1, 0, 64, [2], 1], ["AN", 1, 1, 2], ["FFSP", 1, 0, [2, 1], 1, 1], ["AN", 1, 1, 6], ["PR", 4, 0, "auto_unroll_max_step$1024"]]]], "r": [[0.0813201], 0, 0.63213, 1708765267], "mark": 2, "ag": 0, "v": "v0.6"}
{"i": [["[\"_matmul\", 512, 3072, 768, \"float32\"]", "cuda -keys=cuda,gpu -arch=sm_86 -max_num_threads=1024 -model=unknown -thread_warp_size=32", [82, 999, 999, 49152, 2147483647, 1024, 255, 32], "", 0, []], [[], [["CHW", 2, "local"], ["SP", 2, 0, 512, [1, 2, 16, 1], 1], ["SP", 2, 5, 768, [1, 24, 32, 1], 1], ["SP", 2, 10, 3072, [1, 1], 1], ["RE", 2, [0, 5, 1, 6, 2, 7, 10, 11, 3, 8, 12, 4, 9]], ["FSP", 3, 0, 1, 3], ["FSP", 3, 4, 2, 3], ["RE", 3, [0, 4, 1, 5, 2, 6, 3, 7]], ["CA", 2, 3, 5], ["CHR", 1, "shared", [2]], ["CA", 2, 3, 6], ["CHR", 0, "shared", [3]], ["CA", 1, 4, 6], ["FU", 5, [0, 1]], ["AN", 5, 0, 5], ["FU", 5, [1, 2]], ["AN", 5, 1, 4], ["FU", 5, [2, 3]], ["AN", 5, 2, 6], ["FU", 3, [0, 1]], ["SP", 3, 0, 32, [2], 1], ["AN", 3, 1, 2], ["FFSP", 3, 0, [2, 1], 1, 1], ["AN", 3, 1, 6], ["FU", 1, [0, 1]], ["SP", 1, 0, 16, [2], 1], ["AN", 1, 1, 2], ["FFSP", 1, 0, [2, 1], 1, 1], ["AN", 1, 1, 6], ["PR", 4, 0, "auto_unroll_max_step$1024"]]]], "r": [[0.0128356], 0, 1.25622, 1708765267], "mark": 2, "ag": 0, "v": "v0.6"}
{"i": [["[\"_matmul\", 512, 3072, 768, \"float32\"]", "cuda -keys=cuda,gpu -arch=sm_86 -max_num_threads=1024 -model=unknown -thread_warp_size=32", [82, 999, 999, 49152, 2147483647, 1024, 255, 32], "", 0, []], [[], [["CHW", 2, "local"], ["SP", 2, 0, 512, [1, 8, 16, 1], 1], ["SP", 2, 5, 768, [1, 24, 32, 1], 1], ["SP", 2, 10, 3072, [1, 1], 1], ["RE", 2, [0, 5, 1, 6, 2, 7, 10, 11, 3, 8, 12, 4, 9]], ["FSP", 3, 0, 1, 3], ["FSP", 3, 4, 2, 3], ["RE", 3, [0, 4, 1, 5, 2, 6, 3, 7]], ["CA", 2, 3, 5], ["CHR", 1, "shared", [2]], ["CA", 2, 3, 6], ["CHR", 0, "shared", [3]], ["CA", 1, 4, 6], ["FU", 5, [0, 1]], ["AN", 5, 0, 5], ["FU", 5, [1, 2]], ["AN", 5, 1, 4], ["FU", 5, [2, 3]], ["AN", 5, 2, 6], ["FU", 3, [0, 1]], ["SP", 3, 0, 32, [2], 1], ["AN", 3, 1, 2], ["FFSP", 3, 0, [2, 1], 1, 1], ["AN", 3, 1, 6], ["FU", 1, [0, 1]], ["SP", 1, 0, 16, [2], 1], ["AN", 1, 1, 2], ["FFSP", 1, 0, [2, 1], 1, 1], ["AN", 1, 1, 6], ["PR", 4, 0, "auto_unroll_max_step$1024"]]]], "r": [[0.0390076], 0, 1.33846, 1708765268], "mark": 2, "ag": 0, "v": "v0.6"}
{"i": [["[\"_matmul\", 512, 3072, 768, \"float32\"]", "cuda -keys=cuda,gpu -arch=sm_86 -max_num_threads=1024 -model=unknown -thread_warp_size=32", [82, 999, 999, 49152, 2147483647, 1024, 255, 32], "", 0, []], [[], [["CHW", 2, "local"], ["SP", 2, 0, 512, [1, 2, 64, 1], 1], ["SP", 2, 5, 768, [1, 24, 32, 1], 1], ["SP", 2, 10, 3072, [1, 1], 1], ["RE", 2, [0, 5, 1, 6, 2, 7, 10, 11, 3, 8, 12, 4, 9]], ["FSP", 3, 0, 1, 3], ["FSP", 3, 4, 2, 3], ["RE", 3, [0, 4, 1, 5, 2, 6, 3, 7]], ["CA", 2, 3, 5], ["CHR", 1, "shared", [2]], ["CA", 2, 3, 6], ["CHR", 0, "shared", [3]], ["CA", 1, 4, 6], ["FU", 5, [0, 1]], ["AN", 5, 0, 5], ["FU", 5, [1, 2]], ["AN", 5, 1, 4], ["FU", 5, [2, 3]], ["AN", 5, 2, 6], ["FU", 3, [0, 1]], ["SP", 3, 0, 32, [2], 1], ["AN", 3, 1, 2], ["FFSP", 3, 0, [2, 1], 1, 1], ["AN", 3, 1, 6], ["FU", 1, [0, 1]], ["SP", 1, 0, 64, [2], 1], ["AN", 1, 1, 2], ["FFSP", 1, 0, [2, 1], 1, 1], ["AN", 1, 1, 6], ["PR", 4, 0, "auto_unroll_max_step$1024"]]]], "r": [[0.0754184], 0, 0.596373, 1708765268], "mark": 2, "ag": 0, "v": "v0.6"}
{"i": [["[\"_matmul\", 512, 3072, 768, \"float32\"]", "cuda -keys=cuda,gpu -arch=sm_86 -max_num_threads=1024 -model=unknown -thread_warp_size=32", [82, 999, 999, 49152, 2147483647, 1024, 255, 32], "", 0, []], [[], [["CHW", 2, "local"], ["SP", 2, 0, 512, [1, 8, 64, 1], 1], ["SP", 2, 5, 768, [1, 24, 32, 1], 1], ["SP", 2, 10, 3072, [1, 1], 1], ["RE", 2, [0, 5, 1, 6, 2, 7, 10, 11, 3, 8, 12, 4, 9]], ["FSP", 3, 0, 1, 3], ["FSP", 3, 4, 2, 3], ["RE", 3, [0, 4, 1, 5, 2, 6, 3, 7]], ["CA", 2, 3, 5], ["CHR", 1, "shared", [2]], ["CA", 2, 3, 6], ["CHR", 0, "shared", [3]], ["CA", 1, 4, 6], ["FU", 5, [0, 1]], ["AN", 5, 0, 5], ["FU", 5, [1, 2]], ["AN", 5, 1, 4], ["FU", 5, [2, 3]], ["AN", 5, 2, 6], ["FU", 3, [0, 1]], ["SP", 3, 0, 32, [2], 1], ["AN", 3, 1, 2], ["FFSP", 3, 0, [2, 1], 1, 1], ["AN", 3, 1, 6], ["FU", 1, [0, 1]], ["SP", 1, 0, 64, [2], 1], ["AN", 1, 1, 2], ["FFSP", 1, 0, [2, 1], 1, 1], ["AN", 1, 1, 6], ["PR", 4, 0, "auto_unroll_max_step$1024"]]]], "r": [[0.109316], 0, 0.728327, 1708765268], "mark": 2, "ag": 0, "v": "v0.6"}
{"i": [["[\"_matmul\", 512, 3072, 768, \"float32\"]", "cuda -keys=cuda,gpu -arch=sm_86 -max_num_threads=1024 -model=unknown -thread_warp_size=32", [82, 999, 999, 49152, 2147483647, 1024, 255, 32], "", 0, []], [[], [["CHW", 2, "local"], ["SP", 2, 0, 512, [1, 2, 16, 1], 1], ["SP", 2, 5, 768, [1, 24, 32, 1], 1], ["SP", 2, 10, 3072, [1, 1], 1], ["RE", 2, [0, 5, 1, 6, 2, 7, 10, 11, 3, 8, 12, 4, 9]], ["FSP", 3, 0, 1, 3], ["FSP", 3, 4, 2, 3], ["RE", 3, [0, 4, 1, 5, 2, 6, 3, 7]], ["CA", 2, 3, 5], ["CHR", 1, "shared", [2]], ["CA", 2, 3, 6], ["CHR", 0, "shared", [3]], ["CA", 1, 4, 6], ["FU", 5, [0, 1]], ["AN", 5, 0, 5], ["FU", 5, [1, 2]], ["AN", 5, 1, 4], ["FU", 5, [2, 3]], ["AN", 5, 2, 6], ["FU", 3, [0, 1]], ["SP", 3, 0, 32, [2], 1], ["AN", 3, 1, 2], ["FFSP", 3, 0, [2, 1], 1, 1], ["AN", 3, 1, 6], ["FU", 1, [0, 1]], ["SP", 1, 0, 16, [2], 1], ["AN", 1, 1, 2], ["FFSP", 1, 0, [2, 1], 1, 1], ["AN", 1, 1, 6], ["PR", 4, 0, "auto_unroll_max_step$1024"]]]], "r": [[0.0128356], 0, 1.25622, 1708765267], "mark": 2, "ag": 1, "v": "v0.6"}
{"i": [["[\"_matmul\", 512, 3072, 768, \"float32\"]", "cuda -keys=cuda,gpu -arch=sm_86 -max_num_threads=1024 -model=unknown -thread_warp_size=32", [82, 999, 999, 49152, 2147483647, 1024, 255, 32], "", 0, []], [[], [["CHW", 2, "local"], ["SP", 2, 0, 512, [1, 2, 16, 1], 1], ["SP", 2, 5, 768, [1, 24, 32, 1], 1], ["SP", 2, 10, 3072, [2, 1], 1], ["RE", 2, [0, 5, 1, 6, 2, 7, 10, 11, 3, 8, 12, 4, 9]], ["FSP", 3, 0, 1, 3], ["FSP", 3, 4, 2, 3], ["RE", 3, [0, 4, 1, 5, 2, 6, 3, 7]], ["CA", 2, 3, 5], ["CHR", 1, "shared", [2]], ["CA", 2, 3, 6], ["CHR", 0, "shared", [3]], ["CA", 1, 4, 6], ["FU", 5, [0, 1]], ["AN", 5, 0, 5], ["FU", 5, [1, 2]], ["AN", 5, 1, 4], ["FU", 5, [2, 3]], ["AN", 5, 2, 6], ["FU", 3, [0, 1]], ["SP", 3, 0, 64, [2], 1], ["AN", 3, 1, 2], ["FFSP", 3, 0, [2, 1], 1, 1], ["AN", 3, 1, 6], ["FU", 1, [0, 1]], ["SP", 1, 0, 32, [2], 1], ["AN", 1, 1, 2], ["FFSP", 1, 0, [2, 1], 1, 1], ["AN", 1, 1, 6], ["PR", 4, 0, "auto_unroll_max_step$1024"]]]], "r": [[0.0231877], 0, 1.76013, 1708765272], "mark": 2, "ag": 1, "v": "v0.6"}
{"i": [["[\"_matmul\", 512, 3072, 768, \"float32\"]", "cuda -keys=cuda,gpu -arch=sm_86 -max_num_threads=1024 -model=unknown -thread_warp_size=32", [82, 999, 999, 49152, 2147483647, 1024, 255, 32], "", 0, []], [[], [["CHW", 2, "local"], ["SP", 2, 0, 512, [1, 4, 16, 1], 1], ["SP", 2, 5, 768, [1, 24, 32, 1], 1], ["SP", 2, 10, 3072, [1, 1], 1], ["RE", 2, [0, 5, 1, 6, 2, 7, 10, 11, 3, 8, 12, 4, 9]], ["FSP", 3, 0, 1, 3], ["FSP", 3, 4, 2, 3], ["RE", 3, [0, 4, 1, 5, 2, 6, 3, 7]], ["CA", 2, 3, 5], ["CHR", 1, "shared", [2]], ["CA", 2, 3, 6], ["CHR", 0, "shared", [3]], ["CA", 1, 4, 6], ["FU", 5, [0, 1]], ["AN", 5, 0, 5], ["FU", 5, [1, 2]], ["AN", 5, 1, 4], ["FU", 5, [2, 3]], ["AN", 5, 2, 6], ["FU", 3, [0, 1]], ["SP", 3, 0, 32, [2], 1], ["AN", 3, 1, 2], ["FFSP", 3, 0, [2, 1], 1, 1], ["AN", 3, 1, 6], ["FU", 1, [0, 1]], ["SP", 1, 0, 16, [2], 1], ["AN", 1, 1, 2], ["FFSP", 1, 0, [2, 1], 1, 1], ["AN", 1, 1, 6], ["PR", 4, 0, "auto_unroll_max_step$1024"]]]], "r": [[0.0339754], 0, 1.04994, 1708765272], "mark": 2, "ag": 1, "v": "v0.6"}
{"i": [["[\"_matmul\", 512, 3072, 768, \"float32\"]", "cuda -keys=cuda,gpu -arch=sm_86 -max_num_threads=1024 -model=unknown -thread_warp_size=32", [82, 999, 999, 49152, 2147483647, 1024, 255, 32], "", 0, []], [[], [["CHW", 2, "local"], ["SP", 2, 0, 512, [1, 2, 8, 1], 1], ["SP", 2, 5, 768, [1, 24, 32, 1], 1], ["SP", 2, 10, 3072, [1, 1], 1], ["RE", 2, [0, 5, 1, 6, 2, 7, 10, 11, 3, 8, 12, 4, 9]], ["FSP", 3, 0, 1, 3], ["FSP", 3, 4, 2, 3], ["RE", 3, [0, 4, 1, 5, 2, 6, 3, 7]], ["CA", 2, 3, 5], ["CHR", 1, "shared", [2]], ["CA", 2, 3, 6], ["CHR", 0, "shared", [3]], ["CA", 1, 4, 6], ["FU", 5, [0, 1]], ["AN", 5, 0, 5], ["FU", 5, [1, 2]], ["AN", 5, 1, 4], ["FU", 5, [2, 3]], ["AN", 5, 2, 6], ["FU", 3, [0, 1]], ["SP", 3, 0, 32, [2], 1], ["AN", 3, 1, 2], ["FFSP", 3, 0, [2, 1], 1, 1], ["AN", 3, 1, 6], ["FU", 1, [0, 1]], ["SP", 1, 0, 8, [2], 1], ["AN", 1, 1, 2], ["FFSP", 1, 0, [2, 1], 1, 1], ["AN", 1, 1, 6], ["PR", 4, 0, "auto_unroll_max_step$1024"]]]], "r": [[0.0043639], 0, 0.605357, 1708765273], "mark": 2, "ag": 1, "v": "v0.6"}
{"i": [["[\"_matmul\", 512, 3072, 768, \"float32\"]", "cuda -keys=cuda,gpu -arch=sm_86 -max_num_threads=1024 -model=unknown -thread_warp_size=32", [82, 999, 999, 49152, 2147483647, 1024, 255, 32], "", 0, []], [[], [["CHW", 2, "local"], ["SP", 2, 0, 512, [1, 2, 32, 1], 1], ["SP", 2, 5, 768, [1, 24, 32, 1], 1], ["SP", 2, 10, 3072, [1, 1], 1], ["RE", 2, [0, 5, 1, 6, 2, 7, 10, 11, 3, 8, 12, 4, 9]], ["FSP", 3, 0, 1, 3], ["FSP", 3, 4, 2, 3], ["RE", 3, [0, 4, 1, 5, 2, 6, 3, 7]], ["CA", 2, 3, 5], ["CHR", 1, "shared", [2]], ["CA", 2, 3, 6], ["CHR", 0, "shared", [3]], ["CA", 1, 4, 6], ["FU", 5, [0, 1]], ["AN", 5, 0, 5], ["FU", 5, [1, 2]], ["AN", 5, 1, 4], ["FU", 5, [2, 3]], ["AN", 5, 2, 6], ["FU", 3, [0, 1]], ["SP", 3, 0, 32, [2], 1], ["AN", 3, 1, 2], ["FFSP", 3, 0, [2, 1], 1, 1], ["AN", 3, 1, 6], ["FU", 1, [0, 1]], ["SP", 1, 0, 32, [2], 1], ["AN", 1, 1, 2], ["FFSP", 1, 0, [2, 1], 1, 1], ["AN", 1, 1, 6], ["PR", 4, 0, "auto_unroll_max_step$1024"]]]], "r": [[0.0520876], 0, 2.25606, 1708765273], "mark": 2, "ag": 1, "v": "v0.6"}
{"i": [["[\"_matmul\", 512, 3072, 768, \"float32\"]", "cuda -keys=cuda,gpu -arch=sm_86 -max_num_threads=1024 -model=unknown -thread_warp_size=32", [82, 999, 999, 49152, 2147483647, 1024, 255, 32], "", 0, []], [[], [["CHW", 2, "local"], ["SP", 2, 0, 512, [1, 4, 16, 1], 1], ["SP", 2, 5, 768, [1, 24, 32, 1], 1], ["SP", 2, 10, 3072, [2, 1], 1], ["RE", 2, [0, 5, 1, 6, 2, 7, 10, 11, 3, 8, 12, 4, 9]], ["FSP", 3, 0, 1, 3], ["FSP", 3, 4, 2, 3], ["RE", 3, [0, 4, 1, 5, 2, 6, 3, 7]], ["CA", 2, 3, 5], ["CHR", 1, "shared", [2]], ["CA", 2, 3, 6], ["CHR", 0, "shared", [3]], ["CA", 1, 4, 6], ["FU", 5, [0, 1]], ["AN", 5, 0, 5], ["FU", 5, [1, 2]], ["AN", 5, 1, 4], ["FU", 5, [2, 3]], ["AN", 5, 2, 6], ["FU", 3, [0, 1]], ["SP", 3, 0, 64, [2], 1], ["AN", 3, 1, 2], ["FFSP", 3, 0, [2, 1], 1, 1], ["AN", 3, 1, 6], ["FU", 1, [0, 1]], ["SP", 1, 0, 32, [2], 1], ["AN", 1, 1, 2], ["FFSP", 1, 0, [2, 1], 1, 1], ["AN", 1, 1, 6], ["PR", 4, 0, "auto_unroll_max_step$1024"]]]], "r": [[0.031932], 0, 1.55857, 1708765273], "mark": 2, "ag": 1, "v": "v0.6"}
{"i": [["[\"_matmul\", 512, 3072, 768, \"float32\"]", "cuda -keys=cuda,gpu -arch=sm_86 -max_num_threads=1024 -model=unknown -thread_warp_size=32", [82, 999, 999, 49152, 2147483647, 1024, 255, 32], "", 0, []], [[], [["CHW", 2, "local"], ["SP", 2, 0, 512, [1, 4, 16, 1], 1], ["SP", 2, 5, 768, [1, 12, 32, 1], 1], ["SP", 2, 10, 3072, [1, 1], 1], ["RE", 2, [0, 5, 1, 6, 2, 7, 10, 11, 3, 8, 12, 4, 9]], ["FSP", 3, 0, 1, 3], ["FSP", 3, 4, 2, 3], ["RE", 3, [0, 4, 1, 5, 2, 6, 3, 7]], ["CA", 2, 3, 5], ["CHR", 1, "shared", [2]], ["CA", 2, 3, 6], ["CHR", 0, "shared", [3]], ["CA", 1, 4, 6], ["FU", 5, [0, 1]], ["AN", 5, 0, 5], ["FU", 5, [1, 2]], ["AN", 5, 1, 4], ["FU", 5, [2, 3]], ["AN", 5, 2, 6], ["FU", 3, [0, 1]], ["SP", 3, 0, 32, [2], 1], ["AN", 3, 1, 2], ["FFSP", 3, 0, [2, 1], 1, 1], ["AN", 3, 1, 6], ["FU", 1, [0, 1]], ["SP", 1, 0, 16, [2], 1], ["AN", 1, 1, 2], ["FFSP", 1, 0, [2, 1], 1, 1], ["AN", 1, 1, 6], ["PR", 4, 0, "auto_unroll_max_step$1024"]]]], "r": [[0.0153153], 0, 1.0772, 1708765273], "mark": 2, "ag": 1, "v": "v0.6"}
{"i": [["[\"_matmul\", 512, 3072, 768, \"float32\"]", "cuda -keys=cuda,gpu -arch=sm_86 -max_num_threads=1024 -model=unknown -thread_warp_size=32", [82, 999, 999, 49152, 2147483647, 1024, 255, 32], "", 0, []], [[], [["CHW", 2, "local"], ["SP", 2, 0, 512, [1, 2, 8, 1], 1], ["SP", 2, 5, 768, [1, 24, 32, 1], 1], ["SP", 2, 10, 3072, [2, 1], 1], ["RE", 2, [0, 5, 1, 6, 2, 7, 10, 11, 3, 8, 12, 4, 9]], ["FSP", 3, 0, 1, 3], ["FSP", 3, 4, 2, 3], ["RE", 3, [0, 4, 1, 5, 2, 6, 3, 7]], ["CA", 2, 3, 5], ["CHR", 1, "shared", [2]], ["CA", 2, 3, 6], ["CHR", 0, "shared", [3]], ["CA", 1, 4, 6], ["FU", 5, [0, 1]], ["AN", 5, 0, 5], ["FU", 5, [1, 2]], ["AN", 5, 1, 4], ["FU", 5, [2, 3]], ["AN", 5, 2, 6], ["FU", 3, [0, 1]], ["SP", 3, 0, 64, [2], 1], ["AN", 3, 1, 2], ["FFSP", 3, 0, [2, 1], 1, 1], ["AN", 3, 1, 6], ["FU", 1, [0, 1]], ["SP", 1, 0, 16, [2], 1], ["AN", 1, 1, 2], ["FFSP", 1, 0, [2, 1], 1, 1], ["AN", 1, 1, 6], ["PR", 4, 0, "auto_unroll_max_step$1024"]]]], "r": [[0.00314446], 0, 0.796523, 1708765274], "mark": 2, "ag": 1, "v": "v0.6"}
{"i": [["[\"_matmul\", 512, 3072, 768, \"float32\"]", "cuda -keys=cuda,gpu -arch=sm_86 -max_num_threads=1024 -model=unknown -thread_warp_size=32", [82, 999, 999, 49152, 2147483647, 1024, 255, 32], "", 0, []], [[], [["CHW", 2, "local"], ["SP", 2, 0, 512, [1, 2, 32, 1], 1], ["SP", 2, 5, 768, [1, 24, 32, 1], 1], ["SP", 2, 10, 3072, [2, 1], 1], ["RE", 2, [0, 5, 1, 6, 2, 7, 10, 11, 3, 8, 12, 4, 9]], ["FSP", 3, 0, 1, 3], ["FSP", 3, 4, 2, 3], ["RE", 3, [0, 4, 1, 5, 2, 6, 3, 7]], ["CA", 2, 3, 5], ["CHR", 1, "shared", [2]], ["CA", 2, 3, 6], ["CHR", 0, "shared", [3]], ["CA", 1, 4, 6], ["FU", 5, [0, 1]], ["AN", 5, 0, 5], ["FU", 5, [1, 2]], ["AN", 5, 1, 4], ["FU", 5, [2, 3]], ["AN", 5, 2, 6], ["FU", 3, [0, 1]], ["SP", 3, 0, 64, [2], 1], ["AN", 3, 1, 2], ["FFSP", 3, 0, [2, 1], 1, 1], ["AN", 3, 1, 6], ["FU", 1, [0, 1]], ["SP", 1, 0, 64, [2], 1], ["AN", 1, 1, 2], ["FFSP", 1, 0, [2, 1], 1, 1], ["AN", 1, 1, 6], ["PR", 4, 0, "auto_unroll_max_step$1024"]]]], "r": [[0.0476369], 0, 2.50124, 1708765274], "mark": 2, "ag": 1, "v": "v0.6"}
{"i": [["[\"_matmul\", 512, 3072, 768, \"float32\"]", "cuda -keys=cuda,gpu -arch=sm_86 -max_num_threads=1024 -model=unknown -thread_warp_size=32", [82, 999, 999, 49152, 2147483647, 1024, 255, 32], "", 0, []], [[], [["CHW", 2, "local"], ["SP", 2, 0, 512, [1, 4, 8, 1], 1], ["SP", 2, 5, 768, [1, 24, 32, 1], 1], ["SP", 2, 10, 3072, [1, 1], 1], ["RE", 2, [0, 5, 1, 6, 2, 7, 10, 11, 3, 8, 12, 4, 9]], ["FSP", 3, 0, 1, 3], ["FSP", 3, 4, 2, 3], ["RE", 3, [0, 4, 1, 5, 2, 6, 3, 7]], ["CA", 2, 3, 5], ["CHR", 1, "shared", [2]], ["CA", 2, 3, 6], ["CHR", 0, "shared", [3]], ["CA", 1, 4, 6], ["FU", 5, [0, 1]], ["AN", 5, 0, 5], ["FU", 5, [1, 2]], ["AN", 5, 1, 4], ["FU", 5, [2, 3]], ["AN", 5, 2, 6], ["FU", 3, [0, 1]], ["SP", 3, 0, 32, [2], 1], ["AN", 3, 1, 2], ["FFSP", 3, 0, [2, 1], 1, 1], ["AN", 3, 1, 6], ["FU", 1, [0, 1]], ["SP", 1, 0, 8, [2], 1], ["AN", 1, 1, 2], ["FFSP", 1, 0, [2, 1], 1, 1], ["AN", 1, 1, 6], ["PR", 4, 0, "auto_unroll_max_step$1024"]]]], "r": [[0.00374064], 0, 0.810163, 1708765274], "mark": 2, "ag": 1, "v": "v0.6"}
{"i": [["[\"_matmul\", 512, 3072, 768, \"float32\"]", "cuda -keys=cuda,gpu -arch=sm_86 -max_num_threads=1024 -model=unknown -thread_warp_size=32", [82, 999, 999, 49152, 2147483647, 1024, 255, 32], "", 0, []], [[], [["CHW", 2, "local"], ["SP", 2, 0, 512, [1, 2, 8, 1], 1], ["SP", 2, 5, 768, [1, 24, 32, 1], 1], ["SP", 2, 10, 3072, [2, 1], 1], ["RE", 2, [0, 5, 1, 6, 2, 7, 10, 11, 3, 8, 12, 4, 9]], ["FSP", 3, 0, 1, 3], ["FSP", 3, 4, 2, 3], ["RE", 3, [0, 4, 1, 5, 2, 6, 3, 7]], ["CA", 2, 3, 5], ["CHR", 1, "shared", [2]], ["CA", 2, 3, 6], ["CHR", 0, "shared", [3]], ["CA", 1, 4, 6], ["FU", 5, [0, 1]], ["AN", 5, 0, 5], ["FU", 5, [1, 2]], ["AN", 5, 1, 4], ["FU", 5, [2, 3]], ["AN", 5, 2, 6], ["FU", 3, [0, 1]], ["SP", 3, 0, 64, [2], 1], ["AN", 3, 1, 2], ["FFSP", 3, 0, [2, 1], 1, 1], ["AN", 3, 1, 6], ["FU", 1, [0, 1]], ["SP", 1, 0, 16, [2], 1], ["AN", 1, 1, 2], ["FFSP", 1, 0, [2, 1], 1, 1], ["AN", 1, 1, 6], ["PR", 4, 0, "auto_unroll_max_step$1024"]]]], "r": [[0.00314446], 0, 0.796523, 1708765274], "mark": 2, "ag": 2, "v": "v0.6"}
{"i": [["[\"_matmul\", 512, 3072, 768, \"float32\"]", "cuda -keys=cuda,gpu -arch=sm_86 -max_num_threads=1024 -model=unknown -thread_warp_size=32", [82, 999, 999, 49152, 2147483647, 1024, 255, 32], "", 0, []], [[], [["CHW", 2, "local"], ["SP", 2, 0, 512, [1, 2, 8, 1], 1], ["SP", 2, 5, 768, [1, 24, 32, 1], 1], ["SP", 2, 10, 3072, [1, 1], 1], ["RE", 2, [0, 5, 1, 6, 2, 7, 10, 11, 3, 8, 12, 4, 9]], ["FSP", 3, 0, 1, 3], ["FSP", 3, 4, 2, 3], ["RE", 3, [0, 4, 1, 5, 2, 6, 3, 7]], ["CA", 2, 3, 5], ["CHR", 1, "shared", [2]], ["CA", 2, 3, 6], ["CHR", 0, "shared", [3]], ["CA", 1, 4, 6], ["FU", 5, [0, 1]], ["AN", 5, 0, 5], ["FU", 5, [1, 2]], ["AN", 5, 1, 4], ["FU", 5, [2, 3]], ["AN", 5, 2, 6], ["FU", 3, [0, 1]], ["SP", 3, 0, 32, [2], 1], ["AN", 3, 1, 2], ["FFSP", 3, 0, [2, 1], 1, 1], ["AN", 3, 1, 6], ["FU", 1, [0, 1]], ["SP", 1, 0, 8, [2], 1], ["AN", 1, 1, 2], ["FFSP", 1, 0, [2, 1], 1, 1], ["AN", 1, 1, 6], ["PR", 4, 0, "auto_unroll_max_step$1024"]]]], "r": [[0.00436553], 0, 0.827518, 1708765277], "mark": 2, "ag": 2, "v": "v0.6"}
{"i": [["[\"_matmul\", 512, 3072, 768, \"float32\"]", "cuda -keys=cuda,gpu -arch=sm_86 -max_num_threads=1024 -model=unknown -thread_warp_size=32", [82, 999, 999, 49152, 2147483647, 1024, 255, 32], "", 0, []], [[], [["CHW", 2, "local"], ["SP", 2, 0, 512, [1, 2, 8, 1], 1], ["SP", 2, 5, 768, [1, 24, 32, 1], 1], ["SP", 2, 10, 3072, [3, 1], 1], ["RE", 2, [0, 5, 1, 6, 2, 7, 10, 11, 3, 8, 12, 4, 9]], ["FSP", 3, 0, 1, 3], ["FSP", 3, 4, 2, 3], ["RE", 3, [0, 4, 1, 5, 2, 6, 3, 7]], ["CA", 2, 3, 5], ["CHR", 1, "shared", [2]], ["CA", 2, 3, 6], ["CHR", 0, "shared", [3]], ["CA", 1, 4, 6], ["FU", 5, [0, 1]], ["AN", 5, 0, 5], ["FU", 5, [1, 2]], ["AN", 5, 1, 4], ["FU", 5, [2, 3]], ["AN", 5, 2, 6], ["FU", 3, [0, 1]], ["SP", 3, 0, 96, [2], 1], ["AN", 3, 1, 2], ["FFSP", 3, 0, [2, 1], 1, 1], ["AN", 3, 1, 6], ["FU", 1, [0, 1]], ["SP", 1, 0, 24, [2], 1], ["AN", 1, 1, 2], ["FFSP", 1, 0, [2, 1], 1, 1], ["AN", 1, 1, 6], ["PR", 4, 0, "auto_unroll_max_step$1024"]]]], "r": [[0.00411798], 0, 0.837182, 1708765277], "mark": 2, "ag": 2, "v": "v0.6"}
{"i": [["[\"_matmul\", 512, 3072, 768, \"float32\"]", "cuda -keys=cuda,gpu -arch=sm_86 -max_num_threads=1024 -model=unknown -thread_warp_size=32", [82, 999, 999, 49152, 2147483647, 1024, 255, 32], "", 0, []], [[], [["CHW", 2, "local"], ["SP", 2, 0, 512, [1, 4, 8, 1], 1], ["SP", 2, 5, 768, [1, 24, 32, 1], 1], ["SP", 2, 10, 3072, [2, 1], 1], ["RE", 2, [0, 5, 1, 6, 2, 7, 10, 11, 3, 8, 12, 4, 9]], ["FSP", 3, 0, 1, 3], ["FSP", 3, 4, 2, 3], ["RE", 3, [0, 4, 1, 5, 2, 6, 3, 7]], ["CA", 2, 3, 5], ["CHR", 1, "shared", [2]], ["CA", 2, 3, 6], ["CHR", 0, "shared", [3]], ["CA", 1, 4, 6], ["FU", 5, [0, 1]], ["AN", 5, 0, 5], ["FU", 5, [1, 2]], ["AN", 5, 1, 4], ["FU", 5, [2, 3]], ["AN", 5, 2, 6], ["FU", 3, [0, 1]], ["SP", 3, 0, 64, [2], 1], ["AN", 3, 1, 2], ["FFSP", 3, 0, [2, 1], 1, 1], ["AN", 3, 1, 6], ["FU", 1, [0, 1]], ["SP", 1, 0, 16, [2], 1], ["AN", 1, 1, 2], ["FFSP", 1, 0, [2, 1], 1, 1], ["AN", 1, 1, 6], ["PR", 4, 0, "auto_unroll_max_step$1024"]]]], "r": [[0.00294112], 0, 0.793009, 1708765277], "mark": 2, "ag": 2, "v": "v0.6"}
{"i": [["[\"_matmul\", 512, 3072, 768, \"float32\"]", "cuda -keys=cuda,gpu -arch=sm_86 -max_num_threads=1024 -model=unknown -thread_warp_size=32", [82, 999, 999, 49152, 2147483647, 1024, 255, 32], "", 0, []], [[], [["CHW", 2, "local"], ["SP", 2, 0, 512, [1, 2, 4, 1], 1], ["SP", 2, 5, 768, [1, 24, 32, 1], 1], ["SP", 2, 10, 3072, [2, 1], 1], ["RE", 2, [0, 5, 1, 6, 2, 7, 10, 11, 3, 8, 12, 4, 9]], ["FSP", 3, 0, 1, 3], ["FSP", 3, 4, 2, 3], ["RE", 3, [0, 4, 1, 5, 2, 6, 3, 7]], ["CA", 2, 3, 5], ["CHR", 1, "shared", [2]], ["CA", 2, 3, 6], ["CHR", 0, "shared", [3]], ["CA", 1, 4, 6], ["FU", 5, [0, 1]], ["AN", 5, 0, 5], ["FU", 5, [1, 2]], ["AN", 5, 1, 4], ["FU", 5, [2, 3]], ["AN", 5, 2, 6], ["FU", 3, [0, 1]], ["SP", 3, 0, 64, [2], 1], ["AN", 3, 1, 2], ["FFSP", 3, 0, [2, 1], 1, 1], ["AN", 3, 1, 6], ["FU", 1, [0, 1]], ["SP", 1, 0, 8, [2], 1], ["AN", 1, 1, 2], ["FFSP", 1, 0, [2, 1], 1, 1], ["AN", 1, 1, 6], ["PR", 4, 0, "auto_unroll_max_step$1024"]]]], "r": [[0.00205301], 0, 0.459805, 1708765278], "mark": 2, "ag": 2, "v": "v0.6"}
{"i": [["[\"_matmul\", 512, 3072, 768, \"float32\"]", "cuda -keys=cuda,gpu -arch=sm_86 -max_num_threads=1024 -model=unknown -thread_warp_size=32", [82, 999, 999, 49152, 2147483647, 1024, 255, 32], "", 0, []], [[], [["CHW", 2, "local"], ["SP", 2, 0, 512, [1, 2, 16, 1], 1], ["SP", 2, 5, 768, [1, 24, 32, 1], 1], ["SP", 2, 10, 3072, [2, 1], 1], ["RE", 2, [0, 5, 1, 6, 2, 7, 10, 11, 3, 8, 12, 4, 9]], ["FSP", 3, 0, 1, 3], ["FSP", 3, 4, 2, 3], ["RE", 3, [0, 4, 1, 5, 2, 6, 3, 7]], ["CA", 2, 3, 5], ["CHR", 1, "shared", [2]], ["CA", 2, 3, 6], ["CHR", 0, "shared", [3]], ["CA", 1, 4, 6], ["FU", 5, [0, 1]], ["AN", 5, 0, 5], ["FU", 5, [1, 2]], ["AN", 5, 1, 4], ["FU", 5, [2, 3]], ["AN", 5, 2, 6], ["FU", 3, [0, 1]], ["SP", 3, 0, 64, [2], 1], ["AN", 3, 1, 2], ["FFSP", 3, 0, [2, 1], 1, 1], ["AN", 3, 1, 6], ["FU", 1, [0, 1]], ["SP", 1, 0, 32, [2], 1], ["AN", 1, 1, 2], ["FFSP", 1, 0, [2, 1], 1, 1], ["AN", 1, 1, 6], ["PR", 4, 0, "auto_unroll_max_step$1024"]]]], "r": [[0.0232021], 0, 1.37543, 1708765278], "mark": 2, "ag": 2, "v": "v0.6"}
{"i": [["[\"_matmul\", 512, 3072, 768, \"float32\"]", "cuda -keys=cuda,gpu -arch=sm_86 -max_num_threads=1024 -model=unknown -thread_warp_size=32", [82, 999, 999, 49152, 2147483647, 1024, 255, 32], "", 0, []], [[], [["CHW", 2, "local"], ["SP", 2, 0, 512, [1, 4, 8, 1], 1], ["SP", 2, 5, 768, [1, 24, 32, 1], 1], ["SP", 2, 10, 3072, [1, 1], 1], ["RE", 2, [0, 5, 1, 6, 2, 7, 10, 11, 3, 8, 12, 4, 9]], ["FSP", 3, 0, 1, 3], ["FSP", 3, 4, 2, 3], ["RE", 3, [0, 4, 1, 5, 2, 6, 3, 7]], ["CA", 2, 3, 5], ["CHR", 1, "shared", [2]], ["CA", 2, 3, 6], ["CHR", 0, "shared", [3]], ["CA", 1, 4, 6], ["FU", 5, [0, 1]], ["AN", 5, 0, 5], ["FU", 5, [1, 2]], ["AN", 5, 1, 4], ["FU", 5, [2, 3]], ["AN", 5, 2, 6], ["FU", 3, [0, 1]], ["SP", 3, 0, 32, [2], 1], ["AN", 3, 1, 2], ["FFSP", 3, 0, [2, 1], 1, 1], ["AN", 3, 1, 6], ["FU", 1, [0, 1]], ["SP", 1, 0, 8, [2], 1], ["AN", 1, 1, 2], ["FFSP", 1, 0, [2, 1], 1, 1], ["AN", 1, 1, 6], ["PR", 4, 0, "auto_unroll_max_step$1024"]]]], "r": [[0.00373945], 0, 0.509348, 1708765278], "mark": 2, "ag": 2, "v": "v0.6"}
{"i": [["[\"_matmul\", 512, 3072, 768, \"float32\"]", "cuda -keys=cuda,gpu -arch=sm_86 -max_num_threads=1024 -model=unknown -thread_warp_size=32", [82, 999, 999, 49152, 2147483647, 1024, 255, 32], "", 0, []], [[], [["CHW", 2, "local"], ["SP", 2, 0, 512, [1, 4, 8, 1], 1], ["SP", 2, 5, 768, [1, 24, 32, 1], 1], ["SP", 2, 10, 3072, [3, 1], 1], ["RE", 2, [0, 5, 1, 6, 2, 7, 10, 11, 3, 8, 12, 4, 9]], ["FSP", 3, 0, 1, 3], ["FSP", 3, 4, 2, 3], ["RE", 3, [0, 4, 1, 5, 2, 6, 3, 7]], ["CA", 2, 3, 5], ["CHR", 1, "shared", [2]], ["CA", 2, 3, 6], ["CHR", 0, "shared", [3]], ["CA", 1, 4, 6], ["FU", 5, [0, 1]], ["AN", 5, 0, 5], ["FU", 5, [1, 2]], ["AN", 5, 1, 4], ["FU", 5, [2, 3]], ["AN", 5, 2, 6], ["FU", 3, [0, 1]], ["SP", 3, 0, 96, [2], 1], ["AN", 3, 1, 2], ["FFSP", 3, 0, [2, 1], 1, 1], ["AN", 3, 1, 6], ["FU", 1, [0, 1]], ["SP", 1, 0, 24, [2], 1], ["AN", 1, 1, 2], ["FFSP", 1, 0, [2, 1], 1, 1], ["AN", 1, 1, 6], ["PR", 4, 0, "auto_unroll_max_step$1024"]]]], "r": [[0.00417836], 0, 0.796127, 1708765278], "mark": 2, "ag": 2, "v": "v0.6"}
{"i": [["[\"_matmul\", 512, 3072, 768, \"float32\"]", "cuda -keys=cuda,gpu -arch=sm_86 -max_num_threads=1024 -model=unknown -thread_warp_size=32", [82, 999, 999, 49152, 2147483647, 1024, 255, 32], "", 0, []], [[], [["CHW", 2, "local"], ["SP", 2, 0, 512, [1, 4, 8, 1], 1], ["SP", 2, 5, 768, [1, 12, 32, 1], 1], ["SP", 2, 10, 3072, [2, 1], 1], ["RE", 2, [0, 5, 1, 6, 2, 7, 10, 11, 3, 8, 12, 4, 9]], ["FSP", 3, 0, 1, 3], ["FSP", 3, 4, 2, 3], ["RE", 3, [0, 4, 1, 5, 2, 6, 3, 7]], ["CA", 2, 3, 5], ["CHR", 1, "shared", [2]], ["CA", 2, 3, 6], ["CHR", 0, "shared", [3]], ["CA", 1, 4, 6], ["FU", 5, [0, 1]], ["AN", 5, 0, 5], ["FU", 5, [1, 2]], ["AN", 5, 1, 4], ["FU", 5, [2, 3]], ["AN", 5, 2, 6], ["FU", 3, [0, 1]], ["SP", 3, 0, 64, [2], 1], ["AN", 3, 1, 2], ["FFSP", 3, 0, [2, 1], 1, 1], ["AN", 3, 1, 6], ["FU", 1, [0, 1]], ["SP", 1, 0, 16, [2], 1], ["AN", 1, 1, 2], ["FFSP", 1, 0, [2, 1], 1, 1], ["AN", 1, 1, 6], ["PR", 4, 0, "auto_unroll_max_step$1024"]]]], "r": [[0.00273096], 0, 0.829557, 1708765278], "mark": 2, "ag": 2, "v": "v0.6"}
{"i": [["[\"_matmul\", 512, 3072, 768, \"float32\"]", "cuda -keys=cuda,gpu -arch=sm_86 -max_num_threads=1024 -model=unknown -thread_warp_size=32", [82, 999, 999, 49152, 2147483647, 1024, 255, 32], "", 0, []], [[], [["CHW", 2, "local"], ["SP", 2, 0, 512, [1, 2, 4, 1], 1], ["SP", 2, 5, 768, [1, 24, 32, 1], 1], ["SP", 2, 10, 3072, [1, 1], 1], ["RE", 2, [0, 5, 1, 6, 2, 7, 10, 11, 3, 8, 12, 4, 9]], ["FSP", 3, 0, 1, 3], ["FSP", 3, 4, 2, 3], ["RE", 3, [0, 4, 1, 5, 2, 6, 3, 7]], ["CA", 2, 3, 5], ["CHR", 1, "shared", [2]], ["CA", 2, 3, 6], ["CHR", 0, "shared", [3]], ["CA", 1, 4, 6], ["FU", 5, [0, 1]], ["AN", 5, 0, 5], ["FU", 5, [1, 2]], ["AN", 5, 1, 4], ["FU", 5, [2, 3]], ["AN", 5, 2, 6], ["FU", 3, [0, 1]], ["SP", 3, 0, 32, [2], 1], ["AN", 3, 1, 2], ["FFSP", 3, 0, [2, 1], 1, 1], ["AN", 3, 1, 6], ["FU", 1, [0, 1]], ["SP", 1, 0, 4, [2], 1], ["AN", 1, 1, 2], ["FFSP", 1, 0, [2, 1], 1, 1], ["AN", 1, 1, 6], ["PR", 4, 0, "auto_unroll_max_step$1024"]]]], "r": [[0.00208119], 0, 0.586496, 1708765278], "mark": 2, "ag": 2, "v": "v0.6"}
{"i": [["[\"_matmul\", 512, 3072, 768, \"float32\"]", "cuda -keys=cuda,gpu -arch=sm_86 -max_num_threads=1024 -model=unknown -thread_warp_size=32", [82, 999, 999, 49152, 2147483647, 1024, 255, 32], "", 0, []], [[], [["CHW", 2, "local"], ["SP", 2, 0, 512, [1, 2, 4, 1], 1], ["SP", 2, 5, 768, [1, 24, 32, 1], 1], ["SP", 2, 10, 3072, [3, 1], 1], ["RE", 2, [0, 5, 1, 6, 2, 7, 10, 11, 3, 8, 12, 4, 9]], ["FSP", 3, 0, 1, 3], ["FSP", 3, 4, 2, 3], ["RE", 3, [0, 4, 1, 5, 2, 6, 3, 7]], ["CA", 2, 3, 5], ["CHR", 1, "shared", [2]], ["CA", 2, 3, 6], ["CHR", 0, "shared", [3]], ["CA", 1, 4, 6], ["FU", 5, [0, 1]], ["AN", 5, 0, 5], ["FU", 5, [1, 2]], ["AN", 5, 1, 4], ["FU", 5, [2, 3]], ["AN", 5, 2, 6], ["FU", 3, [0, 1]], ["SP", 3, 0, 96, [2], 1], ["AN", 3, 1, 2], ["FFSP", 3, 0, [2, 1], 1, 1], ["AN", 3, 1, 6], ["FU", 1, [0, 1]], ["SP", 1, 0, 12, [2], 1], ["AN", 1, 1, 2], ["FFSP", 1, 0, [2, 1], 1, 1], ["AN", 1, 1, 6], ["PR", 4, 0, "auto_unroll_max_step$1024"]]]], "r": [[0.00197538], 0, 0.527227, 1708765279], "mark": 2, "ag": 2, "v": "v0.6"}
{"i": [["[\"_matmul\", 512, 3072, 768, \"float32\"]", "cuda -keys=cuda,gpu -arch=sm_86 -max_num_threads=1024 -model=unknown -thread_warp_size=32", [82, 999, 999, 49152, 2147483647, 1024, 255, 32], "", 0, []], [[], [["CHW", 2, "local"], ["SP", 2, 0, 512, [1, 2, 16, 1], 1], ["SP", 2, 5, 768, [1, 24, 32, 1], 1], ["SP", 2, 10, 3072, [3, 1], 1], ["RE", 2, [0, 5, 1, 6, 2, 7, 10, 11, 3, 8, 12, 4, 9]], ["FSP", 3, 0, 1, 3], ["FSP", 3, 4, 2, 3], ["RE", 3, [0, 4, 1, 5, 2, 6, 3, 7]], ["CA", 2, 3, 5], ["CHR", 1, "shared", [2]], ["CA", 2, 3, 6], ["CHR", 0, "shared", [3]], ["CA", 1, 4, 6], ["FU", 5, [0, 1]], ["AN", 5, 0, 5], ["FU", 5, [1, 2]], ["AN", 5, 1, 4], ["FU", 5, [2, 3]], ["AN", 5, 2, 6], ["FU", 3, [0, 1]], ["SP", 3, 0, 96, [2], 1], ["AN", 3, 1, 2], ["FFSP", 3, 0, [2, 1], 1, 1], ["AN", 3, 1, 6], ["FU", 1, [0, 1]], ["SP", 1, 0, 48, [2], 1], ["AN", 1, 1, 2], ["FFSP", 1, 0, [2, 1], 1, 1], ["AN", 1, 1, 6], ["PR", 4, 0, "auto_unroll_max_step$1024"]]]], "r": [[0.015686], 0, 1.18209, 1708765279], "mark": 2, "ag": 2, "v": "v0.6"}
{"i": [["[\"_matmul\", 512, 3072, 768, \"float32\"]", "cuda -keys=cuda,gpu -arch=sm_86 -max_num_threads=1024 -model=unknown -thread_warp_size=32", [82, 999, 999, 49152, 2147483647, 1024, 255, 32], "", 0, []], [[], [["CHW", 2, "local"], ["SP", 2, 0, 512, [1, 4, 4, 1], 1], ["SP", 2, 5, 768, [1, 24, 32, 1], 1], ["SP", 2, 10, 3072, [2, 1], 1], ["RE", 2, [0, 5, 1, 6, 2, 7, 10, 11, 3, 8, 12, 4, 9]], ["FSP", 3, 0, 1, 3], ["FSP", 3, 4, 2, 3], ["RE", 3, [0, 4, 1, 5, 2, 6, 3, 7]], ["CA", 2, 3, 5], ["CHR", 1, "shared", [2]], ["CA", 2, 3, 6], ["CHR", 0, "shared", [3]], ["CA", 1, 4, 6], ["FU", 5, [0, 1]], ["AN", 5, 0, 5], ["FU", 5, [1, 2]], ["AN", 5, 1, 4], ["FU", 5, [2, 3]], ["AN", 5, 2, 6], ["FU", 3, [0, 1]], ["SP", 3, 0, 64, [2], 1], ["AN", 3, 1, 2], ["FFSP", 3, 0, [2, 1], 1, 1], ["AN", 3, 1, 6], ["FU", 1, [0, 1]], ["SP", 1, 0, 8, [2], 1], ["AN", 1, 1, 2], ["FFSP", 1, 0, [2, 1], 1, 1], ["AN", 1, 1, 6], ["PR", 4, 0, "auto_unroll_max_step$1024"]]]], "r": [[0.00199119], 0, 0.592475, 1708765279], "mark": 2, "ag": 2, "v": "v0.6"}
{"i": [["[\"_matmul\", 512, 3072, 768, \"float32\"]", "cuda -keys=cuda,gpu -arch=sm_86 -max_num_threads=1024 -model=unknown -thread_warp_size=32", [82, 999, 999, 49152, 2147483647, 1024, 255, 32], "", 0, []], [[], [["CHW", 2, "local"], ["SP", 2, 0, 512, [1, 4, 16, 1], 1], ["SP", 2, 5, 768, [1, 24, 32, 1], 1], ["SP", 2, 10, 3072, [2, 1], 1], ["RE", 2, [0, 5, 1, 6, 2, 7, 10, 11, 3, 8, 12, 4, 9]], ["FSP", 3, 0, 1, 3], ["FSP", 3, 4, 2, 3], ["RE", 3, [0, 4, 1, 5, 2, 6, 3, 7]], ["CA", 2, 3, 5], ["CHR", 1, "shared", [2]], ["CA", 2, 3, 6], ["CHR", 0, "shared", [3]], ["CA", 1, 4, 6], ["FU", 5, [0, 1]], ["AN", 5, 0, 5], ["FU", 5, [1, 2]], ["AN", 5, 1, 4], ["FU", 5, [2, 3]], ["AN", 5, 2, 6], ["FU", 3, [0, 1]], ["SP", 3, 0, 64, [2], 1], ["AN", 3, 1, 2], ["FFSP", 3, 0, [2, 1], 1, 1], ["AN", 3, 1, 6], ["FU", 1, [0, 1]], ["SP", 1, 0, 32, [2], 1], ["AN", 1, 1, 2], ["FFSP", 1, 0, [2, 1], 1, 1], ["AN", 1, 1, 6], ["PR", 4, 0, "auto_unroll_max_step$1024"]]]], "r": [[0.0318086], 0, 1.49674, 1708765279], "mark": 2, "ag": 2, "v": "v0.6"}
{"i": [["[\"_matmul\", 512, 3072, 768, \"float32\"]", "cuda -keys=cuda,gpu -arch=sm_86 -max_num_threads=1024 -model=unknown -thread_warp_size=32", [82, 999, 999, 49152, 2147483647, 1024, 255, 32], "", 0, []], [[], [["CHW", 2, "local"], ["SP", 2, 0, 512, [1, 2, 4, 1], 1], ["SP", 2, 5, 768, [1, 24, 32, 1], 1], ["SP", 2, 10, 3072, [3, 1], 1], ["RE", 2, [0, 5, 1, 6, 2, 7, 10, 11, 3, 8, 12, 4, 9]], ["FSP", 3, 0, 1, 3], ["FSP", 3, 4, 2, 3], ["RE", 3, [0, 4, 1, 5, 2, 6, 3, 7]], ["CA", 2, 3, 5], ["CHR", 1, "shared", [2]], ["CA", 2, 3, 6], ["CHR", 0, "shared", [3]], ["CA", 1, 4, 6], ["FU", 5, [0, 1]], ["AN", 5, 0, 5], ["FU", 5, [1, 2]], ["AN", 5, 1, 4], ["FU", 5, [2, 3]], ["AN", 5, 2, 6], ["FU", 3, [0, 1]], ["SP", 3, 0, 96, [2], 1], ["AN", 3, 1, 2], ["FFSP", 3, 0, [2, 1], 1, 1], ["AN", 3, 1, 6], ["FU", 1, [0, 1]], ["SP", 1, 0, 12, [2], 1], ["AN", 1, 1, 2], ["FFSP", 1, 0, [2, 1], 1, 1], ["AN", 1, 1, 6], ["PR", 4, 0, "auto_unroll_max_step$1024"]]]], "r": [[0.00197538], 0, 0.527227, 1708765279], "mark": 2, "ag": 3, "v": "v0.6"}
{"i": [["[\"_matmul\", 512, 3072, 768, \"float32\"]", "cuda -keys=cuda,gpu -arch=sm_86 -max_num_threads=1024 -model=unknown -thread_warp_size=32", [82, 999, 999, 49152, 2147483647, 1024, 255, 32], "", 0, []], [[], [["CHW", 2, "local"], ["SP", 2, 0, 512, [1, 2, 4, 1], 1], ["SP", 2, 5, 768, [1, 24, 32, 1], 1], ["SP", 2, 10, 3072, [2, 1], 1], ["RE", 2, [0, 5, 1, 6, 2, 7, 10, 11, 3, 8, 12, 4, 9]], ["FSP", 3, 0, 1, 3], ["FSP", 3, 4, 2, 3], ["RE", 3, [0, 4, 1, 5, 2, 6, 3, 7]], ["CA", 2, 3, 5], ["CHR", 1, "shared", [2]], ["CA", 2, 3, 6], ["CHR", 0, "shared", [3]], ["CA", 1, 4, 6], ["FU", 5, [0, 1]], ["AN", 5, 0, 5], ["FU", 5, [1, 2]], ["AN", 5, 1, 4], ["FU", 5, [2, 3]], ["AN", 5, 2, 6], ["FU", 3, [0, 1]], ["SP", 3, 0, 64, [2], 1], ["AN", 3, 1, 2], ["FFSP", 3, 0, [2, 1], 1, 1], ["AN", 3, 1, 6], ["FU", 1, [0, 1]], ["SP", 1, 0, 8, [2], 1], ["AN", 1, 1, 2], ["FFSP", 1, 0, [2, 1], 1, 1], ["AN", 1, 1, 6], ["PR", 4, 0, "auto_unroll_max_step$1024"]]]], "r": [[0.00205562], 0, 0.46324, 1708765282], "mark": 2, "ag": 3, "v": "v0.6"}
{"i": [["[\"_matmul\", 512, 3072, 768, \"float32\"]", "cuda -keys=cuda,gpu -arch=sm_86 -max_num_threads=1024 -model=unknown -thread_warp_size=32", [82, 999, 999, 49152, 2147483647, 1024, 255, 32], "", 0, []], [[], [["CHW", 2, "local"], ["SP", 2, 0, 512, [1, 2, 4, 1], 1], ["SP", 2, 5, 768, [1, 24, 32, 1], 1], ["SP", 2, 10, 3072, [4, 1], 1], ["RE", 2, [0, 5, 1, 6, 2, 7, 10, 11, 3, 8, 12, 4, 9]], ["FSP", 3, 0, 1, 3], ["FSP", 3, 4, 2, 3], ["RE", 3, [0, 4, 1, 5, 2, 6, 3, 7]], ["CA", 2, 3, 5], ["CHR", 1, "shared", [2]], ["CA", 2, 3, 6], ["CHR", 0, "shared", [3]], ["CA", 1, 4, 6], ["FU", 5, [0, 1]], ["AN", 5, 0, 5], ["FU", 5, [1, 2]], ["AN", 5, 1, 4], ["FU", 5, [2, 3]], ["AN", 5, 2, 6], ["FU", 3, [0, 1]], ["SP", 3, 0, 128, [2], 1], ["AN", 3, 1, 2], ["FFSP", 3, 0, [2, 1], 1, 1], ["AN", 3, 1, 6], ["FU", 1, [0, 1]], ["SP", 1, 0, 16, [2], 1], ["AN", 1, 1, 2], ["FFSP", 1, 0, [2, 1], 1, 1], ["AN", 1, 1, 6], ["PR", 4, 0, "auto_unroll_max_step$1024"]]]], "r": [[0.0018303], 0, 0.748347, 1708765282], "mark": 2, "ag": 3, "v": "v0.6"}
{"i": [["[\"_matmul\", 512, 3072, 768, \"float32\"]", "cuda -keys=cuda,gpu -arch=sm_86 -max_num_threads=1024 -model=unknown -thread_warp_size=32", [82, 999, 999, 49152, 2147483647, 1024, 255, 32], "", 0, []], [[], [["CHW", 2, "local"], ["SP", 2, 0, 512, [1, 4, 4, 1], 1], ["SP", 2, 5, 768, [1, 24, 32, 1], 1], ["SP", 2, 10, 3072, [3, 1], 1], ["RE", 2, [0, 5, 1, 6, 2, 7, 10, 11, 3, 8, 12, 4, 9]], ["FSP", 3, 0, 1, 3], ["FSP", 3, 4, 2, 3], ["RE", 3, [0, 4, 1, 5, 2, 6, 3, 7]], ["CA", 2, 3, 5], ["CHR", 1, "shared", [2]], ["CA", 2, 3, 6], ["CHR", 0, "shared", [3]], ["CA", 1, 4, 6], ["FU", 5, [0, 1]], ["AN", 5, 0, 5], ["FU", 5, [1, 2]], ["AN", 5, 1, 4], ["FU", 5, [2, 3]], ["AN", 5, 2, 6], ["FU", 3, [0, 1]], ["SP", 3, 0, 96, [2], 1], ["AN", 3, 1, 2], ["FFSP", 3, 0, [2, 1], 1, 1], ["AN", 3, 1, 6], ["FU", 1, [0, 1]], ["SP", 1, 0, 12, [2], 1], ["AN", 1, 1, 2], ["FFSP", 1, 0, [2, 1], 1, 1], ["AN", 1, 1, 6], ["PR", 4, 0, "auto_unroll_max_step$1024"]]]], "r": [[0.00174503], 0, 0.64442, 1708765282], "mark": 2, "ag": 3, "v": "v0.6"}
{"i": [["[\"_matmul\", 512, 3072, 768, \"float32\"]", "cuda -keys=cuda,gpu -arch=sm_86 -max_num_threads=1024 -model=unknown -thread_warp_size=32", [82, 999, 999, 49152, 2147483647, 1024, 255, 32], "", 0, []], [[], [["CHW", 2, "local"], ["SP", 2, 0, 512, [1, 2, 2, 1], 1], ["SP", 2, 5, 768, [1, 24, 32, 1], 1], ["SP", 2, 10, 3072, [3, 1], 1], ["RE", 2, [0, 5, 1, 6, 2, 7, 10, 11, 3, 8, 12, 4, 9]], ["FSP", 3, 0, 1, 3], ["FSP", 3, 4, 2, 3], ["RE", 3, [0, 4, 1, 5, 2, 6, 3, 7]], ["CA", 2, 3, 5], ["CHR", 1, "shared", [2]], ["CA", 2, 3, 6], ["CHR", 0, "shared", [3]], ["CA", 1, 4, 6], ["FU", 5, [0, 1]], ["AN", 5, 0, 5], ["FU", 5, [1, 2]], ["AN", 5, 1, 4], ["FU", 5, [2, 3]], ["AN", 5, 2, 6], ["FU", 3, [0, 1]], ["SP", 3, 0, 96, [2], 1], ["AN", 3, 1, 2], ["FFSP", 3, 0, [2, 1], 1, 1], ["AN", 3, 1, 6], ["FU", 1, [0, 1]], ["SP", 1, 0, 6, [2], 1], ["AN", 1, 1, 2], ["FFSP", 1, 0, [2, 1], 1, 1], ["AN", 1, 1, 6], ["PR", 4, 0, "auto_unroll_max_step$1024"]]]], "r": [[0.00193345], 0, 0.558357, 1708765282], "mark": 2, "ag": 3, "v": "v0.6"}
{"i": [["[\"_matmul\", 512, 3072, 768, \"float32\"]", "cuda -keys=cuda,gpu -arch=sm_86 -max_num_threads=1024 -model=unknown -thread_warp_size=32", [82, 999, 999, 49152, 2147483647, 1024, 255, 32], "", 0, []], [[], [["CHW", 2, "local"], ["SP", 2, 0, 512, [1, 2, 8, 1], 1], ["SP", 2, 5, 768, [1, 24, 32, 1], 1], ["SP", 2, 10, 3072, [3, 1], 1], ["RE", 2, [0, 5, 1, 6, 2, 7, 10, 11, 3, 8, 12, 4, 9]], ["FSP", 3, 0, 1, 3], ["FSP", 3, 4, 2, 3], ["RE", 3, [0, 4, 1, 5, 2, 6, 3, 7]], ["CA", 2, 3, 5], ["CHR", 1, "shared", [2]], ["CA", 2, 3, 6], ["CHR", 0, "shared", [3]], ["CA", 1, 4, 6], ["FU", 5, [0, 1]], ["AN", 5, 0, 5], ["FU", 5, [1, 2]], ["AN", 5, 1, 4], ["FU", 5, [2, 3]], ["AN", 5, 2, 6], ["FU", 3, [0, 1]], ["SP", 3, 0, 96, [2], 1], ["AN", 3, 1, 2], ["FFSP", 3, 0, [2, 1], 1, 1], ["AN", 3, 1, 6], ["FU", 1, [0, 1]], ["SP", 1, 0, 24, [2], 1], ["AN", 1, 1, 2], ["FFSP", 1, 0, [2, 1], 1, 1], ["AN", 1, 1, 6], ["PR", 4, 0, "auto_unroll_max_step$1024"]]]], "r": [[0.00411957], 0, 0.805032, 1708765282], "mark": 2, "ag": 3, "v": "v0.6"}
{"i": [["[\"_matmul\", 512, 3072, 768, \"float32\"]", "cuda -keys=cuda,gpu -arch=sm_86 -max_num_threads=1024 -model=unknown -thread_warp_size=32", [82, 999, 999, 49152, 2147483647, 1024, 255, 32], "", 0, []], [[], [["CHW", 2, "local"], ["SP", 2, 0, 512, [1, 4, 4, 1], 1], ["SP", 2, 5, 768, [1, 24, 32, 1], 1], ["SP", 2, 10, 3072, [2, 1], 1], ["RE", 2, [0, 5, 1, 6, 2, 7, 10, 11, 3, 8, 12, 4, 9]], ["FSP", 3, 0, 1, 3], ["FSP", 3, 4, 2, 3], ["RE", 3, [0, 4, 1, 5, 2, 6, 3, 7]], ["CA", 2, 3, 5], ["CHR", 1, "shared", [2]], ["CA", 2, 3, 6], ["CHR", 0, "shared", [3]], ["CA", 1, 4, 6], ["FU", 5, [0, 1]], ["AN", 5, 0, 5], ["FU", 5, [1, 2]], ["AN", 5, 1, 4], ["FU", 5, [2, 3]], ["AN", 5, 2, 6], ["FU", 3, [0, 1]], ["SP", 3, 0, 64, [2], 1], ["AN", 3, 1, 2], ["FFSP", 3, 0, [2, 1], 1, 1], ["AN", 3, 1, 6], ["FU", 1, [0, 1]], ["SP", 1, 0, 8, [2], 1], ["AN", 1, 1, 2], ["FFSP", 1, 0, [2, 1], 1, 1], ["AN", 1, 1, 6], ["PR", 4, 0, "auto_unroll_max_step$1024"]]]], "r": [[0.00199018], 0, 0.573694, 1708765282], "mark": 2, "ag": 3, "v": "v0.6"}
{"i": [["[\"_matmul\", 512, 3072, 768, \"float32\"]", "cuda -keys=cuda,gpu -arch=sm_86 -max_num_threads=1024 -model=unknown -thread_warp_size=32", [82, 999, 999, 49152, 2147483647, 1024, 255, 32], "", 0, []], [[], [["CHW", 2, "local"], ["SP", 2, 0, 512, [1, 4, 4, 1], 1], ["SP", 2, 5, 768, [1, 24, 32, 1], 1], ["SP", 2, 10, 3072, [4, 1], 1], ["RE", 2, [0, 5, 1, 6, 2, 7, 10, 11, 3, 8, 12, 4, 9]], ["FSP", 3, 0, 1, 3], ["FSP", 3, 4, 2, 3], ["RE", 3, [0, 4, 1, 5, 2, 6, 3, 7]], ["CA", 2, 3, 5], ["CHR", 1, "shared", [2]], ["CA", 2, 3, 6], ["CHR", 0, "shared", [3]], ["CA", 1, 4, 6], ["FU", 5, [0, 1]], ["AN", 5, 0, 5], ["FU", 5, [1, 2]], ["AN", 5, 1, 4], ["FU", 5, [2, 3]], ["AN", 5, 2, 6], ["FU", 3, [0, 1]], ["SP", 3, 0, 128, [2], 1], ["AN", 3, 1, 2], ["FFSP", 3, 0, [2, 1], 1, 1], ["AN", 3, 1, 6], ["FU", 1, [0, 1]], ["SP", 1, 0, 16, [2], 1], ["AN", 1, 1, 2], ["FFSP", 1, 0, [2, 1], 1, 1], ["AN", 1, 1, 6], ["PR", 4, 0, "auto_unroll_max_step$1024"]]]], "r": [[0.00175769], 0, 0.744323, 1708765283], "mark": 2, "ag": 3, "v": "v0.6"}
{"i": [["[\"_matmul\", 512, 3072, 768, \"float32\"]", "cuda -keys=cuda,gpu -arch=sm_86 -max_num_threads=1024 -model=unknown -thread_warp_size=32", [82, 999, 999, 49152, 2147483647, 1024, 255, 32], "", 0, []], [[], [["CHW", 2, "local"], ["SP", 2, 0, 512, [1, 4, 4, 1], 1], ["SP", 2, 5, 768, [1, 12, 32, 1], 1], ["SP", 2, 10, 3072, [3, 1], 1], ["RE", 2, [0, 5, 1, 6, 2, 7, 10, 11, 3, 8, 12, 4, 9]], ["FSP", 3, 0, 1, 3], ["FSP", 3, 4, 2, 3], ["RE", 3, [0, 4, 1, 5, 2, 6, 3, 7]], ["CA", 2, 3, 5], ["CHR", 1, "shared", [2]], ["CA", 2, 3, 6], ["CHR", 0, "shared", [3]], ["CA", 1, 4, 6], ["FU", 5, [0, 1]], ["AN", 5, 0, 5], ["FU", 5, [1, 2]], ["AN", 5, 1, 4], ["FU", 5, [2, 3]], ["AN", 5, 2, 6], ["FU", 3, [0, 1]], ["SP", 3, 0, 96, [2], 1], ["AN", 3, 1, 2], ["FFSP", 3, 0, [2, 1], 1, 1], ["AN", 3, 1, 6], ["FU", 1, [0, 1]], ["SP", 1, 0, 12, [2], 1], ["AN", 1, 1, 2], ["FFSP", 1, 0, [2, 1], 1, 1], ["AN", 1, 1, 6], ["PR", 4, 0, "auto_unroll_max_step$1024"]]]], "r": [[0.00127983], 0, 0.545867, 1708765283], "mark": 2, "ag": 3, "v": "v0.6"}
{"i": [["[\"_matmul\", 512, 3072, 768, \"float32\"]", "cuda -keys=cuda,gpu -arch=sm_86 -max_num_threads=1024 -model=unknown -thread_warp_size=32", [82, 999, 999, 49152, 2147483647, 1024, 255, 32], "", 0, []], [[], [["CHW", 2, "local"], ["SP", 2, 0, 512, [1, 2, 2, 1], 1], ["SP", 2, 5, 768, [1, 24, 32, 1], 1], ["SP", 2, 10, 3072, [2, 1], 1], ["RE", 2, [0, 5, 1, 6, 2, 7, 10, 11, 3, 8, 12, 4, 9]], ["FSP", 3, 0, 1, 3], ["FSP", 3, 4, 2, 3], ["RE", 3, [0, 4, 1, 5, 2, 6, 3, 7]], ["CA", 2, 3, 5], ["CHR", 1, "shared", [2]], ["CA", 2, 3, 6], ["CHR", 0, "shared", [3]], ["CA", 1, 4, 6], ["FU", 5, [0, 1]], ["AN", 5, 0, 5], ["FU", 5, [1, 2]], ["AN", 5, 1, 4], ["FU", 5, [2, 3]], ["AN", 5, 2, 6], ["FU", 3, [0, 1]], ["SP", 3, 0, 64, [2], 1], ["AN", 3, 1, 2], ["FFSP", 3, 0, [2, 1], 1, 1], ["AN", 3, 1, 6], ["FU", 1, [0, 1]], ["SP", 1, 0, 4, [2], 1], ["AN", 1, 1, 2], ["FFSP", 1, 0, [2, 1], 1, 1], ["AN", 1, 1, 6], ["PR", 4, 0, "auto_unroll_max_step$1024"]]]], "r": [[0.00173211], 0, 0.39188, 1708765283], "mark": 2, "ag": 3, "v": "v0.6"}
{"i": [["[\"_matmul\", 512, 3072, 768, \"float32\"]", "cuda -keys=cuda,gpu -arch=sm_86 -max_num_threads=1024 -model=unknown -thread_warp_size=32", [82, 999, 999, 49152, 2147483647, 1024, 255, 32], "", 0, []], [[], [["CHW", 2, "local"], ["SP", 2, 0, 512, [1, 2, 2, 1], 1], ["SP", 2, 5, 768, [1, 24, 32, 1], 1], ["SP", 2, 10, 3072, [4, 1], 1], ["RE", 2, [0, 5, 1, 6, 2, 7, 10, 11, 3, 8, 12, 4, 9]], ["FSP", 3, 0, 1, 3], ["FSP", 3, 4, 2, 3], ["RE", 3, [0, 4, 1, 5, 2, 6, 3, 7]], ["CA", 2, 3, 5], ["CHR", 1, "shared", [2]], ["CA", 2, 3, 6], ["CHR", 0, "shared", [3]], ["CA", 1, 4, 6], ["FU", 5, [0, 1]], ["AN", 5, 0, 5], ["FU", 5, [1, 2]], ["AN", 5, 1, 4], ["FU", 5, [2, 3]], ["AN", 5, 2, 6], ["FU", 3, [0, 1]], ["SP", 3, 0, 128, [2], 1], ["AN", 3, 1, 2], ["FFSP", 3, 0, [2, 1], 1, 1], ["AN", 3, 1, 6], ["FU", 1, [0, 1]], ["SP", 1, 0, 8, [2], 1], ["AN", 1, 1, 2], ["FFSP", 1, 0, [2, 1], 1, 1], ["AN", 1, 1, 6], ["PR", 4, 0, "auto_unroll_max_step$1024"]]]], "r": [[0.00174083], 0, 0.490873, 1708765283], "mark": 2, "ag": 3, "v": "v0.6"}
{"i": [["[\"_matmul\", 512, 3072, 768, \"float32\"]", "cuda -keys=cuda,gpu -arch=sm_86 -max_num_threads=1024 -model=unknown -thread_warp_size=32", [82, 999, 999, 49152, 2147483647, 1024, 255, 32], "", 0, []], [[], [["CHW", 2, "local"], ["SP", 2, 0, 512, [1, 2, 8, 1], 1], ["SP", 2, 5, 768, [1, 24, 32, 1], 1], ["SP", 2, 10, 3072, [4, 1], 1], ["RE", 2, [0, 5, 1, 6, 2, 7, 10, 11, 3, 8, 12, 4, 9]], ["FSP", 3, 0, 1, 3], ["FSP", 3, 4, 2, 3], ["RE", 3, [0, 4, 1, 5, 2, 6, 3, 7]], ["CA", 2, 3, 5], ["CHR", 1, "shared", [2]], ["CA", 2, 3, 6], ["CHR", 0, "shared", [3]], ["CA", 1, 4, 6], ["FU", 5, [0, 1]], ["AN", 5, 0, 5], ["FU", 5, [1, 2]], ["AN", 5, 1, 4], ["FU", 5, [2, 3]], ["AN", 5, 2, 6], ["FU", 3, [0, 1]], ["SP", 3, 0, 128, [2], 1], ["AN", 3, 1, 2], ["FFSP", 3, 0, [2, 1], 1, 1], ["AN", 3, 1, 6], ["FU", 1, [0, 1]], ["SP", 1, 0, 32, [2], 1], ["AN", 1, 1, 2], ["FFSP", 1, 0, [2, 1], 1, 1], ["AN", 1, 1, 6], ["PR", 4, 0, "auto_unroll_max_step$1024"]]]], "r": [[0.00373277], 0, 0.976618, 1708765283], "mark": 2, "ag": 3, "v": "v0.6"}
{"i": [["[\"_matmul\", 512, 3072, 768, \"float32\"]", "cuda -keys=cuda,gpu -arch=sm_86 -max_num_threads=1024 -model=unknown -thread_warp_size=32", [82, 999, 999, 49152, 2147483647, 1024, 255, 32], "", 0, []], [[], [["CHW", 2, "local"], ["SP", 2, 0, 512, [1, 4, 2, 1], 1], ["SP", 2, 5, 768, [1, 24, 32, 1], 1], ["SP", 2, 10, 3072, [3, 1], 1], ["RE", 2, [0, 5, 1, 6, 2, 7, 10, 11, 3, 8, 12, 4, 9]], ["FSP", 3, 0, 1, 3], ["FSP", 3, 4, 2, 3], ["RE", 3, [0, 4, 1, 5, 2, 6, 3, 7]], ["CA", 2, 3, 5], ["CHR", 1, "shared", [2]], ["CA", 2, 3, 6], ["CHR", 0, "shared", [3]], ["CA", 1, 4, 6], ["FU", 5, [0, 1]], ["AN", 5, 0, 5], ["FU", 5, [1, 2]], ["AN", 5, 1, 4], ["FU", 5, [2, 3]], ["AN", 5, 2, 6], ["FU", 3, [0, 1]], ["SP", 3, 0, 96, [2], 1], ["AN", 3, 1, 2], ["FFSP", 3, 0, [2, 1], 1, 1], ["AN", 3, 1, 6], ["FU", 1, [0, 1]], ["SP", 1, 0, 6, [2], 1], ["AN", 1, 1, 2], ["FFSP", 1, 0, [2, 1], 1, 1], ["AN", 1, 1, 6], ["PR", 4, 0, "auto_unroll_max_step$1024"]]]], "r": [[0.00172344], 0, 0.743707, 1708765284], "mark": 2, "ag": 3, "v": "v0.6"}
{"i": [["[\"_matmul\", 512, 3072, 768, \"float32\"]", "cuda -keys=cuda,gpu -arch=sm_86 -max_num_threads=1024 -model=unknown -thread_warp_size=32", [82, 999, 999, 49152, 2147483647, 1024, 255, 32], "", 0, []], [[], [["CHW", 2, "local"], ["SP", 2, 0, 512, [1, 4, 8, 1], 1], ["SP", 2, 5, 768, [1, 24, 32, 1], 1], ["SP", 2, 10, 3072, [3, 1], 1], ["RE", 2, [0, 5, 1, 6, 2, 7, 10, 11, 3, 8, 12, 4, 9]], ["FSP", 3, 0, 1, 3], ["FSP", 3, 4, 2, 3], ["RE", 3, [0, 4, 1, 5, 2, 6, 3, 7]], ["CA", 2, 3, 5], ["CHR", 1, "shared", [2]], ["CA", 2, 3, 6], ["CHR", 0, "shared", [3]], ["CA", 1, 4, 6], ["FU", 5, [0, 1]], ["AN", 5, 0, 5], ["FU", 5, [1, 2]], ["AN", 5, 1, 4], ["FU", 5, [2, 3]], ["AN", 5, 2, 6], ["FU", 3, [0, 1]], ["SP", 3, 0, 96, [2], 1], ["AN", 3, 1, 2], ["FFSP", 3, 0, [2, 1], 1, 1], ["AN", 3, 1, 6], ["FU", 1, [0, 1]], ["SP", 1, 0, 24, [2], 1], ["AN", 1, 1, 2], ["FFSP", 1, 0, [2, 1], 1, 1], ["AN", 1, 1, 6], ["PR", 4, 0, "auto_unroll_max_step$1024"]]]], "r": [[0.00423562], 0, 0.808607, 1708765284], "mark": 2, "ag": 3, "v": "v0.6"}
{"i": [["[\"_matmul\", 512, 3072, 768, \"float32\"]", "cuda -keys=cuda,gpu -arch=sm_86 -max_num_threads=1024 -model=unknown -thread_warp_size=32", [82, 999, 999, 49152, 2147483647, 1024, 255, 32], "", 0, []], [[], [["CHW", 2, "local"], ["SP", 2, 0, 512, [1, 4, 4, 1], 1], ["SP", 2, 5, 768, [1, 12, 32, 1], 1], ["SP", 2, 10, 3072, [3, 1], 1], ["RE", 2, [0, 5, 1, 6, 2, 7, 10, 11, 3, 8, 12, 4, 9]], ["FSP", 3, 0, 1, 3], ["FSP", 3, 4, 2, 3], ["RE", 3, [0, 4, 1, 5, 2, 6, 3, 7]], ["CA", 2, 3, 5], ["CHR", 1, "shared", [2]], ["CA", 2, 3, 6], ["CHR", 0, "shared", [3]], ["CA", 1, 4, 6], ["FU", 5, [0, 1]], ["AN", 5, 0, 5], ["FU", 5, [1, 2]], ["AN", 5, 1, 4], ["FU", 5, [2, 3]], ["AN", 5, 2, 6], ["FU", 3, [0, 1]], ["SP", 3, 0, 96, [2], 1], ["AN", 3, 1, 2], ["FFSP", 3, 0, [2, 1], 1, 1], ["AN", 3, 1, 6], ["FU", 1, [0, 1]], ["SP", 1, 0, 12, [2], 1], ["AN", 1, 1, 2], ["FFSP", 1, 0, [2, 1], 1, 1], ["AN", 1, 1, 6], ["PR", 4, 0, "auto_unroll_max_step$1024"]]]], "r": [[0.00127983], 0, 0.545867, 1708765283], "mark": 2, "ag": 4, "v": "v0.6"}
{"i": [["[\"_matmul\", 512, 3072, 768, \"float32\"]", "cuda -keys=cuda,gpu -arch=sm_86 -max_num_threads=1024 -model=unknown -thread_warp_size=32", [82, 999, 999, 49152, 2147483647, 1024, 255, 32], "", 0, []], [[], [["CHW", 2, "local"], ["SP", 2, 0, 512, [1, 4, 4, 1], 1], ["SP", 2, 5, 768, [1, 12, 32, 1], 1], ["SP", 2, 10, 3072, [2, 1], 1], ["RE", 2, [0, 5, 1, 6, 2, 7, 10, 11, 3, 8, 12, 4, 9]], ["FSP", 3, 0, 1, 3], ["FSP", 3, 4, 2, 3], ["RE", 3, [0, 4, 1, 5, 2, 6, 3, 7]], ["CA", 2, 3, 5], ["CHR", 1, "shared", [2]], ["CA", 2, 3, 6], ["CHR", 0, "shared", [3]], ["CA", 1, 4, 6], ["FU", 5, [0, 1]], ["AN", 5, 0, 5], ["FU", 5, [1, 2]], ["AN", 5, 1, 4], ["FU", 5, [2, 3]], ["AN", 5, 2, 6], ["FU", 3, [0, 1]], ["SP", 3, 0, 64, [2], 1], ["AN", 3, 1, 2], ["FFSP", 3, 0, [2, 1], 1, 1], ["AN", 3, 1, 6], ["FU", 1, [0, 1]], ["SP", 1, 0, 8, [2], 1], ["AN", 1, 1, 2], ["FFSP", 1, 0, [2, 1], 1, 1], ["AN", 1, 1, 6], ["PR", 4, 0, "auto_unroll_max_step$1024"]]]], "r": [[0.00152395], 0, 0.83881, 1708765287], "mark": 2, "ag": 4, "v": "v0.6"}
{"i": [["[\"_matmul\", 512, 3072, 768, \"float32\"]", "cuda -keys=cuda,gpu -arch=sm_86 -max_num_threads=1024 -model=unknown -thread_warp_size=32", [82, 999, 999, 49152, 2147483647, 1024, 255, 32], "", 0, []], [[], [["CHW", 2, "local"], ["SP", 2, 0, 512, [1, 4, 4, 1], 1], ["SP", 2, 5, 768, [1, 12, 32, 1], 1], ["SP", 2, 10, 3072, [4, 1], 1], ["RE", 2, [0, 5, 1, 6, 2, 7, 10, 11, 3, 8, 12, 4, 9]], ["FSP", 3, 0, 1, 3], ["FSP", 3, 4, 2, 3], ["RE", 3, [0, 4, 1, 5, 2, 6, 3, 7]], ["CA", 2, 3, 5], ["CHR", 1, "shared", [2]], ["CA", 2, 3, 6], ["CHR", 0, "shared", [3]], ["CA", 1, 4, 6], ["FU", 5, [0, 1]], ["AN", 5, 0, 5], ["FU", 5, [1, 2]], ["AN", 5, 1, 4], ["FU", 5, [2, 3]], ["AN", 5, 2, 6], ["FU", 3, [0, 1]], ["SP", 3, 0, 128, [2], 1], ["AN", 3, 1, 2], ["FFSP", 3, 0, [2, 1], 1, 1], ["AN", 3, 1, 6], ["FU", 1, [0, 1]], ["SP", 1, 0, 16, [2], 1], ["AN", 1, 1, 2], ["FFSP", 1, 0, [2, 1], 1, 1], ["AN", 1, 1, 6], ["PR", 4, 0, "auto_unroll_max_step$1024"]]]], "r": [[0.00134228], 0, 0.796673, 1708765287], "mark": 2, "ag": 4, "v": "v0.6"}
{"i": [["[\"_matmul\", 512, 3072, 768, \"float32\"]", "cuda -keys=cuda,gpu -arch=sm_86 -max_num_threads=1024 -model=unknown -thread_warp_size=32", [82, 999, 999, 49152, 2147483647, 1024, 255, 32], "", 0, []], [[], [["CHW", 2, "local"], ["SP", 2, 0, 512, [1, 4, 4, 1], 1], ["SP", 2, 5, 768, [1, 8, 32, 1], 1], ["SP", 2, 10, 3072, [3, 1], 1], ["RE", 2, [0, 5, 1, 6, 2, 7, 10, 11, 3, 8, 12, 4, 9]], ["FSP", 3, 0, 1, 3], ["FSP", 3, 4, 2, 3], ["RE", 3, [0, 4, 1, 5, 2, 6, 3, 7]], ["CA", 2, 3, 5], ["CHR", 1, "shared", [2]], ["CA", 2, 3, 6], ["CHR", 0, "shared", [3]], ["CA", 1, 4, 6], ["FU", 5, [0, 1]], ["AN", 5, 0, 5], ["FU", 5, [1, 2]], ["AN", 5, 1, 4], ["FU", 5, [2, 3]], ["AN", 5, 2, 6], ["FU", 3, [0, 1]], ["SP", 3, 0, 96, [2], 1], ["AN", 3, 1, 2], ["FFSP", 3, 0, [2, 1], 1, 1], ["AN", 3, 1, 6], ["FU", 1, [0, 1]], ["SP", 1, 0, 12, [2], 1], ["AN", 1, 1, 2], ["FFSP", 1, 0, [2, 1], 1, 1], ["AN", 1, 1, 6], ["PR", 4, 0, "auto_unroll_max_step$1024"]]]], "r": [[0.00130782], 0, 0.806991, 1708765287], "mark": 2, "ag": 4, "v": "v0.6"}
{"i": [["[\"_matmul\", 512, 3072, 768, \"float32\"]", "cuda -keys=cuda,gpu -arch=sm_86 -max_num_threads=1024 -model=unknown -thread_warp_size=32", [82, 999, 999, 49152, 2147483647, 1024, 255, 32], "", 0, []], [[], [["CHW", 2, "local"], ["SP", 2, 0, 512, [1, 4, 4, 1], 1], ["SP", 2, 5, 768, [1, 24, 32, 1], 1], ["SP", 2, 10, 3072, [3, 1], 1], ["RE", 2, [0, 5, 1, 6, 2, 7, 10, 11, 3, 8, 12, 4, 9]], ["FSP", 3, 0, 1, 3], ["FSP", 3, 4, 2, 3], ["RE", 3, [0, 4, 1, 5, 2, 6, 3, 7]], ["CA", 2, 3, 5], ["CHR", 1, "shared", [2]], ["CA", 2, 3, 6], ["CHR", 0, "shared", [3]], ["CA", 1, 4, 6], ["FU", 5, [0, 1]], ["AN", 5, 0, 5], ["FU", 5, [1, 2]], ["AN", 5, 1, 4], ["FU", 5, [2, 3]], ["AN", 5, 2, 6], ["FU", 3, [0, 1]], ["SP", 3, 0, 96, [2], 1], ["AN", 3, 1, 2], ["FFSP", 3, 0, [2, 1], 1, 1], ["AN", 3, 1, 6], ["FU", 1, [0, 1]], ["SP", 1, 0, 12, [2], 1], ["AN", 1, 1, 2], ["FFSP", 1, 0, [2, 1], 1, 1], ["AN", 1, 1, 6], ["PR", 4, 0, "auto_unroll_max_step$1024"]]]], "r": [[0.0017464], 0, 0.62432, 1708765287], "mark": 2, "ag": 4, "v": "v0.6"}
