data/new-200-5/75cuda_testCase_5_matmul_M512_N768_K3072.json
{"i": [["[\"_matmul\", 512, 3072, 768, \"float32\"]", "cuda -keys=cuda,gpu -arch=sm_86 -max_num_threads=1024 -model=unknown -thread_warp_size=32", [82, 999, 999, 49152, 2147483647, 1024, 255, 32], "", 0, []], [[], [["CHW", 2, "local"], ["SP", 2, 0, 512, [1, 2, 16, 1], 1], ["SP", 2, 5, 768, [1, 32, 8, 1], 1], ["SP", 2, 10, 3072, [32, 1], 1], ["RE", 2, [0, 5, 1, 6, 2, 7, 10, 11, 3, 8, 12, 4, 9]], ["FSP", 3, 0, 1, 3], ["FSP", 3, 4, 2, 3], ["RE", 3, [0, 4, 1, 5, 2, 6, 3, 7]], ["CA", 2, 3, 5], ["CHR", 1, "shared", [2]], ["CA", 2, 3, 6], ["CHR", 0, "shared", [3]], ["CA", 1, 4, 6], ["FU", 5, [0, 1]], ["AN", 5, 0, 5], ["FU", 5, [1, 2]], ["AN", 5, 1, 4], ["FU", 5, [2, 3]], ["AN", 5, 2, 6], ["FU", 3, [0, 1]], ["SP", 3, 0, 256, [2], 1], ["AN", 3, 1, 2], ["FFSP", 3, 0, [2, 1], 1, 1], ["AN", 3, 1, 6], ["FU", 1, [0, 1]], ["SP", 1, 0, 512, [2], 1], ["AN", 1, 1, 2], ["FFSP", 1, 0, [2, 1], 1, 1], ["AN", 1, 1, 6], ["PR", 4, 0, "auto_unroll_max_step$1024"]]]], "r": [[0.000622505], 0, 0.811183, 1708768623], "mark": 2, "ag": 0, "v": "v0.6"}
{"i": [["[\"_matmul\", 512, 3072, 768, \"float32\"]", "cuda -keys=cuda,gpu -arch=sm_86 -max_num_threads=1024 -model=unknown -thread_warp_size=32", [82, 999, 999, 49152, 2147483647, 1024, 255, 32], "", 0, []], [[], [["CHW", 2, "local"], ["SP", 2, 0, 512, [1, 2, 16, 1], 1], ["SP", 2, 5, 768, [1, 32, 8, 1], 1], ["SP", 2, 10, 3072, [24, 1], 1], ["RE", 2, [0, 5, 1, 6, 2, 7, 10, 11, 3, 8, 12, 4, 9]], ["FSP", 3, 0, 1, 3], ["FSP", 3, 4, 2, 3], ["RE", 3, [0, 4, 1, 5, 2, 6, 3, 7]], ["CA", 2, 3, 5], ["CHR", 1, "shared", [2]], ["CA", 2, 3, 6], ["CHR", 0, "shared", [3]], ["CA", 1, 4, 6], ["FU", 5, [0, 1]], ["AN", 5, 0, 5], ["FU", 5, [1, 2]], ["AN", 5, 1, 4], ["FU", 5, [2, 3]], ["AN", 5, 2, 6], ["FU", 3, [0, 1]], ["SP", 3, 0, 192, [2], 1], ["AN", 3, 1, 2], ["FFSP", 3, 0, [2, 1], 1, 1], ["AN", 3, 1, 6], ["FU", 1, [0, 1]], ["SP", 1, 0, 384, [2], 1], ["AN", 1, 1, 2], ["FFSP", 1, 0, [2, 1], 1, 1], ["AN", 1, 1, 6], ["PR", 4, 0, "auto_unroll_max_step$1024"]]]], "r": [[0.00054078], 0, 0.819608, 1708768624], "mark": 2, "ag": 0, "v": "v0.6"}
{"i": [["[\"_matmul\", 512, 3072, 768, \"float32\"]", "cuda -keys=cuda,gpu -arch=sm_86 -max_num_threads=1024 -model=unknown -thread_warp_size=32", [82, 999, 999, 49152, 2147483647, 1024, 255, 32], "", 0, []], [[], [["CHW", 2, "local"], ["SP", 2, 0, 512, [1, 2, 16, 1], 1], ["SP", 2, 5, 768, [1, 24, 8, 1], 1], ["SP", 2, 10, 3072, [32, 1], 1], ["RE", 2, [0, 5, 1, 6, 2, 7, 10, 11, 3, 8, 12, 4, 9]], ["FSP", 3, 0, 1, 3], ["FSP", 3, 4, 2, 3], ["RE", 3, [0, 4, 1, 5, 2, 6, 3, 7]], ["CA", 2, 3, 5], ["CHR", 1, "shared", [2]], ["CA", 2, 3, 6], ["CHR", 0, "shared", [3]], ["CA", 1, 4, 6], ["FU", 5, [0, 1]], ["AN", 5, 0, 5], ["FU", 5, [1, 2]], ["AN", 5, 1, 4], ["FU", 5, [2, 3]], ["AN", 5, 2, 6], ["FU", 3, [0, 1]], ["SP", 3, 0, 256, [2], 1], ["AN", 3, 1, 2], ["FFSP", 3, 0, [2, 1], 1, 1], ["AN", 3, 1, 6], ["FU", 1, [0, 1]], ["SP", 1, 0, 512, [2], 1], ["AN", 1, 1, 2], ["FFSP", 1, 0, [2, 1], 1, 1], ["AN", 1, 1, 6], ["PR", 4, 0, "auto_unroll_max_step$1024"]]]], "r": [[0.000538089], 0, 0.953646, 1708768624], "mark": 2, "ag": 0, "v": "v0.6"}
{"i": [["[\"_matmul\", 512, 3072, 768, \"float32\"]", "cuda -keys=cuda,gpu -arch=sm_86 -max_num_threads=1024 -model=unknown -thread_warp_size=32", [82, 999, 999, 49152, 2147483647, 1024, 255, 32], "", 0, []], [[], [["CHW", 2, "local"], ["SP", 2, 0, 512, [1, 2, 16, 1], 1], ["SP", 2, 5, 768, [1, 32, 6, 1], 1], ["SP", 2, 10, 3072, [32, 1], 1], ["RE", 2, [0, 5, 1, 6, 2, 7, 10, 11, 3, 8, 12, 4, 9]], ["FSP", 3, 0, 1, 3], ["FSP", 3, 4, 2, 3], ["RE", 3, [0, 4, 1, 5, 2, 6, 3, 7]], ["CA", 2, 3, 5], ["CHR", 1, "shared", [2]], ["CA", 2, 3, 6], ["CHR", 0, "shared", [3]], ["CA", 1, 4, 6], ["FU", 5, [0, 1]], ["AN", 5, 0, 5], ["FU", 5, [1, 2]], ["AN", 5, 1, 4], ["FU", 5, [2, 3]], ["AN", 5, 2, 6], ["FU", 3, [0, 1]], ["SP", 3, 0, 192, [2], 1], ["AN", 3, 1, 2], ["FFSP", 3, 0, [2, 1], 1, 1], ["AN", 3, 1, 6], ["FU", 1, [0, 1]], ["SP", 1, 0, 512, [2], 1], ["AN", 1, 1, 2], ["FFSP", 1, 0, [2, 1], 1, 1], ["AN", 1, 1, 6], ["PR", 4, 0, "auto_unroll_max_step$1024"]]]], "r": [[0.000348459], 0, 1.06128, 1708768624], "mark": 2, "ag": 0, "v": "v0.6"}
{"i": [["[\"_matmul\", 512, 3072, 768, \"float32\"]", "cuda -keys=cuda,gpu -arch=sm_86 -max_num_threads=1024 -model=unknown -thread_warp_size=32", [82, 999, 999, 49152, 2147483647, 1024, 255, 32], "", 0, []], [[], [["CHW", 2, "local"], ["SP", 2, 0, 512, [1, 1, 16, 1], 1], ["SP", 2, 5, 768, [1, 32, 8, 1], 1], ["SP", 2, 10, 3072, [32, 1], 1], ["RE", 2, [0, 5, 1, 6, 2, 7, 10, 11, 3, 8, 12, 4, 9]], ["FSP", 3, 0, 1, 3], ["FSP", 3, 4, 2, 3], ["RE", 3, [0, 4, 1, 5, 2, 6, 3, 7]], ["CA", 2, 3, 5], ["CHR", 1, "shared", [2]], ["CA", 2, 3, 6], ["CHR", 0, "shared", [3]], ["CA", 1, 4, 6], ["FU", 5, [0, 1]], ["AN", 5, 0, 5], ["FU", 5, [1, 2]], ["AN", 5, 1, 4], ["FU", 5, [2, 3]], ["AN", 5, 2, 6], ["FU", 3, [0, 1]], ["SP", 3, 0, 256, [2], 1], ["AN", 3, 1, 2], ["FFSP", 3, 0, [2, 1], 1, 1], ["AN", 3, 1, 6], ["FU", 1, [0, 1]], ["SP", 1, 0, 512, [2], 1], ["AN", 1, 1, 2], ["FFSP", 1, 0, [2, 1], 1, 1], ["AN", 1, 1, 6], ["PR", 4, 0, "auto_unroll_max_step$1024"]]]], "r": [[0.000566886], 0, 1.00777, 1708768624], "mark": 2, "ag": 0, "v": "v0.6"}
{"i": [["[\"_matmul\", 512, 3072, 768, \"float32\"]", "cuda -keys=cuda,gpu -arch=sm_86 -max_num_threads=1024 -model=unknown -thread_warp_size=32", [82, 999, 999, 49152, 2147483647, 1024, 255, 32], "", 0, []], [[], [["CHW", 2, "local"], ["SP", 2, 0, 512, [1, 4, 16, 1], 1], ["SP", 2, 5, 768, [1, 32, 8, 1], 1], ["SP", 2, 10, 3072, [32, 1], 1], ["RE", 2, [0, 5, 1, 6, 2, 7, 10, 11, 3, 8, 12, 4, 9]], ["FSP", 3, 0, 1, 3], ["FSP", 3, 4, 2, 3], ["RE", 3, [0, 4, 1, 5, 2, 6, 3, 7]], ["CA", 2, 3, 5], ["CHR", 1, "shared", [2]], ["CA", 2, 3, 6], ["CHR", 0, "shared", [3]], ["CA", 1, 4, 6], ["FU", 5, [0, 1]], ["AN", 5, 0, 5], ["FU", 5, [1, 2]], ["AN", 5, 1, 4], ["FU", 5, [2, 3]], ["AN", 5, 2, 6], ["FU", 3, [0, 1]], ["SP", 3, 0, 256, [2], 1], ["AN", 3, 1, 2], ["FFSP", 3, 0, [2, 1], 1, 1], ["AN", 3, 1, 6], ["FU", 1, [0, 1]], ["SP", 1, 0, 512, [2], 1], ["AN", 1, 1, 2], ["FFSP", 1, 0, [2, 1], 1, 1], ["AN", 1, 1, 6], ["PR", 4, 0, "auto_unroll_max_step$1024"]]]], "r": [[0.00054996], 0, 0.718496, 1708768625], "mark": 2, "ag": 0, "v": "v0.6"}
{"i": [["[\"_matmul\", 512, 3072, 768, \"float32\"]", "cuda -keys=cuda,gpu -arch=sm_86 -max_num_threads=1024 -model=unknown -thread_warp_size=32", [82, 999, 999, 49152, 2147483647, 1024, 255, 32], "", 0, []], [[], [["CHW", 2, "local"], ["SP", 2, 0, 512, [1, 2, 8, 1], 1], ["SP", 2, 5, 768, [1, 32, 8, 1], 1], ["SP", 2, 10, 3072, [32, 1], 1], ["RE", 2, [0, 5, 1, 6, 2, 7, 10, 11, 3, 8, 12, 4, 9]], ["FSP", 3, 0, 1, 3], ["FSP", 3, 4, 2, 3], ["RE", 3, [0, 4, 1, 5, 2, 6, 3, 7]], ["CA", 2, 3, 5], ["CHR", 1, "shared", [2]], ["CA", 2, 3, 6], ["CHR", 0, "shared", [3]], ["CA", 1, 4, 6], ["FU", 5, [0, 1]], ["AN", 5, 0, 5], ["FU", 5, [1, 2]], ["AN", 5, 1, 4], ["FU", 5, [2, 3]], ["AN", 5, 2, 6], ["FU", 3, [0, 1]], ["SP", 3, 0, 256, [2], 1], ["AN", 3, 1, 2], ["FFSP", 3, 0, [2, 1], 1, 1], ["AN", 3, 1, 6], ["FU", 1, [0, 1]], ["SP", 1, 0, 256, [2], 1], ["AN", 1, 1, 2], ["FFSP", 1, 0, [2, 1], 1, 1], ["AN", 1, 1, 6], ["PR", 4, 0, "auto_unroll_max_step$1024"]]]], "r": [[0.000306984], 0, 0.767688, 1708768625], "mark": 2, "ag": 0, "v": "v0.6"}
{"i": [["[\"_matmul\", 512, 3072, 768, \"float32\"]", "cuda -keys=cuda,gpu -arch=sm_86 -max_num_threads=1024 -model=unknown -thread_warp_size=32", [82, 999, 999, 49152, 2147483647, 1024, 255, 32], "", 0, []], [[], [["CHW", 2, "local"], ["SP", 2, 0, 512, [1, 2, 32, 1], 1], ["SP", 2, 5, 768, [1, 32, 8, 1], 1], ["SP", 2, 10, 3072, [32, 1], 1], ["RE", 2, [0, 5, 1, 6, 2, 7, 10, 11, 3, 8, 12, 4, 9]], ["FSP", 3, 0, 1, 3], ["FSP", 3, 4, 2, 3], ["RE", 3, [0, 4, 1, 5, 2, 6, 3, 7]], ["CA", 2, 3, 5], ["CHR", 1, "shared", [2]], ["CA", 2, 3, 6], ["CHR", 0, "shared", [3]], ["CA", 1, 4, 6], ["FU", 5, [0, 1]], ["AN", 5, 0, 5], ["FU", 5, [1, 2]], ["AN", 5, 1, 4], ["FU", 5, [2, 3]], ["AN", 5, 2, 6], ["FU", 3, [0, 1]], ["SP", 3, 0, 256, [2], 1], ["AN", 3, 1, 2], ["FFSP", 3, 0, [2, 1], 1, 1], ["AN", 3, 1, 6], ["FU", 1, [0, 1]], ["SP", 1, 0, 1024, [2], 1], ["AN", 1, 1, 2], ["FFSP", 1, 0, [2, 1], 1, 1], ["AN", 1, 1, 6], ["PR", 4, 0, "auto_unroll_max_step$1024"]]]], "r": [[0.00350883], 0, 0.909589, 1708768625], "mark": 2, "ag": 0, "v": "v0.6"}
{"i": [["[\"_matmul\", 512, 3072, 768, \"float32\"]", "cuda -keys=cuda,gpu -arch=sm_86 -max_num_threads=1024 -model=unknown -thread_warp_size=32", [82, 999, 999, 49152, 2147483647, 1024, 255, 32], "", 0, []], [[], [["CHW", 2, "local"], ["SP", 2, 0, 512, [1, 2, 16, 1], 1], ["SP", 2, 5, 768, [1, 24, 8, 1], 1], ["SP", 2, 10, 3072, [24, 1], 1], ["RE", 2, [0, 5, 1, 6, 2, 7, 10, 11, 3, 8, 12, 4, 9]], ["FSP", 3, 0, 1, 3], ["FSP", 3, 4, 2, 3], ["RE", 3, [0, 4, 1, 5, 2, 6, 3, 7]], ["CA", 2, 3, 5], ["CHR", 1, "shared", [2]], ["CA", 2, 3, 6], ["CHR", 0, "shared", [3]], ["CA", 1, 4, 6], ["FU", 5, [0, 1]], ["AN", 5, 0, 5], ["FU", 5, [1, 2]], ["AN", 5, 1, 4], ["FU", 5, [2, 3]], ["AN", 5, 2, 6], ["FU", 3, [0, 1]], ["SP", 3, 0, 192, [2], 1], ["AN", 3, 1, 2], ["FFSP", 3, 0, [2, 1], 1, 1], ["AN", 3, 1, 6], ["FU", 1, [0, 1]], ["SP", 1, 0, 384, [2], 1], ["AN", 1, 1, 2], ["FFSP", 1, 0, [2, 1], 1, 1], ["AN", 1, 1, 6], ["PR", 4, 0, "auto_unroll_max_step$1024"]]]], "r": [[0.000516073], 0, 0.737194, 1708768625], "mark": 2, "ag": 0, "v": "v0.6"}
{"i": [["[\"_matmul\", 512, 3072, 768, \"float32\"]", "cuda -keys=cuda,gpu -arch=sm_86 -max_num_threads=1024 -model=unknown -thread_warp_size=32", [82, 999, 999, 49152, 2147483647, 1024, 255, 32], "", 0, []], [[], [["CHW", 2, "local"], ["SP", 2, 0, 512, [1, 2, 16, 1], 1], ["SP", 2, 5, 768, [1, 24, 8, 1], 1], ["SP", 2, 10, 3072, [48, 1], 1], ["RE", 2, [0, 5, 1, 6, 2, 7, 10, 11, 3, 8, 12, 4, 9]], ["FSP", 3, 0, 1, 3], ["FSP", 3, 4, 2, 3], ["RE", 3, [0, 4, 1, 5, 2, 6, 3, 7]], ["CA", 2, 3, 5], ["CHR", 1, "shared", [2]], ["CA", 2, 3, 6], ["CHR", 0, "shared", [3]], ["CA", 1, 4, 6], ["FU", 5, [0, 1]], ["AN", 5, 0, 5], ["FU", 5, [1, 2]], ["AN", 5, 1, 4], ["FU", 5, [2, 3]], ["AN", 5, 2, 6], ["FU", 3, [0, 1]], ["SP", 3, 0, 384, [2], 1], ["AN", 3, 1, 2], ["FFSP", 3, 0, [2, 1], 1, 1], ["AN", 3, 1, 6], ["FU", 1, [0, 1]], ["SP", 1, 0, 768, [2], 1], ["AN", 1, 1, 2], ["FFSP", 1, 0, [2, 1], 1, 1], ["AN", 1, 1, 6], ["PR", 4, 0, "auto_unroll_max_step$1024"]]]], "r": [[0.000519284], 0, 0.802346, 1708768625], "mark": 2, "ag": 0, "v": "v0.6"}
{"i": [["[\"_matmul\", 512, 3072, 768, \"float32\"]", "cuda -keys=cuda,gpu -arch=sm_86 -max_num_threads=1024 -model=unknown -thread_warp_size=32", [82, 999, 999, 49152, 2147483647, 1024, 255, 32], "", 0, []], [[], [["CHW", 2, "local"], ["SP", 2, 0, 512, [1, 2, 16, 1], 1], ["SP", 2, 5, 768, [1, 48, 8, 1], 1], ["SP", 2, 10, 3072, [24, 1], 1], ["RE", 2, [0, 5, 1, 6, 2, 7, 10, 11, 3, 8, 12, 4, 9]], ["FSP", 3, 0, 1, 3], ["FSP", 3, 4, 2, 3], ["RE", 3, [0, 4, 1, 5, 2, 6, 3, 7]], ["CA", 2, 3, 5], ["CHR", 1, "shared", [2]], ["CA", 2, 3, 6], ["CHR", 0, "shared", [3]], ["CA", 1, 4, 6], ["FU", 5, [0, 1]], ["AN", 5, 0, 5], ["FU", 5, [1, 2]], ["AN", 5, 1, 4], ["FU", 5, [2, 3]], ["AN", 5, 2, 6], ["FU", 3, [0, 1]], ["SP", 3, 0, 192, [2], 1], ["AN", 3, 1, 2], ["FFSP", 3, 0, [2, 1], 1, 1], ["AN", 3, 1, 6], ["FU", 1, [0, 1]], ["SP", 1, 0, 384, [2], 1], ["AN", 1, 1, 2], ["FFSP", 1, 0, [2, 1], 1, 1], ["AN", 1, 1, 6], ["PR", 4, 0, "auto_unroll_max_step$1024"]]]], "r": [[0.000569446], 0, 0.681249, 1708768625], "mark": 2, "ag": 0, "v": "v0.6"}
{"i": [["[\"_matmul\", 512, 3072, 768, \"float32\"]", "cuda -keys=cuda,gpu -arch=sm_86 -max_num_threads=1024 -model=unknown -thread_warp_size=32", [82, 999, 999, 49152, 2147483647, 1024, 255, 32], "", 0, []], [[], [["CHW", 2, "local"], ["SP", 2, 0, 512, [1, 2, 16, 1], 1], ["SP", 2, 5, 768, [1, 32, 6, 1], 1], ["SP", 2, 10, 3072, [24, 1], 1], ["RE", 2, [0, 5, 1, 6, 2, 7, 10, 11, 3, 8, 12, 4, 9]], ["FSP", 3, 0, 1, 3], ["FSP", 3, 4, 2, 3], ["RE", 3, [0, 4, 1, 5, 2, 6, 3, 7]], ["CA", 2, 3, 5], ["CHR", 1, "shared", [2]], ["CA", 2, 3, 6], ["CHR", 0, "shared", [3]], ["CA", 1, 4, 6], ["FU", 5, [0, 1]], ["AN", 5, 0, 5], ["FU", 5, [1, 2]], ["AN", 5, 1, 4], ["FU", 5, [2, 3]], ["AN", 5, 2, 6], ["FU", 3, [0, 1]], ["SP", 3, 0, 144, [2], 1], ["AN", 3, 1, 2], ["FFSP", 3, 0, [2, 1], 1, 1], ["AN", 3, 1, 6], ["FU", 1, [0, 1]], ["SP", 1, 0, 384, [2], 1], ["AN", 1, 1, 2], ["FFSP", 1, 0, [2, 1], 1, 1], ["AN", 1, 1, 6], ["PR", 4, 0, "auto_unroll_max_step$1024"]]]], "r": [[0.000338993], 0, 0.812825, 1708768626], "mark": 2, "ag": 0, "v": "v0.6"}
{"i": [["[\"_matmul\", 512, 3072, 768, \"float32\"]", "cuda -keys=cuda,gpu -arch=sm_86 -max_num_threads=1024 -model=unknown -thread_warp_size=32", [82, 999, 999, 49152, 2147483647, 1024, 255, 32], "", 0, []], [[], [["CHW", 2, "local"], ["SP", 2, 0, 512, [1, 2, 16, 1], 1], ["SP", 2, 5, 768, [1, 32, 6, 1], 1], ["SP", 2, 10, 3072, [48, 1], 1], ["RE", 2, [0, 5, 1, 6, 2, 7, 10, 11, 3, 8, 12, 4, 9]], ["FSP", 3, 0, 1, 3], ["FSP", 3, 4, 2, 3], ["RE", 3, [0, 4, 1, 5, 2, 6, 3, 7]], ["CA", 2, 3, 5], ["CHR", 1, "shared", [2]], ["CA", 2, 3, 6], ["CHR", 0, "shared", [3]], ["CA", 1, 4, 6], ["FU", 5, [0, 1]], ["AN", 5, 0, 5], ["FU", 5, [1, 2]], ["AN", 5, 1, 4], ["FU", 5, [2, 3]], ["AN", 5, 2, 6], ["FU", 3, [0, 1]], ["SP", 3, 0, 288, [2], 1], ["AN", 3, 1, 2], ["FFSP", 3, 0, [2, 1], 1, 1], ["AN", 3, 1, 6], ["FU", 1, [0, 1]], ["SP", 1, 0, 768, [2], 1], ["AN", 1, 1, 2], ["FFSP", 1, 0, [2, 1], 1, 1], ["AN", 1, 1, 6], ["PR", 4, 0, "auto_unroll_max_step$1024"]]]], "r": [[0.000420376], 0, 0.807387, 1708768626], "mark": 2, "ag": 0, "v": "v0.6"}
{"i": [["[\"_matmul\", 512, 3072, 768, \"float32\"]", "cuda -keys=cuda,gpu -arch=sm_86 -max_num_threads=1024 -model=unknown -thread_warp_size=32", [82, 999, 999, 49152, 2147483647, 1024, 255, 32], "", 0, []], [[], [["CHW", 2, "local"], ["SP", 2, 0, 512, [1, 2, 16, 1], 1], ["SP", 2, 5, 768, [1, 32, 12, 1], 1], ["SP", 2, 10, 3072, [24, 1], 1], ["RE", 2, [0, 5, 1, 6, 2, 7, 10, 11, 3, 8, 12, 4, 9]], ["FSP", 3, 0, 1, 3], ["FSP", 3, 4, 2, 3], ["RE", 3, [0, 4, 1, 5, 2, 6, 3, 7]], ["CA", 2, 3, 5], ["CHR", 1, "shared", [2]], ["CA", 2, 3, 6], ["CHR", 0, "shared", [3]], ["CA", 1, 4, 6], ["FU", 5, [0, 1]], ["AN", 5, 0, 5], ["FU", 5, [1, 2]], ["AN", 5, 1, 4], ["FU", 5, [2, 3]], ["AN", 5, 2, 6], ["FU", 3, [0, 1]], ["SP", 3, 0, 288, [2], 1], ["AN", 3, 1, 2], ["FFSP", 3, 0, [2, 1], 1, 1], ["AN", 3, 1, 6], ["FU", 1, [0, 1]], ["SP", 1, 0, 384, [2], 1], ["AN", 1, 1, 2], ["FFSP", 1, 0, [2, 1], 1, 1], ["AN", 1, 1, 6], ["PR", 4, 0, "auto_unroll_max_step$1024"]]]], "r": [[0.000875521], 0, 0.847705, 1708768626], "mark": 2, "ag": 0, "v": "v0.6"}
{"i": [["[\"_matmul\", 512, 3072, 768, \"float32\"]", "cuda -keys=cuda,gpu -arch=sm_86 -max_num_threads=1024 -model=unknown -thread_warp_size=32", [82, 999, 999, 49152, 2147483647, 1024, 255, 32], "", 0, []], [[], [["CHW", 2, "local"], ["SP", 2, 0, 512, [1, 1, 16, 1], 1], ["SP", 2, 5, 768, [1, 32, 8, 1], 1], ["SP", 2, 10, 3072, [24, 1], 1], ["RE", 2, [0, 5, 1, 6, 2, 7, 10, 11, 3, 8, 12, 4, 9]], ["FSP", 3, 0, 1, 3], ["FSP", 3, 4, 2, 3], ["RE", 3, [0, 4, 1, 5, 2, 6, 3, 7]], ["CA", 2, 3, 5], ["CHR", 1, "shared", [2]], ["CA", 2, 3, 6], ["CHR", 0, "shared", [3]], ["CA", 1, 4, 6], ["FU", 5, [0, 1]], ["AN", 5, 0, 5], ["FU", 5, [1, 2]], ["AN", 5, 1, 4], ["FU", 5, [2, 3]], ["AN", 5, 2, 6], ["FU", 3, [0, 1]], ["SP", 3, 0, 192, [2], 1], ["AN", 3, 1, 2], ["FFSP", 3, 0, [2, 1], 1, 1], ["AN", 3, 1, 6], ["FU", 1, [0, 1]], ["SP", 1, 0, 384, [2], 1], ["AN", 1, 1, 2], ["FFSP", 1, 0, [2, 1], 1, 1], ["AN", 1, 1, 6], ["PR", 4, 0, "auto_unroll_max_step$1024"]]]], "r": [[0.000573836], 0, 0.787632, 1708768626], "mark": 2, "ag": 0, "v": "v0.6"}
{"i": [["[\"_matmul\", 512, 3072, 768, \"float32\"]", "cuda -keys=cuda,gpu -arch=sm_86 -max_num_threads=1024 -model=unknown -thread_warp_size=32", [82, 999, 999, 49152, 2147483647, 1024, 255, 32], "", 0, []], [[], [["CHW", 2, "local"], ["SP", 2, 0, 512, [1, 4, 16, 1], 1], ["SP", 2, 5, 768, [1, 32, 8, 1], 1], ["SP", 2, 10, 3072, [24, 1], 1], ["RE", 2, [0, 5, 1, 6, 2, 7, 10, 11, 3, 8, 12, 4, 9]], ["FSP", 3, 0, 1, 3], ["FSP", 3, 4, 2, 3], ["RE", 3, [0, 4, 1, 5, 2, 6, 3, 7]], ["CA", 2, 3, 5], ["CHR", 1, "shared", [2]], ["CA", 2, 3, 6], ["CHR", 0, "shared", [3]], ["CA", 1, 4, 6], ["FU", 5, [0, 1]], ["AN", 5, 0, 5], ["FU", 5, [1, 2]], ["AN", 5, 1, 4], ["FU", 5, [2, 3]], ["AN", 5, 2, 6], ["FU", 3, [0, 1]], ["SP", 3, 0, 192, [2], 1], ["AN", 3, 1, 2], ["FFSP", 3, 0, [2, 1], 1, 1], ["AN", 3, 1, 6], ["FU", 1, [0, 1]], ["SP", 1, 0, 384, [2], 1], ["AN", 1, 1, 2], ["FFSP", 1, 0, [2, 1], 1, 1], ["AN", 1, 1, 6], ["PR", 4, 0, "auto_unroll_max_step$1024"]]]], "r": [[0.000623762], 0, 0.868047, 1708768626], "mark": 2, "ag": 0, "v": "v0.6"}
{"i": [["[\"_matmul\", 512, 3072, 768, \"float32\"]", "cuda -keys=cuda,gpu -arch=sm_86 -max_num_threads=1024 -model=unknown -thread_warp_size=32", [82, 999, 999, 49152, 2147483647, 1024, 255, 32], "", 0, []], [[], [["CHW", 2, "local"], ["SP", 2, 0, 512, [1, 4, 16, 1], 1], ["SP", 2, 5, 768, [1, 24, 8, 1], 1], ["SP", 2, 10, 3072, [32, 1], 1], ["RE", 2, [0, 5, 1, 6, 2, 7, 10, 11, 3, 8, 12, 4, 9]], ["FSP", 3, 0, 1, 3], ["FSP", 3, 4, 2, 3], ["RE", 3, [0, 4, 1, 5, 2, 6, 3, 7]], ["CA", 2, 3, 5], ["CHR", 1, "shared", [2]], ["CA", 2, 3, 6], ["CHR", 0, "shared", [3]], ["CA", 1, 4, 6], ["FU", 5, [0, 1]], ["AN", 5, 0, 5], ["FU", 5, [1, 2]], ["AN", 5, 1, 4], ["FU", 5, [2, 3]], ["AN", 5, 2, 6], ["FU", 3, [0, 1]], ["SP", 3, 0, 256, [2], 1], ["AN", 3, 1, 2], ["FFSP", 3, 0, [2, 1], 1, 1], ["AN", 3, 1, 6], ["FU", 1, [0, 1]], ["SP", 1, 0, 512, [2], 1], ["AN", 1, 1, 2], ["FFSP", 1, 0, [2, 1], 1, 1], ["AN", 1, 1, 6], ["PR", 4, 0, "auto_unroll_max_step$1024"]]]], "r": [[0.000571984], 0, 0.682476, 1708768627], "mark": 2, "ag": 0, "v": "v0.6"}
{"i": [["[\"_matmul\", 512, 3072, 768, \"float32\"]", "cuda -keys=cuda,gpu -arch=sm_86 -max_num_threads=1024 -model=unknown -thread_warp_size=32", [82, 999, 999, 49152, 2147483647, 1024, 255, 32], "", 0, []], [[], [["CHW", 2, "local"], ["SP", 2, 0, 512, [1, 1, 16, 1], 1], ["SP", 2, 5, 768, [1, 32, 6, 1], 1], ["SP", 2, 10, 3072, [32, 1], 1], ["RE", 2, [0, 5, 1, 6, 2, 7, 10, 11, 3, 8, 12, 4, 9]], ["FSP", 3, 0, 1, 3], ["FSP", 3, 4, 2, 3], ["RE", 3, [0, 4, 1, 5, 2, 6, 3, 7]], ["CA", 2, 3, 5], ["CHR", 1, "shared", [2]], ["CA", 2, 3, 6], ["CHR", 0, "shared", [3]], ["CA", 1, 4, 6], ["FU", 5, [0, 1]], ["AN", 5, 0, 5], ["FU", 5, [1, 2]], ["AN", 5, 1, 4], ["FU", 5, [2, 3]], ["AN", 5, 2, 6], ["FU", 3, [0, 1]], ["SP", 3, 0, 192, [2], 1], ["AN", 3, 1, 2], ["FFSP", 3, 0, [2, 1], 1, 1], ["AN", 3, 1, 6], ["FU", 1, [0, 1]], ["SP", 1, 0, 512, [2], 1], ["AN", 1, 1, 2], ["FFSP", 1, 0, [2, 1], 1, 1], ["AN", 1, 1, 6], ["PR", 4, 0, "auto_unroll_max_step$1024"]]]], "r": [[0.000371018], 0, 1.05983, 1708768627], "mark": 2, "ag": 0, "v": "v0.6"}
{"i": [["[\"_matmul\", 512, 3072, 768, \"float32\"]", "cuda -keys=cuda,gpu -arch=sm_86 -max_num_threads=1024 -model=unknown -thread_warp_size=32", [82, 999, 999, 49152, 2147483647, 1024, 255, 32], "", 0, []], [[], [["CHW", 2, "local"], ["SP", 2, 0, 512, [1, 4, 16, 1], 1], ["SP", 2, 5, 768, [1, 32, 6, 1], 1], ["SP", 2, 10, 3072, [32, 1], 1], ["RE", 2, [0, 5, 1, 6, 2, 7, 10, 11, 3, 8, 12, 4, 9]], ["FSP", 3, 0, 1, 3], ["FSP", 3, 4, 2, 3], ["RE", 3, [0, 4, 1, 5, 2, 6, 3, 7]], ["CA", 2, 3, 5], ["CHR", 1, "shared", [2]], ["CA", 2, 3, 6], ["CHR", 0, "shared", [3]], ["CA", 1, 4, 6], ["FU", 5, [0, 1]], ["AN", 5, 0, 5], ["FU", 5, [1, 2]], ["AN", 5, 1, 4], ["FU", 5, [2, 3]], ["AN", 5, 2, 6], ["FU", 3, [0, 1]], ["SP", 3, 0, 192, [2], 1], ["AN", 3, 1, 2], ["FFSP", 3, 0, [2, 1], 1, 1], ["AN", 3, 1, 6], ["FU", 1, [0, 1]], ["SP", 1, 0, 512, [2], 1], ["AN", 1, 1, 2], ["FFSP", 1, 0, [2, 1], 1, 1], ["AN", 1, 1, 6], ["PR", 4, 0, "auto_unroll_max_step$1024"]]]], "r": [[0.000331903], 0, 1.06362, 1708768627], "mark": 2, "ag": 0, "v": "v0.6"}
{"i": [["[\"_matmul\", 512, 3072, 768, \"float32\"]", "cuda -keys=cuda,gpu -arch=sm_86 -max_num_threads=1024 -model=unknown -thread_warp_size=32", [82, 999, 999, 49152, 2147483647, 1024, 255, 32], "", 0, []], [[], [["CHW", 2, "local"], ["SP", 2, 0, 512, [1, 2, 8, 1], 1], ["SP", 2, 5, 768, [1, 32, 8, 1], 1], ["SP", 2, 10, 3072, [24, 1], 1], ["RE", 2, [0, 5, 1, 6, 2, 7, 10, 11, 3, 8, 12, 4, 9]], ["FSP", 3, 0, 1, 3], ["FSP", 3, 4, 2, 3], ["RE", 3, [0, 4, 1, 5, 2, 6, 3, 7]], ["CA", 2, 3, 5], ["CHR", 1, "shared", [2]], ["CA", 2, 3, 6], ["CHR", 0, "shared", [3]], ["CA", 1, 4, 6], ["FU", 5, [0, 1]], ["AN", 5, 0, 5], ["FU", 5, [1, 2]], ["AN", 5, 1, 4], ["FU", 5, [2, 3]], ["AN", 5, 2, 6], ["FU", 3, [0, 1]], ["SP", 3, 0, 192, [2], 1], ["AN", 3, 1, 2], ["FFSP", 3, 0, [2, 1], 1, 1], ["AN", 3, 1, 6], ["FU", 1, [0, 1]], ["SP", 1, 0, 192, [2], 1], ["AN", 1, 1, 2], ["FFSP", 1, 0, [2, 1], 1, 1], ["AN", 1, 1, 6], ["PR", 4, 0, "auto_unroll_max_step$1024"]]]], "r": [[0.000296492], 0, 0.697682, 1708768627], "mark": 2, "ag": 0, "v": "v0.6"}
{"i": [["[\"_matmul\", 512, 3072, 768, \"float32\"]", "cuda -keys=cuda,gpu -arch=sm_86 -max_num_threads=1024 -model=unknown -thread_warp_size=32", [82, 999, 999, 49152, 2147483647, 1024, 255, 32], "", 0, []], [[], [["CHW", 2, "local"], ["SP", 2, 0, 512, [1, 2, 32, 1], 1], ["SP", 2, 5, 768, [1, 32, 8, 1], 1], ["SP", 2, 10, 3072, [24, 1], 1], ["RE", 2, [0, 5, 1, 6, 2, 7, 10, 11, 3, 8, 12, 4, 9]], ["FSP", 3, 0, 1, 3], ["FSP", 3, 4, 2, 3], ["RE", 3, [0, 4, 1, 5, 2, 6, 3, 7]], ["CA", 2, 3, 5], ["CHR", 1, "shared", [2]], ["CA", 2, 3, 6], ["CHR", 0, "shared", [3]], ["CA", 1, 4, 6], ["FU", 5, [0, 1]], ["AN", 5, 0, 5], ["FU", 5, [1, 2]], ["AN", 5, 1, 4], ["FU", 5, [2, 3]], ["AN", 5, 2, 6], ["FU", 3, [0, 1]], ["SP", 3, 0, 192, [2], 1], ["AN", 3, 1, 2], ["FFSP", 3, 0, [2, 1], 1, 1], ["AN", 3, 1, 6], ["FU", 1, [0, 1]], ["SP", 1, 0, 768, [2], 1], ["AN", 1, 1, 2], ["FFSP", 1, 0, [2, 1], 1, 1], ["AN", 1, 1, 6], ["PR", 4, 0, "auto_unroll_max_step$1024"]]]], "r": [[0.00355637], 0, 0.910593, 1708768627], "mark": 2, "ag": 0, "v": "v0.6"}
{"i": [["[\"_matmul\", 512, 3072, 768, \"float32\"]", "cuda -keys=cuda,gpu -arch=sm_86 -max_num_threads=1024 -model=unknown -thread_warp_size=32", [82, 999, 999, 49152, 2147483647, 1024, 255, 32], "", 0, []], [[], [["CHW", 2, "local"], ["SP", 2, 0, 512, [1, 2, 8, 1], 1], ["SP", 2, 5, 768, [1, 24, 8, 1], 1], ["SP", 2, 10, 3072, [32, 1], 1], ["RE", 2, [0, 5, 1, 6, 2, 7, 10, 11, 3, 8, 12, 4, 9]], ["FSP", 3, 0, 1, 3], ["FSP", 3, 4, 2, 3], ["RE", 3, [0, 4, 1, 5, 2, 6, 3, 7]], ["CA", 2, 3, 5], ["CHR", 1, "shared", [2]], ["CA", 2, 3, 6], ["CHR", 0, "shared", [3]], ["CA", 1, 4, 6], ["FU", 5, [0, 1]], ["AN", 5, 0, 5], ["FU", 5, [1, 2]], ["AN", 5, 1, 4], ["FU", 5, [2, 3]], ["AN", 5, 2, 6], ["FU", 3, [0, 1]], ["SP", 3, 0, 256, [2], 1], ["AN", 3, 1, 2], ["FFSP", 3, 0, [2, 1], 1, 1], ["AN", 3, 1, 6], ["FU", 1, [0, 1]], ["SP", 1, 0, 256, [2], 1], ["AN", 1, 1, 2], ["FFSP", 1, 0, [2, 1], 1, 1], ["AN", 1, 1, 6], ["PR", 4, 0, "auto_unroll_max_step$1024"]]]], "r": [[0.000383941], 0, 0.633143, 1708768628], "mark": 2, "ag": 0, "v": "v0.6"}
{"i": [["[\"_matmul\", 512, 3072, 768, \"float32\"]", "cuda -keys=cuda,gpu -arch=sm_86 -max_num_threads=1024 -model=unknown -thread_warp_size=32", [82, 999, 999, 49152, 2147483647, 1024, 255, 32], "", 0, []], [[], [["CHW", 2, "local"], ["SP", 2, 0, 512, [1, 2, 32, 1], 1], ["SP", 2, 5, 768, [1, 24, 8, 1], 1], ["SP", 2, 10, 3072, [32, 1], 1], ["RE", 2, [0, 5, 1, 6, 2, 7, 10, 11, 3, 8, 12, 4, 9]], ["FSP", 3, 0, 1, 3], ["FSP", 3, 4, 2, 3], ["RE", 3, [0, 4, 1, 5, 2, 6, 3, 7]], ["CA", 2, 3, 5], ["CHR", 1, "shared", [2]], ["CA", 2, 3, 6], ["CHR", 0, "shared", [3]], ["CA", 1, 4, 6], ["FU", 5, [0, 1]], ["AN", 5, 0, 5], ["FU", 5, [1, 2]], ["AN", 5, 1, 4], ["FU", 5, [2, 3]], ["AN", 5, 2, 6], ["FU", 3, [0, 1]], ["SP", 3, 0, 256, [2], 1], ["AN", 3, 1, 2], ["FFSP", 3, 0, [2, 1], 1, 1], ["AN", 3, 1, 6], ["FU", 1, [0, 1]], ["SP", 1, 0, 1024, [2], 1], ["AN", 1, 1, 2], ["FFSP", 1, 0, [2, 1], 1, 1], ["AN", 1, 1, 6], ["PR", 4, 0, "auto_unroll_max_step$1024"]]]], "r": [[0.00365457], 0, 0.714453, 1708768628], "mark": 2, "ag": 0, "v": "v0.6"}
{"i": [["[\"_matmul\", 512, 3072, 768, \"float32\"]", "cuda -keys=cuda,gpu -arch=sm_86 -max_num_threads=1024 -model=unknown -thread_warp_size=32", [82, 999, 999, 49152, 2147483647, 1024, 255, 32], "", 0, []], [[], [["CHW", 2, "local"], ["SP", 2, 0, 512, [1, 2, 8, 1], 1], ["SP", 2, 5, 768, [1, 32, 6, 1], 1], ["SP", 2, 10, 3072, [32, 1], 1], ["RE", 2, [0, 5, 1, 6, 2, 7, 10, 11, 3, 8, 12, 4, 9]], ["FSP", 3, 0, 1, 3], ["FSP", 3, 4, 2, 3], ["RE", 3, [0, 4, 1, 5, 2, 6, 3, 7]], ["CA", 2, 3, 5], ["CHR", 1, "shared", [2]], ["CA", 2, 3, 6], ["CHR", 0, "shared", [3]], ["CA", 1, 4, 6], ["FU", 5, [0, 1]], ["AN", 5, 0, 5], ["FU", 5, [1, 2]], ["AN", 5, 1, 4], ["FU", 5, [2, 3]], ["AN", 5, 2, 6], ["FU", 3, [0, 1]], ["SP", 3, 0, 192, [2], 1], ["AN", 3, 1, 2], ["FFSP", 3, 0, [2, 1], 1, 1], ["AN", 3, 1, 6], ["FU", 1, [0, 1]], ["SP", 1, 0, 256, [2], 1], ["AN", 1, 1, 2], ["FFSP", 1, 0, [2, 1], 1, 1], ["AN", 1, 1, 6], ["PR", 4, 0, "auto_unroll_max_step$1024"]]]], "r": [[0.000239438], 0, 0.597102, 1708768628], "mark": 2, "ag": 0, "v": "v0.6"}
{"i": [["[\"_matmul\", 512, 3072, 768, \"float32\"]", "cuda -keys=cuda,gpu -arch=sm_86 -max_num_threads=1024 -model=unknown -thread_warp_size=32", [82, 999, 999, 49152, 2147483647, 1024, 255, 32], "", 0, []], [[], [["CHW", 2, "local"], ["SP", 2, 0, 512, [1, 2, 32, 1], 1], ["SP", 2, 5, 768, [1, 32, 6, 1], 1], ["SP", 2, 10, 3072, [32, 1], 1], ["RE", 2, [0, 5, 1, 6, 2, 7, 10, 11, 3, 8, 12, 4, 9]], ["FSP", 3, 0, 1, 3], ["FSP", 3, 4, 2, 3], ["RE", 3, [0, 4, 1, 5, 2, 6, 3, 7]], ["CA", 2, 3, 5], ["CHR", 1, "shared", [2]], ["CA", 2, 3, 6], ["CHR", 0, "shared", [3]], ["CA", 1, 4, 6], ["FU", 5, [0, 1]], ["AN", 5, 0, 5], ["FU", 5, [1, 2]], ["AN", 5, 1, 4], ["FU", 5, [2, 3]], ["AN", 5, 2, 6], ["FU", 3, [0, 1]], ["SP", 3, 0, 192, [2], 1], ["AN", 3, 1, 2], ["FFSP", 3, 0, [2, 1], 1, 1], ["AN", 3, 1, 6], ["FU", 1, [0, 1]], ["SP", 1, 0, 1024, [2], 1], ["AN", 1, 1, 2], ["FFSP", 1, 0, [2, 1], 1, 1], ["AN", 1, 1, 6], ["PR", 4, 0, "auto_unroll_max_step$1024"]]]], "r": [[0.000684629], 0, 0.92919, 1708768628], "mark": 2, "ag": 0, "v": "v0.6"}
{"i": [["[\"_matmul\", 512, 3072, 768, \"float32\"]", "cuda -keys=cuda,gpu -arch=sm_86 -max_num_threads=1024 -model=unknown -thread_warp_size=32", [82, 999, 999, 49152, 2147483647, 1024, 255, 32], "", 0, []], [[], [["CHW", 2, "local"], ["SP", 2, 0, 512, [1, 1, 8, 1], 1], ["SP", 2, 5, 768, [1, 32, 8, 1], 1], ["SP", 2, 10, 3072, [32, 1], 1], ["RE", 2, [0, 5, 1, 6, 2, 7, 10, 11, 3, 8, 12, 4, 9]], ["FSP", 3, 0, 1, 3], ["FSP", 3, 4, 2, 3], ["RE", 3, [0, 4, 1, 5, 2, 6, 3, 7]], ["CA", 2, 3, 5], ["CHR", 1, "shared", [2]], ["CA", 2, 3, 6], ["CHR", 0, "shared", [3]], ["CA", 1, 4, 6], ["FU", 5, [0, 1]], ["AN", 5, 0, 5], ["FU", 5, [1, 2]], ["AN", 5, 1, 4], ["FU", 5, [2, 3]], ["AN", 5, 2, 6], ["FU", 3, [0, 1]], ["SP", 3, 0, 256, [2], 1], ["AN", 3, 1, 2], ["FFSP", 3, 0, [2, 1], 1, 1], ["AN", 3, 1, 6], ["FU", 1, [0, 1]], ["SP", 1, 0, 256, [2], 1], ["AN", 1, 1, 2], ["FFSP", 1, 0, [2, 1], 1, 1], ["AN", 1, 1, 6], ["PR", 4, 0, "auto_unroll_max_step$1024"]]]], "r": [[0.000643802], 0, 0.779882, 1708768629], "mark": 2, "ag": 0, "v": "v0.6"}
{"i": [["[\"_matmul\", 512, 3072, 768, \"float32\"]", "cuda -keys=cuda,gpu -arch=sm_86 -max_num_threads=1024 -model=unknown -thread_warp_size=32", [82, 999, 999, 49152, 2147483647, 1024, 255, 32], "", 0, []], [[], [["CHW", 2, "local"], ["SP", 2, 0, 512, [1, 4, 8, 1], 1], ["SP", 2, 5, 768, [1, 32, 8, 1], 1], ["SP", 2, 10, 3072, [32, 1], 1], ["RE", 2, [0, 5, 1, 6, 2, 7, 10, 11, 3, 8, 12, 4, 9]], ["FSP", 3, 0, 1, 3], ["FSP", 3, 4, 2, 3], ["RE", 3, [0, 4, 1, 5, 2, 6, 3, 7]], ["CA", 2, 3, 5], ["CHR", 1, "shared", [2]], ["CA", 2, 3, 6], ["CHR", 0, "shared", [3]], ["CA", 1, 4, 6], ["FU", 5, [0, 1]], ["AN", 5, 0, 5], ["FU", 5, [1, 2]], ["AN", 5, 1, 4], ["FU", 5, [2, 3]], ["AN", 5, 2, 6], ["FU", 3, [0, 1]], ["SP", 3, 0, 256, [2], 1], ["AN", 3, 1, 2], ["FFSP", 3, 0, [2, 1], 1, 1], ["AN", 3, 1, 6], ["FU", 1, [0, 1]], ["SP", 1, 0, 256, [2], 1], ["AN", 1, 1, 2], ["FFSP", 1, 0, [2, 1], 1, 1], ["AN", 1, 1, 6], ["PR", 4, 0, "auto_unroll_max_step$1024"]]]], "r": [[0.000296302], 0, 0.510157, 1708768629], "mark": 2, "ag": 0, "v": "v0.6"}
{"i": [["[\"_matmul\", 512, 3072, 768, \"float32\"]", "cuda -keys=cuda,gpu -arch=sm_86 -max_num_threads=1024 -model=unknown -thread_warp_size=32", [82, 999, 999, 49152, 2147483647, 1024, 255, 32], "", 0, []], [[], [["CHW", 2, "local"], ["SP", 2, 0, 512, [1, 1, 32, 1], 1], ["SP", 2, 5, 768, [1, 32, 8, 1], 1], ["SP", 2, 10, 3072, [32, 1], 1], ["RE", 2, [0, 5, 1, 6, 2, 7, 10, 11, 3, 8, 12, 4, 9]], ["FSP", 3, 0, 1, 3], ["FSP", 3, 4, 2, 3], ["RE", 3, [0, 4, 1, 5, 2, 6, 3, 7]], ["CA", 2, 3, 5], ["CHR", 1, "shared", [2]], ["CA", 2, 3, 6], ["CHR", 0, "shared", [3]], ["CA", 1, 4, 6], ["FU", 5, [0, 1]], ["AN", 5, 0, 5], ["FU", 5, [1, 2]], ["AN", 5, 1, 4], ["FU", 5, [2, 3]], ["AN", 5, 2, 6], ["FU", 3, [0, 1]], ["SP", 3, 0, 256, [2], 1], ["AN", 3, 1, 2], ["FFSP", 3, 0, [2, 1], 1, 1], ["AN", 3, 1, 6], ["FU", 1, [0, 1]], ["SP", 1, 0, 1024, [2], 1], ["AN", 1, 1, 2], ["FFSP", 1, 0, [2, 1], 1, 1], ["AN", 1, 1, 6], ["PR", 4, 0, "auto_unroll_max_step$1024"]]]], "r": [[0.00363297], 0, 0.750749, 1708768629], "mark": 2, "ag": 0, "v": "v0.6"}
{"i": [["[\"_matmul\", 512, 3072, 768, \"float32\"]", "cuda -keys=cuda,gpu -arch=sm_86 -max_num_threads=1024 -model=unknown -thread_warp_size=32", [82, 999, 999, 49152, 2147483647, 1024, 255, 32], "", 0, []], [[], [["CHW", 2, "local"], ["SP", 2, 0, 512, [1, 4, 32, 1], 1], ["SP", 2, 5, 768, [1, 32, 8, 1], 1], ["SP", 2, 10, 3072, [32, 1], 1], ["RE", 2, [0, 5, 1, 6, 2, 7, 10, 11, 3, 8, 12, 4, 9]], ["FSP", 3, 0, 1, 3], ["FSP", 3, 4, 2, 3], ["RE", 3, [0, 4, 1, 5, 2, 6, 3, 7]], ["CA", 2, 3, 5], ["CHR", 1, "shared", [2]], ["CA", 2, 3, 6], ["CHR", 0, "shared", [3]], ["CA", 1, 4, 6], ["FU", 5, [0, 1]], ["AN", 5, 0, 5], ["FU", 5, [1, 2]], ["AN", 5, 1, 4], ["FU", 5, [2, 3]], ["AN", 5, 2, 6], ["FU", 3, [0, 1]], ["SP", 3, 0, 256, [2], 1], ["AN", 3, 1, 2], ["FFSP", 3, 0, [2, 1], 1, 1], ["AN", 3, 1, 6], ["FU", 1, [0, 1]], ["SP", 1, 0, 1024, [2], 1], ["AN", 1, 1, 2], ["FFSP", 1, 0, [2, 1], 1, 1], ["AN", 1, 1, 6], ["PR", 4, 0, "auto_unroll_max_step$1024"]]]], "r": [[0.00334624], 0, 0.661427, 1708768629], "mark": 2, "ag": 0, "v": "v0.6"}
{"i": [["[\"_matmul\", 512, 3072, 768, \"float32\"]", "cuda -keys=cuda,gpu -arch=sm_86 -max_num_threads=1024 -model=unknown -thread_warp_size=32", [82, 999, 999, 49152, 2147483647, 1024, 255, 32], "", 0, []], [[], [["CHW", 2, "local"], ["SP", 2, 0, 512, [1, 2, 8, 1], 1], ["SP", 2, 5, 768, [1, 32, 6, 1], 1], ["SP", 2, 10, 3072, [32, 1], 1], ["RE", 2, [0, 5, 1, 6, 2, 7, 10, 11, 3, 8, 12, 4, 9]], ["FSP", 3, 0, 1, 3], ["FSP", 3, 4, 2, 3], ["RE", 3, [0, 4, 1, 5, 2, 6, 3, 7]], ["CA", 2, 3, 5], ["CHR", 1, "shared", [2]], ["CA", 2, 3, 6], ["CHR", 0, "shared", [3]], ["CA", 1, 4, 6], ["FU", 5, [0, 1]], ["AN", 5, 0, 5], ["FU", 5, [1, 2]], ["AN", 5, 1, 4], ["FU", 5, [2, 3]], ["AN", 5, 2, 6], ["FU", 3, [0, 1]], ["SP", 3, 0, 192, [2], 1], ["AN", 3, 1, 2], ["FFSP", 3, 0, [2, 1], 1, 1], ["AN", 3, 1, 6], ["FU", 1, [0, 1]], ["SP", 1, 0, 256, [2], 1], ["AN", 1, 1, 2], ["FFSP", 1, 0, [2, 1], 1, 1], ["AN", 1, 1, 6], ["PR", 4, 0, "auto_unroll_max_step$1024"]]]], "r": [[0.000239438], 0, 0.597102, 1708768628], "mark": 2, "ag": 1, "v": "v0.6"}
{"i": [["[\"_matmul\", 512, 3072, 768, \"float32\"]", "cuda -keys=cuda,gpu -arch=sm_86 -max_num_threads=1024 -model=unknown -thread_warp_size=32", [82, 999, 999, 49152, 2147483647, 1024, 255, 32], "", 0, []], [[], [["CHW", 2, "local"], ["SP", 2, 0, 512, [1, 2, 8, 1], 1], ["SP", 2, 5, 768, [1, 32, 6, 1], 1], ["SP", 2, 10, 3072, [24, 1], 1], ["RE", 2, [0, 5, 1, 6, 2, 7, 10, 11, 3, 8, 12, 4, 9]], ["FSP", 3, 0, 1, 3], ["FSP", 3, 4, 2, 3], ["RE", 3, [0, 4, 1, 5, 2, 6, 3, 7]], ["CA", 2, 3, 5], ["CHR", 1, "shared", [2]], ["CA", 2, 3, 6], ["CHR", 0, "shared", [3]], ["CA", 1, 4, 6], ["FU", 5, [0, 1]], ["AN", 5, 0, 5], ["FU", 5, [1, 2]], ["AN", 5, 1, 4], ["FU", 5, [2, 3]], ["AN", 5, 2, 6], ["FU", 3, [0, 1]], ["SP", 3, 0, 144, [2], 1], ["AN", 3, 1, 2], ["FFSP", 3, 0, [2, 1], 1, 1], ["AN", 3, 1, 6], ["FU", 1, [0, 1]], ["SP", 1, 0, 192, [2], 1], ["AN", 1, 1, 2], ["FFSP", 1, 0, [2, 1], 1, 1], ["AN", 1, 1, 6], ["PR", 4, 0, "auto_unroll_max_step$1024"]]]], "r": [[0.000255883], 0, 0.851991, 1708768633], "mark": 2, "ag": 1, "v": "v0.6"}
{"i": [["[\"_matmul\", 512, 3072, 768, \"float32\"]", "cuda -keys=cuda,gpu -arch=sm_86 -max_num_threads=1024 -model=unknown -thread_warp_size=32", [82, 999, 999, 49152, 2147483647, 1024, 255, 32], "", 0, []], [[], [["CHW", 2, "local"], ["SP", 2, 0, 512, [1, 2, 8, 1], 1], ["SP", 2, 5, 768, [1, 32, 6, 1], 1], ["SP", 2, 10, 3072, [48, 1], 1], ["RE", 2, [0, 5, 1, 6, 2, 7, 10, 11, 3, 8, 12, 4, 9]], ["FSP", 3, 0, 1, 3], ["FSP", 3, 4, 2, 3], ["RE", 3, [0, 4, 1, 5, 2, 6, 3, 7]], ["CA", 2, 3, 5], ["CHR", 1, "shared", [2]], ["CA", 2, 3, 6], ["CHR", 0, "shared", [3]], ["CA", 1, 4, 6], ["FU", 5, [0, 1]], ["AN", 5, 0, 5], ["FU", 5, [1, 2]], ["AN", 5, 1, 4], ["FU", 5, [2, 3]], ["AN", 5, 2, 6], ["FU", 3, [0, 1]], ["SP", 3, 0, 288, [2], 1], ["AN", 3, 1, 2], ["FFSP", 3, 0, [2, 1], 1, 1], ["AN", 3, 1, 6], ["FU", 1, [0, 1]], ["SP", 1, 0, 384, [2], 1], ["AN", 1, 1, 2], ["FFSP", 1, 0, [2, 1], 1, 1], ["AN", 1, 1, 6], ["PR", 4, 0, "auto_unroll_max_step$1024"]]]], "r": [[0.000249266], 0, 0.843082, 1708768633], "mark": 2, "ag": 1, "v": "v0.6"}
{"i": [["[\"_matmul\", 512, 3072, 768, \"float32\"]", "cuda -keys=cuda,gpu -arch=sm_86 -max_num_threads=1024 -model=unknown -thread_warp_size=32", [82, 999, 999, 49152, 2147483647, 1024, 255, 32], "", 0, []], [[], [["CHW", 2, "local"], ["SP", 2, 0, 512, [1, 2, 8, 1], 1], ["SP", 2, 5, 768, [1, 32, 4, 1], 1], ["SP", 2, 10, 3072, [32, 1], 1], ["RE", 2, [0, 5, 1, 6, 2, 7, 10, 11, 3, 8, 12, 4, 9]], ["FSP", 3, 0, 1, 3], ["FSP", 3, 4, 2, 3], ["RE", 3, [0, 4, 1, 5, 2, 6, 3, 7]], ["CA", 2, 3, 5], ["CHR", 1, "shared", [2]], ["CA", 2, 3, 6], ["CHR", 0, "shared", [3]], ["CA", 1, 4, 6], ["FU", 5, [0, 1]], ["AN", 5, 0, 5], ["FU", 5, [1, 2]], ["AN", 5, 1, 4], ["FU", 5, [2, 3]], ["AN", 5, 2, 6], ["FU", 3, [0, 1]], ["SP", 3, 0, 128, [2], 1], ["AN", 3, 1, 2], ["FFSP", 3, 0, [2, 1], 1, 1], ["AN", 3, 1, 6], ["FU", 1, [0, 1]], ["SP", 1, 0, 256, [2], 1], ["AN", 1, 1, 2], ["FFSP", 1, 0, [2, 1], 1, 1], ["AN", 1, 1, 6], ["PR", 4, 0, "auto_unroll_max_step$1024"]]]], "r": [[0.000232759], 0, 1.18379, 1708768633], "mark": 2, "ag": 1, "v": "v0.6"}
{"i": [["[\"_matmul\", 512, 3072, 768, \"float32\"]", "cuda -keys=cuda,gpu -arch=sm_86 -max_num_threads=1024 -model=unknown -thread_warp_size=32", [82, 999, 999, 49152, 2147483647, 1024, 255, 32], "", 0, []], [[], [["CHW", 2, "local"], ["SP", 2, 0, 512, [1, 2, 8, 1], 1], ["SP", 2, 5, 768, [1, 32, 8, 1], 1], ["SP", 2, 10, 3072, [32, 1], 1], ["RE", 2, [0, 5, 1, 6, 2, 7, 10, 11, 3, 8, 12, 4, 9]], ["FSP", 3, 0, 1, 3], ["FSP", 3, 4, 2, 3], ["RE", 3, [0, 4, 1, 5, 2, 6, 3, 7]], ["CA", 2, 3, 5], ["CHR", 1, "shared", [2]], ["CA", 2, 3, 6], ["CHR", 0, "shared", [3]], ["CA", 1, 4, 6], ["FU", 5, [0, 1]], ["AN", 5, 0, 5], ["FU", 5, [1, 2]], ["AN", 5, 1, 4], ["FU", 5, [2, 3]], ["AN", 5, 2, 6], ["FU", 3, [0, 1]], ["SP", 3, 0, 256, [2], 1], ["AN", 3, 1, 2], ["FFSP", 3, 0, [2, 1], 1, 1], ["AN", 3, 1, 6], ["FU", 1, [0, 1]], ["SP", 1, 0, 256, [2], 1], ["AN", 1, 1, 2], ["FFSP", 1, 0, [2, 1], 1, 1], ["AN", 1, 1, 6], ["PR", 4, 0, "auto_unroll_max_step$1024"]]]], "r": [[0.000309929], 0, 0.906939, 1708768633], "mark": 2, "ag": 1, "v": "v0.6"}
{"i": [["[\"_matmul\", 512, 3072, 768, \"float32\"]", "cuda -keys=cuda,gpu -arch=sm_86 -max_num_threads=1024 -model=unknown -thread_warp_size=32", [82, 999, 999, 49152, 2147483647, 1024, 255, 32], "", 0, []], [[], [["CHW", 2, "local"], ["SP", 2, 0, 512, [1, 1, 8, 1], 1], ["SP", 2, 5, 768, [1, 32, 6, 1], 1], ["SP", 2, 10, 3072, [32, 1], 1], ["RE", 2, [0, 5, 1, 6, 2, 7, 10, 11, 3, 8, 12, 4, 9]], ["FSP", 3, 0, 1, 3], ["FSP", 3, 4, 2, 3], ["RE", 3, [0, 4, 1, 5, 2, 6, 3, 7]], ["CA", 2, 3, 5], ["CHR", 1, "shared", [2]], ["CA", 2, 3, 6], ["CHR", 0, "shared", [3]], ["CA", 1, 4, 6], ["FU", 5, [0, 1]], ["AN", 5, 0, 5], ["FU", 5, [1, 2]], ["AN", 5, 1, 4], ["FU", 5, [2, 3]], ["AN", 5, 2, 6], ["FU", 3, [0, 1]], ["SP", 3, 0, 192, [2], 1], ["AN", 3, 1, 2], ["FFSP", 3, 0, [2, 1], 1, 1], ["AN", 3, 1, 6], ["FU", 1, [0, 1]], ["SP", 1, 0, 256, [2], 1], ["AN", 1, 1, 2], ["FFSP", 1, 0, [2, 1], 1, 1], ["AN", 1, 1, 6], ["PR", 4, 0, "auto_unroll_max_step$1024"]]]], "r": [[0.000502294], 0, 0.751487, 1708768634], "mark": 2, "ag": 1, "v": "v0.6"}
{"i": [["[\"_matmul\", 512, 3072, 768, \"float32\"]", "cuda -keys=cuda,gpu -arch=sm_86 -max_num_threads=1024 -model=unknown -thread_warp_size=32", [82, 999, 999, 49152, 2147483647, 1024, 255, 32], "", 0, []], [[], [["CHW", 2, "local"], ["SP", 2, 0, 512, [1, 4, 8, 1], 1], ["SP", 2, 5, 768, [1, 32, 6, 1], 1], ["SP", 2, 10, 3072, [32, 1], 1], ["RE", 2, [0, 5, 1, 6, 2, 7, 10, 11, 3, 8, 12, 4, 9]], ["FSP", 3, 0, 1, 3], ["FSP", 3, 4, 2, 3], ["RE", 3, [0, 4, 1, 5, 2, 6, 3, 7]], ["CA", 2, 3, 5], ["CHR", 1, "shared", [2]], ["CA", 2, 3, 6], ["CHR", 0, "shared", [3]], ["CA", 1, 4, 6], ["FU", 5, [0, 1]], ["AN", 5, 0, 5], ["FU", 5, [1, 2]], ["AN", 5, 1, 4], ["FU", 5, [2, 3]], ["AN", 5, 2, 6], ["FU", 3, [0, 1]], ["SP", 3, 0, 192, [2], 1], ["AN", 3, 1, 2], ["FFSP", 3, 0, [2, 1], 1, 1], ["AN", 3, 1, 6], ["FU", 1, [0, 1]], ["SP", 1, 0, 256, [2], 1], ["AN", 1, 1, 2], ["FFSP", 1, 0, [2, 1], 1, 1], ["AN", 1, 1, 6], ["PR", 4, 0, "auto_unroll_max_step$1024"]]]], "r": [[0.000253053], 0, 0.600332, 1708768634], "mark": 2, "ag": 1, "v": "v0.6"}
{"i": [["[\"_matmul\", 512, 3072, 768, \"float32\"]", "cuda -keys=cuda,gpu -arch=sm_86 -max_num_threads=1024 -model=unknown -thread_warp_size=32", [82, 999, 999, 49152, 2147483647, 1024, 255, 32], "", 0, []], [[], [["CHW", 2, "local"], ["SP", 2, 0, 512, [1, 2, 4, 1], 1], ["SP", 2, 5, 768, [1, 32, 6, 1], 1], ["SP", 2, 10, 3072, [32, 1], 1], ["RE", 2, [0, 5, 1, 6, 2, 7, 10, 11, 3, 8, 12, 4, 9]], ["FSP", 3, 0, 1, 3], ["FSP", 3, 4, 2, 3], ["RE", 3, [0, 4, 1, 5, 2, 6, 3, 7]], ["CA", 2, 3, 5], ["CHR", 1, "shared", [2]], ["CA", 2, 3, 6], ["CHR", 0, "shared", [3]], ["CA", 1, 4, 6], ["FU", 5, [0, 1]], ["AN", 5, 0, 5], ["FU", 5, [1, 2]], ["AN", 5, 1, 4], ["FU", 5, [2, 3]], ["AN", 5, 2, 6], ["FU", 3, [0, 1]], ["SP", 3, 0, 192, [2], 1], ["AN", 3, 1, 2], ["FFSP", 3, 0, [2, 1], 1, 1], ["AN", 3, 1, 6], ["FU", 1, [0, 1]], ["SP", 1, 0, 128, [2], 1], ["AN", 1, 1, 2], ["FFSP", 1, 0, [2, 1], 1, 1], ["AN", 1, 1, 6], ["PR", 4, 0, "auto_unroll_max_step$1024"]]]], "r": [[0.000392241], 0, 1.06753, 1708768634], "mark": 2, "ag": 1, "v": "v0.6"}
{"i": [["[\"_matmul\", 512, 3072, 768, \"float32\"]", "cuda -keys=cuda,gpu -arch=sm_86 -max_num_threads=1024 -model=unknown -thread_warp_size=32", [82, 999, 999, 49152, 2147483647, 1024, 255, 32], "", 0, []], [[], [["CHW", 2, "local"], ["SP", 2, 0, 512, [1, 2, 16, 1], 1], ["SP", 2, 5, 768, [1, 32, 6, 1], 1], ["SP", 2, 10, 3072, [32, 1], 1], ["RE", 2, [0, 5, 1, 6, 2, 7, 10, 11, 3, 8, 12, 4, 9]], ["FSP", 3, 0, 1, 3], ["FSP", 3, 4, 2, 3], ["RE", 3, [0, 4, 1, 5, 2, 6, 3, 7]], ["CA", 2, 3, 5], ["CHR", 1, "shared", [2]], ["CA", 2, 3, 6], ["CHR", 0, "shared", [3]], ["CA", 1, 4, 6], ["FU", 5, [0, 1]], ["AN", 5, 0, 5], ["FU", 5, [1, 2]], ["AN", 5, 1, 4], ["FU", 5, [2, 3]], ["AN", 5, 2, 6], ["FU", 3, [0, 1]], ["SP", 3, 0, 192, [2], 1], ["AN", 3, 1, 2], ["FFSP", 3, 0, [2, 1], 1, 1], ["AN", 3, 1, 6], ["FU", 1, [0, 1]], ["SP", 1, 0, 512, [2], 1], ["AN", 1, 1, 2], ["FFSP", 1, 0, [2, 1], 1, 1], ["AN", 1, 1, 6], ["PR", 4, 0, "auto_unroll_max_step$1024"]]]], "r": [[0.000351685], 0, 0.93326, 1708768634], "mark": 2, "ag": 1, "v": "v0.6"}
{"i": [["[\"_matmul\", 512, 3072, 768, \"float32\"]", "cuda -keys=cuda,gpu -arch=sm_86 -max_num_threads=1024 -model=unknown -thread_warp_size=32", [82, 999, 999, 49152, 2147483647, 1024, 255, 32], "", 0, []], [[], [["CHW", 2, "local"], ["SP", 2, 0, 512, [1, 2, 8, 1], 1], ["SP", 2, 5, 768, [1, 32, 4, 1], 1], ["SP", 2, 10, 3072, [24, 1], 1], ["RE", 2, [0, 5, 1, 6, 2, 7, 10, 11, 3, 8, 12, 4, 9]], ["FSP", 3, 0, 1, 3], ["FSP", 3, 4, 2, 3], ["RE", 3, [0, 4, 1, 5, 2, 6, 3, 7]], ["CA", 2, 3, 5], ["CHR", 1, "shared", [2]], ["CA", 2, 3, 6], ["CHR", 0, "shared", [3]], ["CA", 1, 4, 6], ["FU", 5, [0, 1]], ["AN", 5, 0, 5], ["FU", 5, [1, 2]], ["AN", 5, 1, 4], ["FU", 5, [2, 3]], ["AN", 5, 2, 6], ["FU", 3, [0, 1]], ["SP", 3, 0, 96, [2], 1], ["AN", 3, 1, 2], ["FFSP", 3, 0, [2, 1], 1, 1], ["AN", 3, 1, 6], ["FU", 1, [0, 1]], ["SP", 1, 0, 192, [2], 1], ["AN", 1, 1, 2], ["FFSP", 1, 0, [2, 1], 1, 1], ["AN", 1, 1, 6], ["PR", 4, 0, "auto_unroll_max_step$1024"]]]], "r": [[0.000241106], 0, 0.90871, 1708768634], "mark": 2, "ag": 1, "v": "v0.6"}
{"i": [["[\"_matmul\", 512, 3072, 768, \"float32\"]", "cuda -keys=cuda,gpu -arch=sm_86 -max_num_threads=1024 -model=unknown -thread_warp_size=32", [82, 999, 999, 49152, 2147483647, 1024, 255, 32], "", 0, []], [[], [["CHW", 2, "local"], ["SP", 2, 0, 512, [1, 2, 8, 1], 1], ["SP", 2, 5, 768, [1, 32, 4, 1], 1], ["SP", 2, 10, 3072, [48, 1], 1], ["RE", 2, [0, 5, 1, 6, 2, 7, 10, 11, 3, 8, 12, 4, 9]], ["FSP", 3, 0, 1, 3], ["FSP", 3, 4, 2, 3], ["RE", 3, [0, 4, 1, 5, 2, 6, 3, 7]], ["CA", 2, 3, 5], ["CHR", 1, "shared", [2]], ["CA", 2, 3, 6], ["CHR", 0, "shared", [3]], ["CA", 1, 4, 6], ["FU", 5, [0, 1]], ["AN", 5, 0, 5], ["FU", 5, [1, 2]], ["AN", 5, 1, 4], ["FU", 5, [2, 3]], ["AN", 5, 2, 6], ["FU", 3, [0, 1]], ["SP", 3, 0, 192, [2], 1], ["AN", 3, 1, 2], ["FFSP", 3, 0, [2, 1], 1, 1], ["AN", 3, 1, 6], ["FU", 1, [0, 1]], ["SP", 1, 0, 384, [2], 1], ["AN", 1, 1, 2], ["FFSP", 1, 0, [2, 1], 1, 1], ["AN", 1, 1, 6], ["PR", 4, 0, "auto_unroll_max_step$1024"]]]], "r": [[0.000252867], 0, 0.695964, 1708768635], "mark": 2, "ag": 1, "v": "v0.6"}
{"i": [["[\"_matmul\", 512, 3072, 768, \"float32\"]", "cuda -keys=cuda,gpu -arch=sm_86 -max_num_threads=1024 -model=unknown -thread_warp_size=32", [82, 999, 999, 49152, 2147483647, 1024, 255, 32], "", 0, []], [[], [["CHW", 2, "local"], ["SP", 2, 0, 512, [1, 2, 8, 1], 1], ["SP", 2, 5, 768, [1, 32, 8, 1], 1], ["SP", 2, 10, 3072, [24, 1], 1], ["RE", 2, [0, 5, 1, 6, 2, 7, 10, 11, 3, 8, 12, 4, 9]], ["FSP", 3, 0, 1, 3], ["FSP", 3, 4, 2, 3], ["RE", 3, [0, 4, 1, 5, 2, 6, 3, 7]], ["CA", 2, 3, 5], ["CHR", 1, "shared", [2]], ["CA", 2, 3, 6], ["CHR", 0, "shared", [3]], ["CA", 1, 4, 6], ["FU", 5, [0, 1]], ["AN", 5, 0, 5], ["FU", 5, [1, 2]], ["AN", 5, 1, 4], ["FU", 5, [2, 3]], ["AN", 5, 2, 6], ["FU", 3, [0, 1]], ["SP", 3, 0, 192, [2], 1], ["AN", 3, 1, 2], ["FFSP", 3, 0, [2, 1], 1, 1], ["AN", 3, 1, 6], ["FU", 1, [0, 1]], ["SP", 1, 0, 192, [2], 1], ["AN", 1, 1, 2], ["FFSP", 1, 0, [2, 1], 1, 1], ["AN", 1, 1, 6], ["PR", 4, 0, "auto_unroll_max_step$1024"]]]], "r": [[0.00029788], 0, 0.67461, 1708768635], "mark": 2, "ag": 1, "v": "v0.6"}
{"i": [["[\"_matmul\", 512, 3072, 768, \"float32\"]", "cuda -keys=cuda,gpu -arch=sm_86 -max_num_threads=1024 -model=unknown -thread_warp_size=32", [82, 999, 999, 49152, 2147483647, 1024, 255, 32], "", 0, []], [[], [["CHW", 2, "local"], ["SP", 2, 0, 512, [1, 1, 8, 1], 1], ["SP", 2, 5, 768, [1, 32, 6, 1], 1], ["SP", 2, 10, 3072, [24, 1], 1], ["RE", 2, [0, 5, 1, 6, 2, 7, 10, 11, 3, 8, 12, 4, 9]], ["FSP", 3, 0, 1, 3], ["FSP", 3, 4, 2, 3], ["RE", 3, [0, 4, 1, 5, 2, 6, 3, 7]], ["CA", 2, 3, 5], ["CHR", 1, "shared", [2]], ["CA", 2, 3, 6], ["CHR", 0, "shared", [3]], ["CA", 1, 4, 6], ["FU", 5, [0, 1]], ["AN", 5, 0, 5], ["FU", 5, [1, 2]], ["AN", 5, 1, 4], ["FU", 5, [2, 3]], ["AN", 5, 2, 6], ["FU", 3, [0, 1]], ["SP", 3, 0, 144, [2], 1], ["AN", 3, 1, 2], ["FFSP", 3, 0, [2, 1], 1, 1], ["AN", 3, 1, 6], ["FU", 1, [0, 1]], ["SP", 1, 0, 192, [2], 1], ["AN", 1, 1, 2], ["FFSP", 1, 0, [2, 1], 1, 1], ["AN", 1, 1, 6], ["PR", 4, 0, "auto_unroll_max_step$1024"]]]], "r": [[0.000330533], 0, 0.743539, 1708768635], "mark": 2, "ag": 1, "v": "v0.6"}
{"i": [["[\"_matmul\", 512, 3072, 768, \"float32\"]", "cuda -keys=cuda,gpu -arch=sm_86 -max_num_threads=1024 -model=unknown -thread_warp_size=32", [82, 999, 999, 49152, 2147483647, 1024, 255, 32], "", 0, []], [[], [["CHW", 2, "local"], ["SP", 2, 0, 512, [1, 1, 8, 1], 1], ["SP", 2, 5, 768, [1, 32, 6, 1], 1], ["SP", 2, 10, 3072, [48, 1], 1], ["RE", 2, [0, 5, 1, 6, 2, 7, 10, 11, 3, 8, 12, 4, 9]], ["FSP", 3, 0, 1, 3], ["FSP", 3, 4, 2, 3], ["RE", 3, [0, 4, 1, 5, 2, 6, 3, 7]], ["CA", 2, 3, 5], ["CHR", 1, "shared", [2]], ["CA", 2, 3, 6], ["CHR", 0, "shared", [3]], ["CA", 1, 4, 6], ["FU", 5, [0, 1]], ["AN", 5, 0, 5], ["FU", 5, [1, 2]], ["AN", 5, 1, 4], ["FU", 5, [2, 3]], ["AN", 5, 2, 6], ["FU", 3, [0, 1]], ["SP", 3, 0, 288, [2], 1], ["AN", 3, 1, 2], ["FFSP", 3, 0, [2, 1], 1, 1], ["AN", 3, 1, 6], ["FU", 1, [0, 1]], ["SP", 1, 0, 384, [2], 1], ["AN", 1, 1, 2], ["FFSP", 1, 0, [2, 1], 1, 1], ["AN", 1, 1, 6], ["PR", 4, 0, "auto_unroll_max_step$1024"]]]], "r": [[0.000512748], 0, 1.08517, 1708768635], "mark": 2, "ag": 1, "v": "v0.6"}
{"i": [["[\"_matmul\", 512, 3072, 768, \"float32\"]", "cuda -keys=cuda,gpu -arch=sm_86 -max_num_threads=1024 -model=unknown -thread_warp_size=32", [82, 999, 999, 49152, 2147483647, 1024, 255, 32], "", 0, []], [[], [["CHW", 2, "local"], ["SP", 2, 0, 512, [1, 4, 8, 1], 1], ["SP", 2, 5, 768, [1, 32, 6, 1], 1], ["SP", 2, 10, 3072, [24, 1], 1], ["RE", 2, [0, 5, 1, 6, 2, 7, 10, 11, 3, 8, 12, 4, 9]], ["FSP", 3, 0, 1, 3], ["FSP", 3, 4, 2, 3], ["RE", 3, [0, 4, 1, 5, 2, 6, 3, 7]], ["CA", 2, 3, 5], ["CHR", 1, "shared", [2]], ["CA", 2, 3, 6], ["CHR", 0, "shared", [3]], ["CA", 1, 4, 6], ["FU", 5, [0, 1]], ["AN", 5, 0, 5], ["FU", 5, [1, 2]], ["AN", 5, 1, 4], ["FU", 5, [2, 3]], ["AN", 5, 2, 6], ["FU", 3, [0, 1]], ["SP", 3, 0, 144, [2], 1], ["AN", 3, 1, 2], ["FFSP", 3, 0, [2, 1], 1, 1], ["AN", 3, 1, 6], ["FU", 1, [0, 1]], ["SP", 1, 0, 192, [2], 1], ["AN", 1, 1, 2], ["FFSP", 1, 0, [2, 1], 1, 1], ["AN", 1, 1, 6], ["PR", 4, 0, "auto_unroll_max_step$1024"]]]], "r": [[0.000243392], 0, 0.681826, 1708768635], "mark": 2, "ag": 1, "v": "v0.6"}
{"i": [["[\"_matmul\", 512, 3072, 768, \"float32\"]", "cuda -keys=cuda,gpu -arch=sm_86 -max_num_threads=1024 -model=unknown -thread_warp_size=32", [82, 999, 999, 49152, 2147483647, 1024, 255, 32], "", 0, []], [[], [["CHW", 2, "local"], ["SP", 2, 0, 512, [1, 4, 8, 1], 1], ["SP", 2, 5, 768, [1, 32, 6, 1], 1], ["SP", 2, 10, 3072, [48, 1], 1], ["RE", 2, [0, 5, 1, 6, 2, 7, 10, 11, 3, 8, 12, 4, 9]], ["FSP", 3, 0, 1, 3], ["FSP", 3, 4, 2, 3], ["RE", 3, [0, 4, 1, 5, 2, 6, 3, 7]], ["CA", 2, 3, 5], ["CHR", 1, "shared", [2]], ["CA", 2, 3, 6], ["CHR", 0, "shared", [3]], ["CA", 1, 4, 6], ["FU", 5, [0, 1]], ["AN", 5, 0, 5], ["FU", 5, [1, 2]], ["AN", 5, 1, 4], ["FU", 5, [2, 3]], ["AN", 5, 2, 6], ["FU", 3, [0, 1]], ["SP", 3, 0, 288, [2], 1], ["AN", 3, 1, 2], ["FFSP", 3, 0, [2, 1], 1, 1], ["AN", 3, 1, 6], ["FU", 1, [0, 1]], ["SP", 1, 0, 384, [2], 1], ["AN", 1, 1, 2], ["FFSP", 1, 0, [2, 1], 1, 1], ["AN", 1, 1, 6], ["PR", 4, 0, "auto_unroll_max_step$1024"]]]], "r": [[0.000238886], 0, 0.797907, 1708768635], "mark": 2, "ag": 1, "v": "v0.6"}
{"i": [["[\"_matmul\", 512, 3072, 768, \"float32\"]", "cuda -keys=cuda,gpu -arch=sm_86 -max_num_threads=1024 -model=unknown -thread_warp_size=32", [82, 999, 999, 49152, 2147483647, 1024, 255, 32], "", 0, []], [[], [["CHW", 2, "local"], ["SP", 2, 0, 512, [1, 1, 8, 1], 1], ["SP", 2, 5, 768, [1, 32, 4, 1], 1], ["SP", 2, 10, 3072, [32, 1], 1], ["RE", 2, [0, 5, 1, 6, 2, 7, 10, 11, 3, 8, 12, 4, 9]], ["FSP", 3, 0, 1, 3], ["FSP", 3, 4, 2, 3], ["RE", 3, [0, 4, 1, 5, 2, 6, 3, 7]], ["CA", 2, 3, 5], ["CHR", 1, "shared", [2]], ["CA", 2, 3, 6], ["CHR", 0, "shared", [3]], ["CA", 1, 4, 6], ["FU", 5, [0, 1]], ["AN", 5, 0, 5], ["FU", 5, [1, 2]], ["AN", 5, 1, 4], ["FU", 5, [2, 3]], ["AN", 5, 2, 6], ["FU", 3, [0, 1]], ["SP", 3, 0, 128, [2], 1], ["AN", 3, 1, 2], ["FFSP", 3, 0, [2, 1], 1, 1], ["AN", 3, 1, 6], ["FU", 1, [0, 1]], ["SP", 1, 0, 256, [2], 1], ["AN", 1, 1, 2], ["FFSP", 1, 0, [2, 1], 1, 1], ["AN", 1, 1, 6], ["PR", 4, 0, "auto_unroll_max_step$1024"]]]], "r": [[0.000321959], 0, 1.19257, 1708768636], "mark": 2, "ag": 1, "v": "v0.6"}
{"i": [["[\"_matmul\", 512, 3072, 768, \"float32\"]", "cuda -keys=cuda,gpu -arch=sm_86 -max_num_threads=1024 -model=unknown -thread_warp_size=32", [82, 999, 999, 49152, 2147483647, 1024, 255, 32], "", 0, []], [[], [["CHW", 2, "local"], ["SP", 2, 0, 512, [1, 1, 8, 1], 1], ["SP", 2, 5, 768, [1, 32, 8, 1], 1], ["SP", 2, 10, 3072, [32, 1], 1], ["RE", 2, [0, 5, 1, 6, 2, 7, 10, 11, 3, 8, 12, 4, 9]], ["FSP", 3, 0, 1, 3], ["FSP", 3, 4, 2, 3], ["RE", 3, [0, 4, 1, 5, 2, 6, 3, 7]], ["CA", 2, 3, 5], ["CHR", 1, "shared", [2]], ["CA", 2, 3, 6], ["CHR", 0, "shared", [3]], ["CA", 1, 4, 6], ["FU", 5, [0, 1]], ["AN", 5, 0, 5], ["FU", 5, [1, 2]], ["AN", 5, 1, 4], ["FU", 5, [2, 3]], ["AN", 5, 2, 6], ["FU", 3, [0, 1]], ["SP", 3, 0, 256, [2], 1], ["AN", 3, 1, 2], ["FFSP", 3, 0, [2, 1], 1, 1], ["AN", 3, 1, 6], ["FU", 1, [0, 1]], ["SP", 1, 0, 256, [2], 1], ["AN", 1, 1, 2], ["FFSP", 1, 0, [2, 1], 1, 1], ["AN", 1, 1, 6], ["PR", 4, 0, "auto_unroll_max_step$1024"]]]], "r": [[0.000647784], 0, 0.967466, 1708768636], "mark": 2, "ag": 1, "v": "v0.6"}
{"i": [["[\"_matmul\", 512, 3072, 768, \"float32\"]", "cuda -keys=cuda,gpu -arch=sm_86 -max_num_threads=1024 -model=unknown -thread_warp_size=32", [82, 999, 999, 49152, 2147483647, 1024, 255, 32], "", 0, []], [[], [["CHW", 2, "local"], ["SP", 2, 0, 512, [1, 4, 8, 1], 1], ["SP", 2, 5, 768, [1, 32, 4, 1], 1], ["SP", 2, 10, 3072, [32, 1], 1], ["RE", 2, [0, 5, 1, 6, 2, 7, 10, 11, 3, 8, 12, 4, 9]], ["FSP", 3, 0, 1, 3], ["FSP", 3, 4, 2, 3], ["RE", 3, [0, 4, 1, 5, 2, 6, 3, 7]], ["CA", 2, 3, 5], ["CHR", 1, "shared", [2]], ["CA", 2, 3, 6], ["CHR", 0, "shared", [3]], ["CA", 1, 4, 6], ["FU", 5, [0, 1]], ["AN", 5, 0, 5], ["FU", 5, [1, 2]], ["AN", 5, 1, 4], ["FU", 5, [2, 3]], ["AN", 5, 2, 6], ["FU", 3, [0, 1]], ["SP", 3, 0, 128, [2], 1], ["AN", 3, 1, 2], ["FFSP", 3, 0, [2, 1], 1, 1], ["AN", 3, 1, 6], ["FU", 1, [0, 1]], ["SP", 1, 0, 256, [2], 1], ["AN", 1, 1, 2], ["FFSP", 1, 0, [2, 1], 1, 1], ["AN", 1, 1, 6], ["PR", 4, 0, "auto_unroll_max_step$1024"]]]], "r": [[0.000216363], 0, 1.2392, 1708768636], "mark": 2, "ag": 1, "v": "v0.6"}
{"i": [["[\"_matmul\", 512, 3072, 768, \"float32\"]", "cuda -keys=cuda,gpu -arch=sm_86 -max_num_threads=1024 -model=unknown -thread_warp_size=32", [82, 999, 999, 49152, 2147483647, 1024, 255, 32], "", 0, []], [[], [["CHW", 2, "local"], ["SP", 2, 0, 512, [1, 4, 8, 1], 1], ["SP", 2, 5, 768, [1, 32, 8, 1], 1], ["SP", 2, 10, 3072, [32, 1], 1], ["RE", 2, [0, 5, 1, 6, 2, 7, 10, 11, 3, 8, 12, 4, 9]], ["FSP", 3, 0, 1, 3], ["FSP", 3, 4, 2, 3], ["RE", 3, [0, 4, 1, 5, 2, 6, 3, 7]], ["CA", 2, 3, 5], ["CHR", 1, "shared", [2]], ["CA", 2, 3, 6], ["CHR", 0, "shared", [3]], ["CA", 1, 4, 6], ["FU", 5, [0, 1]], ["AN", 5, 0, 5], ["FU", 5, [1, 2]], ["AN", 5, 1, 4], ["FU", 5, [2, 3]], ["AN", 5, 2, 6], ["FU", 3, [0, 1]], ["SP", 3, 0, 256, [2], 1], ["AN", 3, 1, 2], ["FFSP", 3, 0, [2, 1], 1, 1], ["AN", 3, 1, 6], ["FU", 1, [0, 1]], ["SP", 1, 0, 256, [2], 1], ["AN", 1, 1, 2], ["FFSP", 1, 0, [2, 1], 1, 1], ["AN", 1, 1, 6], ["PR", 4, 0, "auto_unroll_max_step$1024"]]]], "r": [[0.000300263], 0, 0.874049, 1708768636], "mark": 2, "ag": 1, "v": "v0.6"}
{"i": [["[\"_matmul\", 512, 3072, 768, \"float32\"]", "cuda -keys=cuda,gpu -arch=sm_86 -max_num_threads=1024 -model=unknown -thread_warp_size=32", [82, 999, 999, 49152, 2147483647, 1024, 255, 32], "", 0, []], [[], [["CHW", 2, "local"], ["SP", 2, 0, 512, [1, 2, 4, 1], 1], ["SP", 2, 5, 768, [1, 32, 6, 1], 1], ["SP", 2, 10, 3072, [24, 1], 1], ["RE", 2, [0, 5, 1, 6, 2, 7, 10, 11, 3, 8, 12, 4, 9]], ["FSP", 3, 0, 1, 3], ["FSP", 3, 4, 2, 3], ["RE", 3, [0, 4, 1, 5, 2, 6, 3, 7]], ["CA", 2, 3, 5], ["CHR", 1, "shared", [2]], ["CA", 2, 3, 6], ["CHR", 0, "shared", [3]], ["CA", 1, 4, 6], ["FU", 5, [0, 1]], ["AN", 5, 0, 5], ["FU", 5, [1, 2]], ["AN", 5, 1, 4], ["FU", 5, [2, 3]], ["AN", 5, 2, 6], ["FU", 3, [0, 1]], ["SP", 3, 0, 144, [2], 1], ["AN", 3, 1, 2], ["FFSP", 3, 0, [2, 1], 1, 1], ["AN", 3, 1, 6], ["FU", 1, [0, 1]], ["SP", 1, 0, 96, [2], 1], ["AN", 1, 1, 2], ["FFSP", 1, 0, [2, 1], 1, 1], ["AN", 1, 1, 6], ["PR", 4, 0, "auto_unroll_max_step$1024"]]]], "r": [[0.000335694], 0, 0.853944, 1708768637], "mark": 2, "ag": 1, "v": "v0.6"}
{"i": [["[\"_matmul\", 512, 3072, 768, \"float32\"]", "cuda -keys=cuda,gpu -arch=sm_86 -max_num_threads=1024 -model=unknown -thread_warp_size=32", [82, 999, 999, 49152, 2147483647, 1024, 255, 32], "", 0, []], [[], [["CHW", 2, "local"], ["SP", 2, 0, 512, [1, 2, 4, 1], 1], ["SP", 2, 5, 768, [1, 32, 6, 1], 1], ["SP", 2, 10, 3072, [48, 1], 1], ["RE", 2, [0, 5, 1, 6, 2, 7, 10, 11, 3, 8, 12, 4, 9]], ["FSP", 3, 0, 1, 3], ["FSP", 3, 4, 2, 3], ["RE", 3, [0, 4, 1, 5, 2, 6, 3, 7]], ["CA", 2, 3, 5], ["CHR", 1, "shared", [2]], ["CA", 2, 3, 6], ["CHR", 0, "shared", [3]], ["CA", 1, 4, 6], ["FU", 5, [0, 1]], ["AN", 5, 0, 5], ["FU", 5, [1, 2]], ["AN", 5, 1, 4], ["FU", 5, [2, 3]], ["AN", 5, 2, 6], ["FU", 3, [0, 1]], ["SP", 3, 0, 288, [2], 1], ["AN", 3, 1, 2], ["FFSP", 3, 0, [2, 1], 1, 1], ["AN", 3, 1, 6], ["FU", 1, [0, 1]], ["SP", 1, 0, 192, [2], 1], ["AN", 1, 1, 2], ["FFSP", 1, 0, [2, 1], 1, 1], ["AN", 1, 1, 6], ["PR", 4, 0, "auto_unroll_max_step$1024"]]]], "r": [[0.000401084], 0, 0.768125, 1708768637], "mark": 2, "ag": 1, "v": "v0.6"}
{"i": [["[\"_matmul\", 512, 3072, 768, \"float32\"]", "cuda -keys=cuda,gpu -arch=sm_86 -max_num_threads=1024 -model=unknown -thread_warp_size=32", [82, 999, 999, 49152, 2147483647, 1024, 255, 32], "", 0, []], [[], [["CHW", 2, "local"], ["SP", 2, 0, 512, [1, 2, 16, 1], 1], ["SP", 2, 5, 768, [1, 32, 6, 1], 1], ["SP", 2, 10, 3072, [24, 1], 1], ["RE", 2, [0, 5, 1, 6, 2, 7, 10, 11, 3, 8, 12, 4, 9]], ["FSP", 3, 0, 1, 3], ["FSP", 3, 4, 2, 3], ["RE", 3, [0, 4, 1, 5, 2, 6, 3, 7]], ["CA", 2, 3, 5], ["CHR", 1, "shared", [2]], ["CA", 2, 3, 6], ["CHR", 0, "shared", [3]], ["CA", 1, 4, 6], ["FU", 5, [0, 1]], ["AN", 5, 0, 5], ["FU", 5, [1, 2]], ["AN", 5, 1, 4], ["FU", 5, [2, 3]], ["AN", 5, 2, 6], ["FU", 3, [0, 1]], ["SP", 3, 0, 144, [2], 1], ["AN", 3, 1, 2], ["FFSP", 3, 0, [2, 1], 1, 1], ["AN", 3, 1, 6], ["FU", 1, [0, 1]], ["SP", 1, 0, 384, [2], 1], ["AN", 1, 1, 2], ["FFSP", 1, 0, [2, 1], 1, 1], ["AN", 1, 1, 6], ["PR", 4, 0, "auto_unroll_max_step$1024"]]]], "r": [[0.000342049], 0, 0.963189, 1708768637], "mark": 2, "ag": 1, "v": "v0.6"}
{"i": [["[\"_matmul\", 512, 3072, 768, \"float32\"]", "cuda -keys=cuda,gpu -arch=sm_86 -max_num_threads=1024 -model=unknown -thread_warp_size=32", [82, 999, 999, 49152, 2147483647, 1024, 255, 32], "", 0, []], [[], [["CHW", 2, "local"], ["SP", 2, 0, 512, [1, 2, 16, 1], 1], ["SP", 2, 5, 768, [1, 32, 6, 1], 1], ["SP", 2, 10, 3072, [48, 1], 1], ["RE", 2, [0, 5, 1, 6, 2, 7, 10, 11, 3, 8, 12, 4, 9]], ["FSP", 3, 0, 1, 3], ["FSP", 3, 4, 2, 3], ["RE", 3, [0, 4, 1, 5, 2, 6, 3, 7]], ["CA", 2, 3, 5], ["CHR", 1, "shared", [2]], ["CA", 2, 3, 6], ["CHR", 0, "shared", [3]], ["CA", 1, 4, 6], ["FU", 5, [0, 1]], ["AN", 5, 0, 5], ["FU", 5, [1, 2]], ["AN", 5, 1, 4], ["FU", 5, [2, 3]], ["AN", 5, 2, 6], ["FU", 3, [0, 1]], ["SP", 3, 0, 288, [2], 1], ["AN", 3, 1, 2], ["FFSP", 3, 0, [2, 1], 1, 1], ["AN", 3, 1, 6], ["FU", 1, [0, 1]], ["SP", 1, 0, 768, [2], 1], ["AN", 1, 1, 2], ["FFSP", 1, 0, [2, 1], 1, 1], ["AN", 1, 1, 6], ["PR", 4, 0, "auto_unroll_max_step$1024"]]]], "r": [[0.000422848], 0, 0.733506, 1708768637], "mark": 2, "ag": 1, "v": "v0.6"}
{"i": [["[\"_matmul\", 512, 3072, 768, \"float32\"]", "cuda -keys=cuda,gpu -arch=sm_86 -max_num_threads=1024 -model=unknown -thread_warp_size=32", [82, 999, 999, 49152, 2147483647, 1024, 255, 32], "", 0, []], [[], [["CHW", 2, "local"], ["SP", 2, 0, 512, [1, 2, 4, 1], 1], ["SP", 2, 5, 768, [1, 32, 4, 1], 1], ["SP", 2, 10, 3072, [32, 1], 1], ["RE", 2, [0, 5, 1, 6, 2, 7, 10, 11, 3, 8, 12, 4, 9]], ["FSP", 3, 0, 1, 3], ["FSP", 3, 4, 2, 3], ["RE", 3, [0, 4, 1, 5, 2, 6, 3, 7]], ["CA", 2, 3, 5], ["CHR", 1, "shared", [2]], ["CA", 2, 3, 6], ["CHR", 0, "shared", [3]], ["CA", 1, 4, 6], ["FU", 5, [0, 1]], ["AN", 5, 0, 5], ["FU", 5, [1, 2]], ["AN", 5, 1, 4], ["FU", 5, [2, 3]], ["AN", 5, 2, 6], ["FU", 3, [0, 1]], ["SP", 3, 0, 128, [2], 1], ["AN", 3, 1, 2], ["FFSP", 3, 0, [2, 1], 1, 1], ["AN", 3, 1, 6], ["FU", 1, [0, 1]], ["SP", 1, 0, 128, [2], 1], ["AN", 1, 1, 2], ["FFSP", 1, 0, [2, 1], 1, 1], ["AN", 1, 1, 6], ["PR", 4, 0, "auto_unroll_max_step$1024"]]]], "r": [[0.000314708], 0, 0.941161, 1708768637], "mark": 2, "ag": 1, "v": "v0.6"}
{"i": [["[\"_matmul\", 512, 3072, 768, \"float32\"]", "cuda -keys=cuda,gpu -arch=sm_86 -max_num_threads=1024 -model=unknown -thread_warp_size=32", [82, 999, 999, 49152, 2147483647, 1024, 255, 32], "", 0, []], [[], [["CHW", 2, "local"], ["SP", 2, 0, 512, [1, 2, 4, 1], 1], ["SP", 2, 5, 768, [1, 32, 8, 1], 1], ["SP", 2, 10, 3072, [32, 1], 1], ["RE", 2, [0, 5, 1, 6, 2, 7, 10, 11, 3, 8, 12, 4, 9]], ["FSP", 3, 0, 1, 3], ["FSP", 3, 4, 2, 3], ["RE", 3, [0, 4, 1, 5, 2, 6, 3, 7]], ["CA", 2, 3, 5], ["CHR", 1, "shared", [2]], ["CA", 2, 3, 6], ["CHR", 0, "shared", [3]], ["CA", 1, 4, 6], ["FU", 5, [0, 1]], ["AN", 5, 0, 5], ["FU", 5, [1, 2]], ["AN", 5, 1, 4], ["FU", 5, [2, 3]], ["AN", 5, 2, 6], ["FU", 3, [0, 1]], ["SP", 3, 0, 256, [2], 1], ["AN", 3, 1, 2], ["FFSP", 3, 0, [2, 1], 1, 1], ["AN", 3, 1, 6], ["FU", 1, [0, 1]], ["SP", 1, 0, 128, [2], 1], ["AN", 1, 1, 2], ["FFSP", 1, 0, [2, 1], 1, 1], ["AN", 1, 1, 6], ["PR", 4, 0, "auto_unroll_max_step$1024"]]]], "r": [[0.000489341], 0, 1.25722, 1708768638], "mark": 2, "ag": 1, "v": "v0.6"}
{"i": [["[\"_matmul\", 512, 3072, 768, \"float32\"]", "cuda -keys=cuda,gpu -arch=sm_86 -max_num_threads=1024 -model=unknown -thread_warp_size=32", [82, 999, 999, 49152, 2147483647, 1024, 255, 32], "", 0, []], [[], [["CHW", 2, "local"], ["SP", 2, 0, 512, [1, 2, 16, 1], 1], ["SP", 2, 5, 768, [1, 32, 4, 1], 1], ["SP", 2, 10, 3072, [32, 1], 1], ["RE", 2, [0, 5, 1, 6, 2, 7, 10, 11, 3, 8, 12, 4, 9]], ["FSP", 3, 0, 1, 3], ["FSP", 3, 4, 2, 3], ["RE", 3, [0, 4, 1, 5, 2, 6, 3, 7]], ["CA", 2, 3, 5], ["CHR", 1, "shared", [2]], ["CA", 2, 3, 6], ["CHR", 0, "shared", [3]], ["CA", 1, 4, 6], ["FU", 5, [0, 1]], ["AN", 5, 0, 5], ["FU", 5, [1, 2]], ["AN", 5, 1, 4], ["FU", 5, [2, 3]], ["AN", 5, 2, 6], ["FU", 3, [0, 1]], ["SP", 3, 0, 128, [2], 1], ["AN", 3, 1, 2], ["FFSP", 3, 0, [2, 1], 1, 1], ["AN", 3, 1, 6], ["FU", 1, [0, 1]], ["SP", 1, 0, 512, [2], 1], ["AN", 1, 1, 2], ["FFSP", 1, 0, [2, 1], 1, 1], ["AN", 1, 1, 6], ["PR", 4, 0, "auto_unroll_max_step$1024"]]]], "r": [[0.000246732], 0, 0.748358, 1708768638], "mark": 2, "ag": 1, "v": "v0.6"}
{"i": [["[\"_matmul\", 512, 3072, 768, \"float32\"]", "cuda -keys=cuda,gpu -arch=sm_86 -max_num_threads=1024 -model=unknown -thread_warp_size=32", [82, 999, 999, 49152, 2147483647, 1024, 255, 32], "", 0, []], [[], [["CHW", 2, "local"], ["SP", 2, 0, 512, [1, 1, 4, 1], 1], ["SP", 2, 5, 768, [1, 32, 6, 1], 1], ["SP", 2, 10, 3072, [32, 1], 1], ["RE", 2, [0, 5, 1, 6, 2, 7, 10, 11, 3, 8, 12, 4, 9]], ["FSP", 3, 0, 1, 3], ["FSP", 3, 4, 2, 3], ["RE", 3, [0, 4, 1, 5, 2, 6, 3, 7]], ["CA", 2, 3, 5], ["CHR", 1, "shared", [2]], ["CA", 2, 3, 6], ["CHR", 0, "shared", [3]], ["CA", 1, 4, 6], ["FU", 5, [0, 1]], ["AN", 5, 0, 5], ["FU", 5, [1, 2]], ["AN", 5, 1, 4], ["FU", 5, [2, 3]], ["AN", 5, 2, 6], ["FU", 3, [0, 1]], ["SP", 3, 0, 192, [2], 1], ["AN", 3, 1, 2], ["FFSP", 3, 0, [2, 1], 1, 1], ["AN", 3, 1, 6], ["FU", 1, [0, 1]], ["SP", 1, 0, 128, [2], 1], ["AN", 1, 1, 2], ["FFSP", 1, 0, [2, 1], 1, 1], ["AN", 1, 1, 6], ["PR", 4, 0, "auto_unroll_max_step$1024"]]]], "r": [[0.000644873], 0, 1.05381, 1708768638], "mark": 2, "ag": 1, "v": "v0.6"}
{"i": [["[\"_matmul\", 512, 3072, 768, \"float32\"]", "cuda -keys=cuda,gpu -arch=sm_86 -max_num_threads=1024 -model=unknown -thread_warp_size=32", [82, 999, 999, 49152, 2147483647, 1024, 255, 32], "", 0, []], [[], [["CHW", 2, "local"], ["SP", 2, 0, 512, [1, 4, 4, 1], 1], ["SP", 2, 5, 768, [1, 32, 6, 1], 1], ["SP", 2, 10, 3072, [32, 1], 1], ["RE", 2, [0, 5, 1, 6, 2, 7, 10, 11, 3, 8, 12, 4, 9]], ["FSP", 3, 0, 1, 3], ["FSP", 3, 4, 2, 3], ["RE", 3, [0, 4, 1, 5, 2, 6, 3, 7]], ["CA", 2, 3, 5], ["CHR", 1, "shared", [2]], ["CA", 2, 3, 6], ["CHR", 0, "shared", [3]], ["CA", 1, 4, 6], ["FU", 5, [0, 1]], ["AN", 5, 0, 5], ["FU", 5, [1, 2]], ["AN", 5, 1, 4], ["FU", 5, [2, 3]], ["AN", 5, 2, 6], ["FU", 3, [0, 1]], ["SP", 3, 0, 192, [2], 1], ["AN", 3, 1, 2], ["FFSP", 3, 0, [2, 1], 1, 1], ["AN", 3, 1, 6], ["FU", 1, [0, 1]], ["SP", 1, 0, 128, [2], 1], ["AN", 1, 1, 2], ["FFSP", 1, 0, [2, 1], 1, 1], ["AN", 1, 1, 6], ["PR", 4, 0, "auto_unroll_max_step$1024"]]]], "r": [[0.000245224], 0, 1.02227, 1708768638], "mark": 2, "ag": 1, "v": "v0.6"}
{"i": [["[\"_matmul\", 512, 3072, 768, \"float32\"]", "cuda -keys=cuda,gpu -arch=sm_86 -max_num_threads=1024 -model=unknown -thread_warp_size=32", [82, 999, 999, 49152, 2147483647, 1024, 255, 32], "", 0, []], [[], [["CHW", 2, "local"], ["SP", 2, 0, 512, [1, 1, 16, 1], 1], ["SP", 2, 5, 768, [1, 32, 6, 1], 1], ["SP", 2, 10, 3072, [32, 1], 1], ["RE", 2, [0, 5, 1, 6, 2, 7, 10, 11, 3, 8, 12, 4, 9]], ["FSP", 3, 0, 1, 3], ["FSP", 3, 4, 2, 3], ["RE", 3, [0, 4, 1, 5, 2, 6, 3, 7]], ["CA", 2, 3, 5], ["CHR", 1, "shared", [2]], ["CA", 2, 3, 6], ["CHR", 0, "shared", [3]], ["CA", 1, 4, 6], ["FU", 5, [0, 1]], ["AN", 5, 0, 5], ["FU", 5, [1, 2]], ["AN", 5, 1, 4], ["FU", 5, [2, 3]], ["AN", 5, 2, 6], ["FU", 3, [0, 1]], ["SP", 3, 0, 192, [2], 1], ["AN", 3, 1, 2], ["FFSP", 3, 0, [2, 1], 1, 1], ["AN", 3, 1, 6], ["FU", 1, [0, 1]], ["SP", 1, 0, 512, [2], 1], ["AN", 1, 1, 2], ["FFSP", 1, 0, [2, 1], 1, 1], ["AN", 1, 1, 6], ["PR", 4, 0, "auto_unroll_max_step$1024"]]]], "r": [[0.000374251], 0, 0.986906, 1708768638], "mark": 2, "ag": 1, "v": "v0.6"}
{"i": [["[\"_matmul\", 512, 3072, 768, \"float32\"]", "cuda -keys=cuda,gpu -arch=sm_86 -max_num_threads=1024 -model=unknown -thread_warp_size=32", [82, 999, 999, 49152, 2147483647, 1024, 255, 32], "", 0, []], [[], [["CHW", 2, "local"], ["SP", 2, 0, 512, [1, 4, 16, 1], 1], ["SP", 2, 5, 768, [1, 32, 6, 1], 1], ["SP", 2, 10, 3072, [32, 1], 1], ["RE", 2, [0, 5, 1, 6, 2, 7, 10, 11, 3, 8, 12, 4, 9]], ["FSP", 3, 0, 1, 3], ["FSP", 3, 4, 2, 3], ["RE", 3, [0, 4, 1, 5, 2, 6, 3, 7]], ["CA", 2, 3, 5], ["CHR", 1, "shared", [2]], ["CA", 2, 3, 6], ["CHR", 0, "shared", [3]], ["CA", 1, 4, 6], ["FU", 5, [0, 1]], ["AN", 5, 0, 5], ["FU", 5, [1, 2]], ["AN", 5, 1, 4], ["FU", 5, [2, 3]], ["AN", 5, 2, 6], ["FU", 3, [0, 1]], ["SP", 3, 0, 192, [2], 1], ["AN", 3, 1, 2], ["FFSP", 3, 0, [2, 1], 1, 1], ["AN", 3, 1, 6], ["FU", 1, [0, 1]], ["SP", 1, 0, 512, [2], 1], ["AN", 1, 1, 2], ["FFSP", 1, 0, [2, 1], 1, 1], ["AN", 1, 1, 6], ["PR", 4, 0, "auto_unroll_max_step$1024"]]]], "r": [[0.000334058], 0, 0.954133, 1708768639], "mark": 2, "ag": 1, "v": "v0.6"}
{"i": [["[\"_matmul\", 512, 3072, 768, \"float32\"]", "cuda -keys=cuda,gpu -arch=sm_86 -max_num_threads=1024 -model=unknown -thread_warp_size=32", [82, 999, 999, 49152, 2147483647, 1024, 255, 32], "", 0, []], [[], [["CHW", 2, "local"], ["SP", 2, 0, 512, [1, 4, 8, 1], 1], ["SP", 2, 5, 768, [1, 32, 4, 1], 1], ["SP", 2, 10, 3072, [32, 1], 1], ["RE", 2, [0, 5, 1, 6, 2, 7, 10, 11, 3, 8, 12, 4, 9]], ["FSP", 3, 0, 1, 3], ["FSP", 3, 4, 2, 3], ["RE", 3, [0, 4, 1, 5, 2, 6, 3, 7]], ["CA", 2, 3, 5], ["CHR", 1, "shared", [2]], ["CA", 2, 3, 6], ["CHR", 0, "shared", [3]], ["CA", 1, 4, 6], ["FU", 5, [0, 1]], ["AN", 5, 0, 5], ["FU", 5, [1, 2]], ["AN", 5, 1, 4], ["FU", 5, [2, 3]], ["AN", 5, 2, 6], ["FU", 3, [0, 1]], ["SP", 3, 0, 128, [2], 1], ["AN", 3, 1, 2], ["FFSP", 3, 0, [2, 1], 1, 1], ["AN", 3, 1, 6], ["FU", 1, [0, 1]], ["SP", 1, 0, 256, [2], 1], ["AN", 1, 1, 2], ["FFSP", 1, 0, [2, 1], 1, 1], ["AN", 1, 1, 6], ["PR", 4, 0, "auto_unroll_max_step$1024"]]]], "r": [[0.000216363], 0, 1.2392, 1708768636], "mark": 2, "ag": 2, "v": "v0.6"}
