data/50-start-345/14cuda_testCase_5_matmul_M512_N768_K3072.json
{"i": [["[\"_matmul\", 512, 3072, 768, \"float32\"]", "cuda -keys=cuda,gpu -arch=sm_86 -max_num_threads=1024 -model=unknown -thread_warp_size=32", [82, 999, 999, 49152, 2147483647, 1024, 255, 32], "", 0, []], [[], [["CHW", 2, "local"], ["SP", 2, 0, 512, [1, 32, 16, 1], 1], ["SP", 2, 5, 768, [1, 1, 256, 1], 1], ["SP", 2, 10, 3072, [6, 1], 1], ["RE", 2, [0, 5, 1, 6, 2, 7, 10, 11, 3, 8, 12, 4, 9]], ["FSP", 3, 0, 1, 3], ["FSP", 3, 4, 2, 3], ["RE", 3, [0, 4, 1, 5, 2, 6, 3, 7]], ["CA", 2, 3, 5], ["CHR", 1, "shared", [2]], ["CA", 2, 3, 6], ["CHR", 0, "shared", [3]], ["CA", 1, 4, 6], ["FU", 5, [0, 1]], ["AN", 5, 0, 5], ["FU", 5, [1, 2]], ["AN", 5, 1, 4], ["FU", 5, [2, 3]], ["AN", 5, 2, 6], ["FU", 3, [0, 1]], ["SP", 3, 0, 1536, [2], 1], ["AN", 3, 1, 2], ["FFSP", 3, 0, [2, 1], 1, 1], ["AN", 3, 1, 6], ["FU", 1, [0, 1]], ["SP", 1, 0, 96, [2], 1], ["AN", 1, 1, 2], ["FFSP", 1, 0, [2, 1], 1, 1], ["AN", 1, 1, 6], ["PR", 4, 0, "auto_unroll_max_step$1024"]]]], "r": [[0.201293], 0, 3.78571, 1707741186], "mark": 2, "ag": 0, "v": "v0.6"}
{"i": [["[\"_matmul\", 512, 3072, 768, \"float32\"]", "cuda -keys=cuda,gpu -arch=sm_86 -max_num_threads=1024 -model=unknown -thread_warp_size=32", [82, 999, 999, 49152, 2147483647, 1024, 255, 32], "", 0, []], [[], [["CHW", 2, "local"], ["SP", 2, 0, 512, [1, 32, 16, 1], 1], ["SP", 2, 5, 768, [1, 1, 256, 1], 1], ["SP", 2, 10, 3072, [4, 1], 1], ["RE", 2, [0, 5, 1, 6, 2, 7, 10, 11, 3, 8, 12, 4, 9]], ["FSP", 3, 0, 1, 3], ["FSP", 3, 4, 2, 3], ["RE", 3, [0, 4, 1, 5, 2, 6, 3, 7]], ["CA", 2, 3, 5], ["CHR", 1, "shared", [2]], ["CA", 2, 3, 6], ["CHR", 0, "shared", [3]], ["CA", 1, 4, 6], ["FU", 5, [0, 1]], ["AN", 5, 0, 5], ["FU", 5, [1, 2]], ["AN", 5, 1, 4], ["FU", 5, [2, 3]], ["AN", 5, 2, 6], ["FU", 3, [0, 1]], ["SP", 3, 0, 1024, [2], 1], ["AN", 3, 1, 2], ["FFSP", 3, 0, [2, 1], 1, 1], ["AN", 3, 1, 6], ["FU", 1, [0, 1]], ["SP", 1, 0, 64, [2], 1], ["AN", 1, 1, 2], ["FFSP", 1, 0, [2, 1], 1, 1], ["AN", 1, 1, 6], ["PR", 4, 0, "auto_unroll_max_step$1024"]]]], "r": [[0.175346], 0, 3.99479, 1707741187], "mark": 2, "ag": 0, "v": "v0.6"}
{"i": [["[\"_matmul\", 512, 3072, 768, \"float32\"]", "cuda -keys=cuda,gpu -arch=sm_86 -max_num_threads=1024 -model=unknown -thread_warp_size=32", [82, 999, 999, 49152, 2147483647, 1024, 255, 32], "", 0, []], [[], [["CHW", 2, "local"], ["SP", 2, 0, 512, [1, 32, 16, 1], 1], ["SP", 2, 5, 768, [1, 1, 256, 1], 1], ["SP", 2, 10, 3072, [8, 1], 1], ["RE", 2, [0, 5, 1, 6, 2, 7, 10, 11, 3, 8, 12, 4, 9]], ["FSP", 3, 0, 1, 3], ["FSP", 3, 4, 2, 3], ["RE", 3, [0, 4, 1, 5, 2, 6, 3, 7]], ["CA", 2, 3, 5], ["CHR", 1, "shared", [2]], ["CA", 2, 3, 6], ["CHR", 0, "shared", [3]], ["CA", 1, 4, 6], ["FU", 5, [0, 1]], ["AN", 5, 0, 5], ["FU", 5, [1, 2]], ["AN", 5, 1, 4], ["FU", 5, [2, 3]], ["AN", 5, 2, 6], ["FU", 3, [0, 1]], ["SP", 3, 0, 2048, [2], 1], ["AN", 3, 1, 2], ["FFSP", 3, 0, [2, 1], 1, 1], ["AN", 3, 1, 6], ["FU", 1, [0, 1]], ["SP", 1, 0, 128, [2], 1], ["AN", 1, 1, 2], ["FFSP", 1, 0, [2, 1], 1, 1], ["AN", 1, 1, 6], ["PR", 4, 0, "auto_unroll_max_step$1024"]]]], "r": [[0.174937], 0, 3.6079, 1707741188], "mark": 2, "ag": 0, "v": "v0.6"}
{"i": [["[\"_matmul\", 512, 3072, 768, \"float32\"]", "cuda -keys=cuda,gpu -arch=sm_86 -max_num_threads=1024 -model=unknown -thread_warp_size=32", [82, 999, 999, 49152, 2147483647, 1024, 255, 32], "", 0, []], [[], [["CHW", 2, "local"], ["SP", 2, 0, 512, [1, 32, 16, 1], 1], ["SP", 2, 5, 768, [1, 1, 192, 1], 1], ["SP", 2, 10, 3072, [6, 1], 1], ["RE", 2, [0, 5, 1, 6, 2, 7, 10, 11, 3, 8, 12, 4, 9]], ["FSP", 3, 0, 1, 3], ["FSP", 3, 4, 2, 3], ["RE", 3, [0, 4, 1, 5, 2, 6, 3, 7]], ["CA", 2, 3, 5], ["CHR", 1, "shared", [2]], ["CA", 2, 3, 6], ["CHR", 0, "shared", [3]], ["CA", 1, 4, 6], ["FU", 5, [0, 1]], ["AN", 5, 0, 5], ["FU", 5, [1, 2]], ["AN", 5, 1, 4], ["FU", 5, [2, 3]], ["AN", 5, 2, 6], ["FU", 3, [0, 1]], ["SP", 3, 0, 1152, [2], 1], ["AN", 3, 1, 2], ["FFSP", 3, 0, [2, 1], 1, 1], ["AN", 3, 1, 6], ["FU", 1, [0, 1]], ["SP", 1, 0, 96, [2], 1], ["AN", 1, 1, 2], ["FFSP", 1, 0, [2, 1], 1, 1], ["AN", 1, 1, 6], ["PR", 4, 0, "auto_unroll_max_step$1024"]]]], "r": [[0.10985], 0, 2.08354, 1707741188], "mark": 2, "ag": 0, "v": "v0.6"}
{"i": [["[\"_matmul\", 512, 3072, 768, \"float32\"]", "cuda -keys=cuda,gpu -arch=sm_86 -max_num_threads=1024 -model=unknown -thread_warp_size=32", [82, 999, 999, 49152, 2147483647, 1024, 255, 32], "", 0, []], [[], [["CHW", 2, "local"], ["SP", 2, 0, 512, [1, 32, 8, 1], 1], ["SP", 2, 5, 768, [1, 1, 256, 1], 1], ["SP", 2, 10, 3072, [6, 1], 1], ["RE", 2, [0, 5, 1, 6, 2, 7, 10, 11, 3, 8, 12, 4, 9]], ["FSP", 3, 0, 1, 3], ["FSP", 3, 4, 2, 3], ["RE", 3, [0, 4, 1, 5, 2, 6, 3, 7]], ["CA", 2, 3, 5], ["CHR", 1, "shared", [2]], ["CA", 2, 3, 6], ["CHR", 0, "shared", [3]], ["CA", 1, 4, 6], ["FU", 5, [0, 1]], ["AN", 5, 0, 5], ["FU", 5, [1, 2]], ["AN", 5, 1, 4], ["FU", 5, [2, 3]], ["AN", 5, 2, 6], ["FU", 3, [0, 1]], ["SP", 3, 0, 1536, [2], 1], ["AN", 3, 1, 2], ["FFSP", 3, 0, [2, 1], 1, 1], ["AN", 3, 1, 6], ["FU", 1, [0, 1]], ["SP", 1, 0, 48, [2], 1], ["AN", 1, 1, 2], ["FFSP", 1, 0, [2, 1], 1, 1], ["AN", 1, 1, 6], ["PR", 4, 0, "auto_unroll_max_step$1024"]]]], "r": [[0.0879339], 0, 3.24391, 1707741189], "mark": 2, "ag": 0, "v": "v0.6"}
{"i": [["[\"_matmul\", 512, 3072, 768, \"float32\"]", "cuda -keys=cuda,gpu -arch=sm_86 -max_num_threads=1024 -model=unknown -thread_warp_size=32", [82, 999, 999, 49152, 2147483647, 1024, 255, 32], "", 0, []], [[], [["CHW", 2, "local"], ["SP", 2, 0, 512, [1, 32, 16, 1], 1], ["SP", 2, 5, 768, [1, 1, 192, 1], 1], ["SP", 2, 10, 3072, [4, 1], 1], ["RE", 2, [0, 5, 1, 6, 2, 7, 10, 11, 3, 8, 12, 4, 9]], ["FSP", 3, 0, 1, 3], ["FSP", 3, 4, 2, 3], ["RE", 3, [0, 4, 1, 5, 2, 6, 3, 7]], ["CA", 2, 3, 5], ["CHR", 1, "shared", [2]], ["CA", 2, 3, 6], ["CHR", 0, "shared", [3]], ["CA", 1, 4, 6], ["FU", 5, [0, 1]], ["AN", 5, 0, 5], ["FU", 5, [1, 2]], ["AN", 5, 1, 4], ["FU", 5, [2, 3]], ["AN", 5, 2, 6], ["FU", 3, [0, 1]], ["SP", 3, 0, 768, [2], 1], ["AN", 3, 1, 2], ["FFSP", 3, 0, [2, 1], 1, 1], ["AN", 3, 1, 6], ["FU", 1, [0, 1]], ["SP", 1, 0, 64, [2], 1], ["AN", 1, 1, 2], ["FFSP", 1, 0, [2, 1], 1, 1], ["AN", 1, 1, 6], ["PR", 4, 0, "auto_unroll_max_step$1024"]]]], "r": [[0.0666606], 0, 1.87301, 1707741189], "mark": 2, "ag": 0, "v": "v0.6"}
{"i": [["[\"_matmul\", 512, 3072, 768, \"float32\"]", "cuda -keys=cuda,gpu -arch=sm_86 -max_num_threads=1024 -model=unknown -thread_warp_size=32", [82, 999, 999, 49152, 2147483647, 1024, 255, 32], "", 0, []], [[], [["CHW", 2, "local"], ["SP", 2, 0, 512, [1, 32, 16, 1], 1], ["SP", 2, 5, 768, [1, 1, 192, 1], 1], ["SP", 2, 10, 3072, [8, 1], 1], ["RE", 2, [0, 5, 1, 6, 2, 7, 10, 11, 3, 8, 12, 4, 9]], ["FSP", 3, 0, 1, 3], ["FSP", 3, 4, 2, 3], ["RE", 3, [0, 4, 1, 5, 2, 6, 3, 7]], ["CA", 2, 3, 5], ["CHR", 1, "shared", [2]], ["CA", 2, 3, 6], ["CHR", 0, "shared", [3]], ["CA", 1, 4, 6], ["FU", 5, [0, 1]], ["AN", 5, 0, 5], ["FU", 5, [1, 2]], ["AN", 5, 1, 4], ["FU", 5, [2, 3]], ["AN", 5, 2, 6], ["FU", 3, [0, 1]], ["SP", 3, 0, 1536, [2], 1], ["AN", 3, 1, 2], ["FFSP", 3, 0, [2, 1], 1, 1], ["AN", 3, 1, 6], ["FU", 1, [0, 1]], ["SP", 1, 0, 128, [2], 1], ["AN", 1, 1, 2], ["FFSP", 1, 0, [2, 1], 1, 1], ["AN", 1, 1, 6], ["PR", 4, 0, "auto_unroll_max_step$1024"]]]], "r": [[0.066321], 0, 1.92337, 1707741189], "mark": 2, "ag": 0, "v": "v0.6"}
{"i": [["[\"_matmul\", 512, 3072, 768, \"float32\"]", "cuda -keys=cuda,gpu -arch=sm_86 -max_num_threads=1024 -model=unknown -thread_warp_size=32", [82, 999, 999, 49152, 2147483647, 1024, 255, 32], "", 0, []], [[], [["CHW", 2, "local"], ["SP", 2, 0, 512, [1, 32, 8, 1], 1], ["SP", 2, 5, 768, [1, 1, 256, 1], 1], ["SP", 2, 10, 3072, [4, 1], 1], ["RE", 2, [0, 5, 1, 6, 2, 7, 10, 11, 3, 8, 12, 4, 9]], ["FSP", 3, 0, 1, 3], ["FSP", 3, 4, 2, 3], ["RE", 3, [0, 4, 1, 5, 2, 6, 3, 7]], ["CA", 2, 3, 5], ["CHR", 1, "shared", [2]], ["CA", 2, 3, 6], ["CHR", 0, "shared", [3]], ["CA", 1, 4, 6], ["FU", 5, [0, 1]], ["AN", 5, 0, 5], ["FU", 5, [1, 2]], ["AN", 5, 1, 4], ["FU", 5, [2, 3]], ["AN", 5, 2, 6], ["FU", 3, [0, 1]], ["SP", 3, 0, 1024, [2], 1], ["AN", 3, 1, 2], ["FFSP", 3, 0, [2, 1], 1, 1], ["AN", 3, 1, 6], ["FU", 1, [0, 1]], ["SP", 1, 0, 32, [2], 1], ["AN", 1, 1, 2], ["FFSP", 1, 0, [2, 1], 1, 1], ["AN", 1, 1, 6], ["PR", 4, 0, "auto_unroll_max_step$1024"]]]], "r": [[0.0879998], 0, 3.62315, 1707741190], "mark": 2, "ag": 0, "v": "v0.6"}
{"i": [["[\"_matmul\", 512, 3072, 768, \"float32\"]", "cuda -keys=cuda,gpu -arch=sm_86 -max_num_threads=1024 -model=unknown -thread_warp_size=32", [82, 999, 999, 49152, 2147483647, 1024, 255, 32], "", 0, []], [[], [["CHW", 2, "local"], ["SP", 2, 0, 512, [1, 32, 8, 1], 1], ["SP", 2, 5, 768, [1, 1, 256, 1], 1], ["SP", 2, 10, 3072, [8, 1], 1], ["RE", 2, [0, 5, 1, 6, 2, 7, 10, 11, 3, 8, 12, 4, 9]], ["FSP", 3, 0, 1, 3], ["FSP", 3, 4, 2, 3], ["RE", 3, [0, 4, 1, 5, 2, 6, 3, 7]], ["CA", 2, 3, 5], ["CHR", 1, "shared", [2]], ["CA", 2, 3, 6], ["CHR", 0, "shared", [3]], ["CA", 1, 4, 6], ["FU", 5, [0, 1]], ["AN", 5, 0, 5], ["FU", 5, [1, 2]], ["AN", 5, 1, 4], ["FU", 5, [2, 3]], ["AN", 5, 2, 6], ["FU", 3, [0, 1]], ["SP", 3, 0, 2048, [2], 1], ["AN", 3, 1, 2], ["FFSP", 3, 0, [2, 1], 1, 1], ["AN", 3, 1, 6], ["FU", 1, [0, 1]], ["SP", 1, 0, 64, [2], 1], ["AN", 1, 1, 2], ["FFSP", 1, 0, [2, 1], 1, 1], ["AN", 1, 1, 6], ["PR", 4, 0, "auto_unroll_max_step$1024"]]]], "r": [[0.0878114], 0, 3.23749, 1707741190], "mark": 2, "ag": 0, "v": "v0.6"}
{"i": [["[\"_matmul\", 512, 3072, 768, \"float32\"]", "cuda -keys=cuda,gpu -arch=sm_86 -max_num_threads=1024 -model=unknown -thread_warp_size=32", [82, 999, 999, 49152, 2147483647, 1024, 255, 32], "", 0, []], [[], [["CHW", 2, "local"], ["SP", 2, 0, 512, [1, 32, 8, 1], 1], ["SP", 2, 5, 768, [1, 1, 192, 1], 1], ["SP", 2, 10, 3072, [6, 1], 1], ["RE", 2, [0, 5, 1, 6, 2, 7, 10, 11, 3, 8, 12, 4, 9]], ["FSP", 3, 0, 1, 3], ["FSP", 3, 4, 2, 3], ["RE", 3, [0, 4, 1, 5, 2, 6, 3, 7]], ["CA", 2, 3, 5], ["CHR", 1, "shared", [2]], ["CA", 2, 3, 6], ["CHR", 0, "shared", [3]], ["CA", 1, 4, 6], ["FU", 5, [0, 1]], ["AN", 5, 0, 5], ["FU", 5, [1, 2]], ["AN", 5, 1, 4], ["FU", 5, [2, 3]], ["AN", 5, 2, 6], ["FU", 3, [0, 1]], ["SP", 3, 0, 1152, [2], 1], ["AN", 3, 1, 2], ["FFSP", 3, 0, [2, 1], 1, 1], ["AN", 3, 1, 6], ["FU", 1, [0, 1]], ["SP", 1, 0, 48, [2], 1], ["AN", 1, 1, 2], ["FFSP", 1, 0, [2, 1], 1, 1], ["AN", 1, 1, 6], ["PR", 4, 0, "auto_unroll_max_step$1024"]]]], "r": [[0.0403505], 0, 1.79852, 1707741190], "mark": 2, "ag": 0, "v": "v0.6"}
{"i": [["[\"_matmul\", 512, 3072, 768, \"float32\"]", "cuda -keys=cuda,gpu -arch=sm_86 -max_num_threads=1024 -model=unknown -thread_warp_size=32", [82, 999, 999, 49152, 2147483647, 1024, 255, 32], "", 0, []], [[], [["CHW", 2, "local"], ["SP", 2, 0, 512, [1, 32, 8, 1], 1], ["SP", 2, 5, 768, [1, 1, 192, 1], 1], ["SP", 2, 10, 3072, [6, 1], 1], ["RE", 2, [0, 5, 1, 6, 2, 7, 10, 11, 3, 8, 12, 4, 9]], ["FSP", 3, 0, 1, 3], ["FSP", 3, 4, 2, 3], ["RE", 3, [0, 4, 1, 5, 2, 6, 3, 7]], ["CA", 2, 3, 5], ["CHR", 1, "shared", [2]], ["CA", 2, 3, 6], ["CHR", 0, "shared", [3]], ["CA", 1, 4, 6], ["FU", 5, [0, 1]], ["AN", 5, 0, 5], ["FU", 5, [1, 2]], ["AN", 5, 1, 4], ["FU", 5, [2, 3]], ["AN", 5, 2, 6], ["FU", 3, [0, 1]], ["SP", 3, 0, 1152, [2], 1], ["AN", 3, 1, 2], ["FFSP", 3, 0, [2, 1], 1, 1], ["AN", 3, 1, 6], ["FU", 1, [0, 1]], ["SP", 1, 0, 48, [2], 1], ["AN", 1, 1, 2], ["FFSP", 1, 0, [2, 1], 1, 1], ["AN", 1, 1, 6], ["PR", 4, 0, "auto_unroll_max_step$1024"]]]], "r": [[0.0403505], 0, 1.79852, 1707741190], "mark": 2, "ag": 1, "v": "v0.6"}
{"i": [["[\"_matmul\", 512, 3072, 768, \"float32\"]", "cuda -keys=cuda,gpu -arch=sm_86 -max_num_threads=1024 -model=unknown -thread_warp_size=32", [82, 999, 999, 49152, 2147483647, 1024, 255, 32], "", 0, []], [[], [["CHW", 2, "local"], ["SP", 2, 0, 512, [1, 32, 8, 1], 1], ["SP", 2, 5, 768, [1, 1, 192, 1], 1], ["SP", 2, 10, 3072, [4, 1], 1], ["RE", 2, [0, 5, 1, 6, 2, 7, 10, 11, 3, 8, 12, 4, 9]], ["FSP", 3, 0, 1, 3], ["FSP", 3, 4, 2, 3], ["RE", 3, [0, 4, 1, 5, 2, 6, 3, 7]], ["CA", 2, 3, 5], ["CHR", 1, "shared", [2]], ["CA", 2, 3, 6], ["CHR", 0, "shared", [3]], ["CA", 1, 4, 6], ["FU", 5, [0, 1]], ["AN", 5, 0, 5], ["FU", 5, [1, 2]], ["AN", 5, 1, 4], ["FU", 5, [2, 3]], ["AN", 5, 2, 6], ["FU", 3, [0, 1]], ["SP", 3, 0, 768, [2], 1], ["AN", 3, 1, 2], ["FFSP", 3, 0, [2, 1], 1, 1], ["AN", 3, 1, 6], ["FU", 1, [0, 1]], ["SP", 1, 0, 32, [2], 1], ["AN", 1, 1, 2], ["FFSP", 1, 0, [2, 1], 1, 1], ["AN", 1, 1, 6], ["PR", 4, 0, "auto_unroll_max_step$1024"]]]], "r": [[0.0338485], 0, 2.29312, 1707741196], "mark": 2, "ag": 1, "v": "v0.6"}
{"i": [["[\"_matmul\", 512, 3072, 768, \"float32\"]", "cuda -keys=cuda,gpu -arch=sm_86 -max_num_threads=1024 -model=unknown -thread_warp_size=32", [82, 999, 999, 49152, 2147483647, 1024, 255, 32], "", 0, []], [[], [["CHW", 2, "local"], ["SP", 2, 0, 512, [1, 32, 8, 1], 1], ["SP", 2, 5, 768, [1, 1, 192, 1], 1], ["SP", 2, 10, 3072, [8, 1], 1], ["RE", 2, [0, 5, 1, 6, 2, 7, 10, 11, 3, 8, 12, 4, 9]], ["FSP", 3, 0, 1, 3], ["FSP", 3, 4, 2, 3], ["RE", 3, [0, 4, 1, 5, 2, 6, 3, 7]], ["CA", 2, 3, 5], ["CHR", 1, "shared", [2]], ["CA", 2, 3, 6], ["CHR", 0, "shared", [3]], ["CA", 1, 4, 6], ["FU", 5, [0, 1]], ["AN", 5, 0, 5], ["FU", 5, [1, 2]], ["AN", 5, 1, 4], ["FU", 5, [2, 3]], ["AN", 5, 2, 6], ["FU", 3, [0, 1]], ["SP", 3, 0, 1536, [2], 1], ["AN", 3, 1, 2], ["FFSP", 3, 0, [2, 1], 1, 1], ["AN", 3, 1, 6], ["FU", 1, [0, 1]], ["SP", 1, 0, 64, [2], 1], ["AN", 1, 1, 2], ["FFSP", 1, 0, [2, 1], 1, 1], ["AN", 1, 1, 6], ["PR", 4, 0, "auto_unroll_max_step$1024"]]]], "r": [[0.0337387], 0, 2.58753, 1707741196], "mark": 2, "ag": 1, "v": "v0.6"}
{"i": [["[\"_matmul\", 512, 3072, 768, \"float32\"]", "cuda -keys=cuda,gpu -arch=sm_86 -max_num_threads=1024 -model=unknown -thread_warp_size=32", [82, 999, 999, 49152, 2147483647, 1024, 255, 32], "", 0, []], [[], [["CHW", 2, "local"], ["SP", 2, 0, 512, [1, 32, 8, 1], 1], ["SP", 2, 5, 768, [1, 1, 128, 1], 1], ["SP", 2, 10, 3072, [6, 1], 1], ["RE", 2, [0, 5, 1, 6, 2, 7, 10, 11, 3, 8, 12, 4, 9]], ["FSP", 3, 0, 1, 3], ["FSP", 3, 4, 2, 3], ["RE", 3, [0, 4, 1, 5, 2, 6, 3, 7]], ["CA", 2, 3, 5], ["CHR", 1, "shared", [2]], ["CA", 2, 3, 6], ["CHR", 0, "shared", [3]], ["CA", 1, 4, 6], ["FU", 5, [0, 1]], ["AN", 5, 0, 5], ["FU", 5, [1, 2]], ["AN", 5, 1, 4], ["FU", 5, [2, 3]], ["AN", 5, 2, 6], ["FU", 3, [0, 1]], ["SP", 3, 0, 768, [2], 1], ["AN", 3, 1, 2], ["FFSP", 3, 0, [2, 1], 1, 1], ["AN", 3, 1, 6], ["FU", 1, [0, 1]], ["SP", 1, 0, 48, [2], 1], ["AN", 1, 1, 2], ["FFSP", 1, 0, [2, 1], 1, 1], ["AN", 1, 1, 6], ["PR", 4, 0, "auto_unroll_max_step$1024"]]]], "r": [[0.02798], 0, 2.94035, 1707741196], "mark": 2, "ag": 1, "v": "v0.6"}
{"i": [["[\"_matmul\", 512, 3072, 768, \"float32\"]", "cuda -keys=cuda,gpu -arch=sm_86 -max_num_threads=1024 -model=unknown -thread_warp_size=32", [82, 999, 999, 49152, 2147483647, 1024, 255, 32], "", 0, []], [[], [["CHW", 2, "local"], ["SP", 2, 0, 512, [1, 64, 8, 1], 1], ["SP", 2, 5, 768, [1, 1, 192, 1], 1], ["SP", 2, 10, 3072, [6, 1], 1], ["RE", 2, [0, 5, 1, 6, 2, 7, 10, 11, 3, 8, 12, 4, 9]], ["FSP", 3, 0, 1, 3], ["FSP", 3, 4, 2, 3], ["RE", 3, [0, 4, 1, 5, 2, 6, 3, 7]], ["CA", 2, 3, 5], ["CHR", 1, "shared", [2]], ["CA", 2, 3, 6], ["CHR", 0, "shared", [3]], ["CA", 1, 4, 6], ["FU", 5, [0, 1]], ["AN", 5, 0, 5], ["FU", 5, [1, 2]], ["AN", 5, 1, 4], ["FU", 5, [2, 3]], ["AN", 5, 2, 6], ["FU", 3, [0, 1]], ["SP", 3, 0, 1152, [2], 1], ["AN", 3, 1, 2], ["FFSP", 3, 0, [2, 1], 1, 1], ["AN", 3, 1, 6], ["FU", 1, [0, 1]], ["SP", 1, 0, 48, [2], 1], ["AN", 1, 1, 2], ["FFSP", 1, 0, [2, 1], 1, 1], ["AN", 1, 1, 6], ["PR", 4, 0, "auto_unroll_max_step$1024"]]]], "r": [[0.04639], 0, 1.84707, 1707741196], "mark": 2, "ag": 1, "v": "v0.6"}
{"i": [["[\"_matmul\", 512, 3072, 768, \"float32\"]", "cuda -keys=cuda,gpu -arch=sm_86 -max_num_threads=1024 -model=unknown -thread_warp_size=32", [82, 999, 999, 49152, 2147483647, 1024, 255, 32], "", 0, []], [[], [["CHW", 2, "local"], ["SP", 2, 0, 512, [1, 32, 4, 1], 1], ["SP", 2, 5, 768, [1, 1, 192, 1], 1], ["SP", 2, 10, 3072, [6, 1], 1], ["RE", 2, [0, 5, 1, 6, 2, 7, 10, 11, 3, 8, 12, 4, 9]], ["FSP", 3, 0, 1, 3], ["FSP", 3, 4, 2, 3], ["RE", 3, [0, 4, 1, 5, 2, 6, 3, 7]], ["CA", 2, 3, 5], ["CHR", 1, "shared", [2]], ["CA", 2, 3, 6], ["CHR", 0, "shared", [3]], ["CA", 1, 4, 6], ["FU", 5, [0, 1]], ["AN", 5, 0, 5], ["FU", 5, [1, 2]], ["AN", 5, 1, 4], ["FU", 5, [2, 3]], ["AN", 5, 2, 6], ["FU", 3, [0, 1]], ["SP", 3, 0, 1152, [2], 1], ["AN", 3, 1, 2], ["FFSP", 3, 0, [2, 1], 1, 1], ["AN", 3, 1, 6], ["FU", 1, [0, 1]], ["SP", 1, 0, 24, [2], 1], ["AN", 1, 1, 2], ["FFSP", 1, 0, [2, 1], 1, 1], ["AN", 1, 1, 6], ["PR", 4, 0, "auto_unroll_max_step$1024"]]]], "r": [[0.0228119], 0, 2.71998, 1707741197], "mark": 2, "ag": 1, "v": "v0.6"}
{"i": [["[\"_matmul\", 512, 3072, 768, \"float32\"]", "cuda -keys=cuda,gpu -arch=sm_86 -max_num_threads=1024 -model=unknown -thread_warp_size=32", [82, 999, 999, 49152, 2147483647, 1024, 255, 32], "", 0, []], [[], [["CHW", 2, "local"], ["SP", 2, 0, 512, [1, 32, 16, 1], 1], ["SP", 2, 5, 768, [1, 1, 192, 1], 1], ["SP", 2, 10, 3072, [6, 1], 1], ["RE", 2, [0, 5, 1, 6, 2, 7, 10, 11, 3, 8, 12, 4, 9]], ["FSP", 3, 0, 1, 3], ["FSP", 3, 4, 2, 3], ["RE", 3, [0, 4, 1, 5, 2, 6, 3, 7]], ["CA", 2, 3, 5], ["CHR", 1, "shared", [2]], ["CA", 2, 3, 6], ["CHR", 0, "shared", [3]], ["CA", 1, 4, 6], ["FU", 5, [0, 1]], ["AN", 5, 0, 5], ["FU", 5, [1, 2]], ["AN", 5, 1, 4], ["FU", 5, [2, 3]], ["AN", 5, 2, 6], ["FU", 3, [0, 1]], ["SP", 3, 0, 1152, [2], 1], ["AN", 3, 1, 2], ["FFSP", 3, 0, [2, 1], 1, 1], ["AN", 3, 1, 6], ["FU", 1, [0, 1]], ["SP", 1, 0, 96, [2], 1], ["AN", 1, 1, 2], ["FFSP", 1, 0, [2, 1], 1, 1], ["AN", 1, 1, 6], ["PR", 4, 0, "auto_unroll_max_step$1024"]]]], "r": [[0.110086], 0, 2.14314, 1707741197], "mark": 2, "ag": 1, "v": "v0.6"}
{"i": [["[\"_matmul\", 512, 3072, 768, \"float32\"]", "cuda -keys=cuda,gpu -arch=sm_86 -max_num_threads=1024 -model=unknown -thread_warp_size=32", [82, 999, 999, 49152, 2147483647, 1024, 255, 32], "", 0, []], [[], [["CHW", 2, "local"], ["SP", 2, 0, 512, [1, 32, 8, 1], 1], ["SP", 2, 5, 768, [1, 1, 128, 1], 1], ["SP", 2, 10, 3072, [4, 1], 1], ["RE", 2, [0, 5, 1, 6, 2, 7, 10, 11, 3, 8, 12, 4, 9]], ["FSP", 3, 0, 1, 3], ["FSP", 3, 4, 2, 3], ["RE", 3, [0, 4, 1, 5, 2, 6, 3, 7]], ["CA", 2, 3, 5], ["CHR", 1, "shared", [2]], ["CA", 2, 3, 6], ["CHR", 0, "shared", [3]], ["CA", 1, 4, 6], ["FU", 5, [0, 1]], ["AN", 5, 0, 5], ["FU", 5, [1, 2]], ["AN", 5, 1, 4], ["FU", 5, [2, 3]], ["AN", 5, 2, 6], ["FU", 3, [0, 1]], ["SP", 3, 0, 512, [2], 1], ["AN", 3, 1, 2], ["FFSP", 3, 0, [2, 1], 1, 1], ["AN", 3, 1, 6], ["FU", 1, [0, 1]], ["SP", 1, 0, 32, [2], 1], ["AN", 1, 1, 2], ["FFSP", 1, 0, [2, 1], 1, 1], ["AN", 1, 1, 6], ["PR", 4, 0, "auto_unroll_max_step$1024"]]]], "r": [[0.0283954], 0, 3.42952, 1707741197], "mark": 2, "ag": 1, "v": "v0.6"}
{"i": [["[\"_matmul\", 512, 3072, 768, \"float32\"]", "cuda -keys=cuda,gpu -arch=sm_86 -max_num_threads=1024 -model=unknown -thread_warp_size=32", [82, 999, 999, 49152, 2147483647, 1024, 255, 32], "", 0, []], [[], [["CHW", 2, "local"], ["SP", 2, 0, 512, [1, 32, 8, 1], 1], ["SP", 2, 5, 768, [1, 1, 128, 1], 1], ["SP", 2, 10, 3072, [8, 1], 1], ["RE", 2, [0, 5, 1, 6, 2, 7, 10, 11, 3, 8, 12, 4, 9]], ["FSP", 3, 0, 1, 3], ["FSP", 3, 4, 2, 3], ["RE", 3, [0, 4, 1, 5, 2, 6, 3, 7]], ["CA", 2, 3, 5], ["CHR", 1, "shared", [2]], ["CA", 2, 3, 6], ["CHR", 0, "shared", [3]], ["CA", 1, 4, 6], ["FU", 5, [0, 1]], ["AN", 5, 0, 5], ["FU", 5, [1, 2]], ["AN", 5, 1, 4], ["FU", 5, [2, 3]], ["AN", 5, 2, 6], ["FU", 3, [0, 1]], ["SP", 3, 0, 1024, [2], 1], ["AN", 3, 1, 2], ["FFSP", 3, 0, [2, 1], 1, 1], ["AN", 3, 1, 6], ["FU", 1, [0, 1]], ["SP", 1, 0, 64, [2], 1], ["AN", 1, 1, 2], ["FFSP", 1, 0, [2, 1], 1, 1], ["AN", 1, 1, 6], ["PR", 4, 0, "auto_unroll_max_step$1024"]]]], "r": [[0.02749], 0, 3.45832, 1707741198], "mark": 2, "ag": 1, "v": "v0.6"}
{"i": [["[\"_matmul\", 512, 3072, 768, \"float32\"]", "cuda -keys=cuda,gpu -arch=sm_86 -max_num_threads=1024 -model=unknown -thread_warp_size=32", [82, 999, 999, 49152, 2147483647, 1024, 255, 32], "", 0, []], [[], [["CHW", 2, "local"], ["SP", 2, 0, 512, [1, 64, 8, 1], 1], ["SP", 2, 5, 768, [1, 1, 192, 1], 1], ["SP", 2, 10, 3072, [4, 1], 1], ["RE", 2, [0, 5, 1, 6, 2, 7, 10, 11, 3, 8, 12, 4, 9]], ["FSP", 3, 0, 1, 3], ["FSP", 3, 4, 2, 3], ["RE", 3, [0, 4, 1, 5, 2, 6, 3, 7]], ["CA", 2, 3, 5], ["CHR", 1, "shared", [2]], ["CA", 2, 3, 6], ["CHR", 0, "shared", [3]], ["CA", 1, 4, 6], ["FU", 5, [0, 1]], ["AN", 5, 0, 5], ["FU", 5, [1, 2]], ["AN", 5, 1, 4], ["FU", 5, [2, 3]], ["AN", 5, 2, 6], ["FU", 3, [0, 1]], ["SP", 3, 0, 768, [2], 1], ["AN", 3, 1, 2], ["FFSP", 3, 0, [2, 1], 1, 1], ["AN", 3, 1, 6], ["FU", 1, [0, 1]], ["SP", 1, 0, 32, [2], 1], ["AN", 1, 1, 2], ["FFSP", 1, 0, [2, 1], 1, 1], ["AN", 1, 1, 6], ["PR", 4, 0, "auto_unroll_max_step$1024"]]]], "r": [[0.0354838], 0, 1.77998, 1707741198], "mark": 2, "ag": 1, "v": "v0.6"}
{"i": [["[\"_matmul\", 512, 3072, 768, \"float32\"]", "cuda -keys=cuda,gpu -arch=sm_86 -max_num_threads=1024 -model=unknown -thread_warp_size=32", [82, 999, 999, 49152, 2147483647, 1024, 255, 32], "", 0, []], [[], [["CHW", 2, "local"], ["SP", 2, 0, 512, [1, 64, 8, 1], 1], ["SP", 2, 5, 768, [1, 1, 192, 1], 1], ["SP", 2, 10, 3072, [8, 1], 1], ["RE", 2, [0, 5, 1, 6, 2, 7, 10, 11, 3, 8, 12, 4, 9]], ["FSP", 3, 0, 1, 3], ["FSP", 3, 4, 2, 3], ["RE", 3, [0, 4, 1, 5, 2, 6, 3, 7]], ["CA", 2, 3, 5], ["CHR", 1, "shared", [2]], ["CA", 2, 3, 6], ["CHR", 0, "shared", [3]], ["CA", 1, 4, 6], ["FU", 5, [0, 1]], ["AN", 5, 0, 5], ["FU", 5, [1, 2]], ["AN", 5, 1, 4], ["FU", 5, [2, 3]], ["AN", 5, 2, 6], ["FU", 3, [0, 1]], ["SP", 3, 0, 1536, [2], 1], ["AN", 3, 1, 2], ["FFSP", 3, 0, [2, 1], 1, 1], ["AN", 3, 1, 6], ["FU", 1, [0, 1]], ["SP", 1, 0, 64, [2], 1], ["AN", 1, 1, 2], ["FFSP", 1, 0, [2, 1], 1, 1], ["AN", 1, 1, 6], ["PR", 4, 0, "auto_unroll_max_step$1024"]]]], "r": [[0.0343614], 0, 2.59403, 1707741198], "mark": 2, "ag": 1, "v": "v0.6"}
{"i": [["[\"_matmul\", 512, 3072, 768, \"float32\"]", "cuda -keys=cuda,gpu -arch=sm_86 -max_num_threads=1024 -model=unknown -thread_warp_size=32", [82, 999, 999, 49152, 2147483647, 1024, 255, 32], "", 0, []], [[], [["CHW", 2, "local"], ["SP", 2, 0, 512, [1, 64, 8, 1], 1], ["SP", 2, 5, 768, [1, 1, 128, 1], 1], ["SP", 2, 10, 3072, [6, 1], 1], ["RE", 2, [0, 5, 1, 6, 2, 7, 10, 11, 3, 8, 12, 4, 9]], ["FSP", 3, 0, 1, 3], ["FSP", 3, 4, 2, 3], ["RE", 3, [0, 4, 1, 5, 2, 6, 3, 7]], ["CA", 2, 3, 5], ["CHR", 1, "shared", [2]], ["CA", 2, 3, 6], ["CHR", 0, "shared", [3]], ["CA", 1, 4, 6], ["FU", 5, [0, 1]], ["AN", 5, 0, 5], ["FU", 5, [1, 2]], ["AN", 5, 1, 4], ["FU", 5, [2, 3]], ["AN", 5, 2, 6], ["FU", 3, [0, 1]], ["SP", 3, 0, 768, [2], 1], ["AN", 3, 1, 2], ["FFSP", 3, 0, [2, 1], 1, 1], ["AN", 3, 1, 6], ["FU", 1, [0, 1]], ["SP", 1, 0, 48, [2], 1], ["AN", 1, 1, 2], ["FFSP", 1, 0, [2, 1], 1, 1], ["AN", 1, 1, 6], ["PR", 4, 0, "auto_unroll_max_step$1024"]]]], "r": [[0.0344287], 0, 3.47095, 1707741198], "mark": 2, "ag": 1, "v": "v0.6"}
{"i": [["[\"_matmul\", 512, 3072, 768, \"float32\"]", "cuda -keys=cuda,gpu -arch=sm_86 -max_num_threads=1024 -model=unknown -thread_warp_size=32", [82, 999, 999, 49152, 2147483647, 1024, 255, 32], "", 0, []], [[], [["CHW", 2, "local"], ["SP", 2, 0, 512, [1, 32, 4, 1], 1], ["SP", 2, 5, 768, [1, 1, 192, 1], 1], ["SP", 2, 10, 3072, [4, 1], 1], ["RE", 2, [0, 5, 1, 6, 2, 7, 10, 11, 3, 8, 12, 4, 9]], ["FSP", 3, 0, 1, 3], ["FSP", 3, 4, 2, 3], ["RE", 3, [0, 4, 1, 5, 2, 6, 3, 7]], ["CA", 2, 3, 5], ["CHR", 1, "shared", [2]], ["CA", 2, 3, 6], ["CHR", 0, "shared", [3]], ["CA", 1, 4, 6], ["FU", 5, [0, 1]], ["AN", 5, 0, 5], ["FU", 5, [1, 2]], ["AN", 5, 1, 4], ["FU", 5, [2, 3]], ["AN", 5, 2, 6], ["FU", 3, [0, 1]], ["SP", 3, 0, 768, [2], 1], ["AN", 3, 1, 2], ["FFSP", 3, 0, [2, 1], 1, 1], ["AN", 3, 1, 6], ["FU", 1, [0, 1]], ["SP", 1, 0, 16, [2], 1], ["AN", 1, 1, 2], ["FFSP", 1, 0, [2, 1], 1, 1], ["AN", 1, 1, 6], ["PR", 4, 0, "auto_unroll_max_step$1024"]]]], "r": [[0.0245911], 0, 3.6716, 1707741199], "mark": 2, "ag": 1, "v": "v0.6"}
{"i": [["[\"_matmul\", 512, 3072, 768, \"float32\"]", "cuda -keys=cuda,gpu -arch=sm_86 -max_num_threads=1024 -model=unknown -thread_warp_size=32", [82, 999, 999, 49152, 2147483647, 1024, 255, 32], "", 0, []], [[], [["CHW", 2, "local"], ["SP", 2, 0, 512, [1, 32, 4, 1], 1], ["SP", 2, 5, 768, [1, 1, 192, 1], 1], ["SP", 2, 10, 3072, [8, 1], 1], ["RE", 2, [0, 5, 1, 6, 2, 7, 10, 11, 3, 8, 12, 4, 9]], ["FSP", 3, 0, 1, 3], ["FSP", 3, 4, 2, 3], ["RE", 3, [0, 4, 1, 5, 2, 6, 3, 7]], ["CA", 2, 3, 5], ["CHR", 1, "shared", [2]], ["CA", 2, 3, 6], ["CHR", 0, "shared", [3]], ["CA", 1, 4, 6], ["FU", 5, [0, 1]], ["AN", 5, 0, 5], ["FU", 5, [1, 2]], ["AN", 5, 1, 4], ["FU", 5, [2, 3]], ["AN", 5, 2, 6], ["FU", 3, [0, 1]], ["SP", 3, 0, 1536, [2], 1], ["AN", 3, 1, 2], ["FFSP", 3, 0, [2, 1], 1, 1], ["AN", 3, 1, 6], ["FU", 1, [0, 1]], ["SP", 1, 0, 32, [2], 1], ["AN", 1, 1, 2], ["FFSP", 1, 0, [2, 1], 1, 1], ["AN", 1, 1, 6], ["PR", 4, 0, "auto_unroll_max_step$1024"]]]], "r": [[0.020245], 0, 2.70932, 1707741199], "mark": 2, "ag": 1, "v": "v0.6"}
{"i": [["[\"_matmul\", 512, 3072, 768, \"float32\"]", "cuda -keys=cuda,gpu -arch=sm_86 -max_num_threads=1024 -model=unknown -thread_warp_size=32", [82, 999, 999, 49152, 2147483647, 1024, 255, 32], "", 0, []], [[], [["CHW", 2, "local"], ["SP", 2, 0, 512, [1, 32, 16, 1], 1], ["SP", 2, 5, 768, [1, 1, 192, 1], 1], ["SP", 2, 10, 3072, [4, 1], 1], ["RE", 2, [0, 5, 1, 6, 2, 7, 10, 11, 3, 8, 12, 4, 9]], ["FSP", 3, 0, 1, 3], ["FSP", 3, 4, 2, 3], ["RE", 3, [0, 4, 1, 5, 2, 6, 3, 7]], ["CA", 2, 3, 5], ["CHR", 1, "shared", [2]], ["CA", 2, 3, 6], ["CHR", 0, "shared", [3]], ["CA", 1, 4, 6], ["FU", 5, [0, 1]], ["AN", 5, 0, 5], ["FU", 5, [1, 2]], ["AN", 5, 1, 4], ["FU", 5, [2, 3]], ["AN", 5, 2, 6], ["FU", 3, [0, 1]], ["SP", 3, 0, 768, [2], 1], ["AN", 3, 1, 2], ["FFSP", 3, 0, [2, 1], 1, 1], ["AN", 3, 1, 6], ["FU", 1, [0, 1]], ["SP", 1, 0, 64, [2], 1], ["AN", 1, 1, 2], ["FFSP", 1, 0, [2, 1], 1, 1], ["AN", 1, 1, 6], ["PR", 4, 0, "auto_unroll_max_step$1024"]]]], "r": [[0.0668324], 0, 2.59884, 1707741199], "mark": 2, "ag": 1, "v": "v0.6"}
{"i": [["[\"_matmul\", 512, 3072, 768, \"float32\"]", "cuda -keys=cuda,gpu -arch=sm_86 -max_num_threads=1024 -model=unknown -thread_warp_size=32", [82, 999, 999, 49152, 2147483647, 1024, 255, 32], "", 0, []], [[], [["CHW", 2, "local"], ["SP", 2, 0, 512, [1, 32, 16, 1], 1], ["SP", 2, 5, 768, [1, 1, 192, 1], 1], ["SP", 2, 10, 3072, [8, 1], 1], ["RE", 2, [0, 5, 1, 6, 2, 7, 10, 11, 3, 8, 12, 4, 9]], ["FSP", 3, 0, 1, 3], ["FSP", 3, 4, 2, 3], ["RE", 3, [0, 4, 1, 5, 2, 6, 3, 7]], ["CA", 2, 3, 5], ["CHR", 1, "shared", [2]], ["CA", 2, 3, 6], ["CHR", 0, "shared", [3]], ["CA", 1, 4, 6], ["FU", 5, [0, 1]], ["AN", 5, 0, 5], ["FU", 5, [1, 2]], ["AN", 5, 1, 4], ["FU", 5, [2, 3]], ["AN", 5, 2, 6], ["FU", 3, [0, 1]], ["SP", 3, 0, 1536, [2], 1], ["AN", 3, 1, 2], ["FFSP", 3, 0, [2, 1], 1, 1], ["AN", 3, 1, 6], ["FU", 1, [0, 1]], ["SP", 1, 0, 128, [2], 1], ["AN", 1, 1, 2], ["FFSP", 1, 0, [2, 1], 1, 1], ["AN", 1, 1, 6], ["PR", 4, 0, "auto_unroll_max_step$1024"]]]], "r": [[0.0664903], 0, 1.94044, 1707741199], "mark": 2, "ag": 1, "v": "v0.6"}
{"i": [["[\"_matmul\", 512, 3072, 768, \"float32\"]", "cuda -keys=cuda,gpu -arch=sm_86 -max_num_threads=1024 -model=unknown -thread_warp_size=32", [82, 999, 999, 49152, 2147483647, 1024, 255, 32], "", 0, []], [[], [["CHW", 2, "local"], ["SP", 2, 0, 512, [1, 32, 4, 1], 1], ["SP", 2, 5, 768, [1, 1, 128, 1], 1], ["SP", 2, 10, 3072, [6, 1], 1], ["RE", 2, [0, 5, 1, 6, 2, 7, 10, 11, 3, 8, 12, 4, 9]], ["FSP", 3, 0, 1, 3], ["FSP", 3, 4, 2, 3], ["RE", 3, [0, 4, 1, 5, 2, 6, 3, 7]], ["CA", 2, 3, 5], ["CHR", 1, "shared", [2]], ["CA", 2, 3, 6], ["CHR", 0, "shared", [3]], ["CA", 1, 4, 6], ["FU", 5, [0, 1]], ["AN", 5, 0, 5], ["FU", 5, [1, 2]], ["AN", 5, 1, 4], ["FU", 5, [2, 3]], ["AN", 5, 2, 6], ["FU", 3, [0, 1]], ["SP", 3, 0, 768, [2], 1], ["AN", 3, 1, 2], ["FFSP", 3, 0, [2, 1], 1, 1], ["AN", 3, 1, 6], ["FU", 1, [0, 1]], ["SP", 1, 0, 24, [2], 1], ["AN", 1, 1, 2], ["FFSP", 1, 0, [2, 1], 1, 1], ["AN", 1, 1, 6], ["PR", 4, 0, "auto_unroll_max_step$1024"]]]], "r": [[0.0149703], 0, 1.75913, 1707741200], "mark": 2, "ag": 1, "v": "v0.6"}
{"i": [["[\"_matmul\", 512, 3072, 768, \"float32\"]", "cuda -keys=cuda,gpu -arch=sm_86 -max_num_threads=1024 -model=unknown -thread_warp_size=32", [82, 999, 999, 49152, 2147483647, 1024, 255, 32], "", 0, []], [[], [["CHW", 2, "local"], ["SP", 2, 0, 512, [1, 32, 16, 1], 1], ["SP", 2, 5, 768, [1, 1, 128, 1], 1], ["SP", 2, 10, 3072, [6, 1], 1], ["RE", 2, [0, 5, 1, 6, 2, 7, 10, 11, 3, 8, 12, 4, 9]], ["FSP", 3, 0, 1, 3], ["FSP", 3, 4, 2, 3], ["RE", 3, [0, 4, 1, 5, 2, 6, 3, 7]], ["CA", 2, 3, 5], ["CHR", 1, "shared", [2]], ["CA", 2, 3, 6], ["CHR", 0, "shared", [3]], ["CA", 1, 4, 6], ["FU", 5, [0, 1]], ["AN", 5, 0, 5], ["FU", 5, [1, 2]], ["AN", 5, 1, 4], ["FU", 5, [2, 3]], ["AN", 5, 2, 6], ["FU", 3, [0, 1]], ["SP", 3, 0, 768, [2], 1], ["AN", 3, 1, 2], ["FFSP", 3, 0, [2, 1], 1, 1], ["AN", 3, 1, 6], ["FU", 1, [0, 1]], ["SP", 1, 0, 96, [2], 1], ["AN", 1, 1, 2], ["FFSP", 1, 0, [2, 1], 1, 1], ["AN", 1, 1, 6], ["PR", 4, 0, "auto_unroll_max_step$1024"]]]], "r": [[0.0410177], 0, 1.31699, 1707741200], "mark": 2, "ag": 1, "v": "v0.6"}
{"i": [["[\"_matmul\", 512, 3072, 768, \"float32\"]", "cuda -keys=cuda,gpu -arch=sm_86 -max_num_threads=1024 -model=unknown -thread_warp_size=32", [82, 999, 999, 49152, 2147483647, 1024, 255, 32], "", 0, []], [[], [["CHW", 2, "local"], ["SP", 2, 0, 512, [1, 64, 4, 1], 1], ["SP", 2, 5, 768, [1, 1, 192, 1], 1], ["SP", 2, 10, 3072, [6, 1], 1], ["RE", 2, [0, 5, 1, 6, 2, 7, 10, 11, 3, 8, 12, 4, 9]], ["FSP", 3, 0, 1, 3], ["FSP", 3, 4, 2, 3], ["RE", 3, [0, 4, 1, 5, 2, 6, 3, 7]], ["CA", 2, 3, 5], ["CHR", 1, "shared", [2]], ["CA", 2, 3, 6], ["CHR", 0, "shared", [3]], ["CA", 1, 4, 6], ["FU", 5, [0, 1]], ["AN", 5, 0, 5], ["FU", 5, [1, 2]], ["AN", 5, 1, 4], ["FU", 5, [2, 3]], ["AN", 5, 2, 6], ["FU", 3, [0, 1]], ["SP", 3, 0, 1152, [2], 1], ["AN", 3, 1, 2], ["FFSP", 3, 0, [2, 1], 1, 1], ["AN", 3, 1, 6], ["FU", 1, [0, 1]], ["SP", 1, 0, 24, [2], 1], ["AN", 1, 1, 2], ["FFSP", 1, 0, [2, 1], 1, 1], ["AN", 1, 1, 6], ["PR", 4, 0, "auto_unroll_max_step$1024"]]]], "r": [[0.0246141], 0, 3.25239, 1707741200], "mark": 2, "ag": 1, "v": "v0.6"}
{"i": [["[\"_matmul\", 512, 3072, 768, \"float32\"]", "cuda -keys=cuda,gpu -arch=sm_86 -max_num_threads=1024 -model=unknown -thread_warp_size=32", [82, 999, 999, 49152, 2147483647, 1024, 255, 32], "", 0, []], [[], [["CHW", 2, "local"], ["SP", 2, 0, 512, [1, 32, 4, 1], 1], ["SP", 2, 5, 768, [1, 1, 128, 1], 1], ["SP", 2, 10, 3072, [6, 1], 1], ["RE", 2, [0, 5, 1, 6, 2, 7, 10, 11, 3, 8, 12, 4, 9]], ["FSP", 3, 0, 1, 3], ["FSP", 3, 4, 2, 3], ["RE", 3, [0, 4, 1, 5, 2, 6, 3, 7]], ["CA", 2, 3, 5], ["CHR", 1, "shared", [2]], ["CA", 2, 3, 6], ["CHR", 0, "shared", [3]], ["CA", 1, 4, 6], ["FU", 5, [0, 1]], ["AN", 5, 0, 5], ["FU", 5, [1, 2]], ["AN", 5, 1, 4], ["FU", 5, [2, 3]], ["AN", 5, 2, 6], ["FU", 3, [0, 1]], ["SP", 3, 0, 768, [2], 1], ["AN", 3, 1, 2], ["FFSP", 3, 0, [2, 1], 1, 1], ["AN", 3, 1, 6], ["FU", 1, [0, 1]], ["SP", 1, 0, 24, [2], 1], ["AN", 1, 1, 2], ["FFSP", 1, 0, [2, 1], 1, 1], ["AN", 1, 1, 6], ["PR", 4, 0, "auto_unroll_max_step$1024"]]]], "r": [[0.0149703], 0, 1.75913, 1707741200], "mark": 2, "ag": 2, "v": "v0.6"}
{"i": [["[\"_matmul\", 512, 3072, 768, \"float32\"]", "cuda -keys=cuda,gpu -arch=sm_86 -max_num_threads=1024 -model=unknown -thread_warp_size=32", [82, 999, 999, 49152, 2147483647, 1024, 255, 32], "", 0, []], [[], [["CHW", 2, "local"], ["SP", 2, 0, 512, [1, 32, 4, 1], 1], ["SP", 2, 5, 768, [1, 1, 128, 1], 1], ["SP", 2, 10, 3072, [4, 1], 1], ["RE", 2, [0, 5, 1, 6, 2, 7, 10, 11, 3, 8, 12, 4, 9]], ["FSP", 3, 0, 1, 3], ["FSP", 3, 4, 2, 3], ["RE", 3, [0, 4, 1, 5, 2, 6, 3, 7]], ["CA", 2, 3, 5], ["CHR", 1, "shared", [2]], ["CA", 2, 3, 6], ["CHR", 0, "shared", [3]], ["CA", 1, 4, 6], ["FU", 5, [0, 1]], ["AN", 5, 0, 5], ["FU", 5, [1, 2]], ["AN", 5, 1, 4], ["FU", 5, [2, 3]], ["AN", 5, 2, 6], ["FU", 3, [0, 1]], ["SP", 3, 0, 512, [2], 1], ["AN", 3, 1, 2], ["FFSP", 3, 0, [2, 1], 1, 1], ["AN", 3, 1, 6], ["FU", 1, [0, 1]], ["SP", 1, 0, 16, [2], 1], ["AN", 1, 1, 2], ["FFSP", 1, 0, [2, 1], 1, 1], ["AN", 1, 1, 6], ["PR", 4, 0, "auto_unroll_max_step$1024"]]]], "r": [[0.0138945], 0, 1.59193, 1707741205], "mark": 2, "ag": 2, "v": "v0.6"}
{"i": [["[\"_matmul\", 512, 3072, 768, \"float32\"]", "cuda -keys=cuda,gpu -arch=sm_86 -max_num_threads=1024 -model=unknown -thread_warp_size=32", [82, 999, 999, 49152, 2147483647, 1024, 255, 32], "", 0, []], [[], [["CHW", 2, "local"], ["SP", 2, 0, 512, [1, 32, 4, 1], 1], ["SP", 2, 5, 768, [1, 1, 128, 1], 1], ["SP", 2, 10, 3072, [8, 1], 1], ["RE", 2, [0, 5, 1, 6, 2, 7, 10, 11, 3, 8, 12, 4, 9]], ["FSP", 3, 0, 1, 3], ["FSP", 3, 4, 2, 3], ["RE", 3, [0, 4, 1, 5, 2, 6, 3, 7]], ["CA", 2, 3, 5], ["CHR", 1, "shared", [2]], ["CA", 2, 3, 6], ["CHR", 0, "shared", [3]], ["CA", 1, 4, 6], ["FU", 5, [0, 1]], ["AN", 5, 0, 5], ["FU", 5, [1, 2]], ["AN", 5, 1, 4], ["FU", 5, [2, 3]], ["AN", 5, 2, 6], ["FU", 3, [0, 1]], ["SP", 3, 0, 1024, [2], 1], ["AN", 3, 1, 2], ["FFSP", 3, 0, [2, 1], 1, 1], ["AN", 3, 1, 6], ["FU", 1, [0, 1]], ["SP", 1, 0, 32, [2], 1], ["AN", 1, 1, 2], ["FFSP", 1, 0, [2, 1], 1, 1], ["AN", 1, 1, 6], ["PR", 4, 0, "auto_unroll_max_step$1024"]]]], "r": [[0.0143873], 0, 1.33399, 1707741205], "mark": 2, "ag": 2, "v": "v0.6"}
{"i": [["[\"_matmul\", 512, 3072, 768, \"float32\"]", "cuda -keys=cuda,gpu -arch=sm_86 -max_num_threads=1024 -model=unknown -thread_warp_size=32", [82, 999, 999, 49152, 2147483647, 1024, 255, 32], "", 0, []], [[], [["CHW", 2, "local"], ["SP", 2, 0, 512, [1, 32, 4, 1], 1], ["SP", 2, 5, 768, [1, 1, 96, 1], 1], ["SP", 2, 10, 3072, [6, 1], 1], ["RE", 2, [0, 5, 1, 6, 2, 7, 10, 11, 3, 8, 12, 4, 9]], ["FSP", 3, 0, 1, 3], ["FSP", 3, 4, 2, 3], ["RE", 3, [0, 4, 1, 5, 2, 6, 3, 7]], ["CA", 2, 3, 5], ["CHR", 1, "shared", [2]], ["CA", 2, 3, 6], ["CHR", 0, "shared", [3]], ["CA", 1, 4, 6], ["FU", 5, [0, 1]], ["AN", 5, 0, 5], ["FU", 5, [1, 2]], ["AN", 5, 1, 4], ["FU", 5, [2, 3]], ["AN", 5, 2, 6], ["FU", 3, [0, 1]], ["SP", 3, 0, 576, [2], 1], ["AN", 3, 1, 2], ["FFSP", 3, 0, [2, 1], 1, 1], ["AN", 3, 1, 6], ["FU", 1, [0, 1]], ["SP", 1, 0, 24, [2], 1], ["AN", 1, 1, 2], ["FFSP", 1, 0, [2, 1], 1, 1], ["AN", 1, 1, 6], ["PR", 4, 0, "auto_unroll_max_step$1024"]]]], "r": [[0.0102997], 0, 1.89325, 1707741206], "mark": 2, "ag": 2, "v": "v0.6"}
{"i": [["[\"_matmul\", 512, 3072, 768, \"float32\"]", "cuda -keys=cuda,gpu -arch=sm_86 -max_num_threads=1024 -model=unknown -thread_warp_size=32", [82, 999, 999, 49152, 2147483647, 1024, 255, 32], "", 0, []], [[], [["CHW", 2, "local"], ["SP", 2, 0, 512, [1, 64, 4, 1], 1], ["SP", 2, 5, 768, [1, 1, 128, 1], 1], ["SP", 2, 10, 3072, [6, 1], 1], ["RE", 2, [0, 5, 1, 6, 2, 7, 10, 11, 3, 8, 12, 4, 9]], ["FSP", 3, 0, 1, 3], ["FSP", 3, 4, 2, 3], ["RE", 3, [0, 4, 1, 5, 2, 6, 3, 7]], ["CA", 2, 3, 5], ["CHR", 1, "shared", [2]], ["CA", 2, 3, 6], ["CHR", 0, "shared", [3]], ["CA", 1, 4, 6], ["FU", 5, [0, 1]], ["AN", 5, 0, 5], ["FU", 5, [1, 2]], ["AN", 5, 1, 4], ["FU", 5, [2, 3]], ["AN", 5, 2, 6], ["FU", 3, [0, 1]], ["SP", 3, 0, 768, [2], 1], ["AN", 3, 1, 2], ["FFSP", 3, 0, [2, 1], 1, 1], ["AN", 3, 1, 6], ["FU", 1, [0, 1]], ["SP", 1, 0, 24, [2], 1], ["AN", 1, 1, 2], ["FFSP", 1, 0, [2, 1], 1, 1], ["AN", 1, 1, 6], ["PR", 4, 0, "auto_unroll_max_step$1024"]]]], "r": [[0.0154121], 0, 1.95991, 1707741206], "mark": 2, "ag": 2, "v": "v0.6"}
{"i": [["[\"_matmul\", 512, 3072, 768, \"float32\"]", "cuda -keys=cuda,gpu -arch=sm_86 -max_num_threads=1024 -model=unknown -thread_warp_size=32", [82, 999, 999, 49152, 2147483647, 1024, 255, 32], "", 0, []], [[], [["CHW", 2, "local"], ["SP", 2, 0, 512, [1, 32, 2, 1], 1], ["SP", 2, 5, 768, [1, 1, 128, 1], 1], ["SP", 2, 10, 3072, [6, 1], 1], ["RE", 2, [0, 5, 1, 6, 2, 7, 10, 11, 3, 8, 12, 4, 9]], ["FSP", 3, 0, 1, 3], ["FSP", 3, 4, 2, 3], ["RE", 3, [0, 4, 1, 5, 2, 6, 3, 7]], ["CA", 2, 3, 5], ["CHR", 1, "shared", [2]], ["CA", 2, 3, 6], ["CHR", 0, "shared", [3]], ["CA", 1, 4, 6], ["FU", 5, [0, 1]], ["AN", 5, 0, 5], ["FU", 5, [1, 2]], ["AN", 5, 1, 4], ["FU", 5, [2, 3]], ["AN", 5, 2, 6], ["FU", 3, [0, 1]], ["SP", 3, 0, 768, [2], 1], ["AN", 3, 1, 2], ["FFSP", 3, 0, [2, 1], 1, 1], ["AN", 3, 1, 6], ["FU", 1, [0, 1]], ["SP", 1, 0, 12, [2], 1], ["AN", 1, 1, 2], ["FFSP", 1, 0, [2, 1], 1, 1], ["AN", 1, 1, 6], ["PR", 4, 0, "auto_unroll_max_step$1024"]]]], "r": [[0.00282776], 0, 1.32636, 1707741206], "mark": 2, "ag": 2, "v": "v0.6"}
{"i": [["[\"_matmul\", 512, 3072, 768, \"float32\"]", "cuda -keys=cuda,gpu -arch=sm_86 -max_num_threads=1024 -model=unknown -thread_warp_size=32", [82, 999, 999, 49152, 2147483647, 1024, 255, 32], "", 0, []], [[], [["CHW", 2, "local"], ["SP", 2, 0, 512, [1, 32, 8, 1], 1], ["SP", 2, 5, 768, [1, 1, 128, 1], 1], ["SP", 2, 10, 3072, [6, 1], 1], ["RE", 2, [0, 5, 1, 6, 2, 7, 10, 11, 3, 8, 12, 4, 9]], ["FSP", 3, 0, 1, 3], ["FSP", 3, 4, 2, 3], ["RE", 3, [0, 4, 1, 5, 2, 6, 3, 7]], ["CA", 2, 3, 5], ["CHR", 1, "shared", [2]], ["CA", 2, 3, 6], ["CHR", 0, "shared", [3]], ["CA", 1, 4, 6], ["FU", 5, [0, 1]], ["AN", 5, 0, 5], ["FU", 5, [1, 2]], ["AN", 5, 1, 4], ["FU", 5, [2, 3]], ["AN", 5, 2, 6], ["FU", 3, [0, 1]], ["SP", 3, 0, 768, [2], 1], ["AN", 3, 1, 2], ["FFSP", 3, 0, [2, 1], 1, 1], ["AN", 3, 1, 6], ["FU", 1, [0, 1]], ["SP", 1, 0, 48, [2], 1], ["AN", 1, 1, 2], ["FFSP", 1, 0, [2, 1], 1, 1], ["AN", 1, 1, 6], ["PR", 4, 0, "auto_unroll_max_step$1024"]]]], "r": [[0.0279917], 0, 3.47185, 1707741206], "mark": 2, "ag": 2, "v": "v0.6"}
{"i": [["[\"_matmul\", 512, 3072, 768, \"float32\"]", "cuda -keys=cuda,gpu -arch=sm_86 -max_num_threads=1024 -model=unknown -thread_warp_size=32", [82, 999, 999, 49152, 2147483647, 1024, 255, 32], "", 0, []], [[], [["CHW", 2, "local"], ["SP", 2, 0, 512, [1, 32, 4, 1], 1], ["SP", 2, 5, 768, [1, 1, 96, 1], 1], ["SP", 2, 10, 3072, [4, 1], 1], ["RE", 2, [0, 5, 1, 6, 2, 7, 10, 11, 3, 8, 12, 4, 9]], ["FSP", 3, 0, 1, 3], ["FSP", 3, 4, 2, 3], ["RE", 3, [0, 4, 1, 5, 2, 6, 3, 7]], ["CA", 2, 3, 5], ["CHR", 1, "shared", [2]], ["CA", 2, 3, 6], ["CHR", 0, "shared", [3]], ["CA", 1, 4, 6], ["FU", 5, [0, 1]], ["AN", 5, 0, 5], ["FU", 5, [1, 2]], ["AN", 5, 1, 4], ["FU", 5, [2, 3]], ["AN", 5, 2, 6], ["FU", 3, [0, 1]], ["SP", 3, 0, 384, [2], 1], ["AN", 3, 1, 2], ["FFSP", 3, 0, [2, 1], 1, 1], ["AN", 3, 1, 6], ["FU", 1, [0, 1]], ["SP", 1, 0, 16, [2], 1], ["AN", 1, 1, 2], ["FFSP", 1, 0, [2, 1], 1, 1], ["AN", 1, 1, 6], ["PR", 4, 0, "auto_unroll_max_step$1024"]]]], "r": [[0.00886559], 0, 1.5343, 1707741207], "mark": 2, "ag": 2, "v": "v0.6"}
{"i": [["[\"_matmul\", 512, 3072, 768, \"float32\"]", "cuda -keys=cuda,gpu -arch=sm_86 -max_num_threads=1024 -model=unknown -thread_warp_size=32", [82, 999, 999, 49152, 2147483647, 1024, 255, 32], "", 0, []], [[], [["CHW", 2, "local"], ["SP", 2, 0, 512, [1, 32, 4, 1], 1], ["SP", 2, 5, 768, [1, 1, 96, 1], 1], ["SP", 2, 10, 3072, [8, 1], 1], ["RE", 2, [0, 5, 1, 6, 2, 7, 10, 11, 3, 8, 12, 4, 9]], ["FSP", 3, 0, 1, 3], ["FSP", 3, 4, 2, 3], ["RE", 3, [0, 4, 1, 5, 2, 6, 3, 7]], ["CA", 2, 3, 5], ["CHR", 1, "shared", [2]], ["CA", 2, 3, 6], ["CHR", 0, "shared", [3]], ["CA", 1, 4, 6], ["FU", 5, [0, 1]], ["AN", 5, 0, 5], ["FU", 5, [1, 2]], ["AN", 5, 1, 4], ["FU", 5, [2, 3]], ["AN", 5, 2, 6], ["FU", 3, [0, 1]], ["SP", 3, 0, 768, [2], 1], ["AN", 3, 1, 2], ["FFSP", 3, 0, [2, 1], 1, 1], ["AN", 3, 1, 6], ["FU", 1, [0, 1]], ["SP", 1, 0, 32, [2], 1], ["AN", 1, 1, 2], ["FFSP", 1, 0, [2, 1], 1, 1], ["AN", 1, 1, 6], ["PR", 4, 0, "auto_unroll_max_step$1024"]]]], "r": [[0.0104201], 0, 1.3355, 1707741207], "mark": 2, "ag": 2, "v": "v0.6"}
{"i": [["[\"_matmul\", 512, 3072, 768, \"float32\"]", "cuda -keys=cuda,gpu -arch=sm_86 -max_num_threads=1024 -model=unknown -thread_warp_size=32", [82, 999, 999, 49152, 2147483647, 1024, 255, 32], "", 0, []], [[], [["CHW", 2, "local"], ["SP", 2, 0, 512, [1, 64, 4, 1], 1], ["SP", 2, 5, 768, [1, 1, 128, 1], 1], ["SP", 2, 10, 3072, [4, 1], 1], ["RE", 2, [0, 5, 1, 6, 2, 7, 10, 11, 3, 8, 12, 4, 9]], ["FSP", 3, 0, 1, 3], ["FSP", 3, 4, 2, 3], ["RE", 3, [0, 4, 1, 5, 2, 6, 3, 7]], ["CA", 2, 3, 5], ["CHR", 1, "shared", [2]], ["CA", 2, 3, 6], ["CHR", 0, "shared", [3]], ["CA", 1, 4, 6], ["FU", 5, [0, 1]], ["AN", 5, 0, 5], ["FU", 5, [1, 2]], ["AN", 5, 1, 4], ["FU", 5, [2, 3]], ["AN", 5, 2, 6], ["FU", 3, [0, 1]], ["SP", 3, 0, 512, [2], 1], ["AN", 3, 1, 2], ["FFSP", 3, 0, [2, 1], 1, 1], ["AN", 3, 1, 6], ["FU", 1, [0, 1]], ["SP", 1, 0, 16, [2], 1], ["AN", 1, 1, 2], ["FFSP", 1, 0, [2, 1], 1, 1], ["AN", 1, 1, 6], ["PR", 4, 0, "auto_unroll_max_step$1024"]]]], "r": [[0.0193123], 0, 2.12008, 1707741207], "mark": 2, "ag": 2, "v": "v0.6"}
{"i": [["[\"_matmul\", 512, 3072, 768, \"float32\"]", "cuda -keys=cuda,gpu -arch=sm_86 -max_num_threads=1024 -model=unknown -thread_warp_size=32", [82, 999, 999, 49152, 2147483647, 1024, 255, 32], "", 0, []], [[], [["CHW", 2, "local"], ["SP", 2, 0, 512, [1, 64, 4, 1], 1], ["SP", 2, 5, 768, [1, 1, 128, 1], 1], ["SP", 2, 10, 3072, [8, 1], 1], ["RE", 2, [0, 5, 1, 6, 2, 7, 10, 11, 3, 8, 12, 4, 9]], ["FSP", 3, 0, 1, 3], ["FSP", 3, 4, 2, 3], ["RE", 3, [0, 4, 1, 5, 2, 6, 3, 7]], ["CA", 2, 3, 5], ["CHR", 1, "shared", [2]], ["CA", 2, 3, 6], ["CHR", 0, "shared", [3]], ["CA", 1, 4, 6], ["FU", 5, [0, 1]], ["AN", 5, 0, 5], ["FU", 5, [1, 2]], ["AN", 5, 1, 4], ["FU", 5, [2, 3]], ["AN", 5, 2, 6], ["FU", 3, [0, 1]], ["SP", 3, 0, 1024, [2], 1], ["AN", 3, 1, 2], ["FFSP", 3, 0, [2, 1], 1, 1], ["AN", 3, 1, 6], ["FU", 1, [0, 1]], ["SP", 1, 0, 32, [2], 1], ["AN", 1, 1, 2], ["FFSP", 1, 0, [2, 1], 1, 1], ["AN", 1, 1, 6], ["PR", 4, 0, "auto_unroll_max_step$1024"]]]], "r": [[0.0163976], 0, 1.92725, 1707741207], "mark": 2, "ag": 2, "v": "v0.6"}
{"i": [["[\"_matmul\", 512, 3072, 768, \"float32\"]", "cuda -keys=cuda,gpu -arch=sm_86 -max_num_threads=1024 -model=unknown -thread_warp_size=32", [82, 999, 999, 49152, 2147483647, 1024, 255, 32], "", 0, []], [[], [["CHW", 2, "local"], ["SP", 2, 0, 512, [1, 64, 4, 1], 1], ["SP", 2, 5, 768, [1, 1, 96, 1], 1], ["SP", 2, 10, 3072, [6, 1], 1], ["RE", 2, [0, 5, 1, 6, 2, 7, 10, 11, 3, 8, 12, 4, 9]], ["FSP", 3, 0, 1, 3], ["FSP", 3, 4, 2, 3], ["RE", 3, [0, 4, 1, 5, 2, 6, 3, 7]], ["CA", 2, 3, 5], ["CHR", 1, "shared", [2]], ["CA", 2, 3, 6], ["CHR", 0, "shared", [3]], ["CA", 1, 4, 6], ["FU", 5, [0, 1]], ["AN", 5, 0, 5], ["FU", 5, [1, 2]], ["AN", 5, 1, 4], ["FU", 5, [2, 3]], ["AN", 5, 2, 6], ["FU", 3, [0, 1]], ["SP", 3, 0, 576, [2], 1], ["AN", 3, 1, 2], ["FFSP", 3, 0, [2, 1], 1, 1], ["AN", 3, 1, 6], ["FU", 1, [0, 1]], ["SP", 1, 0, 24, [2], 1], ["AN", 1, 1, 2], ["FFSP", 1, 0, [2, 1], 1, 1], ["AN", 1, 1, 6], ["PR", 4, 0, "auto_unroll_max_step$1024"]]]], "r": [[0.0105478], 0, 1.72594, 1707741207], "mark": 2, "ag": 2, "v": "v0.6"}
{"i": [["[\"_matmul\", 512, 3072, 768, \"float32\"]", "cuda -keys=cuda,gpu -arch=sm_86 -max_num_threads=1024 -model=unknown -thread_warp_size=32", [82, 999, 999, 49152, 2147483647, 1024, 255, 32], "", 0, []], [[], [["CHW", 2, "local"], ["SP", 2, 0, 512, [1, 32, 2, 1], 1], ["SP", 2, 5, 768, [1, 1, 128, 1], 1], ["SP", 2, 10, 3072, [4, 1], 1], ["RE", 2, [0, 5, 1, 6, 2, 7, 10, 11, 3, 8, 12, 4, 9]], ["FSP", 3, 0, 1, 3], ["FSP", 3, 4, 2, 3], ["RE", 3, [0, 4, 1, 5, 2, 6, 3, 7]], ["CA", 2, 3, 5], ["CHR", 1, "shared", [2]], ["CA", 2, 3, 6], ["CHR", 0, "shared", [3]], ["CA", 1, 4, 6], ["FU", 5, [0, 1]], ["AN", 5, 0, 5], ["FU", 5, [1, 2]], ["AN", 5, 1, 4], ["FU", 5, [2, 3]], ["AN", 5, 2, 6], ["FU", 3, [0, 1]], ["SP", 3, 0, 512, [2], 1], ["AN", 3, 1, 2], ["FFSP", 3, 0, [2, 1], 1, 1], ["AN", 3, 1, 6], ["FU", 1, [0, 1]], ["SP", 1, 0, 8, [2], 1], ["AN", 1, 1, 2], ["FFSP", 1, 0, [2, 1], 1, 1], ["AN", 1, 1, 6], ["PR", 4, 0, "auto_unroll_max_step$1024"]]]], "r": [[0.0030295], 0, 1.44145, 1707741208], "mark": 2, "ag": 2, "v": "v0.6"}
{"i": [["[\"_matmul\", 512, 3072, 768, \"float32\"]", "cuda -keys=cuda,gpu -arch=sm_86 -max_num_threads=1024 -model=unknown -thread_warp_size=32", [82, 999, 999, 49152, 2147483647, 1024, 255, 32], "", 0, []], [[], [["CHW", 2, "local"], ["SP", 2, 0, 512, [1, 32, 2, 1], 1], ["SP", 2, 5, 768, [1, 1, 128, 1], 1], ["SP", 2, 10, 3072, [8, 1], 1], ["RE", 2, [0, 5, 1, 6, 2, 7, 10, 11, 3, 8, 12, 4, 9]], ["FSP", 3, 0, 1, 3], ["FSP", 3, 4, 2, 3], ["RE", 3, [0, 4, 1, 5, 2, 6, 3, 7]], ["CA", 2, 3, 5], ["CHR", 1, "shared", [2]], ["CA", 2, 3, 6], ["CHR", 0, "shared", [3]], ["CA", 1, 4, 6], ["FU", 5, [0, 1]], ["AN", 5, 0, 5], ["FU", 5, [1, 2]], ["AN", 5, 1, 4], ["FU", 5, [2, 3]], ["AN", 5, 2, 6], ["FU", 3, [0, 1]], ["SP", 3, 0, 1024, [2], 1], ["AN", 3, 1, 2], ["FFSP", 3, 0, [2, 1], 1, 1], ["AN", 3, 1, 6], ["FU", 1, [0, 1]], ["SP", 1, 0, 16, [2], 1], ["AN", 1, 1, 2], ["FFSP", 1, 0, [2, 1], 1, 1], ["AN", 1, 1, 6], ["PR", 4, 0, "auto_unroll_max_step$1024"]]]], "r": [[0.00289046], 0, 1.43481, 1707741208], "mark": 2, "ag": 2, "v": "v0.6"}
{"i": [["[\"_matmul\", 512, 3072, 768, \"float32\"]", "cuda -keys=cuda,gpu -arch=sm_86 -max_num_threads=1024 -model=unknown -thread_warp_size=32", [82, 999, 999, 49152, 2147483647, 1024, 255, 32], "", 0, []], [[], [["CHW", 2, "local"], ["SP", 2, 0, 512, [1, 32, 8, 1], 1], ["SP", 2, 5, 768, [1, 1, 128, 1], 1], ["SP", 2, 10, 3072, [4, 1], 1], ["RE", 2, [0, 5, 1, 6, 2, 7, 10, 11, 3, 8, 12, 4, 9]], ["FSP", 3, 0, 1, 3], ["FSP", 3, 4, 2, 3], ["RE", 3, [0, 4, 1, 5, 2, 6, 3, 7]], ["CA", 2, 3, 5], ["CHR", 1, "shared", [2]], ["CA", 2, 3, 6], ["CHR", 0, "shared", [3]], ["CA", 1, 4, 6], ["FU", 5, [0, 1]], ["AN", 5, 0, 5], ["FU", 5, [1, 2]], ["AN", 5, 1, 4], ["FU", 5, [2, 3]], ["AN", 5, 2, 6], ["FU", 3, [0, 1]], ["SP", 3, 0, 512, [2], 1], ["AN", 3, 1, 2], ["FFSP", 3, 0, [2, 1], 1, 1], ["AN", 3, 1, 6], ["FU", 1, [0, 1]], ["SP", 1, 0, 32, [2], 1], ["AN", 1, 1, 2], ["FFSP", 1, 0, [2, 1], 1, 1], ["AN", 1, 1, 6], ["PR", 4, 0, "auto_unroll_max_step$1024"]]]], "r": [[0.0284234], 0, 2.86061, 1707741208], "mark": 2, "ag": 2, "v": "v0.6"}
{"i": [["[\"_matmul\", 512, 3072, 768, \"float32\"]", "cuda -keys=cuda,gpu -arch=sm_86 -max_num_threads=1024 -model=unknown -thread_warp_size=32", [82, 999, 999, 49152, 2147483647, 1024, 255, 32], "", 0, []], [[], [["CHW", 2, "local"], ["SP", 2, 0, 512, [1, 32, 8, 1], 1], ["SP", 2, 5, 768, [1, 1, 128, 1], 1], ["SP", 2, 10, 3072, [8, 1], 1], ["RE", 2, [0, 5, 1, 6, 2, 7, 10, 11, 3, 8, 12, 4, 9]], ["FSP", 3, 0, 1, 3], ["FSP", 3, 4, 2, 3], ["RE", 3, [0, 4, 1, 5, 2, 6, 3, 7]], ["CA", 2, 3, 5], ["CHR", 1, "shared", [2]], ["CA", 2, 3, 6], ["CHR", 0, "shared", [3]], ["CA", 1, 4, 6], ["FU", 5, [0, 1]], ["AN", 5, 0, 5], ["FU", 5, [1, 2]], ["AN", 5, 1, 4], ["FU", 5, [2, 3]], ["AN", 5, 2, 6], ["FU", 3, [0, 1]], ["SP", 3, 0, 1024, [2], 1], ["AN", 3, 1, 2], ["FFSP", 3, 0, [2, 1], 1, 1], ["AN", 3, 1, 6], ["FU", 1, [0, 1]], ["SP", 1, 0, 64, [2], 1], ["AN", 1, 1, 2], ["FFSP", 1, 0, [2, 1], 1, 1], ["AN", 1, 1, 6], ["PR", 4, 0, "auto_unroll_max_step$1024"]]]], "r": [[0.0274581], 0, 2.8964, 1707741208], "mark": 2, "ag": 2, "v": "v0.6"}
{"i": [["[\"_matmul\", 512, 3072, 768, \"float32\"]", "cuda -keys=cuda,gpu -arch=sm_86 -max_num_threads=1024 -model=unknown -thread_warp_size=32", [82, 999, 999, 49152, 2147483647, 1024, 255, 32], "", 0, []], [[], [["CHW", 2, "local"], ["SP", 2, 0, 512, [1, 32, 2, 1], 1], ["SP", 2, 5, 768, [1, 1, 96, 1], 1], ["SP", 2, 10, 3072, [6, 1], 1], ["RE", 2, [0, 5, 1, 6, 2, 7, 10, 11, 3, 8, 12, 4, 9]], ["FSP", 3, 0, 1, 3], ["FSP", 3, 4, 2, 3], ["RE", 3, [0, 4, 1, 5, 2, 6, 3, 7]], ["CA", 2, 3, 5], ["CHR", 1, "shared", [2]], ["CA", 2, 3, 6], ["CHR", 0, "shared", [3]], ["CA", 1, 4, 6], ["FU", 5, [0, 1]], ["AN", 5, 0, 5], ["FU", 5, [1, 2]], ["AN", 5, 1, 4], ["FU", 5, [2, 3]], ["AN", 5, 2, 6], ["FU", 3, [0, 1]], ["SP", 3, 0, 576, [2], 1], ["AN", 3, 1, 2], ["FFSP", 3, 0, [2, 1], 1, 1], ["AN", 3, 1, 6], ["FU", 1, [0, 1]], ["SP", 1, 0, 12, [2], 1], ["AN", 1, 1, 2], ["FFSP", 1, 0, [2, 1], 1, 1], ["AN", 1, 1, 6], ["PR", 4, 0, "auto_unroll_max_step$1024"]]]], "r": [[0.000825263], 0, 0.666086, 1707741208], "mark": 2, "ag": 2, "v": "v0.6"}
{"i": [["[\"_matmul\", 512, 3072, 768, \"float32\"]", "cuda -keys=cuda,gpu -arch=sm_86 -max_num_threads=1024 -model=unknown -thread_warp_size=32", [82, 999, 999, 49152, 2147483647, 1024, 255, 32], "", 0, []], [[], [["CHW", 2, "local"], ["SP", 2, 0, 512, [1, 32, 8, 1], 1], ["SP", 2, 5, 768, [1, 1, 96, 1], 1], ["SP", 2, 10, 3072, [6, 1], 1], ["RE", 2, [0, 5, 1, 6, 2, 7, 10, 11, 3, 8, 12, 4, 9]], ["FSP", 3, 0, 1, 3], ["FSP", 3, 4, 2, 3], ["RE", 3, [0, 4, 1, 5, 2, 6, 3, 7]], ["CA", 2, 3, 5], ["CHR", 1, "shared", [2]], ["CA", 2, 3, 6], ["CHR", 0, "shared", [3]], ["CA", 1, 4, 6], ["FU", 5, [0, 1]], ["AN", 5, 0, 5], ["FU", 5, [1, 2]], ["AN", 5, 1, 4], ["FU", 5, [2, 3]], ["AN", 5, 2, 6], ["FU", 3, [0, 1]], ["SP", 3, 0, 576, [2], 1], ["AN", 3, 1, 2], ["FFSP", 3, 0, [2, 1], 1, 1], ["AN", 3, 1, 6], ["FU", 1, [0, 1]], ["SP", 1, 0, 48, [2], 1], ["AN", 1, 1, 2], ["FFSP", 1, 0, [2, 1], 1, 1], ["AN", 1, 1, 6], ["PR", 4, 0, "auto_unroll_max_step$1024"]]]], "r": [[0.021614], 0, 2.39865, 1707741209], "mark": 2, "ag": 2, "v": "v0.6"}
{"i": [["[\"_matmul\", 512, 3072, 768, \"float32\"]", "cuda -keys=cuda,gpu -arch=sm_86 -max_num_threads=1024 -model=unknown -thread_warp_size=32", [82, 999, 999, 49152, 2147483647, 1024, 255, 32], "", 0, []], [[], [["CHW", 2, "local"], ["SP", 2, 0, 512, [1, 64, 2, 1], 1], ["SP", 2, 5, 768, [1, 1, 128, 1], 1], ["SP", 2, 10, 3072, [6, 1], 1], ["RE", 2, [0, 5, 1, 6, 2, 7, 10, 11, 3, 8, 12, 4, 9]], ["FSP", 3, 0, 1, 3], ["FSP", 3, 4, 2, 3], ["RE", 3, [0, 4, 1, 5, 2, 6, 3, 7]], ["CA", 2, 3, 5], ["CHR", 1, "shared", [2]], ["CA", 2, 3, 6], ["CHR", 0, "shared", [3]], ["CA", 1, 4, 6], ["FU", 5, [0, 1]], ["AN", 5, 0, 5], ["FU", 5, [1, 2]], ["AN", 5, 1, 4], ["FU", 5, [2, 3]], ["AN", 5, 2, 6], ["FU", 3, [0, 1]], ["SP", 3, 0, 768, [2], 1], ["AN", 3, 1, 2], ["FFSP", 3, 0, [2, 1], 1, 1], ["AN", 3, 1, 6], ["FU", 1, [0, 1]], ["SP", 1, 0, 12, [2], 1], ["AN", 1, 1, 2], ["FFSP", 1, 0, [2, 1], 1, 1], ["AN", 1, 1, 6], ["PR", 4, 0, "auto_unroll_max_step$1024"]]]], "r": [[0.00282534], 0, 1.3124, 1707741209], "mark": 2, "ag": 2, "v": "v0.6"}
{"i": [["[\"_matmul\", 512, 3072, 768, \"float32\"]", "cuda -keys=cuda,gpu -arch=sm_86 -max_num_threads=1024 -model=unknown -thread_warp_size=32", [82, 999, 999, 49152, 2147483647, 1024, 255, 32], "", 0, []], [[], [["CHW", 2, "local"], ["SP", 2, 0, 512, [1, 64, 8, 1], 1], ["SP", 2, 5, 768, [1, 1, 128, 1], 1], ["SP", 2, 10, 3072, [6, 1], 1], ["RE", 2, [0, 5, 1, 6, 2, 7, 10, 11, 3, 8, 12, 4, 9]], ["FSP", 3, 0, 1, 3], ["FSP", 3, 4, 2, 3], ["RE", 3, [0, 4, 1, 5, 2, 6, 3, 7]], ["CA", 2, 3, 5], ["CHR", 1, "shared", [2]], ["CA", 2, 3, 6], ["CHR", 0, "shared", [3]], ["CA", 1, 4, 6], ["FU", 5, [0, 1]], ["AN", 5, 0, 5], ["FU", 5, [1, 2]], ["AN", 5, 1, 4], ["FU", 5, [2, 3]], ["AN", 5, 2, 6], ["FU", 3, [0, 1]], ["SP", 3, 0, 768, [2], 1], ["AN", 3, 1, 2], ["FFSP", 3, 0, [2, 1], 1, 1], ["AN", 3, 1, 6], ["FU", 1, [0, 1]], ["SP", 1, 0, 48, [2], 1], ["AN", 1, 1, 2], ["FFSP", 1, 0, [2, 1], 1, 1], ["AN", 1, 1, 6], ["PR", 4, 0, "auto_unroll_max_step$1024"]]]], "r": [[0.0345582], 0, 2.80775, 1707741209], "mark": 2, "ag": 2, "v": "v0.6"}
{"i": [["[\"_matmul\", 512, 3072, 768, \"float32\"]", "cuda -keys=cuda,gpu -arch=sm_86 -max_num_threads=1024 -model=unknown -thread_warp_size=32", [82, 999, 999, 49152, 2147483647, 1024, 255, 32], "", 0, []], [[], [["CHW", 2, "local"], ["SP", 2, 0, 512, [1, 32, 2, 1], 1], ["SP", 2, 5, 768, [1, 1, 96, 1], 1], ["SP", 2, 10, 3072, [6, 1], 1], ["RE", 2, [0, 5, 1, 6, 2, 7, 10, 11, 3, 8, 12, 4, 9]], ["FSP", 3, 0, 1, 3], ["FSP", 3, 4, 2, 3], ["RE", 3, [0, 4, 1, 5, 2, 6, 3, 7]], ["CA", 2, 3, 5], ["CHR", 1, "shared", [2]], ["CA", 2, 3, 6], ["CHR", 0, "shared", [3]], ["CA", 1, 4, 6], ["FU", 5, [0, 1]], ["AN", 5, 0, 5], ["FU", 5, [1, 2]], ["AN", 5, 1, 4], ["FU", 5, [2, 3]], ["AN", 5, 2, 6], ["FU", 3, [0, 1]], ["SP", 3, 0, 576, [2], 1], ["AN", 3, 1, 2], ["FFSP", 3, 0, [2, 1], 1, 1], ["AN", 3, 1, 6], ["FU", 1, [0, 1]], ["SP", 1, 0, 12, [2], 1], ["AN", 1, 1, 2], ["FFSP", 1, 0, [2, 1], 1, 1], ["AN", 1, 1, 6], ["PR", 4, 0, "auto_unroll_max_step$1024"]]]], "r": [[0.000825263], 0, 0.666086, 1707741208], "mark": 2, "ag": 3, "v": "v0.6"}
{"i": [["[\"_matmul\", 512, 3072, 768, \"float32\"]", "cuda -keys=cuda,gpu -arch=sm_86 -max_num_threads=1024 -model=unknown -thread_warp_size=32", [82, 999, 999, 49152, 2147483647, 1024, 255, 32], "", 0, []], [[], [["CHW", 2, "local"], ["SP", 2, 0, 512, [1, 32, 2, 1], 1], ["SP", 2, 5, 768, [1, 1, 96, 1], 1], ["SP", 2, 10, 3072, [4, 1], 1], ["RE", 2, [0, 5, 1, 6, 2, 7, 10, 11, 3, 8, 12, 4, 9]], ["FSP", 3, 0, 1, 3], ["FSP", 3, 4, 2, 3], ["RE", 3, [0, 4, 1, 5, 2, 6, 3, 7]], ["CA", 2, 3, 5], ["CHR", 1, "shared", [2]], ["CA", 2, 3, 6], ["CHR", 0, "shared", [3]], ["CA", 1, 4, 6], ["FU", 5, [0, 1]], ["AN", 5, 0, 5], ["FU", 5, [1, 2]], ["AN", 5, 1, 4], ["FU", 5, [2, 3]], ["AN", 5, 2, 6], ["FU", 3, [0, 1]], ["SP", 3, 0, 384, [2], 1], ["AN", 3, 1, 2], ["FFSP", 3, 0, [2, 1], 1, 1], ["AN", 3, 1, 6], ["FU", 1, [0, 1]], ["SP", 1, 0, 8, [2], 1], ["AN", 1, 1, 2], ["FFSP", 1, 0, [2, 1], 1, 1], ["AN", 1, 1, 6], ["PR", 4, 0, "auto_unroll_max_step$1024"]]]], "r": [[0.000908691], 0, 1.16309, 1707741212], "mark": 2, "ag": 3, "v": "v0.6"}
{"i": [["[\"_matmul\", 512, 3072, 768, \"float32\"]", "cuda -keys=cuda,gpu -arch=sm_86 -max_num_threads=1024 -model=unknown -thread_warp_size=32", [82, 999, 999, 49152, 2147483647, 1024, 255, 32], "", 0, []], [[], [["CHW", 2, "local"], ["SP", 2, 0, 512, [1, 32, 2, 1], 1], ["SP", 2, 5, 768, [1, 1, 96, 1], 1], ["SP", 2, 10, 3072, [8, 1], 1], ["RE", 2, [0, 5, 1, 6, 2, 7, 10, 11, 3, 8, 12, 4, 9]], ["FSP", 3, 0, 1, 3], ["FSP", 3, 4, 2, 3], ["RE", 3, [0, 4, 1, 5, 2, 6, 3, 7]], ["CA", 2, 3, 5], ["CHR", 1, "shared", [2]], ["CA", 2, 3, 6], ["CHR", 0, "shared", [3]], ["CA", 1, 4, 6], ["FU", 5, [0, 1]], ["AN", 5, 0, 5], ["FU", 5, [1, 2]], ["AN", 5, 1, 4], ["FU", 5, [2, 3]], ["AN", 5, 2, 6], ["FU", 3, [0, 1]], ["SP", 3, 0, 768, [2], 1], ["AN", 3, 1, 2], ["FFSP", 3, 0, [2, 1], 1, 1], ["AN", 3, 1, 6], ["FU", 1, [0, 1]], ["SP", 1, 0, 16, [2], 1], ["AN", 1, 1, 2], ["FFSP", 1, 0, [2, 1], 1, 1], ["AN", 1, 1, 6], ["PR", 4, 0, "auto_unroll_max_step$1024"]]]], "r": [[0.000776015], 0, 0.70443, 1707741213], "mark": 2, "ag": 3, "v": "v0.6"}
{"i": [["[\"_matmul\", 512, 3072, 768, \"float32\"]", "cuda -keys=cuda,gpu -arch=sm_86 -max_num_threads=1024 -model=unknown -thread_warp_size=32", [82, 999, 999, 49152, 2147483647, 1024, 255, 32], "", 0, []], [[], [["CHW", 2, "local"], ["SP", 2, 0, 512, [1, 32, 2, 1], 1], ["SP", 2, 5, 768, [1, 1, 64, 1], 1], ["SP", 2, 10, 3072, [6, 1], 1], ["RE", 2, [0, 5, 1, 6, 2, 7, 10, 11, 3, 8, 12, 4, 9]], ["FSP", 3, 0, 1, 3], ["FSP", 3, 4, 2, 3], ["RE", 3, [0, 4, 1, 5, 2, 6, 3, 7]], ["CA", 2, 3, 5], ["CHR", 1, "shared", [2]], ["CA", 2, 3, 6], ["CHR", 0, "shared", [3]], ["CA", 1, 4, 6], ["FU", 5, [0, 1]], ["AN", 5, 0, 5], ["FU", 5, [1, 2]], ["AN", 5, 1, 4], ["FU", 5, [2, 3]], ["AN", 5, 2, 6], ["FU", 3, [0, 1]], ["SP", 3, 0, 384, [2], 1], ["AN", 3, 1, 2], ["FFSP", 3, 0, [2, 1], 1, 1], ["AN", 3, 1, 6], ["FU", 1, [0, 1]], ["SP", 1, 0, 12, [2], 1], ["AN", 1, 1, 2], ["FFSP", 1, 0, [2, 1], 1, 1], ["AN", 1, 1, 6], ["PR", 4, 0, "auto_unroll_max_step$1024"]]]], "r": [[0.00072533], 0, 0.684833, 1707741213], "mark": 2, "ag": 3, "v": "v0.6"}
{"i": [["[\"_matmul\", 512, 3072, 768, \"float32\"]", "cuda -keys=cuda,gpu -arch=sm_86 -max_num_threads=1024 -model=unknown -thread_warp_size=32", [82, 999, 999, 49152, 2147483647, 1024, 255, 32], "", 0, []], [[], [["CHW", 2, "local"], ["SP", 2, 0, 512, [1, 64, 2, 1], 1], ["SP", 2, 5, 768, [1, 1, 96, 1], 1], ["SP", 2, 10, 3072, [6, 1], 1], ["RE", 2, [0, 5, 1, 6, 2, 7, 10, 11, 3, 8, 12, 4, 9]], ["FSP", 3, 0, 1, 3], ["FSP", 3, 4, 2, 3], ["RE", 3, [0, 4, 1, 5, 2, 6, 3, 7]], ["CA", 2, 3, 5], ["CHR", 1, "shared", [2]], ["CA", 2, 3, 6], ["CHR", 0, "shared", [3]], ["CA", 1, 4, 6], ["FU", 5, [0, 1]], ["AN", 5, 0, 5], ["FU", 5, [1, 2]], ["AN", 5, 1, 4], ["FU", 5, [2, 3]], ["AN", 5, 2, 6], ["FU", 3, [0, 1]], ["SP", 3, 0, 576, [2], 1], ["AN", 3, 1, 2], ["FFSP", 3, 0, [2, 1], 1, 1], ["AN", 3, 1, 6], ["FU", 1, [0, 1]], ["SP", 1, 0, 12, [2], 1], ["AN", 1, 1, 2], ["FFSP", 1, 0, [2, 1], 1, 1], ["AN", 1, 1, 6], ["PR", 4, 0, "auto_unroll_max_step$1024"]]]], "r": [[0.000903614], 0, 0.588164, 1707741213], "mark": 2, "ag": 3, "v": "v0.6"}
{"i": [["[\"_matmul\", 512, 3072, 768, \"float32\"]", "cuda -keys=cuda,gpu -arch=sm_86 -max_num_threads=1024 -model=unknown -thread_warp_size=32", [82, 999, 999, 49152, 2147483647, 1024, 255, 32], "", 0, []], [[], [["CHW", 2, "local"], ["SP", 2, 0, 512, [1, 32, 1, 1], 1], ["SP", 2, 5, 768, [1, 1, 96, 1], 1], ["SP", 2, 10, 3072, [6, 1], 1], ["RE", 2, [0, 5, 1, 6, 2, 7, 10, 11, 3, 8, 12, 4, 9]], ["FSP", 3, 0, 1, 3], ["FSP", 3, 4, 2, 3], ["RE", 3, [0, 4, 1, 5, 2, 6, 3, 7]], ["CA", 2, 3, 5], ["CHR", 1, "shared", [2]], ["CA", 2, 3, 6], ["CHR", 0, "shared", [3]], ["CA", 1, 4, 6], ["FU", 5, [0, 1]], ["AN", 5, 0, 5], ["FU", 5, [1, 2]], ["AN", 5, 1, 4], ["FU", 5, [2, 3]], ["AN", 5, 2, 6], ["FU", 3, [0, 1]], ["SP", 3, 0, 576, [2], 1], ["AN", 3, 1, 2], ["FFSP", 3, 0, [2, 1], 1, 1], ["AN", 3, 1, 6], ["FU", 1, [0, 1]], ["SP", 1, 0, 6, [2], 1], ["AN", 1, 1, 2], ["FFSP", 1, 0, [2, 1], 1, 1], ["AN", 1, 1, 6], ["PR", 4, 0, "auto_unroll_max_step$1024"]]]], "r": [[0.000545274], 0, 1.06301, 1707741213], "mark": 2, "ag": 3, "v": "v0.6"}
{"i": [["[\"_matmul\", 512, 3072, 768, \"float32\"]", "cuda -keys=cuda,gpu -arch=sm_86 -max_num_threads=1024 -model=unknown -thread_warp_size=32", [82, 999, 999, 49152, 2147483647, 1024, 255, 32], "", 0, []], [[], [["CHW", 2, "local"], ["SP", 2, 0, 512, [1, 32, 4, 1], 1], ["SP", 2, 5, 768, [1, 1, 96, 1], 1], ["SP", 2, 10, 3072, [6, 1], 1], ["RE", 2, [0, 5, 1, 6, 2, 7, 10, 11, 3, 8, 12, 4, 9]], ["FSP", 3, 0, 1, 3], ["FSP", 3, 4, 2, 3], ["RE", 3, [0, 4, 1, 5, 2, 6, 3, 7]], ["CA", 2, 3, 5], ["CHR", 1, "shared", [2]], ["CA", 2, 3, 6], ["CHR", 0, "shared", [3]], ["CA", 1, 4, 6], ["FU", 5, [0, 1]], ["AN", 5, 0, 5], ["FU", 5, [1, 2]], ["AN", 5, 1, 4], ["FU", 5, [2, 3]], ["AN", 5, 2, 6], ["FU", 3, [0, 1]], ["SP", 3, 0, 576, [2], 1], ["AN", 3, 1, 2], ["FFSP", 3, 0, [2, 1], 1, 1], ["AN", 3, 1, 6], ["FU", 1, [0, 1]], ["SP", 1, 0, 24, [2], 1], ["AN", 1, 1, 2], ["FFSP", 1, 0, [2, 1], 1, 1], ["AN", 1, 1, 6], ["PR", 4, 0, "auto_unroll_max_step$1024"]]]], "r": [[0.0103897], 0, 1.32713, 1707741213], "mark": 2, "ag": 3, "v": "v0.6"}
{"i": [["[\"_matmul\", 512, 3072, 768, \"float32\"]", "cuda -keys=cuda,gpu -arch=sm_86 -max_num_threads=1024 -model=unknown -thread_warp_size=32", [82, 999, 999, 49152, 2147483647, 1024, 255, 32], "", 0, []], [[], [["CHW", 2, "local"], ["SP", 2, 0, 512, [1, 32, 2, 1], 1], ["SP", 2, 5, 768, [1, 1, 64, 1], 1], ["SP", 2, 10, 3072, [4, 1], 1], ["RE", 2, [0, 5, 1, 6, 2, 7, 10, 11, 3, 8, 12, 4, 9]], ["FSP", 3, 0, 1, 3], ["FSP", 3, 4, 2, 3], ["RE", 3, [0, 4, 1, 5, 2, 6, 3, 7]], ["CA", 2, 3, 5], ["CHR", 1, "shared", [2]], ["CA", 2, 3, 6], ["CHR", 0, "shared", [3]], ["CA", 1, 4, 6], ["FU", 5, [0, 1]], ["AN", 5, 0, 5], ["FU", 5, [1, 2]], ["AN", 5, 1, 4], ["FU", 5, [2, 3]], ["AN", 5, 2, 6], ["FU", 3, [0, 1]], ["SP", 3, 0, 256, [2], 1], ["AN", 3, 1, 2], ["FFSP", 3, 0, [2, 1], 1, 1], ["AN", 3, 1, 6], ["FU", 1, [0, 1]], ["SP", 1, 0, 8, [2], 1], ["AN", 1, 1, 2], ["FFSP", 1, 0, [2, 1], 1, 1], ["AN", 1, 1, 6], ["PR", 4, 0, "auto_unroll_max_step$1024"]]]], "r": [[0.000734693], 0, 0.957668, 1707741214], "mark": 2, "ag": 3, "v": "v0.6"}
{"i": [["[\"_matmul\", 512, 3072, 768, \"float32\"]", "cuda -keys=cuda,gpu -arch=sm_86 -max_num_threads=1024 -model=unknown -thread_warp_size=32", [82, 999, 999, 49152, 2147483647, 1024, 255, 32], "", 0, []], [[], [["CHW", 2, "local"], ["SP", 2, 0, 512, [1, 32, 2, 1], 1], ["SP", 2, 5, 768, [1, 1, 64, 1], 1], ["SP", 2, 10, 3072, [8, 1], 1], ["RE", 2, [0, 5, 1, 6, 2, 7, 10, 11, 3, 8, 12, 4, 9]], ["FSP", 3, 0, 1, 3], ["FSP", 3, 4, 2, 3], ["RE", 3, [0, 4, 1, 5, 2, 6, 3, 7]], ["CA", 2, 3, 5], ["CHR", 1, "shared", [2]], ["CA", 2, 3, 6], ["CHR", 0, "shared", [3]], ["CA", 1, 4, 6], ["FU", 5, [0, 1]], ["AN", 5, 0, 5], ["FU", 5, [1, 2]], ["AN", 5, 1, 4], ["FU", 5, [2, 3]], ["AN", 5, 2, 6], ["FU", 3, [0, 1]], ["SP", 3, 0, 512, [2], 1], ["AN", 3, 1, 2], ["FFSP", 3, 0, [2, 1], 1, 1], ["AN", 3, 1, 6], ["FU", 1, [0, 1]], ["SP", 1, 0, 16, [2], 1], ["AN", 1, 1, 2], ["FFSP", 1, 0, [2, 1], 1, 1], ["AN", 1, 1, 6], ["PR", 4, 0, "auto_unroll_max_step$1024"]]]], "r": [[0.000704949], 0, 1.1787, 1707741214], "mark": 2, "ag": 3, "v": "v0.6"}
{"i": [["[\"_matmul\", 512, 3072, 768, \"float32\"]", "cuda -keys=cuda,gpu -arch=sm_86 -max_num_threads=1024 -model=unknown -thread_warp_size=32", [82, 999, 999, 49152, 2147483647, 1024, 255, 32], "", 0, []], [[], [["CHW", 2, "local"], ["SP", 2, 0, 512, [1, 64, 2, 1], 1], ["SP", 2, 5, 768, [1, 1, 96, 1], 1], ["SP", 2, 10, 3072, [4, 1], 1], ["RE", 2, [0, 5, 1, 6, 2, 7, 10, 11, 3, 8, 12, 4, 9]], ["FSP", 3, 0, 1, 3], ["FSP", 3, 4, 2, 3], ["RE", 3, [0, 4, 1, 5, 2, 6, 3, 7]], ["CA", 2, 3, 5], ["CHR", 1, "shared", [2]], ["CA", 2, 3, 6], ["CHR", 0, "shared", [3]], ["CA", 1, 4, 6], ["FU", 5, [0, 1]], ["AN", 5, 0, 5], ["FU", 5, [1, 2]], ["AN", 5, 1, 4], ["FU", 5, [2, 3]], ["AN", 5, 2, 6], ["FU", 3, [0, 1]], ["SP", 3, 0, 384, [2], 1], ["AN", 3, 1, 2], ["FFSP", 3, 0, [2, 1], 1, 1], ["AN", 3, 1, 6], ["FU", 1, [0, 1]], ["SP", 1, 0, 8, [2], 1], ["AN", 1, 1, 2], ["FFSP", 1, 0, [2, 1], 1, 1], ["AN", 1, 1, 6], ["PR", 4, 0, "auto_unroll_max_step$1024"]]]], "r": [[0.000955479], 0, 0.736833, 1707741214], "mark": 2, "ag": 3, "v": "v0.6"}
{"i": [["[\"_matmul\", 512, 3072, 768, \"float32\"]", "cuda -keys=cuda,gpu -arch=sm_86 -max_num_threads=1024 -model=unknown -thread_warp_size=32", [82, 999, 999, 49152, 2147483647, 1024, 255, 32], "", 0, []], [[], [["CHW", 2, "local"], ["SP", 2, 0, 512, [1, 64, 2, 1], 1], ["SP", 2, 5, 768, [1, 1, 96, 1], 1], ["SP", 2, 10, 3072, [8, 1], 1], ["RE", 2, [0, 5, 1, 6, 2, 7, 10, 11, 3, 8, 12, 4, 9]], ["FSP", 3, 0, 1, 3], ["FSP", 3, 4, 2, 3], ["RE", 3, [0, 4, 1, 5, 2, 6, 3, 7]], ["CA", 2, 3, 5], ["CHR", 1, "shared", [2]], ["CA", 2, 3, 6], ["CHR", 0, "shared", [3]], ["CA", 1, 4, 6], ["FU", 5, [0, 1]], ["AN", 5, 0, 5], ["FU", 5, [1, 2]], ["AN", 5, 1, 4], ["FU", 5, [2, 3]], ["AN", 5, 2, 6], ["FU", 3, [0, 1]], ["SP", 3, 0, 768, [2], 1], ["AN", 3, 1, 2], ["FFSP", 3, 0, [2, 1], 1, 1], ["AN", 3, 1, 6], ["FU", 1, [0, 1]], ["SP", 1, 0, 16, [2], 1], ["AN", 1, 1, 2], ["FFSP", 1, 0, [2, 1], 1, 1], ["AN", 1, 1, 6], ["PR", 4, 0, "auto_unroll_max_step$1024"]]]], "r": [[0.000786108], 0, 0.887549, 1707741214], "mark": 2, "ag": 3, "v": "v0.6"}
{"i": [["[\"_matmul\", 512, 3072, 768, \"float32\"]", "cuda -keys=cuda,gpu -arch=sm_86 -max_num_threads=1024 -model=unknown -thread_warp_size=32", [82, 999, 999, 49152, 2147483647, 1024, 255, 32], "", 0, []], [[], [["CHW", 2, "local"], ["SP", 2, 0, 512, [1, 64, 2, 1], 1], ["SP", 2, 5, 768, [1, 1, 64, 1], 1], ["SP", 2, 10, 3072, [6, 1], 1], ["RE", 2, [0, 5, 1, 6, 2, 7, 10, 11, 3, 8, 12, 4, 9]], ["FSP", 3, 0, 1, 3], ["FSP", 3, 4, 2, 3], ["RE", 3, [0, 4, 1, 5, 2, 6, 3, 7]], ["CA", 2, 3, 5], ["CHR", 1, "shared", [2]], ["CA", 2, 3, 6], ["CHR", 0, "shared", [3]], ["CA", 1, 4, 6], ["FU", 5, [0, 1]], ["AN", 5, 0, 5], ["FU", 5, [1, 2]], ["AN", 5, 1, 4], ["FU", 5, [2, 3]], ["AN", 5, 2, 6], ["FU", 3, [0, 1]], ["SP", 3, 0, 384, [2], 1], ["AN", 3, 1, 2], ["FFSP", 3, 0, [2, 1], 1, 1], ["AN", 3, 1, 6], ["FU", 1, [0, 1]], ["SP", 1, 0, 12, [2], 1], ["AN", 1, 1, 2], ["FFSP", 1, 0, [2, 1], 1, 1], ["AN", 1, 1, 6], ["PR", 4, 0, "auto_unroll_max_step$1024"]]]], "r": [[0.000758757], 0, 0.999657, 1707741215], "mark": 2, "ag": 3, "v": "v0.6"}
